index,author_name,review_date,reviewer_ratings,review_body
0,Stacey White,"March 9, 2020",5, Libe this app... Make dinations on line even checks... Great way to stay connected.
1,Dennis Sherburne,"March 17, 2020",1," Not as easy as past years. Not very user friendly, even for a computer literate user !"
2,Teresa Tumblin,"March 30, 2020",5, So easy and allows us to keep fundraising!
3,Marsha Williams,"February 29, 2020",5, Works great for uploading donations and keeping track of them
4,Nicholas B,"February 18, 2020",1, The app won't start up. It's stuck on the loading screen and then it eventually crashes.
5,Lisa Moore,"February 2, 2020",3," This app needs to be all encompassing so that you can access team information, not just fundraising."
6,Mary Marshall,"February 17, 2020",4, It's great but being on 2 teams you can only see and manage 1...
7,Bonnie BeeMcKeefery,"February 19, 2020",1," Never loads, throws so many errors....."
8,goneplumcrazy2010,"February 22, 2020",5, Love the app makes everything so easy
9,Vye Marshall,"May 22, 2019",3," I don't get notified when I get a donation anymore. Last year I received an email along with a yellow flower icon notifying me of a donation. Now the only way I know when I receive a donation is when I open the app and check under donations. I like to publicly acknowledge my donations in a timely ma...Full ReviewI don't get notified when I get a donation anymore. Last year I received an email along with a yellow flower icon notifying me of a donation. Now the only way I know when I receive a donation is when I open the app and check under donations. I like to publicly acknowledge my donations in a timely matter, yet without the notification, it might be days before I find them . Please fix this issue."
10,Carol Polakowski,"September 19, 2019",1," Good for keeping track of donations since I'm having issues not receiving any emails when I get a donation. Also, just tried to update, since it told me I needed to, and there was no update option so I had to uninstall and reinstall. Ok just re-installed and it still says I need to update????"
11,Allison Testa,"March 14, 2019",3," Not user friendly. I personally haven't had a lot of problems, but my husband has and at our team captains meetings I hear the frustrations of others."
12,Marti Klaus,"April 22, 2019",1, I have been able to use this app in years past & it was very helpful. This year's app keeps stopping after less a minute of use. Can't use it at all.
13,Anne Frank,"April 23, 2019",1," Way too many notifications. I keep turning them off under settings, but it won't save the selection. It reverts to ""allow all"" when I go to another screen. Uninstalling."
14,Jamie Leasure,"February 10, 2019",5, makes it super easy when people pay you cash or check.... you can use your card and still give the sponsor name and credit!!
15,Rachel McGuire,"September 19, 2019",3, It keeps saying theres a required update to be done in the play store window...but no update button to be found. Needs this bug fixed.
16,Evelyne Bevacqua,"April 5, 2019",5," very helpful ...learn more about fundraising, and ACS through the App. love to reveive checks and scan them...great App..."
17,Ann M. Carlin,"April 6, 2019",5," Great app, very convenient, fast account updates when funds are added."
18,Brittany Earnest,"February 16, 2019",4," a wonderful way to get money to our rely for life team!! makes fund raising easy, quick, and convenient!"
19,Jackleen Bernard,"December 15, 2019",5, I installed it for my boyfriend's father he was not well. But unfortunately he died before we could arrange funds for him. I feel so sad and guilty for not coming across this app before. But I will definitely help others if I start working again. I am surely share link of this app on my page. And le...Full ReviewI installed it for my boyfriend's father he was not well. But unfortunately he died before we could arrange funds for him. I feel so sad and guilty for not coming across this app before. But I will definitely help others if I start working again. I am surely share link of this app on my page. And let know all in need of this kind of app. Regards Mysa.
20,Diana Munoz,"April 5, 2019",5, Easy to use. But Couldnt change/update the Team name.
21,Nancy morris,"September 23, 2019",1, It's not accurate and it doesn't allow me to do as much as original website
22,A Google user,"February 21, 2019",5, easy and great to have for raising money on the spot
23,Tracy Mathews,"November 16, 2018",2, Not always dependable when doing onsite fundraising which it is designed for.
24,A Google user,"August 2, 2019",5, Great way to track progress and accept donations.
25,Angie Mccubbins,"September 19, 2019",1, App keeps telling me to update it but when I go to play store it doesn't give me the option to update only uninstall and open. I cant even bypass it so I cant access the app at all.
26,Tina Montalvo,"January 28, 2019",3, does not work well.recieves several error messages.
27,Linda Johnson,"May 31, 2019",5, I am so grateful this app really helped me raise money last year and has gotten better this year.
28,sandra salazar,"February 2, 2020",5, Great easy to navigate
29,Barbara Gonsalves,"June 29, 2019",5," the most beautiful experience anyone can have. A day full of fun, games, friends and so much more, its so worth contributing too."
30,Phenomenal Beauty,"September 1, 2019",5, I love that this app!! It allows everyone to donate safely knowing that their donations are going to the cause. ~MsAngela Hogan Team Lady Soldiers 💋
31,Judy Teaney,"August 8, 2019",5, not had any problems with app. stays current
32,RG RK King,"October 3, 2018",5, Finding the cure is very important to me my mom passed away from breast cancer in 2010. So this is a good app to use to help fight for the cure.
33,Dee Pizzo,"June 15, 2019",5, very helpful and quite user friendly
34,Joy Coon,"April 30, 2019",4, a little tricky to get used to but really worth it.
35,Rhoda Cutlip,"April 5, 2019",4, photo easier than in the past.
36,LaSadie McCullum,"April 8, 2019",4, love this app. Very informative!
37,J Kathy Cobbs,"January 4, 2019",5, Easy to use. Very convenient.
38,Tina A,"September 24, 2019",5, Easy to use and collect donations
39,steven Jenkins,"February 13, 2019",5, great tool to help with fundraising
40,Amy Patrick,"March 27, 2019",5, great app and easy to navigate
41,Rosemary Gandy,"September 5, 2019",5," Awesome, easy way to raise money!"
42,Chelsea Whitney,"September 20, 2019",5, What a great app! Very user friendly :)
43,Maria E Ortega,"June 17, 2019",5, very easy and useful
44,Elizabeth Rowan,"February 20, 2020",5, Just got Started yet I Look forward to the experience
45,Irene Posadas,"November 22, 2019",4," So far, I have not had problems using this app."
46,Theresa McCray,"September 19, 2019",5, This app is so user friendly!!😁 I love it!!
47,Barb Lamb,"June 16, 2019",5, uploading check donations is super easy!!
48,Tiffany Kelly,"November 15, 2019",5, Very easy to use
49,She Blessed JAW White,"October 8, 2018",4, The app has changed from last year.
50,Lori Fried,"April 6, 2020",5, Easy to use
51,Lisa Papa,"April 19, 2019",1, won't work. can't post donation
52,A Google user,"March 20, 2019",5, user-friendly no way you can make a mistake I love this app
53,Carmen Cheek,"April 3, 2019",5, very easy to use
54,Anita Holder,"October 19, 2019",5, All donation can be noticed
55,Ron Volanski,"May 25, 2019",5, easy & fast
56,Mary Shinn Shaner,"April 5, 2019",5, Easy to check donations.
57,Brian Meehan,"June 14, 2019",5, makes fundraising easy
58,Angela Hearl,"March 25, 2020",5, Fundraisers for a good cause are always a great way to make money for donations and get the word out about organizations
59,Robyn Paciulli-Griffith,"November 27, 2018",5, Great when you are accepting donations on the go
60,Boriqua Cruz,"September 16, 2018",5, We are new to cancer so we are learning as we go.. And if someone knows how i can change the name to Molly's Ninjas i will appreciate it thank you kindly and let us all fight the battle together
61,A Google user,"December 16, 2018",5, Great way to fundraise on the go. Great cause it's goes to great resources
62,Daielle Stalter,"September 25, 2019",5, Easy to use.
63,Jolena Cristan,"April 5, 2019",5, great for updates of monies raised to find a CURE!!
64,Donna Carette,"February 21, 2019",5, I love relay for life and help fellow relay for life partiant
65,Musa Christopher,"February 1, 2020",1, It's a waste of data
66,Yolanda Alvarez,"February 25, 2019",5, so east to use even for a computer illiterate.
67,James Kelly,"November 15, 2019",5, easy to use
68,Anthony Fishback,"September 20, 2019",5, Last Season I met my Goal in Fund raising.
69,Christopher Davis,"June 14, 2019",4, good little app
70,Ramona Wisby,"March 29, 2019",4, hard to figure out
71,Jeanette Tucker,"July 24, 2019",5, it help us save lives
72,Geddy Lee,"April 8, 2019",5, I luv it...
73,Tina Lillig,"September 25, 2018",5, Love supporting this cause
74,Michelle Schaefer,"April 8, 2019",4, easy to use
75,Curtis Williams,"April 5, 2019",5, i love this app
76,penny pennyjohnson,"October 21, 2019",4, It was fun
77,Elaine Wilson,"April 26, 2019",5," Easy as 1, 2, 3"
78,YT Ahoy,"September 21, 2019",5, Easy to use
79,Liz McGiffin,"September 21, 2019",5, Easy to use
80,Lori Caminiti,"April 19, 2019",5, love this app
81,Laura Tyree,"August 30, 2019",1, Will not open
82,ELAINE STROUSE,"March 1, 2020",5, Good.
83,Alexis Thomas,"January 29, 2020",5, I love it
84,christina Christina,"January 27, 2020",5, great
85,Mark Cyr,"October 5, 2019",5, Great!
86,Bonnie Estes,"October 14, 2019",5, Awesome
87,Margaret Valderrama-Soliz,"December 4, 2019",5, Awesome
88,Ruben Rangel,"October 18, 2019",5, Excellent
89,Rodney Mann,"September 20, 2019",5, Great app
90,Michelle White,"September 19, 2019",5, Great
91,Ms Banks,"January 25, 2020",5, Easy access
92,Cloey Jane,"June 13, 2019",5, Aweome App
93,Maria Bush,"September 16, 2019",4, Works great
94,Erin Goldman,"May 30, 2019",5, Nice to always look at how much your team raised
95,Juliea Gotsch,"August 7, 2019",5, works great!!
96,Jackie Ballor,"May 8, 2019",5, great fast
97,Darlene Nadeau,"May 30, 2019",5, awesome
98,Jo Cella,"April 3, 2019",5, IT'S good
99,Laurie Ellis,"April 1, 2019",5, great
100,Deborah Hughes,"April 6, 2019",4, good
101,Angela Tucker,"April 5, 2019",5, great
102,Ana Zavala,"April 5, 2019",5, phenomenal
103,KayCe Parsons,"February 12, 2019",5," The improvements made to this app are great. It's nice to accept credit cards, and also to be able to accept different types of payments on behalf of someone else who is fundraising, also."
104,"Phillip Jones, Sr.","March 22, 2019",5, All Good!
105,kerry Anderson,"April 5, 2019",5, Love it!
106,joel halpern,"March 9, 2019",5, great app
107,A Google user,"February 20, 2019",5, awesome app
108,Rose Hajec,"April 24, 2019",5, great.
109,Cynthia Iwanaga,"February 23, 2019",5, great
110,Robbin Valerio,"April 7, 2019",4, exceptional
111,Mike Craig,"April 6, 2019",5, love it.
112,John Deatrick,"October 25, 2018",4, Great app.
113,Mildred Swann,"November 15, 2018",4, Tech friendly
114,cam 77,"October 7, 2018",5, Easy!
115,Amber Farley,"August 22, 2018",3," I love app except since the last update, you have to put in your ID and password every time you try to open the app up. Which if you're running a booth of any sort and taking donations it's really not helpful because you have to make people wait for you to log back in every single time."
116,Heather Lambrecht,"September 11, 2018",2, Login issues as others have stated.
117,Amy Scott,"September 5, 2018",2, Can't log in
118,Trichelle Eddy,"July 15, 2018",4," Love being able to track my team and event at all times plus take 
donations. But the random app updates where you can't open the app with out 
updating is annoying. I was beyond embarrassed when during opening 
ceremomies, I went to open the app to announce current total and team role 
call as eve ...Full ReviewLove being able to track my team and event at all times plus take 
donations. But the random app updates where you can't open the app with out 
updating is annoying. I was beyond embarrassed when during opening 
ceremomies, I went to open the app to announce current total and team role 
call as eve t lead and it wouldn't run due to updates although the night 
before no issue. It would be awesome if there was a extra option for 
leadership or team captains to deposit money under team members names."
119,Pam Armstrong,"July 19, 2018",3," Since the update, when I click on the app it tries to open but ends open 
taking me back to my home page. After 4 or 5 attempts it usually will open."
120,mAr Alaniz,"July 15, 2018",4, Like being able to track my team
121,ScoutFinch,"June 8, 2018",3," All of my donations have shown up, but when I tried to change things on my 
profile it came up as a web page error? Also, when I'd click various links 
to check out how it all works I was told that the main site certificate 
isn't updated or something and that continuing could be unsafe. It might be...Full ReviewAll of my donations have shown up, but when I tried to change things on my 
profile it came up as a web page error? Also, when I'd click various links 
to check out how it all works I was told that the main site certificate 
isn't updated or something and that continuing could be unsafe. It might be 
my phone, bc none of the people who donated mentioned this. I would look 
into it, though. Thank you."
122,Becky Matulich,"June 10, 2018",4," I would like to add any items to my team members as team captain, but seem 
to be unable to do it"
123,Bridget Davis,"June 23, 2018",5," It just means everything i feel,,everything i live... from day to 
day,,minute to minute,,,it is just so real ,,,so true...."
124,Jan Mckay,"June 7, 2018",5, Love it!
125,J Rodriguez,"April 14, 2018",5," The App has been AWESOME for selling our items during our Relay!!! I don't 
think it could be any easier to use."
126,Armalene Matson,"May 4, 2018",5," This app has improved since last year! It's so easy to use and I highly 
recommend! We used it at our event and will continue using it!"
127,A Google user,"May 27, 2018",3, Hard to line up the check to take a picture
128,Nicky Nicole Buford,"April 30, 2018",5, Very easy app to use😁
129,Sheri Humphries,"April 26, 2018",4, Great & easy to use
130,Maureen Latimer,"April 11, 2018",2," Used this app, last year...it was great.  This year...its HORRIBLE!  I keep getting an error message to try and log in later; then I try to log in via facebook...no luck!  I need to scan checks into my page...cant make that happen.  HELP!!!!"
131,Jenni DelVecchio,"April 10, 2018",2, I just downloaded it and now it won't even open. What's the point??
132,A Google user,"May 28, 2018",5, Awesome
133,Denise Southern,"March 14, 2018",1, Ugh! This is the last time I even try to use this app! It did last year! Extremely frustrating now that I have a team fundraiser coming up on 3/24. It's been of absolutely no help to me this year considering I have to keep uninstalling and now it won't even open! Please fix this for next year!
134,A Google user,"March 26, 2018",3, It's difficult to download to Facebook...
135,Nicole Hollomon,"March 11, 2018",5, Immediately started receiving donations!
136,Leah Hayes,"February 18, 2018",2," It won't open anymore. I really liked it, it had everything needed"
137,Terry Callahan,"December 6, 2017",3, Definitely needs work. Some donations are not getting credited to my team. I know they've gone through because my donors have shared transaction receipts with me. Please fix the app.
138,Heather Staton,"January 4, 2018",2," I can't screenshot any checks using my app. It will act like it is taking the picture of the check, but then goes back to the first screen and clears everything I have already entered."
139,Lisa Heise,"November 14, 2017",2," I don't know what happened but this app isn't working.  It was up to date on the next year's registration but now on my iPad it is back on last year's fundraising and on my phone it isn't even going into the app, keeps kicking it back out and I have uninstalled and reinstalled it a few times.  Pleas...Full ReviewI don't know what happened but this app isn't working.  It was up to date on the next year's registration but now on my iPad it is back on last year's fundraising and on my phone it isn't even going into the app, keeps kicking it back out and I have uninstalled and reinstalled it a few times.  Please fix this issue and get it back to current fundraising and not closed fundraising."
140,Dawn Ziegler,"November 14, 2017",1," This app used to work very well for me, but now it won't even open. I have uninstalled and reinstalled it several times but it still won't open."
141,Braden Terrill,"November 14, 2017",1, Crashes when I try to open it
142,Anna M,"November 14, 2017",2," Worked before the update, now it won't open."
143,Heather Boddy,"November 14, 2017",2, The app was wonderful until the update and now it won't open
144,Celeste Fernandez,"November 1, 2017",2," It's a *great* app when it's working...but crashes pretty much all the time. Can't get it to update or even load the last couple of days, and keeps giving us a weird team company affiliation even though I keep clicking ""none."""
145,Dixie Shoemaker,"September 13, 2017",4," I can't get the app to update/sync. It doesn't keep up with what's going on. I had several donations made weeks ago that never showed up on the app. I logged into this year's event and that hasn't updated either.  I can't find anywhere in the app to sync or update, nor info in the FAQ or help sectio...Full ReviewI can't get the app to update/sync. It doesn't keep up with what's going on. I had several donations made weeks ago that never showed up on the app. I logged into this year's event and that hasn't updated either.  I can't find anywhere in the app to sync or update, nor info in the FAQ or help section. It is a pretty good all, I look forward to using it more, but hope I can get advisement on how to fix this issue."
146,Betty Spates,"October 4, 2017",3, This app needs some major updating!! It takes forever to load anything you want to do and does not show what you need to show. I can't see my team nor accept cash donations.
147,Sharon Bentham,"October 5, 2017",5, It's very convenient for people to make donations that you are not able to see daily
148,purshotam singh,"October 5, 2017",1, Bekaar
149,Tasha Ratcliff,"October 3, 2017",5, Very informational
150,Judy Shaw,"October 13, 2017",4, Great AP
151,ginger raymond,"August 3, 2017",5, Everything you need to know is in these apps. Download and have fun!!!!
152,A Google user,"May 22, 2017",1, My donations did not show up on my Relay for Life account. I shared from app to Facebook. The donations went into American Cancer Society account. Called 2 differant 800 phone numbers and both said funds cannot be transferred back to my Relay account. This app is awful and I am deleting it. I will o...Full ReviewMy donations did not show up on my Relay for Life account. I shared from app to Facebook. The donations went into American Cancer Society account. Called 2 differant 800 phone numbers and both said funds cannot be transferred back to my Relay account. This app is awful and I am deleting it. I will only now use the Relay for Life webpage to fundraise.
153,Dawn Adams,"August 14, 2017",4," It seems easy, I just wish the auto payment amount options started at $25 instead of $35"
154,K Racano,"May 20, 2017",2, This needs to be more user friendly like the dashboard online.
155,L Hagman,"May 27, 2017",5, Works much better than it did last year! Love it!
156,Ŕobertà Ďutchèr,"April 27, 2017",5, Works great and fast
157,A Google user,"March 3, 2017",2, Very frustrating to use!!  Have to log out and go back to the old  Making Strides app just to be able to see who's donating. Can't click on anyone or anything.  Also not getting notifications when people are donating. Hoped this year it would actually work.
158,mega_doge playz,"March 3, 2017",5," After having problems getting logged on with my new phone, I called ACS and they got to work fixing the problem.  Received a email stating that the app had been fixed and was now compatible with my android 7.0 phone."
159,Evelyn Munday,"January 25, 2017",1," I am now walking away from my third donation because I can't get this app to work.  I have stopped promoting it as a fundraising tool to my team members because it is SO unreliable.  IF I can get it to take a picture, and IF I can get it to acknowledge the checks are on US funds, I inevitability get...Full ReviewI am now walking away from my third donation because I can't get this app to work.  I have stopped promoting it as a fundraising tool to my team members because it is SO unreliable.  IF I can get it to take a picture, and IF I can get it to acknowledge the checks are on US funds, I inevitability get the donation rejected email.  FRUSTRATED!!  Emailed ACS requesting assistance and got no response."
160,Darcie Jones,"November 10, 2017",2," I have money to put on a different team member, as it is money raised by that person. I can't even access my team's roster to apply the money to the proper team member with this app, and I am co-captain of the team."
161,Carol Jamison,"March 2, 2017",1," I was very happy with the app earlier this season but now it won't let me log in. I've uninstalled and reinstalled it several times and all I get is the spinning wheel. As an event lead, I've promoted this app often.  I hate to tell them to disregard as it doesn't work.  I was very excited about thi...Full ReviewI was very happy with the app earlier this season but now it won't let me log in. I've uninstalled and reinstalled it several times and all I get is the spinning wheel. As an event lead, I've promoted this app often.  I hate to tell them to disregard as it doesn't work.  I was very excited about this app and am now highly disappointed. Its over a year old so these types of bugs should be non-existent. I hope the issues are resolved soon."
162,Faith Borel,"December 7, 2016",4,Much better It's getting much better. Wish we could put our in kind donations cause those help support our Relay too
163,Alex Ranc,"February 14, 2017",1, I've been trying to get this app to open for an hour. It just keeps spinning. I've lost so many donations because of it.
164,A Google user,"February 3, 2017",1, Will not log on no matter which method I use. Tried Facebook Google and typing in my email and password. Nothing ever happens just keeps loading.
165,Allen Holtz,"February 24, 2017",1, The app downloads but will not log-in no matter what I try.  The app just spins and spins and spins.  The app does NOT WORK with Android 7.1.1.  Forget it.  App stinks.
166,Jordan Bartlett,"February 25, 2017",1, Can't even log in on the app! Very inconvenient when I have my phone with me all the time. Can't take my donations! It sucks!!
167,Valentino Lovato,"January 25, 2017",1, I've downloaded the app three times.  App won't let me login for any reason.
168,Johnathon Musgrove,"March 2, 2017",3, I love it when it works but now I have an Honor 8 it will not get past the login screen.  Just loads forever after entering my credentials.
169,Showdow Grayhawk,"March 2, 2017",1, It has crashed with logging in with Facebook.
170,A Google user,"February 2, 2017",4, Works great! Paypal donations have been perfect and I can see all our teams progress.
171,Antoine Kepczyk,"February 2, 2017",1, Literally won't even load past the log in screen...
172,Amy Cedars,"March 26, 2017",1, The app was so much easier last year. There is no where to enter cash amounts.
173,Sam Swanson,"February 7, 2017",1, It said that I wasn't registered when I actually am
174,Roselynn Stoy,"October 15, 2016",2,Terrible Does not show donations. Does not show team. Won't take check scans. I am deleting it now.
175,Melodyann Williams-Vena,"October 2, 2016",2," Says I'm not registered, when my team is, won't let me log in"
176,briann drake,"September 25, 2016",5,Great app A great app for fundraising
177,kathey phan,"September 11, 2016",3, I am not able to access my team page. It kept saying failed to fetch team page even after I've rebooted my phone. Please fix. Thanks
178,A M,"September 13, 2016",1, This app does not work
179,nic b,"July 18, 2016",2,"Can't accept checks It took about 20 attempts to photograph a check and it was approved on Friday and now I've woken up to an email saying the download didn't work!!! Very frustrating!!! Told me to get the latest version of the ap, which I have 😕"
180,Brenda Dunn,"July 23, 2016",1,Worthless for checks Cannot get it to take a photo of a check to save my life.
181,Marina Saldana,"August 9, 2016",2, I can't get a working link thru text to send folks so they can join our team
182,Yvette M. Lama,"June 3, 2016",5,"Convenient FUNdraising On-The-Go Easy to use and SO convenient--Especially with the ability to process credit cards and checks in ""real time.""  With this app, you'll meet or exceed your fundraising goals!! Encourage all your team members to download this app today!!"
183,Laura Frankhouser,"June 6, 2016",4,Team Alverson Very easy to use and I'd love to be able to keep track my team's progress and get credit cards processed and checks processed quickly.
