index,author_name,review_date,reviewer_ratings,review_body
184,LANI Munoz,"May 3, 2016",2,Loved it till.... I download relay for life awhile ago and everything worked fine. Then I upgraded to this version and had login issues as well as issues with sending messages and asking for donations. It does not give me any options to select from when I click send message. No email no text no Facebook etc. I hope t...Full ReviewI download relay for life awhile ago and everything worked fine. Then I upgraded to this version and had login issues as well as issues with sending messages and asking for donations. It does not give me any options to select from when I click send message. No email no text no Facebook etc. I hope they fix this issue so I can love this app as much as previous one.
185,Kati Westcott,"April 21, 2016",5,I love this App! I absolutely love being able to enter checks immediately when I get them and see my fundraising total go up immediately!  It is so easy to use. I also like being able to send text messages to my contact list on on my phone to ask for donations. Makes it so easy. Thank you for this great tool!
186,Ben Kaplan,"April 21, 2016",5, Upgraded version resolved a bug I was experiencing.  Thanks ACS.    The new FUNdraising app is great b/c now I don't need two separate apps to help fundraise and track funds.  I like the new look and feel and it seems to be much faster than previous versions.  I wish it allowed payment via Android P...Full ReviewUpgraded version resolved a bug I was experiencing.  Thanks ACS.    The new FUNdraising app is great b/c now I don't need two separate apps to help fundraise and track funds.  I like the new look and feel and it seems to be much faster than previous versions.  I wish it allowed payment via Android Pay...
187,katie chiocca,"April 24, 2016",4," I had to reach out for assistance as I was getting an error message when I tried to log in.  Up and running now, thanks Ben!"
188,Cassie Meeks,"April 27, 2016",3,Asking people to join. Hi like the new app but am disappointed because I'm unable to use the making strides app anymore and can't ask people to join my team like I have in previous years. Can you help?
189,Sarah Yingling,"May 1, 2016",1,"I can't log in to this app I have tried many of time to log in. I've changed my password more than once, but it just keeps telling me to migrate my account. Which makes no sense, I have tried everything."
190,Heather Sewczak,"April 27, 2016",5,"Fundraising made easy, bugs fixed! Everyone was raving, so I had to try. Love this app!"
191,Ashley Ingraham,"April 24, 2016",1,Still having log in errors Unable to log in. Changed the password a couple times amd constantly get yhe error tbd or incorrect login info.
192,Chrissy Seals,"July 7, 2016",5," I love the new ACS FUNdraising app! It is so easy for me to post to my Facebook page and links directly to my fundraising page. For my personal use, it allows me to keep up with my donation activity, the main page shows how close I am to my fundraising goal."
193,Erin Buehrer,"May 3, 2016",2,Check donations option needs improvement Take many times to get clear picture copy
194,Pamela Villars,"May 26, 2016",4," I don't use the app a lot, but it does exactly what I need it to -- it's easy to navigate and fast."
195,Dawn Hecke,"June 3, 2016",5,Easy to use I love this app.
196,Ygnacio Mutio,"March 31, 2016",1,This app is pointless The Relay for Life app actually served a purpose to help me manage teams. This doesn't even let me see how my team is doing or anything. Would rather just load in a browser.
197,Maria Dacosta,"April 2, 2016",1,"Doesn't work I downloaded this because the Relay for life app directed me to this one. Now neither one works! Extremely disappointed! My relay event is in 2 months and I do most of my fundraising thru the app, now it doesn't work. PLEASE FIX QUICKLY!"
198,Cassie Lambert,"April 3, 2016",1,Log in It'd be great if I could actually log in. I set my email as my username and it won't let me log in because of that. I can't log in with my Google account or my Facebook. I tried resetting my password and it won't accept it. I deleted the other app so now I can't even keep track of how my team is doi...Full ReviewIt'd be great if I could actually log in. I set my email as my username and it won't let me log in because of that. I can't log in with my Google account or my Facebook. I tried resetting my password and it won't accept it. I deleted the other app so now I can't even keep track of how my team is doing. Very annoying!
199,Candace Haynes,"March 31, 2016",1,"Can't log in! I can see that I am not the only one having this issue. Anyone who had an account with the Relay for Life app is unable to log in to this new app. We are missing out on valuable fundraising opportunities because no one is fixing this. What does migrate my account mean? It keeps telling me to do this...Full ReviewI can see that I am not the only one having this issue. Anyone who had an account with the Relay for Life app is unable to log in to this new app. We are missing out on valuable fundraising opportunities because no one is fixing this. What does migrate my account mean? It keeps telling me to do this, which makes no sense with no directions."
200,Tina Shifflett,"April 6, 2016",3,"Easier to use Easier to use than RFL app but it won't let you ask for donations for luminaries. Would like to have email templates from website available. Right now, using app and website to do what I want"
201,Hilary Howser,"April 24, 2016",5,Love the updates! I used my new app at a fundraiser yesterday to accept credit cards and checks instantly. My profile was updated immediately with my new fundraising progress and it was so simple to use. Thank you for the fantastic updates! SO MUCH BETTER THAN THE OLD APP!
202,Tom Willner,"March 23, 2016",5," It's great to be able to accept credit cards, checks, and now even Paypal for donations. The new version has added a lot of features and a much nicer interface. Well done!"
203,Lori De Rosa,"April 7, 2016",1,Does not work. It won't let me login and says I have to login to the browser and migrate my account. I do not see an option to migrate within the browser app. Please fix your problems so that people aren't confused and have problems getting donations.
204,Sarah Davenport,"March 31, 2016",1,"Login Problems It won't let me login, even after resetting my password!"
205,Darren Ross,"April 16, 2016",5,Great new App. I use it in my android device and it works great. Easy way to help fight cancer and raise awareness. Great job ACS!
206,Amber Dewberry,"April 2, 2016",1," Well, I was hoping the login problem was fixed, but I cannot login either. Come on ACS please fix this."
207,Shane Joynes,"April 4, 2016",1,Cant login Same problem as literally everyone else.
208,Caryline Clark,"March 29, 2016",5,Great updates! I love that fundraising can be linked to my team page. And that paypal is accepted!
209,Debbie Smith,"April 23, 2016",5,Makes it so easy! Love being able to raise even more money for a great cause!
210,Me,"March 30, 2016",1,Frustration It would be great if it would let me log in properly.
211,Carleen DeSisto,"April 11, 2016",1, App doesn't work. Can't log in
212,Frances Braun,"April 7, 2016",1,Sign in This app will not accept my sign on that I have already.
213,christy brown,"March 31, 2016",1,Can't login How do we raise money if it won't log in?????
214,Amber Staggers,"April 1, 2016",2, Love the idea but needs lots of help!
215,Alyssa Minaev,"April 2, 2016",1,The old app is better Cant log in
216,Crystal Drumheller,"March 18, 2016",1,Can't log in Keeps telling me to link my accounts but then tells me my credentials are bad and I need to update them. I only have one account. I'm not sure what I'm supposed to link. Please fix this!
217,Ricky,"November 13, 2015",1,Can't scan checks You need to upgrade the app to allow you to take a picture of the check like banks do instead of scanning.  I spend 10 to 15 minutes every check trying to scan a check
218,Adnahc Chew,"October 13, 2015",1,"Log in I have updated my ""credentials "" several times and it still won't let me log in"
219,Jasmine Kaufer,"November 6, 2015",2,"Frustrating The app only let's me scan ONE check after I uninstall and reinstall it.  Also, the actual scanning of check is not accurate and rarely works."
220,Leeann Jenkins,"January 16, 2016",2,Can't log in I have tried several times and can not log in.
221,Ashley Barnes,"March 9, 2016",3," After i log in and it takes me to pick the event i'm in,  it just takes me right out of the app."
222,Chris Jensen,"February 19, 2016",3, Can't log in.
223,Emmy Bailey,"March 3, 2016",5,Whole new way to relay Very easy to use
224,Alexander Eder,"September 11, 2015",5,"Great app Such a good idea, thank you for finally making it available for Android devices!"
225,Jen Vargas,"September 21, 2015",4,"Finally for Android! So far, so smooth..."
226,Mike Katchourine,"April 4, 2017",5," I highly recommend this app to anyone who is a serious fundraiser for ACS. It combines features across all possible ways of fundraising  - accepting credit card donations directly from people at the spur of the moment, reaching out to your contacts, processing paper checks, checking team status, sen...Full ReviewI highly recommend this app to anyone who is a serious fundraiser for ACS. It combines features across all possible ways of fundraising  - accepting credit card donations directly from people at the spur of the moment, reaching out to your contacts, processing paper checks, checking team status, sending receipts, adding photos to your page, sending event coordinates...   Plus, you can put it in your pocket. Sure, it's not perfect, but nothing ever is."
227,Janice Williamson,"March 31, 2016",1," Great idea but not only does it not work,  but now I can't get to the original Relay For Life app to work.  This app is always prompting me to download now, even though it shows is already installed. ..very frustrating!"
228,Michelle Burnett,"June 20, 2018",5," I am a Cancer Survivor as of 2002. I had my daughter on 6-26-2002. Then in 
2004 Emily Elizabeth Burnett also saved her grandmother Barboura Burnett by 
having put off her breasts exam until 2005 were we found out the she had 
breast cancer."
229,Megan White,"March 23, 2018",3, This app worked great until I bought a new phone.  Now I can't even open the app to fundraise.  I have relay for Life event happening in two months and have not been able to share this to get donations.  Please help.  My last phone was an Android and still have an Android.
230,A Google user,"February 14, 2017",2," It was working great about a month ago, but now I can't get passed the log in screen.  Same issues as many others apparently. Unfortunate - I was really hoping this would be helpful. Deleted it."
231,Shawn Posthumus,"June 3, 2016",1, Really wish I could use this app. The old one no longer works and this one is not compatible with any of my families 3 tablets answer 3 smart phones. 6 devices and not one that I can use this on. Seems stupid to make it so people cannot even do anything to help their team out.
232,Michelle Fertig,"June 5, 2016",5,Thank you for this app Just found out that I have second stage breast cancer and this is going to help me out a lot thank you very much I have never used it but I surely will Now.. I will be having surgery next week everyone keep me up in your prayers thank you
233,Janna McKenna,"March 31, 2016",1,"Not an Improvement Able to use the app once, but after that it kept locking up on blue entrance screen. User interface not nearly as interactive as other apps."
234,JANET BENEZET,"April 8, 2016",1, New to using this and it won't let you log in. Seem that a lot of people are having the same problem. PLEASE fix your app.
235,Fran Coffey,"November 18, 2015",1,Logging in Keeps telling me my password and I'd don't match.  So I reset it and I get the same results.  PLEASE HELP!!!
236,Mary Keil,"November 15, 2015",1, Unable to log in. How do you set your username and password?
237,josh hollingshead,"February 16, 2018",1, I donated and it didnt get credited to my girlfriends team
238,Rredrose,"November 30, 2015",5,Great way to raise funds This app helped us obtain more donations than before.
239,Hope Ukpong,"October 31, 2016",1,"Doesn't work Can't scan checks, and doesn't work half the time. Last year it was so much better!"
240,M Taylor,"March 1, 2017",2, Lots of bugs. Won't run correctly half of the time.
241,Alicia,"March 13, 2017",1," I've downloaded it, deleted it, downloaded it again and repeat 3 more times. It WILL NOT show this year at all. It always go right back to 2016."
242,A Google user,"February 26, 2017",4, Works great but it didn't work in Android 7.  ACS said they will have a fix in less than a week from now.
243,Krystal Pryor,"February 3, 2017",1, I downloaded this app to help get donations but it won't even log me in. What use is it if it won't log in to your account?
244,Cindy Trull,"May 1, 2017",2, Unhelpful..This doesn't work correctly.
245,A Google user,"January 14, 2017",1,Can't log in I am registered and have a team and the app will not get past the log in page.
246,Samantha Cohen,"September 28, 2016",1, I couldn't even open the app. I tried 4 times then deleted right away.
247,A Google user,"March 22, 2018",5, It has everything for me and my team
248,Erin Jones,"May 25, 2016",1, I can't install this at all
249,brenda ransom,"February 27, 2017",1, Not Android friendly!
250,Loni Mounger,"March 29, 2016",3,Excited New to me I pray people look me up!
251,Brenda Bush,"July 29, 2017",5, Good idea for people that can't make  the walk.  Thx
252,A Google user,"July 26, 2018",5, FIRST TIME USERS BUT EASY TO ACCESS
253,Ken Koski,"May 8, 2017",4," Good tool to take donations anytime, anywhere."
254,Robin D,"April 13, 2017",5, I know I'm going to love this app
255,Teri Shockley,"September 10, 2019",5, God app
256,Mary Young,"May 5, 2016",5, Such a good cause
257,joan wills,"April 11, 2016",5, Relay for Life
258,A Google user,"February 2, 2018",4, Ok
259,Shara Haslett,"September 25, 2019",5, Survival
260,Anna Codini,"April 4, 2017",5, Easy  to donate
261,Linda LaPrise,"October 9, 2017",5, Great and convenient
262,Bella Mary Portraits,"June 18, 2018",5, Love it
263,Cathey Mckinney,"May 10, 2019",5, great
