index,author_name,review_date,reviewer_ratings,review_body
0,Jin Laxmidas,"March 9, 2020",3, The direct connection to Google G suite and Gmail is what we miss. Our team complains constantly that Insightly is not intuitive and easy to use. I hope you can fix this otherwise we'll be forced to move to a different CRM
1,Kevin Sippel Jr,"January 24, 2020",5," App syncs nicely, and puts nearly all of the power of the desktop version on android."
2,Pan Talon,"January 6, 2020",5," Great mobile companion to web CRM, accepts contacts shared from phone."
3,Bloomquist Chimney Services,"January 18, 2020",4," It is very convenient. Of course there are things that have to be done on the sight that can't be done on the app. Most of what gets done on the app does sync with the sight. Somethings do not. If I create a task for someone other than me on the app, most of the time it doesn't sync. The really stra...Full ReviewIt is very convenient. Of course there are things that have to be done on the sight that can't be done on the app. Most of what gets done on the app does sync with the sight. Somethings do not. If I create a task for someone other than me on the app, most of the time it doesn't sync. The really strange thing is that I can sync my Google calendar to the app, but not to the sight. I would say more, but I am out of space."
4,Gordon Remmington,"October 30, 2019",3," No issues with the app..but it's missing the most useful feature from the web interface - Reports. For a manager, viewing reports is essential for tracking performance of sales and projects, and you have to revert to the web interface instead as the app doesn't show them."
5,Chad Clements,"May 8, 2019",3, It works OK. There are some quirks that makes it inconvenient to use. Chiefly that I can't copy an email address from a lead screen on my Pixel 2 running the latest version of Android. I want to tag my emails sent from Gmail but can't copy the addreses. UPDATE 5/7/2019: developer still hasnt added t...Full ReviewIt works OK. There are some quirks that makes it inconvenient to use. Chiefly that I can't copy an email address from a lead screen on my Pixel 2 running the latest version of Android. I want to tag my emails sent from Gmail but can't copy the addreses. UPDATE 5/7/2019: developer still hasnt added this functionality. What's the point of having an app when it's easier to work from a mobile browser to get work done??
6,Sky Sorenson,"December 5, 2018",2," There is no way to create a report by birthdays.  This should be CRM 101.    I've been paying for the service for a while and they just ignore any requests for help on this.  The 'help' folks tell you to put the request in a forum where there are a bunch of requests for this languishing.  They hoste...Full ReviewThere is no way to create a report by birthdays.  This should be CRM 101.    I've been paying for the service for a while and they just ignore any requests for help on this.  The 'help' folks tell you to put the request in a forum where there are a bunch of requests for this languishing.  They hosted a webinar where I specifically asked about it, the host promised to get back to me when I pointed out that her solutions wouldn't work, and I never heard back.  So frustrating. I'm actively researching competing CRMs."
7,Egor Poludo,"June 21, 2019",3," I like the browser version, but in this app when I want to create a lead, let's say i find a contact on Instagram and want to copy their info to insightly, when I put in the email, then switch to Instagram to get the phone number and get back to insightly the Email I had put in is gone. it's not pos...Full ReviewI like the browser version, but in this app when I want to create a lead, let's say i find a contact on Instagram and want to copy their info to insightly, when I put in the email, then switch to Instagram to get the phone number and get back to insightly the Email I had put in is gone. it's not possible for me to input lead info from the same device, which is a hell of an inconvenience when I discover leads on the go. Samsung galaxy s8+ can this be fixed?"
8,Dwi Pantara,"February 23, 2020",1," I don't know why, I'm not able to signup"
9,oscar munoz,"October 31, 2019",4," Great tool to have in my phone, I wish I could see the dashboards and that I could be able to edit the lead steps"
10,Garrett Jacobs,"April 25, 2019",2," Search option is useless...won't search the entirity of various leads, opps etc. Rendering the search option near useless. Anyone doing B to B sales knows that being able to search for a name or LLC is crucial to getting the right information while on a sales call. -Canot sell multiple products once...Full ReviewSearch option is useless...won't search the entirity of various leads, opps etc. Rendering the search option near useless. Anyone doing B to B sales knows that being able to search for a name or LLC is crucial to getting the right information while on a sales call. -Canot sell multiple products once set up as a opportunity. EG, once a contact(EG Lead>Opportunity >Sales>Contact) showing they are interested on your new product is impossible."
11,Aaron Little,"September 30, 2019",4," It's a really good app for completing tasks and logging calls. The web based portion is better for creating calls, organizations and tasks. Hand in hand they are awesome."
12,"Tim Montague, Solar Expert","November 27, 2018",5, Great CRM app. Affordable but robust for small to medium orgs and companies. Modern interface. Easy to learn.
13,Kelly Sequeiros,"November 5, 2018",1, I can't sign up! I fill in all the fields and nothing happens when it refreshes.
14,Daniel Bainbridge,"May 31, 2019",5, quick and easy to add contacts and modify what stage in the sales cycle the client is. This will definitely help me grow my business
15,Tran Duc Nghia,"October 1, 2019",5," Good, although subscription is a bit expensive, even for a longterm SME user like myself."
16,Nancy Grant-Scott,"April 17, 2019",5, Love logging real time activity and the ability to pull up account info on the go!
17,Broken Boundaries,"September 11, 2019",5, So convient door our home based business! with lots of sales & service appoitments on the road its simple to use from any device.
18,Darin Ray,"July 21, 2019",4, Love the app! Just wish the math feature was not restricted to higher payment plans.
19,Hans Giraud,"June 26, 2019",5," Great interface, Effective, and easy to use"
20,Matt Stiller,"November 26, 2019",5," I manage a network of about 650 people and this CRM has worked really well for me. Were about to grow to about 4000-5000 members, and I am comfortable using insightly for that. Go Google goðŸ¤™"
21,Jim McLaughlin,"December 14, 2018",5, Love the combination of crm and project management. Does most of what I need.
22,Joseph Mouton,"March 20, 2019",1, cant even setup an account. not a good start.
23,Mommy ISH,"January 17, 2019",1, unable to open app. orange screen
24,Francesco Vetrano,"June 25, 2019",5, Easy and flexible
25,Daryl rajnovic,"February 5, 2019",1, no email sent for log in
26,Prakash Jaiswal,"August 3, 2019",5, Beautiful app...very usefull
27,Vince Lee,"December 19, 2018",5, awesome tool to use
28,Jason Lovegrove,"March 4, 2020",5, Really good crm
29,peter hill,"February 4, 2019",5, awesome crm. easy to use too
30,Sonia Ochoa,"February 19, 2019",5, this app is amazing
31,Chidi Nnejiakolam,"November 23, 2018",3, Its user friendly
32,Dean Marks,"February 5, 2020",5, I love how well the app works on mobile devices now.
33,Warrick Morgan,"October 18, 2019",1, App / program isn't entirely trash but zero customer tech support. DO NOT INSTALL OR USE THIS APP - USE SOMETHING BETTER
34,Alan Wright,"May 21, 2019",5," Great app, really has helped me coordinate my dealings with my contacts, been using it for 2 years now, could not do without it."
35,Jason McLennan,"May 17, 2019",5, great functionality
36,Grant Bain,"February 11, 2019",5, I have not been able to edit the body of notes for 2 months. I use a Pixel 2 with OS 8.1.0. I have seen several comments here and on the insightly help forms about this. The help desk has not oh knowledge that they are having a problem or let us know any action they're taking. I just want to be able...Full ReviewI have not been able to edit the body of notes for 2 months. I use a Pixel 2 with OS 8.1.0. I have seen several comments here and on the insightly help forms about this. The help desk has not oh knowledge that they are having a problem or let us know any action they're taking. I just want to be able to edit my notes in the field as this is a large portion of my job. It does not seem that Apple's IOS is having the same issue.
37,Frank Carosella,"January 2, 2019",4, A lot of updates in this mobile app .
38,Sheldon B,"September 20, 2018",1, Feels like I am dealing with a CRM. Very fast response publicly and no meaningful follow up after... while I pay for sonething I cannot use. Shocking! The app used to be useful but I cannot log in after upgrading to a Samsung S9+. Log in approved and straight back to log in screen where I can do it ...Full ReviewFeels like I am dealing with a CRM. Very fast response publicly and no meaningful follow up after... while I pay for sonething I cannot use. Shocking! The app used to be useful but I cannot log in after upgrading to a Samsung S9+. Log in approved and straight back to log in screen where I can do it again... and again... I received a pleasant message thanking me for input but nothing further has happen. I am paying for a service that I cannot access via the app.
39,Jann Mirchandani,"August 2, 2018",5," I've been using Insightly from the beginning. The app has continually 
gotten better. While I mostly use Insightly on my computer, it's great 
being able to work efficiently on my phone when I'm away from my desk!"
40,Allen Hauptman,"August 21, 2018",5," I've been a power user of Salesforce, in the past. I've been using Insightly for 14 months. It has everything I relied on in Salesforce at a fraction of the cost. I love it."
41,Gabriel .Camarena,"August 4, 2018",2," This is not intuitive. There is no way to add notes to leads, 
opportunities, or projects. There is a Related tab for each of those that 
says Notes but it is unresponsive."
42,George Kiorpelidis,"July 27, 2018",4," I've been using the desktop version since the beginning and am really 
loving the convenient app."
43,Brian LoBue,"June 19, 2018",3," Interface could be more useful.  I just arrived in a city where we have some customers.  Couldn't do a sort in the app of organizations by state or city, so it was useless to me while in transit to see who I needed to start setting up visits with.  Too bad, because all the data is in their system."
44,Scott Hogue,"August 3, 2018",2," This company has some problems. The app originally was pretty good and I could see it becoming great in the CRM field, but they took some wrong turns. First, how does a CRM app not allow the use of the word appointment anywhere? An appointment is the basic unit of sales. All of the previous CRM's I ...Full ReviewThis company has some problems. The app originally was pretty good and I could see it becoming great in the CRM field, but they took some wrong turns. First, how does a CRM app not allow the use of the word appointment anywhere? An appointment is the basic unit of sales. All of the previous CRM's I used allowed you to easily schedule an appointment and call it an appointment. It causes a lot of confusion, an event could be a lot of things. Next, they had custom fields you could make and use, but in an update they did away with them and you lost all data you entered into them. And speaking of losing data, as far as I can tell there is no way you can back up your data and keep it safe yourself. Now they have updated the software and it is incompatible with my device. How nice. Once again they have took away features, in this case the ability to use it. They have some things working for them, but it looks like some competitor has infiltrated their business and is sinking them (no I am not serious, but they couldn't do much better if they were) This company desperately needs to communicate with some traditional salespeople and listen..."
45,A Google user,"May 29, 2018",4," Wish I could load my companies on to Google maps easily to see all accounts 
without having to use another application like Badger."
46,Edwin Jeppe,"May 30, 2018",4, I currently use GEOCRM which is a free crm with a web and mobile platform and has all the features and everything I need. Tried this app out after a friend recommended it. Nice UI and great design.
47,Justin Kattau,"June 18, 2018",5," Good app for keeping lead organized. You can record contact,and keep track 
of interaction so no one falls through the cracks."
48,Cera Ridley,"May 25, 2018",5, Great app. Insightly keeps us on task.
49,Daniel Shinkle,"March 26, 2018",5," The app has access to all project and contact information in a convenient format. Unfortunately, there is no off-line access. I've tried several other project management systems and this is the best I have found."
50,Mel Neil,"March 21, 2018",5," Since the last updates, this is awesome. Do wish I could use it offline and then callibrate with the desktop once I'm bcak online but even so, I am in love with it"
51,John Williams,"March 27, 2018",4, Nice easy to use. Would be good if voice to text notations were available.
52,PaPa Morty,"April 25, 2018",4," Iike it. Takes a few YouTube videos to really figure it out (I'm new to 
CRM), but I can see how powerful it can be."
53,John Hill,"April 25, 2018",4," Great app for managing the main components of your CRM. Would love to see 
reports in an upcoming release."
54,×©×ž×¢×•×Ÿ × ×™×–×¨×“,"March 15, 2018",5, Very good
55,Abhilash Kumar,"April 3, 2018",5, Awesome
56,A Google user,"February 7, 2018",5," I am out on the road, making sales calls all day.  I love this app!  It is so user friendly and an easy way to track the status of my customers."
57,Devlin Hendry,"February 27, 2018",3, Peetty helpful but not as great as desktop version alot of exclutions were done from the desktop to mobile but helpful
58,Azeem Qasim,"January 21, 2018",3, No option to send email templates from app. Link it with email
59,Daniele Zanoni,"February 20, 2018",5, Really a good instrument that can be used insteadof the online version with basically all the functionalities
60,John Duprey,"January 13, 2018",5, Great mobile CRM!
61,Brian Hampton,"January 6, 2018",2, Last update broke the app. Can not edit or add new notes. Been broken for 2+ months now.
62,Aaron Daley,"November 29, 2017",4, Pretty good mobile version of the desktop version. No complaints so far as I can use it in there after a sales call to make notes about the transaction.
63,A Google user,"November 1, 2017",5, Insightly is well organized for what I do as an Appliance dealer- relationships were never easier to keep track of!
64,A Google user,"January 1, 2018",4, Please advice if the call tracker from magneticone is the good app to go allign with this app or not?
65,Matt Marshall,"August 29, 2017",3," Ok app.   Problems that need addressing,   1. Need to be able to automatically sync and update contacts on phone tied to a specific account.  2.need to be able to select which page to open to, very rarely do I want open tasks first almost always I'm looking up a contact to update.  3. Clean up searc...Full ReviewOk app.   Problems that need addressing,   1. Need to be able to automatically sync and update contacts on phone tied to a specific account.  2.need to be able to select which page to open to, very rarely do I want open tasks first almost always I'm looking up a contact to update.  3. Clean up search algorithms"
66,Richard Day,"September 13, 2017",5," I have been using this app for about three years.  I am very happy that they continue to develop more features.  Granted, I am not a large company, so many of the improvements are not something I need.  However, it is important that they continue to try to make this app more friendly and capable.  I...Full ReviewI have been using this app for about three years.  I am very happy that they continue to develop more features.  Granted, I am not a large company, so many of the improvements are not something I need.  However, it is important that they continue to try to make this app more friendly and capable.  I would recommend this to a sole practitioner who needs to keep a large number of clients and prospects in control.  I make notes of what I said and what he said.  I email through this app, or I attach the email during the process of sending the email using my gmail account.  The more I use it, the more I depend on it.  I use the mobile app to record meetings after they take place.  When I am sitting in my car, before I move to the next appt or to home, I record the most important aspects of the meeting.  Buy it."
67,Joseph Serrago,"September 5, 2017",3," The app has potential but I think is missing a few key features. When importing contacts search for specific contacts will be imported instead of having to scroll through an entire list. When doing a mass Imports a lot of the organization's I had attached to my contacts didn't come through. Import t...Full ReviewThe app has potential but I think is missing a few key features. When importing contacts search for specific contacts will be imported instead of having to scroll through an entire list. When doing a mass Imports a lot of the organization's I had attached to my contacts didn't come through. Import the contacts one at a time the companies they work for show up. If I make an update to my contacts in my address book and then we imported in, the contact duplicates instead of updates. Something in the system that could recognize duplicates, or ask to merge certain contacts would be ideal. In fact I'd rather keep my contact list on the phone I have it sync rahter having to push it up each time. The same thing with Google Calendar, I would like to keep my events on the Google side but be able to add events from the app or the website be able to see the calendar through it. Basically I'm not asking insightly to store my company data as much as help me manage and organize it."
68,Alpha-Med LTD,"September 8, 2017",5," I use insightly CRM for my small business and I find it very easy to work with and have also costumized for my needs with ease. The mobile app is also good and I can basically manage with it outside the office, without a laptop. The great aspect of Insightly is that  the platform is constantly impro...Full ReviewI use insightly CRM for my small business and I find it very easy to work with and have also costumized for my needs with ease. The mobile app is also good and I can basically manage with it outside the office, without a laptop. The great aspect of Insightly is that  the platform is constantly improving with more integrations, features and ease of use."
69,The Makers Guild,"October 7, 2017",5," Fantastic CRM for our small, rapidly growing business. We love the customization it allows us and it helps us keep track of our enormous list of tasks, contacts and organizations, and our ongoing projects, in an organized manner.  The one thing it is missing, is the ability to integrate our financia...Full ReviewFantastic CRM for our small, rapidly growing business. We love the customization it allows us and it helps us keep track of our enormous list of tasks, contacts and organizations, and our ongoing projects, in an organized manner.  The one thing it is missing, is the ability to integrate our financial software, but we are hoping insightly will incorporate that soon."
70,Bemmygail,"July 4, 2017",3, I could not see income through the app. No reports section I can review. Or maybe I just could not find it.
71,Farrell Gosnell,"September 12, 2017",5," Perfect CRM for us! Every detail of every project in one place, well actually, in many places, as in your phone, tablet, laptop, lets you work from anywhere! Love the Gmail gadget and Google calendar integration!"
72,Jon Windmueller,"September 27, 2017",5," We searched high and low for a CRM that would do what Insightly can do... Insightly is how we run our business! Versatile, customizable, web-based, integrates with Google we love it!"
73,Daniel Shinkle,"September 23, 2017",4, Easy to use mobile version of Insightly seems to have all the functionality of the web version. It is stable and fast. Only downside is the lack of offline usage
74,Din Duong,"August 22, 2017",3, Does app have the record ID like on the website? I could not find it in app. A bit disapointed
75,Angas Reid,"June 28, 2017",5, Absolutely love what Insightly has done with the app. Significant improvements on every update. Awesome work.
76,Andy Nathan,"August 15, 2017",1, Who limits card scans to 5 per month as a paid feature when other apps do it for free.
77,Eric TheRed,"October 8, 2017",3, I need help I can't save nothing new and I'm lost Ericthered4000@gmail HELP I need this
78,Troy Lachinski,"August 19, 2017",5, Easy to use. Great to have easy access from both PC and Phone.
79,Fedi Fianto,"September 15, 2017",5, We use Insightly for our CRM for 2 months now and really like it. Integration with Google Apps is really helpful.
80,David Brown,"August 8, 2017",4, This is great for tracking our customers.  I recommend it highly.
81,Ilan Komarovsky,"September 4, 2017",5, we use it for our business and we love it
82,Amol Magar,"August 18, 2017",1, Not able to login
83,Joey Mallari,"September 26, 2017",5, I love this app. Makes my work so much organized
84,Matthew Sapp,"November 2, 2017",4, Would really like a secondary widget just for lead contact capture
85,Tiffany Wichert,"July 2, 2017",5, Best business tool
86,Joshua Escobedo,"August 5, 2017",5, Quick and efficient. Exactly what I want for mobile
87,Ricard FarrÃ©s,"September 24, 2017",4, Its ok
88,Julian Fernandez,"August 24, 2017",5, Hands down best CRM and Google integration...
89,Jody Foster,"November 9, 2017",5, Life saver!
90,Jesse Reimer,"June 22, 2017",4," The app has definitely gotten better over time. My initial review would've been 2 stars when I first started using it in early 2016, but now, based on the fact that the web app and the mobile app have more similar capabilities compared to before, it's a 4 star rating from me."
91,Tom Merry,"June 19, 2017",2," Since the standard web access through my laptop is virtually unusable due to slowness, the app at least allows some ability to operate with my data."
92,John Eggenberger,"July 27, 2017",4, Great value. Usually use on laptop but mobile app very helpful /friendly when I'm in the field. Definitely recommend Insightly.
93,Bryan Dern,"June 21, 2017",4, Great mobile access to my data online.
94,Dave Tarrant,"May 25, 2017",4, Pretty decent
95,Keith Armenia,"May 19, 2017",5, I am still setting it up..  I can tell you it is invaluable for tracking my outside sales agents activities.  Itegrates with just about everything I use...  Absolutely easy to use.
96,Cath Waters,"May 14, 2017",2," Tried to login with G suit on both phone and tablet and nothing happens. No prompt, just nothing."
97,Brent LaMountain,"May 26, 2017",5, Thid is da BOMB DIGGITY!
98,Daniel Lees,"May 13, 2017",5," Great App, being improved all the time"
99,Austin Forsyth,"May 1, 2017",5," If you need simple CRM on the road, this is it"
100,brendan nadnerb,"May 14, 2017",5, Collection of data is vital and this app ricks
101,Quynh Ngo,"April 6, 2017",1, Keeps telling me to log in again and again but it doesn't recognise my log in details ðŸ¤”ðŸ˜¡
102,Vidas KavoliÅ«nas,"April 15, 2017",2, Keeps asking for my details but fails recognizing. I can log in via website though.
103,abhi singh,"April 15, 2017",4, Overall its a good app for small startup and later can upgarde to paid versions.
104,James Lockhart,"January 21, 2017",3, Crashing when I try to update a task. Never did this before. I use pixel xl.  Was also having troubles syncing contacts. Not sure if it is the app to be fair. But considering the issues with crashing seems like update is needed. Been using Insightly for years. Never had the problems I am having now.
105,Richard Johnson,"March 22, 2017",2, Totally given up with this company and their shady billing practices and a few friends have said they had the same problems with billing. Also the continuous logging out is annoying. There are lots of issues the company is blind to with that corporate response feel to anything you ask. We have now c...Full ReviewTotally given up with this company and their shady billing practices and a few friends have said they had the same problems with billing. Also the continuous logging out is annoying. There are lots of issues the company is blind to with that corporate response feel to anything you ask. We have now canceled all out accounts as there are just to many broken elements
106,Simon Wadsworth,"March 25, 2017",2," I'm unable to access Organisation notes from the app. Seeing as you moved all our email addresses into a notes text field this weekend without our permission, I'm now unable to view email addresses for our contacts. A huge oversight which I trust Insightly is fixing by restoring our email addresses ...Full ReviewI'm unable to access Organisation notes from the app. Seeing as you moved all our email addresses into a notes text field this weekend without our permission, I'm now unable to view email addresses for our contacts. A huge oversight which I trust Insightly is fixing by restoring our email addresses back into Organisations' About/Contact area - urgently before work opens on Monday morning GMT. Thank you."
