index,author_name,review_date,reviewer_ratings,review_body
0,Suvam Mukherjee,"April 21, 2020",4, Pretty awesome app to view your Azure resources. Clean and simple app interface. Drawback includes limited support for actually controlling these resources. I would say use this app for checking the status of your Azure resources on the go. Hopefully future updates will add greater controlling capab...Full ReviewPretty awesome app to view your Azure resources. Clean and simple app interface. Drawback includes limited support for actually controlling these resources. I would say use this app for checking the status of your Azure resources on the go. Hopefully future updates will add greater controlling capabilities.
1,Malay Vasavada,"March 9, 2020",2," Suddenly this app has stopped working. It continuously asking for sign in organization page. Despite of successfully providing organization username and password and authenticating with Microsoft Authenticator App with code or even approve button, it simply doesn't login. Keep asking organization cr...Full ReviewSuddenly this app has stopped working. It continuously asking for sign in organization page. Despite of successfully providing organization username and password and authenticating with Microsoft Authenticator App with code or even approve button, it simply doesn't login. Keep asking organization credentials again and then code and then again credentials and then code and again... Endless... This was never the case earlier.dont know what has changed. App is now useless since I can't login"
2,Larry Webb,"March 14, 2020",5," Microsoft Azure is the perfect platform used for many purposes including storage, database evaluation, and networking. I have had a positive experience with Azure and highly recommend it to anyone who doesn't necessarily have the principal to buy the resources that Azure offers."
3,Avery Chua,"April 18, 2020",5, Good first experience so far. Easy to use and fast in speed. I move my SAP Business One to Azure from Newtek One. So much faster and economical than Newtek One.
4,Jovany Espinoza,"February 23, 2020",4," Portal functionality is very limited. Unless you memorize the commands to create resources, this application can merely be used for tracking and monitoring your resources. Room for improvement."
5,Cla Oijas,"April 11, 2020",4, Useful for alerts and see a quick status of your services. What would be really nice is too have also a cost dashboard.
6,Kris Deb,"March 10, 2020",2," Not much to do tbh. Useful for control the VMs and nothing else... I wish I had AAD, Intune, identity Protection, Azure Security Center, Sentinel dashboards minimum. At this state it's not Azure app, it's rather Azure VM list."
7,Nicholas Rogoff,"April 17, 2020",5, Great app. Works very well and allows me to manage my Azure environment very quickly
8,Jon Thwaites,"February 7, 2020",1," Completely pointless, I was expecting this to allow me to perform some administrative tasks on our tenantcy. It needs some serious work and features added for it to be worth installing."
9,Lukáš Josai,"March 19, 2020",2," I am very disappointed, the UI sucks, there is no darkmode, you cant add or remove resources and the information available is sparse at best."
10,Ashraf Khan,"March 23, 2020",4, Amazing App. I would have given it 5 stars if only it showed me my Azure Credit Balance when I open the app
11,R S,"March 8, 2020",1, I cant acces AZURE DEVOPS board from this app. It seems the devop service is not integrated with Azure cloud. I wish there was a mobile app for Azure Devops boarfs.
12,Jeffrey Ingle,"March 5, 2020",4, All the extensions and add ons to gather up any and all system and file apps is amazing.I am impressed.
13,dec20056,"March 14, 2020",1, I just wanted to manage work items on my project but after logging in it says i don't have an azure account.
14,Charlie Kimsey,"March 22, 2020",5, Easy setup and connect to your account nice and smooth
15,Abhishek Mukhopadhyay,"February 28, 2020",5, Gives you a good insight of what's happening inside your Azure account.
16,Tonderai Ngirande,"March 1, 2020",5, Great App Check my Sever anytime and but I'm having challenges access my Networking Options
17,Dave Angotti,"April 1, 2020",2, You will get 5 stars when you give us dark mode and configure* it like how the mobile-browser one looks.
18,Olemaiko Kolev,"February 14, 2020",5, Start all is needed. To select all servers.
19,Wade J Hannah,"February 7, 2020",4, No bad. Yet i lost all my work for some reason. Would like to retrieve it back some how. All around it is a great app.
20,Chandrashekhar Seetaram,"February 22, 2020",2, Would have been nice to have cost analysis also on the app
21,Drew Bryant,"February 22, 2020",4, Has simple to follow instructions.
22,Ahmed Hablas,"April 18, 2020",5, Excellent app! Keep up the good work!
23,Andrew Madrigallos,"March 9, 2020",1," Useless app, information are useless, just stick to web."
24,Mike Surcouf,"November 11, 2019",1, This app doesn't seem to work if MFA is enabled.and device compliance is requested. The login shows Device Authentication Required - DeviceId -DeviceAltSecId claims are null Other apps such as Office 365 app seem to work with MFA and conditional access just fine
25,Doug Thompson,"December 15, 2019",3," Whats the app Actually do? As a TFS user moving to Azure i want to know what builds have failed. If i am running out of space somewhere, if i need to trigger a house keeping job. How does my Work Items queue look. What action do i need to take. Are there any pressure points building up in any of my ...Full ReviewWhats the app Actually do? As a TFS user moving to Azure i want to know what builds have failed. If i am running out of space somewhere, if i need to trigger a house keeping job. How does my Work Items queue look. What action do i need to take. Are there any pressure points building up in any of my architectures. What can i do now and what do i have to do in the office. What SDK is there to drive this app so i am always connected. What youtube vids are there to lever this tool - none."
26,Tim Brien,"January 31, 2020",5, Combining this app with the RD Client on a DeX mounted Samsung phone eliminates the need to carry a laptop!
27,Ivan Porta,"January 4, 2020",5, I use this app to manage my web applications instead of using the web portal. It has a friendly UI and offers many useful features.
28,Osarenmwinda Ohuimumwen,"January 4, 2020",5, The application is easily accessible and fast to deploy VMs.
29,Tuomas Hietanen,"January 17, 2020",1," Couldn't even add a firewall rule to a VM. Considering that Azure Portal website is buggy on mobile and cannot do it either, that is where you'd need this software."
30,K K,"October 31, 2019",5," Love it, saved my life a couple of times, was able to restart webapps while having dinner."
31,Αθανάσιος Κουρούκλης,"January 7, 2020",5, A very nice and essential app offers a good look inside the vast amount of information in the Azure cloud.
32,Teja Swaroop Bezawada,"January 19, 2020",4, UI can be improved along with adding more features. Content refresh is a big concern with this app.
33,Bennett Cookson,"December 29, 2019",5, Handy for managing servers when away from computer and I find it much easier for simple tasks than full website.
34,Imran Muhammad,"January 8, 2020",5, One suggestion : Recent resources section should get cleared if the resources have been terminated. I had deleted VM but still showing in recent resources....
35,James Hinojosa,"March 12, 2020",5, Easy to use on mobile devices!
36,Bryan Smith,"March 27, 2020",5, Great app for Azure Admin on the go!
37,מרדכי אלתר,"January 4, 2020",1, Shows nothing but general resource information. I'd expect at least a liitle bit of information beyond resource name and ID. I can't even see the money spent for this month.
38,ssc134,"January 21, 2020",4, Fingerprint unlock feature doesn't work. And the app takes frustrating long to respond even on a decent device processor and a decent network speed.
39,Mr. Saiya OFFICIAL,"April 5, 2020",1, Hello microsoft . why when i go singup azure student free. And i looking for my country (cambodia ) it no has :( why you did it. Idont know what you think about my country :( but you need to know .many people of my country use your product ;(
40,Reagan Govender,"January 10, 2020",5, Excellent app. Very easy to start and stop Azure VMs on the go
41,Anthony Franks,"December 12, 2019",5, Nice app! 👍 I like that you can use cloud Shell in it. First time I've ever been able to use vim from my phone!
42,David Hansen,"December 18, 2019",4, Love this app. Dashboards is the only thing missing.
43,Paul Lloyd,"January 23, 2020",4," Great app, so useful for managing ones Azure environment from a mobile phone."
44,John Landis,"December 8, 2019",5," simple navigation to resource status, and CLI access available."
45,Michael Mancini,"December 19, 2019",1," Doesn't work. All it ever shows me is ""failed to load."""
46,kamar hamzah,"December 3, 2019",1," I registered free account recently and was charged MYR5, despite Microsoft keep emphasising no upfront charge... totally dissapointed"
47,Rayyan Hodges,"December 21, 2019",4," Great app, wish you could deploy and delete things though."
48,Parag P.,"January 15, 2020",2, Unable to set shutdown schedule of a VM.
49,Ankit Shah,"February 14, 2020",1," Not useful Update: I expected ""Users"" and ""Groups"" Ain't this basic requirement?"
50,Peter Nedonosko,"January 22, 2020",5, Good balance of features and quality.
51,Matt Watson,"December 3, 2019",1, This provides practically no real usable functionality. Very limited usefulness.
52,Shaun Hicks,"January 12, 2020",5, Smoothest and best experience with a Microsoft product yet
53,Anthony Robinson,"December 5, 2019",1, Literally just stopped working for no reason. Thoroughly underwhelmed
54,Tharinda Dammika Kumara,"April 23, 2020",5, Very helpful application
55,Guru Prasad,"January 14, 2020",5, Its very easy to Use and manage
56,Vinayreddy Yadavelli,"November 2, 2019",5, Useful app to manage azure resources on the go
57,sinenhlanhla bhengu,"April 5, 2020",3," Just couldn't do a basic like logging in to the azure portal. For me the app wasn't helpful based on what i wanted, for different maybe it is or might."
58,Timothy Lam,"February 27, 2020",1, Refresh Doesnt. Work at all
59,Ali Amjad,"April 18, 2020",5, Best cloud experience compare to AWS or Google
60,Kiron Ghosh,"January 19, 2020",5, Easy to use and works great
61,Michael Richardson,"March 22, 2020",1," I don't understand the point of this app. I cannot control any of the metrics views, see any useful billing information, or manipulate anything. I always end up on the website. Uninstalled."
62,Mark Lawton,"January 17, 2020",5, Restart App Service a real life saver!
63,Earl Medina,"December 19, 2019",5, Really simple to use.
64,Syed Muhammad Kashif,"February 7, 2020",5, Best service in the world
65,Ramon Litonjua,"March 1, 2020",4," Very good response times and latency, good integration of local tools with the cloud services."
66,Tareq Imbasher,"June 18, 2019",4," Pretty good. would be nice to include a way for the user to see costs, I would like to keep tabs on how much costs my VMs accrued this far for the month. i can do that from the web but not here. Obviously, this app wasn't made to do everything the web interface does, nor should it, but I think somet...Full ReviewPretty good. would be nice to include a way for the user to see costs, I would like to keep tabs on how much costs my VMs accrued this far for the month. i can do that from the web but not here. Obviously, this app wasn't made to do everything the web interface does, nor should it, but I think something like costs is a good metric to have, and doesn't require user input so that should make the feature simpler to implement. Thank you for the great app 👍"
67,Miloslav Pawlica,"December 29, 2019",1," Useless, as most of new invetions from MS. Interface is poor, nothing interesting except starting stopping VM. When I try to run cloud shell, my device will crash. Even using Azure over desktop is pain."
68,Tamás Gábor Szabó,"September 6, 2019",1," The name of the application is awfully misleading. You can't manage Azure services with it (AAD, AIP, PIM, B2C, Intune, OMS, AADC, and a lot lot more) . This is only a VM management tool with very limited functions. The app should be called something like Azure Virtual Resource Manager... I'd love t...Full ReviewThe name of the application is awfully misleading. You can't manage Azure services with it (AAD, AIP, PIM, B2C, Intune, OMS, AADC, and a lot lot more) . This is only a VM management tool with very limited functions. The app should be called something like Azure Virtual Resource Manager... I'd love to see a usable app with at least the same functionality like the basic Azure website"
69,Danny bird,"March 20, 2019",4," great potential, but I'd like to see some consistency on the time periods on the graphs.  why do some resources show the last hour and others 24hrs?  examples of 24hr are SQL Database or Event hubs.  I want to use this app to see problems as they happen in more detail.  Can we have maybe a global ti...Full Reviewgreat potential, but I'd like to see some consistency on the time periods on the graphs.  why do some resources show the last hour and others 24hrs?  examples of 24hr are SQL Database or Event hubs.  I want to use this app to see problems as they happen in more detail.  Can we have maybe a global time period for everything you see?"
70,Pierre Namroud,"March 28, 2020",5, Very handy app....
71,Anoop JK,"July 17, 2019",4, so cool and smooth navigation. sadly I cannot view the files in storage location under resource group. looks like the option is not available! also to authenticate rdp connectioni have to approve the port through Browser and then have to come back to the azure app and click connect. that way only it...Full Reviewso cool and smooth navigation. sadly I cannot view the files in storage location under resource group. looks like the option is not available! also to authenticate rdp connectioni have to approve the port through Browser and then have to come back to the azure app and click connect. that way only it looks working! that's weird
72,Ashley Lee,"October 15, 2019",1," Only the most basic functionality is supported, which renders the app almost useless. Every time I open I end up having to load using my browser to get to the information I need. You can pull up AppInsights performance, but not dependencies. I can open AKS, but no visibility into nodes, pods, or con...Full ReviewOnly the most basic functionality is supported, which renders the app almost useless. Every time I open I end up having to load using my browser to get to the information I need. You can pull up AppInsights performance, but not dependencies. I can open AKS, but no visibility into nodes, pods, or containers. No log analytics, ect."
73,Omar X,"December 27, 2019",5, Brilliant app. I see it ain't more and me functionality from the online Azure dashboard. Keep up the great work!!
74,SJC Burrage,"September 7, 2019",5," I had a choice: Buy a new workstation for around £1000, or rent a VM on Azure at £0.14 per hour (of use), costing me around £300 per year. So glad I've chosen Azure. I can remote desktop into my VM from wherever I am, and even use my the Azure's built in RDC on my android tablet when out and about a...Full ReviewI had a choice: Buy a new workstation for around £1000, or rent a VM on Azure at £0.14 per hour (of use), costing me around £300 per year. So glad I've chosen Azure. I can remote desktop into my VM from wherever I am, and even use my the Azure's built in RDC on my android tablet when out and about and it's just as if I'm sat in front of a high end workstation. Really love it."
75,Vishal Patil,"January 27, 2020",5, Great app to control azure resources !
76,Sean Cross,"November 2, 2019",5," Amazed that this works on my S9. Interface is a bit hard to move around and learn the workaround controls, but it works!"
77,Pratish Thaker,"June 13, 2019",5," Very nice and effectively useful app to design, store and monitor all my AI apps which are working properly with Azure Web resources and Microsoft platform. Many thanks to the developer team to help researchers like us to utilize machine learning capabilities in real time functionality. Keep it up."
78,Peter Wishart,"January 4, 2019",1, Doesn't work on my Samsung S7 with Oreo. I have just installed. It can't seem to start. Just shows the swirling circle like it is trying to connect. No interaction or messages. I gave up after 15 mins of waiting.
79,Sean Lyttle,"December 4, 2018",3," This app was so useful, but the latest updates has broken it on my OnePlus6. It just sits on its opening loading screen and refuses to proceed. No settings or options, just useless no. Please fix it quick!"
80,Bryan Ponnwitz,"May 21, 2019",2," This app might be good for some basic monitoring, but that's about it. I wasn't even able to change the time span for monitoring. It's basically next to worthless for doing anything other than that."
81,Will Westrop,"October 20, 2019",1," Incredibly limited. There is no access to logs, no monitoring of containers, no access to cost information, no ability to create new resources - it's pretty much just a read-only view of your subscription (and a very limited subset at that)"
82,Andy Nicholls,"February 1, 2019",4," No longer works since Android 9 update. Can't even sign in!! Update.... Yep, now works!! Thanks. Frustrated as i use the mobile app quite a bit over multiple subscriptions."
83,S B,"December 1, 2018",4," I like the app. However, it doesn't let me to have two accounts with same email: microsoft account and corporate login. Please, add this feature!"
84,Nandkishor Bobade,"November 2, 2019",1, Not able properly do the copy and paste activities . Also very bad terminal management for Azure CLI and powershell
85,Deepak Agarwal,"February 1, 2019",3," the latest updates doest allow me to davr my credentials, everytime i have to enter them again. it doent makw this app worthy as it should be for a quick action. batter tobuse browse than."
86,Дмитрий Барбул,"January 25, 2020",1, Almost no functionality. Even no billing information.
87,hemendra singh,"May 4, 2019",2," Very basic, can't even scale up/down an app service. It's only good for monitoring and start/stop of services."
88,Ted Miles,"March 3, 2019",5," The shear convenience and smooth operation of the mobile app, in some ways, makes it more enjoyable than the full website experience!"
89,Nirav Madariya,"November 5, 2018",5," Awesome application, you can view all of your resources health and status from Azure. In other words, Azure in your hands."
90,Sean Hasling,"July 27, 2019",2," Azure Active Directory Premium 2 can't be administered through here. If you are going to advertise on Azure Active Directory's portal, and recommend the install of the app, prpvide admin services for AAD, especially AAD connect health agent"
91,Stan,"February 3, 2019",1, cannot log in. keeps telling me login failed. I can log in using browser with no problem. but not in this app.
92,Andrei Vlad,"September 16, 2018",4, Is there no option to actually see the costs for your subscription within the app? I believe this might be useful for a mobile admin who needa to check things quickly
93,Ana Nikolic,"August 14, 2019",5, One of my favorite by Microsoft.. Learn a lot.. Take care of their users. Provide knowledge without paying.. Quite different from all others app.. Very satisfied.. Ana Nikolic
94,Anderson Anjos,"April 23, 2019",2," If Microsoft want to provide a truly useful tool for Azurr Cloud, they definitely have a lot of work to do."
95,Ankesh Bhutada,"February 20, 2019",1, Not able log in. It says 'your account doesn't exist' or something like that. And i am easily able to login to my Microsoft Azure account on my PC.
96,Arshad Badar Khan,"December 8, 2018",1, I have an honor9 and I wanted to use it to metrics but the charts on insight are empty. The servicbus provides no info on queues and topics. But the liveinsight is cool
97,Simon Lane,"October 3, 2018",5," Great app, would be great if Just in Time JIT rules can be activated though as still need portal access."
98,Al Romano,"September 24, 2019",1," Can't login if fingerprint verification is done via screen tap, it closes the login modal. Impossible to login using Huawei MATE20 Pro. Please fix."
99,Mike Weiner,"October 17, 2018",1, Unable to use because I have a personal account tied to a work account. It won't let you choose which account to use.
100,Pandu Hutabarat,"July 8, 2019",1," Subscription or Resources not showing. Login works fine, but it won't show any of my Subscription or Resources even though it works normal through the web browser."
101,Umar Ali,"October 29, 2019",1, Does not list my subscription. I have already sponsor ship subscription but not showing in app.
102,Benjamin Siegel,"February 1, 2019",5, Excellent tool for supporting Azure resources on the go. Glad to see this latest update resolves some MFA login issues. Great job Microsoft...
103,Raul Butuc,"August 10, 2019",1," You cant access your remote VM if you have JIT enabled because the mobile app doesn't have the ""Request Access"" feature. Brilliant idea leaving that feature out!"
104,许良,"May 24, 2019",4," In the web portal, everything is ok. But when I sign in the app. It shows have no subscription to Azure service. Can you help me?"
105,Magesh P,"October 18, 2018",3," Need more information from developer perspective. Couldn't dig deep in failed request, Dependency failures. As a developer I should know each and every failed request and what is the reason behind."
106,Jeejnesh,"April 16, 2019",4, Experience is very good. Its easy to do some basic operations in mobile without PC. Thank you Microsoft
107,Michael Mbugua,"September 9, 2019",5, I can easily monitor my function apps and databases from the convenience of my phone. awesome application.
108,Alex Michel,"December 12, 2019",1," I'm not able to install the app. It's stuck on ""waiting for download"""
109,Rafael Stirling,"October 7, 2019",4," Hi guys, Is it possible to include a list of alerts on the Application Insights screen? It sounds weird to show that are 3 or 4 recent alarms but only let the user to have access to the lastest one."
110,Argelo Bautista,"November 11, 2019",3," It would be nice if I can create new resources, upgrade/downgrade SKU, and delete resources."
111,Sunil Ajagekar,"December 13, 2018",3," Its little helpful but missing lots of features, add feature for DW scale up and pause"
112,Saketh Ram,"June 18, 2019",2, This used to work well but now I am always being looped within the login screen again and again.... need a fix
113,admiri92,"October 11, 2019",4," Works fine but is useless, except AZ powershell. Please add possibility to configure firewall rules."
114,Rob Wood,"May 28, 2019",5, Very happy to give this app the full 5 stars. Exactly what you need on the move!
115,Damien Thomas,"December 30, 2018",1," It won't sign me in. I sign In but it fails saying ""Can't sign you in to any of your directories"". FIX ASAP"
116,Rajeshkannan Manickam,"October 16, 2019",3, There is no option to see The cost details in subscriptions. (How much we used)
117,Jonathan Adlerstein,"February 21, 2019",1, Can't sign in. Object reference not set to an instance of the object. Emailed support and got no response.
118,Eduardo Rotundo,"January 26, 2019",4, For the old version works smoothly but now after update i can't enter to my panel i got a error of sign process
119,Laith Astifan,"March 2, 2019",2," Need to be able to access Azure AD privileged Identity Management, otherwise how will you JIT yourself when enabled for your organization, without this you will not be able to perform simple tasks such as restarting a VM"
120,Atanu,"June 26, 2019",3, Very dull UI. Navigation throughout the app is very oldage like. OK kind of app.
121,James Bragg,"January 31, 2020",5, Very fun in the intro to Data science
122,Simon Leach,"April 7, 2019",1, Useless. Will not connect and Error message is no help at all.
123,sachin khedkar,"July 31, 2019",3, Able to login to Azure Account but getting error as You dont have subscription linked to this email.
124,Bryan Austyn Downing,"January 14, 2019",5, simple and great. Simply great! Nice work Microsoft Azure team.
125,Fabio Fernandes,"October 11, 2018",4, Very useful to check our Azure resources and status while on the go.
126,"Dave Cecil, Retired US NAVY SUBMARINE COMMANDER","October 1, 2019",3," Poor access ability, seems Microsoft is abusing getting direct access for free interested users, bad on Microsoft, I'm using Linus for now. Dave Cecil"
127,Santosh Gada,"October 4, 2019",1," Never works, does not allow me to let into the application even after successful MFA. That's odd. Some one please look inti this. I am logging through my official credentials."
128,A Google user,"December 5, 2018",1," Login with fingerprint stopped working, can't login now?!!!"
129,Rich Scott,"October 1, 2019",1," does not list my subscriptions , and no help or support pages anywhere to be found ,"
130,Devansh Jain,"January 24, 2019",1, Keeps crashing on Google Pixel 3. Giving exception - Object Reference is not reference of object.
131,Mike Westaway,"October 9, 2018",5, Very handy especially when I've forgotten to stop my VM
132,The Good samaritan,"September 1, 2019",5, This is a perfect app for people who deploy vms and need to start and stop on fingertips!
133,G P,"December 14, 2019",5, Easy to use and easy to navigate.
134,srinath vr,"March 12, 2019",1, Useless. Dint even have a properly integrated cloud shell. If i type commands it auto types somwthing else. Sigh!! Straight uninstall
