index,author_name,review_date,reviewer_ratings,review_body
135,Andrew Cartwright,"March 5, 2019",5, Great app. So handy to keep an eye on things.
136,Jussi Palo,"August 31, 2019",1," Doesn't support Azure AD Device Authentication, cannot login."
137,Abdollah EL Ḿorsy,"August 15, 2019",1," unuseful app, too many missed options specially for log analytics and azure Security"
138,uday kiran,"February 16, 2019",2," resources are visible but we don't have option to delete them.Like this, many other issues are there."
139,Kenny Wu,"January 11, 2019",1, not able to login after update to the latest version of azure app for Android
140,asif khan,"September 25, 2019",1, Cannot see the logos of the tools.Instead it shows the Up addresses.Dont know which tool is what.
141,Arasu RRK,"January 28, 2019",1, Why this app asking login everytime? Without this basic functionality this app is useless
142,Luis Escobar,"April 2, 2019",5," Great interface, highly recommend this app if you manage azure"
143,Jessica McKinnon,"June 26, 2019",4, Please add support for specifying a target URI for Azure Stack deployments (both tenant and admin portals)
144,Thomas Atwood,"December 15, 2019",5, Well designed and executed!
145,A Google user,"January 29, 2019",1, sign is slow. never able to log in
146,Peter Charleston,"April 23, 2019",5, can u advise on how to get notification alerts on Android? I am getting the alerts appear in the app but I want them to alert me on my phone. I belive I have enabled all notifications in Android settings
147,Michael Dabulamanzi,"June 25, 2019",5, Its a good move on Microsoft side having this Azure mobile platform.
148,kalyan m,"June 15, 2019",1," when I login it says ""no valid azure subscriptions found in the directory"""
149,Erin Sena Torrez Munden,"March 12, 2019",1, I installed the app o my lg aresto phone and go to sign with my school email it gets to the school website then I login and it says sign in failed no directories found for my school email I need help
150,Marcelo Rocha,"April 23, 2019",3," is not possible to follow the spend report, the most interesting point for this app would be to know how many money i migth to pay."
151,A Google user,"February 24, 2019",1, worst app I can't even sign in pls update it for us and fix this issue thanks
152,suresh sanapala,"June 23, 2019",1, i have microsoft account with gmail but i am unable to login.
153,Amey Jirafe,"January 21, 2020",4, Nice UI and functionalities.
154,Muhammad Imran,"April 16, 2019",3," Good app, advise where I can find Serial Console in this app."
155,Ganesh Jadhav,"April 9, 2019",5, Awesome app to manage all azure resources on the go
156,Joe Srnec,"February 8, 2020",5, Still got alot of reading to do not to sure what to do eith but if my memory served me correct i might know who will be interested or it may be just s coincidence they both have the same name
157,Alan Camey,"October 21, 2019",5, Because sometimes not stay at home and try to work for a moments and this app works well for me
158,Bikram Ray,"October 16, 2019",5, Easy to use anywhere anytime.
159,Blaire D.,"September 25, 2019",5, Amazing live statistics and control over your VMs
160,Jamil Malone,"April 17, 2020",5, Great experience so far!
161,Alexius Adhitya Khrisnatama,"April 17, 2019",4, I really wish it has dark mode and provides more detail information.
162,President Litchfield,"June 18, 2019",1," So if you have a free account, are you not able to use this app, as it does not see my resourses or subscription... yet i can login using the mobile web?"
163,George Sturrock,"February 27, 2019",5, a convenient way to monitor clound activities from your phone.
164,Chad Masti,"October 21, 2019",3, Customized DBA dashboard I prepared through the web browser portal doesn't show through in the app. When is that going to happen?
165,Trung Ngo Van,"April 16, 2020",5, This app is good to me.
166,Lee Phillips,"August 4, 2019",1, I am denied access and prompted to enroll in device managment in order to use the app despite my device already being enrolled and compliant with company policy.
167,Richard Jacks,"March 13, 2020",5, Easy to use.
168,Sam Larko,"February 25, 2020",3, Good if you're in commerce. Doesn't seem to support US Gov yet.
169,Steven Vlaanderen,"July 18, 2019",5, Complete and intuitive
170,serwei lee,"May 2, 2019",3, hmm can't log in or specify a user+pass
171,Vivek Maswadkar,"July 25, 2019",5, very handy to start stop VM's
172,Nathan Hutchison,"April 6, 2020",5, It's early day. Complete horse with no name.
173,Rafay Islam,"September 16, 2018",2, Its crashing on Sign In.
174,Daniel Barrett,"January 29, 2019",1, Could not sign me in to use this application. Not off to a good start.
175,Nitesh Seth,"January 31, 2019",5, Its user friendly and fit for purpose.
176,Love Bajpai,"September 8, 2019",5, What a great idea! Manage your infra from phone
177,Vasil Stoichkov,"April 7, 2020",5, All u need to control resources in one place
178,islam khaled,"February 15, 2020",5, Very good app
179,Ronald Brown,"September 3, 2019",5, Integration with migration smooth
180,Frederick Rosales,"October 8, 2019",5, I love Azure and the app is great as well
181,Jason Adam Hoffman,"April 11, 2020",5, Developing the future here.
182,Andrea Capri,"August 21, 2019",1, Doesn't have most of the features that would make having an app useful
183,Josh Barnett,"October 28, 2019",1, Enough limited functionality to say we have an app for that.
184,Andy Mallett,"October 24, 2019",5, Simple elegant management of an estate
185,Scott Bradshaw,"September 30, 2018",1, This app doesn't work with Azure Government tenants.
186,dimitar dimitrov,"March 5, 2019",5, very easy to work with app
187,Rich Green,"August 1, 2019",5, Seriously powerful with the Cloud CLI!
188,Vansh Narula,"February 8, 2020",5," I love it , Give me credit"
189,wizzards10,"October 18, 2019",5, Amazing abilities for mobile users!
190,Hr. Z,"August 14, 2019",1, I can't delete when I type to console...
191,Doug B,"March 20, 2020",5, Azure on the go; lifesaver
192,Eric Fuentes,"June 20, 2019",1, why is this not part of approved apps for intune MAM?
193,Tope Ajayi,"March 23, 2020",4, It is cool
194,Pras Shant,"October 6, 2019",5, Try to have dash board in app like some coding can be done
195,Anonymouse 1,"June 15, 2019",1, subscription not recognized
196,Siddharth Shah,"February 14, 2019",1, can't able to login
197,Esteban Flores,"November 26, 2018",5," Cloud shell access, enough said."
198,Nagaraju Podishetti,"September 19, 2019",4, Easy and fast
199,Manoj Kumar,"September 21, 2018",5, Good to manage vm
200,Srisailam yadav,"March 20, 2020",5, Interesting cloud topic
201,Lucky Bogoshi,"March 28, 2019",5, good app! love it!
202,A Google user,"March 7, 2019",5, really best users experience in this application
203,Tahir Alvi,"December 5, 2018",5, Love this app and performance
204,Rajesh Dhuri,"March 6, 2020",1, Fails in installation
205,David Tomlin,"November 20, 2019",5, Submentting my thanks for subscribing
206,Alok Sharma,"March 11, 2019",1, no directories msg coming...
207,Tomislav Kralj,"October 27, 2018",5, Does what it has to. Simple and effective.
208,Dustin Jackson,"December 7, 2018",5, Lots of cool technically futuristic stuff all in one bag...
209,A Google user,"November 29, 2018",5, This app is so much nice forever
210,Michael C,"December 30, 2019",5, It's very handy.
211,Erin Terrell,"December 20, 2019",5, Awesome app for students
212,Fabian Cloete,"December 4, 2019",5, Easy to work with us up
213,Duncan Kuffar,"January 6, 2020",5, Must have tool of labor for sys adminis az
214,David Denes,"December 13, 2018",5, It's easy to use
215,Real Tech Systems,"January 18, 2020",5, Ease of use
216,Yoki Satria,"November 22, 2019",5, why I put 5 star?
217,Adriel Mebaley,"February 17, 2019",1, cant log in
218,Navin Ghai,"October 31, 2019",5," Just go for it, and have your own experience of goodness"
219,Olav Birkeland,"May 30, 2019",4, Please add dark mode.
220,Pieter Smit,"May 20, 2019",2, No Azure Devops integration
221,Swapnil Roy,"January 3, 2019",1, can't sign in
222,G Hill,"September 19, 2018",4, Like others I am waiting for more functionality.
223,John Stewart,"May 22, 2019",5," ronseal does exactly what it says on the tin, it is great"
224,A Google user,"September 26, 2018",5, I was help by a useful employee he changed me for the better I miss him
225,Amanda Wassum,"March 15, 2020",5, Love the possibilites
226,Alexandre Ely,"February 26, 2019",1, Trash. Don't show my resources and Dashboard.
227,Naveen D,"May 7, 2019",1," Frankly you can do nothing using this app, useless app"
228,チュimoc,"November 29, 2018",2, What? Can't create and delete?
229,Brendan Green,"September 20, 2019",5, I wish I could get this on the desktop
230,Mohammed Moinudheen,"October 13, 2018",4, Nice to have this app.
231,Shehryaar,"November 5, 2018",3, What is Microsoft azure????
232,A Google user,"February 2, 2019",1, Doesn't let me sign in?
233,Bigger Head,"September 6, 2019",2, I can't get an supscripion
234,Coumar Pandourangane,"January 22, 2019",5, Working as expected...
235,Sudarshan Kumar,"December 17, 2018",5, Good job keep it up
236,Ranjeet Bhargava,"July 31, 2019",4, lite wait its good to see the anroid vetsion
237,Imtiyaz Ali,"February 8, 2019",1, How can i open azure active directory?
238,SAMIT Sarkar,"October 21, 2019",5, Azure is in your pocket now 😀😀😀
239,karthik divi,"November 26, 2018",5, Makes my everyday life easy...
240,darivuki,"March 5, 2019",5, Works like a charm
241,Gaurav Madaan,"November 21, 2019",4, Really lovin this
242,kyaw myatzan,"April 22, 2019",5, we can do more effect matter to furture.
243,John Doe,"March 13, 2019",3, doesn't work for gov
244,Chris Watson,"October 4, 2018",4, It's pretty good!
245,Msizi Mabunda,"February 4, 2019",1, CANT EVEN SIGN IN!!!
246,Armaan McLeod,"August 13, 2019",3, i cant delete resources
247,Albert Laforte,"September 27, 2019",5, Create solid product
248,Radu Dumitru,"August 19, 2019",5, nice and handy
249,/\zcii,"October 11, 2018",5, Big fan here
250,Ratna Ratna,"September 7, 2019",4, Should add JIT
251,Sai Prasad,"April 25, 2020",5, Very useful and helpful
252,Kyle,"April 10, 2020",5, Thank you!!
253,Aaron Sullivan,"March 11, 2020",3, Limited functionality
254,Benjamin Hallewell,"April 12, 2020",5," ABSOLUTELY, EPIC!"
255,Dominic Johnson,"April 1, 2020",5, Very informative.
256,Endale Mengesha,"March 18, 2020",5, Transforming life
257,anas abubakar,"April 7, 2020",5, Cool app
258,Michael Paterson,"April 7, 2020",5, Awesome app
259,Ahsan Ahmed Khan,"April 21, 2020",5, Very good
260,Stephen Sprague,"March 25, 2020",5, Awesome
261,varun kulkarni,"April 12, 2020",5, Excellent
262,Phil Beck,"February 14, 2020",5, Awesome
263,Xavier Borrell,"January 27, 2020",5, Great app!
264,sanjeev Singh,"January 21, 2020",5, Good
265,Keyonta Brown,"January 26, 2020",5, Greatest
266,Stefan Van Der Merwe,"January 29, 2020",5, Cool
267,Oduwole Oluwasegun,"April 10, 2020",5, Cool
268,Thomas Farley,"January 3, 2020",5, Wow
269,bpg 168,"January 15, 2020",5, Good application :)
270,nowords010 nowords010,"December 20, 2019",5, Enjoy
271,Ha Anh Tu,"December 31, 2019",5, Good
272,Paul Petre,"January 7, 2020",5, nice
273,Jose Ramirez,"January 13, 2020",5, Excellent
274,Shubhajyoti Ghosh,"December 15, 2019",5, Love this
275,Daniel Cousino,"December 10, 2019",1, Mfa broken
276,Balan M,"November 28, 2019",5, Awesome !!!
277,Abrar Tahmid,"November 29, 2019",5, expensive
278,vishy pawar,"December 4, 2019",5, Good
279,mokhtar elkomy,"November 15, 2019",5, Good app
280,James William Puttergill,"February 22, 2020",5, Fine
281,Sabir Samo,"October 12, 2019",5, Nice app
282,Bernard Añana,"October 21, 2019",5, Thumbs up
283,Deepak Gowda,"October 22, 2019",5, Great
284,Hassan Habib,"October 14, 2019",5, Amazing app!
285,Harish Wani,"September 16, 2019",5, Excellent tool
286,moh sam,"September 30, 2019",5, Very good
287,Bhagyashree Chandrashekar,"August 29, 2019",5, good
288,Fajar Pambudi,"August 14, 2019",5, add billing menu please
289,Aniruddha Bapat,"August 2, 2019",5, Very good
290,Crystal A. Gargasz,"August 5, 2019",5, cobalt blue
291,XXX,"July 6, 2019",1, Rubbish 👎👎👎👎👎👎👎👎👎👎👎👎👎👎👎👎👎👎👎👎👎👎👎👎👎👎👎👎👎👎👎
292,Habib ur Rehman,"July 23, 2019",5, Excellent
293,Lerio Sindane,"September 20, 2019",5, Pratical
294,Dan Benitah,"June 26, 2019",5, Please adf an option to list favorites from all logged in accounts at once. thanks
295,Mayank Aggarwal,"June 22, 2019",5, awesome 👍
296,Jeff Mckenzie,"June 15, 2019",5, good
297,Jose Moreno,"April 29, 2019",4, its good
298,Uthiresh kumaravel,"March 30, 2019",4, nice
299,Papai Copa,"April 10, 2019",5, it
300,Erebor Vlak,"March 9, 2019",5, good view
301,Robin Sayer,"March 23, 2019",5, Superb
302,Rafael Plugge,"March 4, 2019",3," EDIT: Tried updating and installing the app it works now, will update the rating when more time with app has passed."
303,Jimy Kamdani,"February 23, 2019",5, Nice
304,Eu Mesmo,"February 16, 2019",4, we need same features as using browser !
305,Gautam prasad,"February 13, 2019",4, good
306,arikatla narendra,"January 18, 2019",1, automatically logout
307,Isaias Martinez,"November 28, 2018",5, Best
308,Joshua Williams,"October 30, 2018",5, Great app
309,Juan Carlos Cigala García,"October 14, 2018",5, Well done.
310,Apirak Khemapirak,"October 1, 2018",1, ห่วย ไม่รองรับ android ที่เป็นภาษาไทย ต้องแก้เป็นอังกฤษถึง ล็อกออนได้
311,A Google user,"September 7, 2018",5," Very nice app but still very limited in functionality. Would love yo be able to perform some more tasks through the UI. Also it crashed veeeery often on startup, but maybe the latest update has resolved that, let's see."
312,Chriss Kalogeropoulos,"September 8, 2018",5, Very nice app. The issue with classic VMs was my problem
313,Didier Danloy,"September 14, 2018",5," Let you add, control and monitor ressources you have in Azure"
314,Rajitha V,"September 11, 2018",5, Super cool:-)
315,Joe Holstein,"September 7, 2018",2," Doesn't show VMs. Other esouces are visible, but not my VMs. This may be related to account types, but the Azure experience is inconsistent between platforms."
316,Connor Murphy,"September 6, 2018",1, Crashes on open useless!
317,Javad,"August 31, 2018",2, We cannot set sql server fiewall rules
318,Vaibhav Shete,"September 2, 2018",4, More betterment can be done in commands intellisense
319,Gourav Kumar,"September 1, 2018",4, Please add Runcommand option for VM to make it more interactive.
320,Craig Wilson,"August 21, 2018",4, Nice app but would benefit to be able to drill into resources such as storage accounts and backup vault contents. Also how much these are costing us
321,A Google user,"August 7, 2018",5," I'd love to see billing info, such as pay-as-you-go account consumption to 
date."
322,SK K,"August 24, 2018",1, Keep crashing at startup app. I'am S8 user.
323,Mohammad Sabry,"August 10, 2018",5," Need to have a small check box to allow me to check all vms and start/stop 
them once."
324,Ray Lomax,"August 27, 2018",5, Hand on to watch my resources
325,Liron a,"August 5, 2018",3," It's a good start, but many features are not implemented."
326,Adam Phoenix,"July 29, 2018",4, Keeps crashing at startup!
327,Waseem John,"July 31, 2018",4, Should have more control as we have in portal
328,Jim Wang,"August 8, 2018",4, Very good app
329,Felipe Ayora,"August 1, 2018",5," Simply put: WOW!! Clean, fast and well designed app that does everything I 
need to manage and monitor my Azure resources, and more! The Cloud Shell 
integration is AMAZING!!! Seriously, how cool is it to have a bash console 
on your phone WITH the power of Azure included with it?!"
330,Robert Ridal,"August 4, 2018",1," This is app that you can't actually do anything. I feel that the only thing 
I can do is to follow the metrics, but for example most important thing I 
would like to do is to see logs but as it can't be done so this is pretty 
useless."
331,Family Fry,"July 31, 2018",4," Would be nice to be able to select multiple virtual machines and apply an 
action such as start, restart or stop."
332,A Google user,"July 25, 2018",2, Keeps crashing on S8+
333,HC CH,"July 25, 2018",2, Keeps crashing. Please fix it.
334,Andrew Bevan,"July 31, 2018",1, Broken on install... Not good
335,Satyam Pandu,"July 20, 2018",5, Am using this azure App for cloud testing purposes so app is great
336,S E.,"August 6, 2018",1, Keep crashing on startup
337,Kristian Ask,"August 7, 2018",1, Crashes immediately
338,Niranjan Bhatia,"July 26, 2018",5, Good impressive app
339,Andrew Nightingale,"July 10, 2018",5, App is great! Latest update fixed the crashes I had been experiencing.
340,A Google user,"July 16, 2018",1, Crashes on Galaxy S8
341,Leon Strunjak,"July 18, 2018",1, Crashes on note 8
342,Muhammad Mustaqim,"July 12, 2018",1, Crashes at start.
343,harry calgery,"July 14, 2018",4, Need faster loading
344,Andreslon,"July 16, 2018",3, Excelent
345,Ben Duguid,"July 3, 2018",5," Had been using the original App Service app to stop, start and monitor my 
Azure apps, but this gives me almost complete access to everything I have 
in the portal, including live metrics from App Insights and access to the 
cloud shell. Also allows extra security of requiring a thumbprint to 
open/...Full ReviewHad been using the original App Service app to stop, start and monitor my 
Azure apps, but this gives me almost complete access to everything I have 
in the portal, including live metrics from App Insights and access to the 
cloud shell. Also allows extra security of requiring a thumbprint to 
open/switch to the app."
346,Progy,"June 28, 2018",1," WHERE ARE MY NOTEBOOKS? It shows nothing under ""all resources"". I have a 
whole bunch of iPython notebooks in my azure notebooks account. How do I 
access them on mobile??"
347,sanket ghate,"July 16, 2018",4, App must have capabilities to create resources too
348,Craig Matthews,"June 4, 2018",3," It would be great if I could see cost tracking for my resources and with 
that the ability to drill down from all resources to resource group to 
individual resources. Additionally, ability to browse into storage accounts 
would be a nice to have."
349,Matthew Steeples,"May 27, 2018",4," Great to be able to monitor stuff on the go, and do simple tasks. Looking 
forward to more graphs and stats"
350,Justin Niles,"May 26, 2018",5," Love the mobile app, it allows me to monitor Azure resources and take 
crucial actions on them!"
351,Stratos Theodorou,"June 3, 2018",3," Not much to do, other than check the status and restart VMs & services."
352,A Google user,"June 19, 2018",5," Excelente, ojalá vaya ganando nuevas características rapidamente"
353,Aniket Gaikwad,"June 14, 2018",4," It will be great if able to view the resources categorized by their 
resource groups."
354,Sand T,"June 18, 2018",1, Very less functionalities
355,Akira Kusumoto,"May 30, 2018",1, うーん・・・リソースが一つも表示されない・・・
356,Shawn Anderson,"May 21, 2018",3," Needs a lot of work. Doesn't find much in my accounts and what it does find 
you really cannot do anything with."
357,Cole Mickens,"May 15, 2018",1," Can't login if fingerprint is unavailable. App takes forever to load. App 
isn't open source. App doesn't support widgets. App doesn't use the Android 
login/account system. It's a Xamarin app and it shows."
358,Michel Caron,"May 19, 2018",5, Perfect mobile tool!
359,Anders Spælling,"May 8, 2018",4," Fails to stop DevTest Lab VMs. Can start them just fine. Please look into 
this. Confirmed behaviour with other users."
360,A Google user,"May 11, 2018",5," no doubts, a nice tool"
361,Madhur Joshi,"May 10, 2018",5, Finally! Awesome
362,Priyabrata Maharana,"June 10, 2018",5, Such an amazing app to get quick insight of your Azure Resources!
363,appi beaula,"May 4, 2018",1," After signing in, the page is just keep on loading even with good 
internet.. thought it will be useful but full waste.. not sure why 
Microsoft has such faulty apps"
364,Vitaliy Ganzha,"April 29, 2018",1," Can't even sigh in, seeing some flipping g screens and the loading screen"
365,Alexander Babintsev,"May 2, 2018",1," What this app for? It just shows my subscriptions. I cannot manage anything 
or do anything."
366,Rajaram Sapkal,"April 28, 2018",1, This app not stable
367,Shabbar Taj Mohammad,"May 2, 2018",1, Flipping screens it is not working plz help me out
368,Ibrahim Shahatit,"March 25, 2018",5," This is a great effort from Microsoft, although it is very far from the full functionality of the Azure Portal, but it is work in progress. I use it mainly to restart web apps when needed. A must have if you use Azure."
369,A Google user,"April 15, 2018",3," Please add cost and billing features or the dashboard as a rendered view, otherwise ok."
370,Michal Kvasnicka,"April 4, 2018",5, Well done...!!!
371,Trent Robertson,"March 23, 2018",1," I can't figure out the purpose of this app. I can't even see a snapshot of the available backups, or settings or anything."
372,Yusto Omondi,"March 26, 2018",5, This is a great win for Azure users... And having the command line as well is great!
373,Casper Nielsen,"March 26, 2018",5, Thanks
374,James B,"May 16, 2018",2," Content can not be downloaded.... being able to actually watch shows seems 
kind of important. Installed the app to watch ""Adam Ruins Everything"". 
Apparently he ruined this app because it doesn't work. Back to youtube."
375,William Schutt,"March 6, 2018",5, You can do almost everything you can in the web portal.
376,kailash ravuri,"February 20, 2018",3, App is good for quick look at the status of your apps. But search and filter functionality needs to added at every level for now filter is only given to Resource Group level. Better use it on WiFi If you have lots of apps then it eats your data brutally.
377,Sean Kibbee,"February 21, 2018",3, Nice app for viewing basic things. Wish the online portal supported mobile better or this app did everything the web does. Can't see billing as far as I can tell so that's disappointing.
378,RAJAT VASHISHTHA,"February 15, 2018",3, Overall app is good but i don't know why i cant open cloud shell on my device it says oops with some very long number type id and closes??
379,Mahammad Murshudov,"February 15, 2018",5, Great app for quick overview!
380,Enrico Golfetto Masella,"January 20, 2018",5, Wonderful! Together with Microsoft RDS I'm capable of managing remote machines with easy!
381,sam rooney,"February 7, 2018",5, very nice to have powershell web cli on android.
382,Andy Readman,"February 5, 2018",5, Love the ability to use Cloud Shell within the app. Really useful
383,Ashwani Kumar Singh,"April 7, 2018",5, Awesome application
384,A Google user,"December 28, 2017",5, Perfect for monitoring status of Azure services while on the road... Not as full featured as web based interface but handy and usefully none the less.
385,j3224 p,"December 31, 2017",5, Great for a mobile version. Nice to be able to turn IaaS on and of on the go.
386,Denis Salamanca,"December 27, 2017",3, Needs Copy function for cloud shell
387,Joseph Wallis,"January 21, 2018",2, This app provides very little utility for backup customers
388,A Google user,"July 10, 2018",4, cloud shell 是否可以添加命令联想功能？
389,Sachin Tiwari,"January 24, 2018",3, ARM VM and portal in not present
390,Jon Hackett,"January 8, 2018",1, Can't login. I get a 404.
391,Janaka Dissanayake,"December 14, 2017",4, Helps me monitor and occasionally manage my Azure infrastructure through mobile. I am really happy about the cloud PowerShell integration with the app. Hope the developers would add a mighty TAB button somewhere near the keyboard to make it more user friendly.
392,Jeff Nall,"December 14, 2017",4," Outstanding, except notifications arent working for me.  If you have things hosted in Azure, install this app now.  You need it."
393,Naveen Yadav,"December 4, 2017",5, Why not include a widget to shut down and start  a VM
394,Jaydeep Ranipa,"December 13, 2017",2, Not very Rich app. It's just a monitoring app. You cant create anything.
395,Chris Clos,"November 28, 2017",3," Have to hit back when trying to sign in, to get the sign in screen. It seems pretty decent, would be a ton better if I could make changes in the GUI. The powershell option seems to be interesting but it's hard to do without tab completion.  Can't see info on azure site recovery though which was one ...Full ReviewHave to hit back when trying to sign in, to get the sign in screen. It seems pretty decent, would be a ton better if I could make changes in the GUI. The powershell option seems to be interesting but it's hard to do without tab completion.  Can't see info on azure site recovery though which was one of my main wants."
396,A Google user,"November 22, 2017",4, Very useful to check vm status start/stop etc
397,Evgeny Gornov,"November 25, 2017",1, Cannot sign in. Getting error.
398,Alex Ngugi,"November 22, 2017",5, The app is amazing
399,Atul Verma,"December 10, 2017",5, Very nice  👌
400,Mr. Hi Tek,"November 4, 2017",3," I like the app. However, the main set back for me is the very limited view on performance metrics for azure sql database. I would like to customize the metrics to show me info for the past hour (not just the past 24 hours or whatever the default is) also, like the website I can add additional measur...Full ReviewI like the app. However, the main set back for me is the very limited view on performance metrics for azure sql database. I would like to customize the metrics to show me info for the past hour (not just the past 24 hours or whatever the default is) also, like the website I can add additional measurements to the metrics such as CPU, memory, IO on top of DTUs."
