index,author_name,review_date,reviewer_ratings,review_body
107,Mathew Kulkewycz,"February 6, 2017",3," Granted, I am using the free version (with thoughts of upgrading). But now I can't even use the app due to crashing. Uninstalled and reinstalled, now can't even log in says there are 'connection' issues.   I am unable to notify the developer to assist (as I aren't a paying customer). Hopefully this ...Full ReviewGranted, I am using the free version (with thoughts of upgrading). But now I can't even use the app due to crashing. Uninstalled and reinstalled, now can't even log in says there are 'connection' issues.   I am unable to notify the developer to assist (as I aren't a paying customer). Hopefully this gets read as I trust other users are experiencing the same, but are unable to help the developer to fix the bug.  I am at the stage whereby I am know in no position to upgrade out of fear that the bug may not be resolved.  I want this app to do well, but currently I am in limbo."
108,Dau Uba,"March 28, 2017",1, Useless unreliable and seems unfinished. Dont rely on it because it will be a let down and a huge disappointment. Needs to be improved big time.
109,Alfaris Abu Ziad,"February 6, 2017",2," It wont let me sign in :/   It say check your connection, but my connection is Okay. And I tried several networks and several mobiles!!"
110,Todd Wadle,"February 6, 2017",4," I can't log in to the app today! I can log into the browser though.  Please fix, I need it for my business today."
111,Bob Southern,"February 5, 2017",2, Was good now can't even log  on
112,Nick Auskeur,"January 10, 2017",5,"Tags It's okay but the ability to search by tags seems unavailable. You can add them in mobile, but not use them after the fact, unless on desktop. Edit: tag search added, very happy - 5 stars."
113,taylor renfro,"January 5, 2017",3,Great concept Love this app but the laptop version is not syncing with my mobile Android version. It's not productive when you show up to a meeting and can't pull up your notes before. If y'all fix this I will fix my review rating.
114,Rod Bennett,"December 21, 2016",2,Constant Crashing App constantly crashes after the latest update on a Nexus 9 tablet running the latest Nougat software. No offers of assistance from Insightly! Unusable.
115,meraj naqvi,"December 21, 2016",2,In app updating of task description It is not possible to create new update under  task discretion.. How anybody can track the series of activity.. Please help..
116,SUPPLEMENT MENTOR,"December 10, 2016",5,Best crm Thanks for building this great app would be great if inventory & accounting can also be adjoined with it
117,Joshua Boyd,"May 9, 2018",5, Love it ! Such a lifesaver
118,Daniel Ward,"November 23, 2016",1, Horrible!!!   Terrible customer support.  It is all self - help that requires hours of sifting though forums.  BIG PROBLEM was that the accounts between my colleague would not link and her data was in my account and vice-versa.  I could not save e-mails or contacts direclty to my Insightly account a...Full ReviewHorrible!!!   Terrible customer support.  It is all self - help that requires hours of sifting though forums.  BIG PROBLEM was that the accounts between my colleague would not link and her data was in my account and vice-versa.  I could not save e-mails or contacts direclty to my Insightly account as it was linked to my colleague....makes it difficult to schedule tasks and like them to a client.   It just spirals out of controll from here with many little problems.  Very amature job.  Too expensive for this level of service.   The dashboard does not show enough information and too many clicks to make it a smooth workflow
119,Daniel Vassilev,"December 9, 2016",3," On my phone (ZTE Axon 7) I cannot scan business cards with the app. The app simply does not react when I choose this option. It is a function that I use fairly frequently, so it will be great if there is a fix soon for this bug."
120,"Richard K. Halterman, II","October 26, 2016",2,"Major Fixes I have used this product for over two years and continue to use it until I find a better fix.  My biggest objection is its inability to export and re-import data which requires major fixes, a common complaint from many users.  The web version and available apps are great, but no portability between ...Full ReviewI have used this product for over two years and continue to use it until I find a better fix.  My biggest objection is its inability to export and re-import data which requires major fixes, a common complaint from many users.  The web version and available apps are great, but no portability between Insightly and mobile apps.  There continues to be a rather ho-hum response to our concerns which leads me to believe the support personnel in this Organization are few in number and there are not enough resources to continue to improve the product.  I guess it ultimately comes down to you get what you pay for."
121,Linx,"November 2, 2016",4,Great I just found out about Insightly and already loving it. It would be even better if i could send emails while on go via the mobile app. Please support automatic email forwarding!ðŸ˜‰
122,Stephen Barnes,"October 18, 2016",4,Insightful Helpful in small scale election campaign.
123,Murphy's Restoration,"August 29, 2016",1,Having trouble logging into on ap I have an account but can't log into the ap on my phone... help!! It keeps telling me that I don't have an account and then I try to create an account and it tells me I have an account... worst app I have had... can't find  customer service contact information for help...
124,Donna Barrow,"August 28, 2016",3,"Still Learning.. Not ready to rate fully yet until I find out if I can send emails from the app, mostly to attach my email templates. Is this possible,  if so,  then I'm missing how to do it"
125,Ashutosh Zawar,"September 11, 2016",2,No new account creation possible? Haven't been able to sign in.. there is only login option.. no option for creating new account?
126,Phil Cuesta,"September 4, 2016",1," Starts initially on my S7 Edge and Samsung Tab S2, but within a short period, it keeps crashing when opening the widget. Please fix."
127,Srushti Ekbote,"August 4, 2016",5,Great CRM! Easy and simple UI. Very useful app.
128,A Google user,"July 21, 2016",3,"No Home While by and large the app is ok,  it doesn't have the Home screen like the  Web app,  which gives you an overview of anything new that's been added or updated from your team which I find useful."
129,A Google user,"July 21, 2016",4,Nice app Does the basics quite well. Needs some filtering ability on contacts abs other info.
130,Steve Mark,"July 6, 2016",3,"Loved it initially. While I was setting everything up, I really liked the desktop and mobile app. But then...organization names disappeared from all of the contacts in the contact list on the mobile app. The only way to get them back was to delete the link in the desktop app and re-link it. Later in the day however, th...Full ReviewWhile I was setting everything up, I really liked the desktop and mobile app. But then...organization names disappeared from all of the contacts in the contact list on the mobile app. The only way to get them back was to delete the link in the desktop app and re-link it. Later in the day however, they all disappeared again. The contact list just shows a list of names with no organization names. Under organizations, everything is as it should be; the problem is just with the contacts. It's still usable for my needs because most of the time I'll be using the organization list but if the contact list problem could be fixed, it'd be a 5 star app for me. I'm not using it for sales, I'm using it to keep track of inspections and I don't need a full blown, complicated CRM so I like the simple, uncluttered interface. I'll be relying on it heavily so I hope no other problems appear. Update: Just found out Contacts and Organizations can't be filtered in the mobile app. Please add that feature! It would also be nice to be able to filter using tags in the mobile app."
131,Sergiu Rusu,"July 16, 2016",5,"Good app Nice app,  but I have issues with selecting and editing more tasks at the same time...  Sometimes it works and sometimes it does not.  Overall a very nice app."
132,IGP,"July 5, 2016",5,500 error 500 error. Won't let me login. I'll try again with the next update.
133,Robert Simmons,"July 11, 2016",1,I can't add a file via Google drive to a contact? Are you freaking kidding me?
134,Kyle Jones,"July 12, 2016",5,Wow Easy to use most impressive.
135,Vinnie Campagna,"July 12, 2016",5,Great crm app Highly recommend
136,Stephen FitzMaurice,"July 8, 2016",5, Awesome.
137,Rk Wilson,"June 16, 2016",3,"Can you guys do this? Can you set up so the system so it pulls from your apps to automatically create one view of every person and company - all their contact details, and your complete history - every email back and forth, your phone calls together, meetings, notes, files, social, and messages?    everything in one plac...Full ReviewCan you set up so the system so it pulls from your apps to automatically create one view of every person and company - all their contact details, and your complete history - every email back and forth, your phone calls together, meetings, notes, files, social, and messages?    everything in one place,  who is important and keeps them top of mind, and will even remind you to reach out. I will give 5 stars for this"
138,Ramya Shenoy,"May 22, 2016",5,"Amazing CRM Whether you are in sales or not, it's a great app to keep track of your contacts, projects, tasks very easily!"
139,No Limits Stickers,"May 21, 2016",2, Can we update the categories i dont see any and is crucial when seeing the progress on a task other than 50%... Where are the tags!?
140,Beary Good Beans,"May 2, 2016",5," THE BEST!  I have worked in 22 CRM's.  I am a consulting GURU!  Insightly has such excellent integrations, flawless performance.  It is a bit humbling to meet such power in a program.  As a ZOHO reseller, I have to admit that any revenue from that stream will sharply diminish.  SO IMPRESSIVE, well d...Full ReviewTHE BEST!  I have worked in 22 CRM's.  I am a consulting GURU!  Insightly has such excellent integrations, flawless performance.  It is a bit humbling to meet such power in a program.  As a ZOHO reseller, I have to admit that any revenue from that stream will sharply diminish.  SO IMPRESSIVE, well done INSIGHTLY team!!"
141,Simon Elias personal,"May 17, 2016",5," Well designed and presented information, making this a very useful app that's easy to use."
142,Peter Stephens,"February 21, 2016",5,Effective and accessible Puts the important stuff within ready each on the go!  Using the free version because we are small
143,Jason Jacobs,"February 17, 2016",5,Awesome app! Insightly has really made a fantastic app!
144,Sam Russell,"March 2, 2016",2,One of the worst i have used You cant update contacts easily or intuitively after saving them. Adding a job title - this option doesnt even appear... UX is terrible and not 2015/6 ... making notes on contacts are on a different tab and when clicking on a contact you do not have a 'complete' view of the contact. Its ridiculous.
145,Reg Natarajan,"January 23, 2016",1,"Unusable Delete tasks, come back later and they're still there.  Try to delete them again and it tells you they don't exist. Can't mail from app.  Just forget this app and use the very good web interface."
146,Allan Jerman,"February 12, 2016",2,Features missing Some of the main features are missing. As a construction company this app worked great on the web. However once we got the app installed it made this useless to us.
147,Konstantin Thumm,"January 14, 2016",3,not able to set time for a task!? i am a premium user and within this app i am not able to set a task with date AND Time. Only allday tasks. why?
148,TJ Niehaus,"February 3, 2016",1," Complete Garbage. Gets confused when integrated with Google Apps. Will not let you sign into your own account. No help or contact information either. Warning, you may spend hours entering data and then insightly wont let you sign in. Complete Junk"
149,Focus eyez,"January 7, 2016",3,Great program but.. Some desktop features like setting milestones for projects seem unavailable in the mobile app.
150,Wild Harvest Ranch,"February 6, 2016",2,Never could log in error 500 I put in my Google apps info and could not use.  Looked like a good idea.
151,Indra Prastha,"January 21, 2016",1,"Great on the web, not so great on the app Cannot add leads from the app. Saving.... Then failed."
152,saurabh Jakhete,"February 1, 2016",1, Can't sync email...
153,Morgan Norman,"January 23, 2016",1,Requires sign in I just want to try it out
154,marcus rush,"October 4, 2015",3,"Needs more fine tuning Like the website,  but the mobile app is not the greatest.  My task don't  link with my calendar most if the time, same with my contacts. Difficult to click on a lead or contact and make a quick call. Needs more work to compete with mobile CRMs like Base CRM. Also would be nice to be able to send an...Full ReviewLike the website,  but the mobile app is not the greatest.  My task don't  link with my calendar most if the time, same with my contacts. Difficult to click on a lead or contact and make a quick call. Needs more work to compete with mobile CRMs like Base CRM. Also would be nice to be able to send and receive notes on task and projects with team members. Insightly makes it very difficult for that to happen."
155,Doug Montgomery,"November 17, 2015",2," Because you can only see 2 lines of a task and there is no way to expand it. Makes it pretty much useless really.  Update: Running 3.8  If I hit one of the original task emails sent from Insightly, on the details page I see html code in the description section. If I edit that I see 1 long line descr...Full ReviewBecause you can only see 2 lines of a task and there is no way to expand it. Makes it pretty much useless really.  Update: Running 3.8  If I hit one of the original task emails sent from Insightly, on the details page I see html code in the description section. If I edit that I see 1 long line description of the html. Double tap does nothing. If I open one of my tasks I see 2 lines in the description and when editing it goes to one long line also."
156,Scott Kosak,"November 22, 2015",3,"Just started using it... Looks usable,  but why aren't TAGS included in how you can search among organizations and individuals dual contacts? They are a major. Part of how the system is used,  but they seem to be missing from the App in regards to searchability...  Maybe make them clickable within organization or contact da...Full ReviewLooks usable,  but why aren't TAGS included in how you can search among organizations and individuals dual contacts? They are a major. Part of how the system is used,  but they seem to be missing from the App in regards to searchability...  Maybe make them clickable within organization or contact data?"
157,Sunita Woodcheke,"October 13, 2015",3,Sorting leads I have problem not being able to sort leads. Otherwise good program I just don't understand how you can have a leads list and not be able to sort in alpha order or any other order
158,Scott Jutras,"December 14, 2015",4,Tasks Can I sort my tasks by date?
159,Giancarlo Carvalho,"September 14, 2015",5,"Great app Fits all my needs, i have all of my contacts, plus you can set your task with colors so you wont get confused, i changed CRM and since i got involved with this app, i got more organized., thanks insightly"
160,Rod Stadler,"September 3, 2015",5,Great CRM App Insightly is a great CRM program it fits the needs of my company perfectly and the mobile app let's me do real time updates maximizing my time.
161,Raluca Ghete,"September 23, 2015",5, Great app!
162,"Amanda Andrews, Realtor The Whitmore Team","September 2, 2015",5,"Perfect for my Real Estate database I can export my contacts,  keep track of email messages,  track my transactions and prospects.   Syncs my computer to my phone.. Love it!!"
163,Micah Feldkamp,"August 6, 2015",4,Loved the new update! Does exactly what I need for contact management. I just wish I could attach files from Google drive to my records.
164,Chris Bovia,"August 4, 2015",5,"Great for what I use it for, tasks Easy to use and maintain. Very happy and will be updating soon as my client list grows"
165,Chris Mefford,"August 7, 2015",5,Clutch product Makes managing customers simple.  Easily convert leads to new opportunities.  I &lt;3 this Ä…pp
166,Juan Pablo Morey,"August 5, 2015",5,Good Works excellent for small business
167,Francois Malan,"August 3, 2015",1,500 error Can't login with Google apps account keep getting a 500 error
168,Chris Gallagher,"August 1, 2015",1, Awful support.
169,Alex Vincenti,"July 14, 2015",5, Very flexible.
170,Dewald Smit,"June 25, 2015",4,"Suggestion Upload of audio files, I use insightly daily and would like the facility to upload my meeting voice recordings from the app... Help?"
171,Jennifer Park,"July 6, 2015",2,"No feature to add or view my leads Please develop this app so that users can contact their leads from their phone. We are out and about daily and without our lead list, we can't run our business."
172,Eric Sommer,"June 18, 2015",3,Need to filter contacts and organizations Good but unable to filter searches when searching contacts or organizations. Can this be added?
173,Ecobescu Ionut,"July 4, 2015",5, How to add Leeds?
174,Jay Encarnacion,"June 14, 2015",3,Great but Would be nice to have the lead management module itegrated with scheduled tasks.
175,Ben Fehler,"June 17, 2015",3,No leads Why doesn't the mobile app have a leads section?
176,Tom Harris,"June 10, 2015",5,C.E.O Professional Building Service's
177,Dani Montoya,"May 30, 2015",2,"No longer works It was working on my android tablet but now it ""cant connect to the server"". Works fine on my Android phone. Tried unintalling and reinstalling,  no luck. I am reading about a desktop version which I emailed support about and they said there was not one. Where can I get it."
178,Ian Morrison,"May 20, 2015",1,Slows down my business The only thing worse than this app is Insightly's slow to respond and ultimately unhelpful customer support.
179,Steven Skarupa,"May 28, 2015",5,Awesome personal crm Very well thought through and solidly developed.  Only installed for 3 days and already becoming indespensible.
180,Mike Easton,"May 26, 2015",1,"Won't let me log in I can't log in and make this app work, I need to register, get me registered please so I can use this"
181,Tone Love,"April 23, 2015",3,"Barely useable The desktop version is beautiful, and the mobile app is getting better but still very basic. The search doesn't search across all categories, only the category you're viewing and  synchronization appears to be manual, so new items don't appear without refreshing first. The app doesn't appear to have...Full ReviewThe desktop version is beautiful, and the mobile app is getting better but still very basic. The search doesn't search across all categories, only the category you're viewing and  synchronization appears to be manual, so new items don't appear without refreshing first. The app doesn't appear to have security features, a real concern for me. Is it transferring information in the air without encryption? Can someone steal the phone and extract information? Still a decent app though."
182,Joss OSS,"May 15, 2015",4,Great but...... Please link app to phone calls so that insightly prompts me for a note after a call. Base has this. Indigo has this. Insightly has a tonne of other features but this feature is a big gap.
183,Gregory Ferrett,"May 4, 2015",3,"Needs Work Love the desktop application,  but the app is really average. Simple things like filtering opportunities by tag, which are vital when you have a lot of data,  just don't exist."
184,Marcus Assarlind,"May 4, 2015",2,"Not very good Support for pushing native calendar and phone book seems like a given, but no.. Is this a bad port of an IOS app?"
185,Petr Sharapov,"May 5, 2015",2,Totally useless No way to see the feed. All events are mixed up with no logic observed. Deleted after 10 min.
186,alla privates,"April 28, 2015",2,"Customer support Took more than a day to get a respond, was thinking to upgrade but with out technical support why pay"
187,Prasad Rajappan,"May 18, 2015",5,Awesome App indeed! Great app. Easy to use.  Love the business card scanner functionality.
188,Ken Johnson,"January 26, 2015",2,"Not there yet. Still lacks functionality for me.  Too much of a difference between the app and the Web version, I feel like I'm still chains to the desk to use Insightly.  Currently I'm using this and Base to see which one I like better and Base is much better so far.  I think they're going to be my long term prog...Full ReviewStill lacks functionality for me.  Too much of a difference between the app and the Web version, I feel like I'm still chains to the desk to use Insightly.  Currently I'm using this and Base to see which one I like better and Base is much better so far.  I think they're going to be my long term program."
189,Joe Joshua Kochitty,"July 8, 2015",1, I'm moving to Base CRM. Insightly crashes everytime I click on an opportunity. There is no refund for un-used period. Downgrading is not allowed - you have to continue paying high cost even if you don't have large team. Product is not user friendly.
190,Jeff VanderArk,"March 13, 2015",1,"No Settings!?! No refresh button.... Figured out that it refreshes (I think) when you tap and pull down on names in Contracts.  But, entered Contacts on web and even by doing the pull down, it takes hours to refresh the Contacts on the app.  No settings?  Just ""Feedback"" where settings should be.  I've give feedba...Full ReviewNo refresh button.... Figured out that it refreshes (I think) when you tap and pull down on names in Contracts.  But, entered Contacts on web and even by doing the pull down, it takes hours to refresh the Contacts on the app.  No settings?  Just ""Feedback"" where settings should be.  I've give feedback and asked questions 5 times now and nothing but automated responses so far."
191,A Google user,"March 1, 2015",2,"Why app does not refresh? No event? Realised that you need to manually logoff and login again to have your data refresh. This means there is a real danger of viewing and editing stale information especially in a multi-user environment.   Also, why is there no function to add or modify existing events?"
192,Christopher Guillou,"March 28, 2015",2,"Getting there Some good  functionalities but not yet a worthy companion of desktop/browser version. Main gripes are ergonomics that aren't obvious enough, no calendar and at this time I seem to have ""lost"" offline editing/adding...."
193,Loris Facca,"February 27, 2015",1,Frustrated My Kingdom for a CRM service that will integrate Exchange email AND calendar syncing NATIVELY as well as keep a record of phone calls made from WITHIN the app itself. Is that too much to ask for? All these CRM services and apps are half assed in their functionality. I give up. Sigh...
194,Rob DaBiere,"January 19, 2015",3,New version What happened?  The version last week was so much better I could see more tasks and the days of the week. Now it just gives you the date number not day that sucks !!! Why change the format it was good the way it was!!  So much for good free apps
195,Keith Hubbard,"January 22, 2015",2,"Unsightly... ;) I keep trying to use the search function like I do with the browser application, thinking I can search  for something and it will bring up everything related to it... But it doesn't. I have to search for everything within it's own categorywhich makes it combersome and confusing because of the mental...Full ReviewI keep trying to use the search function like I do with the browser application, thinking I can search  for something and it will bring up everything related to it... But it doesn't. I have to search for everything within it's own categorywhich makes it combersome and confusing because of the mental switch between app and full system- I struggle to see the value of the app when it's most basic and powerful features don't match up."
196,Wissam Shaar,"January 19, 2015",5,Big improvements Insightly Android app keeps getting better and richer with functions. Its features on a phone are more than enough for me when I'm not at my desk. Great work Insightly!
197,Joel Heck01,"January 31, 2015",2,What happened? The previous release had a Refresh option in the upper left corner.  It's gone. I added new contacts on pc in desktop mode. I can not get them to show on the newer Android app.  Almost missed an appointment. Not good.
198,Alex Lazurka,"February 11, 2015",5,"A must-have A real life saver when it comes to keeping up with multiple tasks, projects, files, leads and so on. Much quicker learning curve than salesforce, and at a fraction of the price. Love it!"
199,Jr PoirÃ©,"January 26, 2015",4,Great but missing features Love the app but where is my calender? Other wise its great
200,Wytze Wissink,"January 21, 2015",4,"Great update, great app Good app for our small workforce and even gets better with your updates. Keep up the good work!"
201,Blake Kelly,"February 1, 2015",3,not bad mobile app is missing the calendar feature. which I need if I'm going to use this CRM.  app is also missing android notifications. why??
202,Carlos W.,"January 23, 2015",4,"Awesome Only using free version, so there are limitations. Nonethelss, very effective CRM."
203,Gregory Auen,"January 25, 2015",1,"No Calendar???? Hard to schedule from  drop down....where is the calendar??????...gets better..apparently does not provide ""time"" to tasks..yuck!"
