index,author_name,review_date,reviewer_ratings,review_body
401,Karay Akar,"November 3, 2017",5," Excellent app, that would be nice if we can see billing also."
402,Francis Cristallo,"November 21, 2017",2, So limited it's almost useless
403,Vladimir Radulovic,"November 12, 2017",1, Webpage not available always.
404,Graham Harper,"October 20, 2017",4," Pleased to see some significant improvements. Looks to be very useful for monitoring the basic health of my Azure installations. Still has some interesting bugs and issues, but it's reassuring to see that the development team is responsive."
405,Kenny Summerville,"October 21, 2017",3," the app is good, but REALLY needs the ability to edit services, also, attempting to manage a custom image classic vm made with azure powershell crashes the app for me. please fix that bug"
406,Tom Thorp,"October 20, 2017",2, Can't even show basic information such as database quota usage etc
407,Ashish Raj,"October 24, 2017",2," Due to some reason it won't launch cloud shell from app, I am able to access shell from laptop browser."
408,Paul Willies,"October 20, 2017",4, Latest update sorted the issue changing directory tenant... makes it a really useful app to have to hand now!
409,Joey Brakefield,"October 17, 2017",4, This app is great! All that's needed is the ability to switch tenants if the identity has access to multiple just like in the web portal.
410,A Google user,"October 15, 2017",2, The new version is crashing when you scroll fast in a huge list.
411,Alberto Castillo,"October 15, 2017",1," New version does not allow to surf between suscriptions, huge step back with this version"
412,Brad K,"October 17, 2017",1, Works well for virtual machine management.
413,Sarah Sexton,"October 16, 2017",5, Azure on my phone! So useful!
414,JJ Streicher-Bremer,"October 14, 2017",5, Great for working with Azure VMs
415,A Google user,"October 15, 2017",5, Great stuff
416,Technology Geek,"October 14, 2017",5, Love it
417,Srikanth Popuri,"October 5, 2017",2, Does not meet the expectations. Helpful only to deallocate vms and to start the existing vms. This App can't even create or delete resource groups. UI sometimes stuck and not user friendly.
418,Paul Keeney,"October 5, 2017",4, Great app to review resources but needs more control of resources built in
419,Stanislav Kostenko,"October 7, 2017",4, Cloud shell doesn't work
420,Himanshu goel,"October 21, 2017",5, Nice app.
421,A Google user,"September 18, 2017",1," Unable to login when MFA is enabled. Please supply a fix.  Thanks,"
422,Lee Song,"September 20, 2017",4," Please add cost, subscription credit graph"
423,SAFE GREEN FOUNDATION,"September 17, 2017",5, Excellent I love it.
424,Sarat Bisoyi,"September 3, 2017",3, Pls add schedule feature in runbook automation account
425,Dominic Lennon,"August 30, 2017",3, Good start. It would be nice to be able to manage multiple accounts though (I.e work and personal)
426,Kåre Schmidt,"August 16, 2017",5, Awesome app - though I should of course be able to request just-in-time access to my VM's though the app!
427,Paul Shell,"August 9, 2017",5, I switched from Windows phone just for this after watching Azure Friday.
428,William Wilkinson,"August 5, 2017",5, Wow best app ever can it get any better
429,Nathan Leach,"July 31, 2017",4," Not great yet, but making itself useful"
430,Stuart Eggerton,"July 18, 2017",4, Great work Microsoft!
431,Don H,"July 12, 2017",3, After the update I need to log in.. again. Same as with the MS Teams app. That's getting annoying real quick..
432,Guilherme Souza Gomes,"July 9, 2017",4, Great start but looking for news features like blob storage navigation.
433,Stephen Smith,"July 13, 2017",5, Very nice!  Having billing information would be nice though.
434,Brian Behm,"June 28, 2017",3," Great start but looking forward to more features.  Billing would be great to see.  Cloud Shell is not working for me.  I get an ""Internal Server Error, Unknown Error"" when I start up the Cloud Shell screen."
435,Gorgi Rankovski,"July 2, 2017",4," Great app, but still missing vital stuff, like billing (cost analysis), performance monitoring and dashboards."
436,Syed Aqib,"June 30, 2017",3," Lot of things to be added, main thing is scheduling and monitoring the pipeline."
437,Digvijay Singh Rajawat,"July 2, 2017",4, Nice to see you Azure on my Phone
438,simon foster,"June 27, 2017",5, Need any beta testers? I like everything Azure look forward to seeing new features get added to this
439,Cristian-Teodor TATOIU,"June 26, 2017",5," Now we're talking! Finally! 👍 Hell yeah, Cloud Shell!"
440,Lewis Roberts,"June 21, 2017",3, Installed to see if I could review output or job status of Azure Automation accounts and runbooks but doesn't have the feature yet. For now I use an Instant App (Add to Home Screen in Chrome) and that does the job fine.
441,Paul Li,"June 21, 2017",1, Abusive permissions. Was working fine before now wants access to identity. Unacceptable
442,Mark Bell,"June 11, 2017",5, Love it. Love being able to check status of machines and drives on the go. Wish there was a quick view mode to get an overview of all resources' statuses without ha ing to click around.
443,A Google user,"June 11, 2017",2, Can't see billing. Needs work on general
444,Christoph Wegener,"June 11, 2017",1, Doesn't show current billing estimate. What's the point of it then?
445,Google User,"June 3, 2017",3," Sadly, one must log in upon every use. Understandably this should be a highly secure app, so I'm looking forward to seeing better ways to authenticate (fingerprint?). Also looking for multiple accounts/identities support. Otherwise it's fairly useful so far!"
446,alex lim,"May 26, 2017",5, Great work! App is fast and responsive. Has the common info in place which is all good. One enhancement would be to filter by powered on VMs. Or be able to see VM status from the list.
447,Simon C,"May 23, 2017",2," After logging in, the app is sluggish and ring to open a resource it just hangs and crashes. Using a Nexus 5x"
448,klaas langhout,"May 18, 2017",5," Installed, authenticated, checked out my Azure storage account metrics : took less than a minute :)"
449,A Javeed,"June 1, 2017",5, Aws doesnt have powerfull app like dis
450,Jeff Bramwell,"May 19, 2017",3, Nice app but needs to support multiple azure accounts.  Would also like to see my current billing usage.
451,Jan-Hendrik Peters,"May 15, 2017",5, Awesome. It took some time but was worth the wait :)
452,Hesham Desouky,"May 23, 2017",2," Useless, nothing to do with app services but stop and restart Many properties are displayed with irrelevant and useless info. Even the properties are written like the api json!  More over, metrics display requests only, no cpu or memory!  When the details page load there is no indication that it is ...Full ReviewUseless, nothing to do with app services but stop and restart Many properties are displayed with irrelevant and useless info. Even the properties are written like the api json!  More over, metrics display requests only, no cpu or memory!  When the details page load there is no indication that it is loading"
453,Sachin Filinto,"June 6, 2017",5, Nice app. Happy I can manage azure resources from my phone when on the move.
454,Paul Murphy,"May 17, 2017",5, Where is the source?
455,R J,"May 11, 2017",5," Finally a most awaited thing, please create an app for visual studio online as well or make its web ui itself mobile adaptable like GitHub"
456,A Google user,"May 10, 2017",5," Finally a great, simple to use app to manage all my resources on the go. The wait was worth it"
457,Jacob Jedryszek,"May 9, 2017",5, We finally have mobile app to manage and monitor your Azure resources!
458,Giuliano De Luca,"May 10, 2017",5," All the azure resources in your hand, Cloud Shell coming soon, fantastic !"
459,Yash Sodha,"May 10, 2017",5, Finally we have an application and can control everything with one small tap :D
460,Alvaro Dias,"May 9, 2017",5, Love it! I can now manage and monitor my azure services on the go!!
461,MVS KIRAN,"May 11, 2017",5," Finally one can manage all resources by smartphone, splendid!"
462,A Mccall,"May 11, 2017",5," Loving the UI; clean, functional, and looks great."
463,Riza Marhaban,"May 10, 2017",5, Its about time. Powerful tools for Azure management.
464,Sumant Mujumdar,"May 10, 2017",4, Feature to pause/start a data warehouse resource is required
465,Hemant Sathe,"May 10, 2017",4, Great to have a tool to manage azure resources
466,Ravi Rana,"May 12, 2017",5, A great initiative by Microsoft team .
467,Eugene Fong,"May 11, 2017",3, It has some of the basic portal functions but some don't work such as the connect function to a VM
468,PrimeHP,"May 11, 2017",5, Powerful tool for azure management
469,Adam Abdelhamed,"May 11, 2017",5, A great companion to the main portal
470,shrey shirwaikar,"May 11, 2017",5, Finally!!! Awesome app....
471,Ben Kevan,"May 11, 2017",5, About time!!!!!
472,Marck Robinson,"May 9, 2017",5, This is great!
473,Mike Douglas,"May 12, 2017",5, Great UI and functionality
474,Sherron Woolf,"July 23, 2018",5," I have wasted an entire 90 day trial just trying to familiarize myself with 
microsoft and azure. I only hate it's up so soon. I'm trying to set up a 
paying, for-profit organization to parent a non-pro fit rehabilitation and 
recovery mission that heals by teaching love and acceptance. I see the 
n...Full ReviewI have wasted an entire 90 day trial just trying to familiarize myself with 
microsoft and azure. I only hate it's up so soon. I'm trying to set up a 
paying, for-profit organization to parent a non-pro fit rehabilitation and 
recovery mission that heals by teaching love and acceptance. I see the 
necessity of a cloud-based, cheaper, faster, and simpler environment in 
order to manage the broad and challenging aspects involved in running an 
organization"
475,Guy Johnson,"June 20, 2017",1, This app tells me mothing about my Azure environment except to give a list of everything. Useless.
476,Juuso Sokura,"June 19, 2018",1," After latest update, valid credentials are no longer working rendering 
azure app useless."
477,Subhash Das,"January 15, 2018",5," My andriod phone needed Mac os business version.This azure app help me Mac os version setup, install, and activate for help me."
478,lehlohonolo glen,"July 21, 2017",5," Great App on IOS. Hope to see how it performs on Android platform, wish to see capability of running Powershell via app in future."
479,Sandesh Karki,"October 16, 2017",3," I tried to use cloud shell but it says cant provision cloud shell, and it gets stuck forever while restarting shell"
480,Алексей Веткин,"April 21, 2019",1, Списали деньги дважды при отмененной подписке. Все что нужно знать об azure.
481,A Google user,"June 10, 2017",5, All my files!! Yay
482,Hammad Abbasi,"July 29, 2018",1, Keeps crashing on note8
483,A Google user,"July 7, 2018",3, Can't check costs !!!
484,A Google user,"May 29, 2018",3, No Govcloud access :(
485,hani alzayan,"October 4, 2017",5," Good step from Microsoft,  to deal with your stuff on cloud"
486,Priscilla Mitchener,"August 4, 2018",5," priscilla,new microsoft azure guide."
487,S Yandex,"November 11, 2019",5, Must have
488,Spy N Buy videos,"December 11, 2017",5, Free best Ms supported app
489,Key international Enterprise technology solutions,"July 30, 2018",5, #keyinternationalacademy
490,STUDIO BASS,"June 1, 2017",5, I like it
491,Ian Mubangizi,"December 18, 2017",1, Keeps crashing
492,Alejo Astalmi,"August 26, 2017",5, Very well done. Thanks
493,TheBinaryGuy,"May 13, 2017",5, Just what we wanted!
494,Srikanth Reddy Varakantham,"September 11, 2018",5, Very good and pretty cool
495,H. Rashid,"May 12, 2017",5, Finally....
496,Abhishek Pandey,"May 27, 2017",1, Waste
497,Mirko Bonello Dynamics 365 Power Platform Blog,"August 15, 2018",5, Awesome azurebapp from Microsoft
498,JUAN ORTEGA,"February 12, 2020",4, Moto Microsoft Azure
499,Ali Akhtar,"October 25, 2017",5, Good work
500,A Google user,"March 7, 2019",5, Well
501,Nur Rahmat Dwi Riyanto,"August 10, 2017",5, Wowww
502,VSP Virtual Support,"November 29, 2017",5, Nothing
503,Frank Chambillo,"June 6, 2017",5, Great!
504,J.B.D. King,"May 10, 2018",5, Amazing!!
505,Synixx,"April 18, 2020",4, Amazing !!
506,Aries Taurus,"April 23, 2020",5, Awesome!!!
507,A Google user,"December 27, 2017",5, Great app
508,Rex Raphael,"September 21, 2018",5, Great app
509,Lakkala Rakesh,"May 18, 2018",5, Azure Da
510,qadeer ali,"September 23, 2019",5, Nice app
511,M. Arman Uz Zuha,"January 2, 2020",5, Very useful
512,Abhishek Gupta,"May 10, 2017",5, Awesome
513,Pedro Serrano,"October 7, 2018",1, Difficult
514,Khaled Ansar,"March 26, 2020",5, Excellent.
515,Muminjon Abduraimov,"February 1, 2020",5, Amazin'
516,Sarthak Varshney,"May 12, 2017",5, Nice
517,Tony Mcgee,"October 19, 2019",5, Excellent
518,Tracey Anne Mackray,"May 26, 2017",5, Good
519,Nelson Lickey,"February 21, 2019",5, great
520,Clinton Duckworth,"May 31, 2018",5, Luv
521,Baitul Aman,"August 27, 2019",4, Awsome
522,BAUAMS BAUAMS,"September 3, 2019",5, Good
523,BAUAM BAUAM,"September 18, 2019",5, Good
524,Aliya Sharma,"February 27, 2020",5, good
525,Patrick Mic Kohlwey,"April 13, 2020",5, Nice
