index,author_name,review_date,reviewer_ratings,review_body
63,Orphilips,"September 5, 2018",3,Seems buggy My app seems to load very slow and every 3-4 items I have to wait for it to load more. Seems like a waste of time they need to redesign the information to load quicker and smoother for a more seamless experience. Also since my company added my fields I can no longer view opportunities in the app because it states there is too many fields.
64,bagbj,"February 14, 2020",5,"Loading Screen Once I open the app, only Loading shows up  on the screen and nothing after it. Need immediate attention. It was working perfect two days ago but something happened. Pleas check"
65,CarmineGF,"October 31, 2019",5,"CRM in your pocket Love this app.  I can update deals, call customers and prospects, and collaborate with everyone in my company from anywhere!  Every release is noticeably better, as more capabilities are available.   Virtually anything important about my customers is 1-2 clicks away.  Powerful!"
66,JADR8,"July 11, 2019",5,Lightning performance... We’re making heavy use of dashboards... some of our sales team have come up with an alternative name for lightning - they call it Turtle. Would like to see improved performance if possible to help our sales team be more productive.
67,Paulele777,"February 20, 2020",1,"Not User Friendly Too many clicks to do simple things.  I’m in a task to do a follow up phone call but need to click numerous places to find the phone number and contact name.  Then to change a date of an old task, you have to click change date, then click on the date to change the date.  Not to mention it’s not even a calendar, it’s just a list to choose from so you can’t see the day of the week etc.  Very bad app.  Pipedrive works much better."
68,JP_Hokie,"September 18, 2019",5,"Great business app! The Salesforce app is easy to use, has almost all of the functionality of the desktop app, and helps me to stay up to date with all of my customers. I wish wish more business apps were as easy to use."
69,TakenApp2,"September 13, 2019",2,Mileage The app is terrible. #1 issue is that cannot calculate mileage for beans. #2 good luck checking into a place you have been able to check into for the past year and all of a sudden it won’t let you check in. #3 Crashes a lot. Have to delete the app and then re-download it an hope it works. I have to use this daily for work and I have to send in a separate mileage form because it won’t calculate.
70,Eisbrecher12,"October 25, 2017",3,"Generally useful - serious hang time This app is pretty essential to being able to find client information in the field.  I travel, so I live off of my phone and often have to use the app over the site.  It is organized well, but I have a lot of issues with pages loading slowly or coming in completely blank."
71,goingback2,"February 23, 2018",2,"If it only worked... When it actually works it’s great. However it’s never, ever works consistently. I have to completely close the app each time or it gets stuck on the home screen or the last screen I was on. I can’t switch from calendar to contacts or anything else because it locks up. I’m constantly closing the app and reopening to continue using it.  I use it on an iPhone and it’s just painful."
72,Sde 719,"July 23, 2018",3,Not user friendly I can’t find a lot of info I’m looking for. It’s not user friendly. It gives “just enough” info on the app... “just enough” to get a high level but you can’t dive into an account. “Just enough” to get you a little frustrated and want to go back to the website! Not horrible but definitely needs improvement.
73,userBV,"February 7, 2019",3,Could be even better Wished that you could send out email templates that you’ve customized FROM THE APP!! from
74,higgus biggus,"February 24, 2019",1,"Gantt management on app is unusable Trying to move jobs between routes is non functional. It’ll say drag to move but the whole screen shifts and you cannot move the opportunity. It is not formatted for 7plus screen as when you click an opportunity the preview is larger than the screen, you cannot zoom to exit it so you have to re open field service from the menu which is very slow loading. Needs work for sure."
75,sarwasim,"May 23, 2019",5,"A handy tool Its a wonderful tool. Keeps our all the leads, contacts and opportunities organised and easily accessible."
76,KtHagan,"March 16, 2020",5,"Not efficient Please add edit options for notes, activitiesand uploading documents from the mobile version. This is needed with iPads or other tablets for work purposes. It needs to have edit and document upload capabilities ,"
77,Average user,"April 23, 2020",5,Amazing! I can’t imagine running my business without this app I wake up to it and look at my dashboards before reading the news or kissing my wife! Chatter contextualizes conversation and helps keep everyone aware of changes and ideas. Love this app!
78,Reemusk,"October 14, 2019",1,"Intentionally Broken Reporting Feature Who had the genius idea to break summary reports in Salesforce for iOS? You guessed it, Salesforce! Imagine being a half-baked, brain dead app to the Store that loses to your instances mobile website. It’s a shame how SFDC continues to brag about new app innovations, but completely misses the mark on core features. It’s not surprising, at this point. It’s been broken for years. They are willingly avoiding fixing it. Sounds like internal department conflict leaves them in a quagmire, and we are the victims."
79,dheathrealty,"March 18, 2020",4,"Good app but can be improved Good app, easy to use, a suggestion:"
80,Yalebulldog8,"July 31, 2017",5,Salesforce1 I have enjoyed the ability to function as if I'm at my computer but not have to be tethered to my office. It allows all of the same functionality as my computer which is very helpful.
81,Scarby92,"October 29, 2017",5,Salesforce needs more customer reviews I have been using Salesforce since January 1st 2017 and this is the first time I was asked to fill out a review for the Salesforce App. It is great but I wish the app was more intuitive. Our system would be amazing if it was more visually pleasing!
82,sm91006,"January 15, 2018",4,Ability to manage users using iPhone I am a system administrator and I would be able to create new users and Assign them to roles and profiles using my phone which I am on able to do. it’s not easy to find it. this improvement might help
83,beccap2010,"February 20, 2018",3,Slow Loading The app is incredibly slow to load and sometimes won’t load if you don’t have incredibly strong service available. Also the task editing button is difficult to get to. Otherwise I like the way it’s organized and is convenient when I’m in the field
84,Weather is coo,"July 25, 2019",5,"Natural extension of desktop, optimized for mobile This thing flies. It lets me continuing working inside my org no matter where I am. Workflow is incredibly smooth, and let’s me take actions as they come up instead of waiting to get back on the laptop."
85,MarkMPT,"July 5, 2019",3,"Helpful, but not great I love having the ability to access all of the information on my accounts....when it’s actually working. The problem with this app is that too often it just doesn’t work properly. Many times I will search for something and just get a blank page."
86,Marks1mpson,"April 11, 2020",5,Works for simple lookups If you need to simply lookup a customer or contact this works well. I would love to be able to (1) Mark specific reports as favorites (2) make reports mobile friendly and (3) see favorite reports in the app
87,Goblue3313,"October 31, 2019",5,The leader for a reason Salesforce is the leading CRM for a reason. They make data management easy. The fact that I can check if my company does business with a particular entity and update colleagues with changes is pretty awesome. This app is easy and fun to use.
88,Mr. Wish it Worked,"July 16, 2019",1,"Never ending glitches I have to delete and reinstall weekly. The app works fine for a few days then gets stuck on my recent activity. No matter what I click it takes me back to the same page. From that page I search an account, click that account but instead of taking me there it takes me right back to recent activity. The only thing that stops this is to delete and reinstall."
89,jcr8552,"November 19, 2019",3,"Interface Very hard to see opportunities once they have been created, as it seems the font is too large for the screen and you have to open each one individually. There is no ability to do a quick easy scan to find what you are looking for."
90,SF Seabrook,"August 18, 2017",5,How do people live without this?! This app delivers everything I need to run my business. No great salesperson is tied to her desk and this gives me the ability to be in front of customers and with my team without ever skipping a beat.
91,VP of Sales,"December 5, 2017",5,Functionality and ease of use The app does not provide the exact same functionality as the desktop version and an overlay like the Clari App makes it much easier to navigate and use.
92,Lets talk about Apps,"December 14, 2017",2,"Fake reviews Any and all reviews over 3 stars I am assuming are fake. Either my employer is using this app incorrectly (and that may be the problem) or this app just isn't what it could be. It's slow, it's not user friendly, and it lacks pertinent information. I would have designed the app to work on the fly, and be customizable by the user. "
93,daisycowboy,"January 8, 2018",4,Bridging gaps Salesforce has not only put many concepts into play but has streamline this in a way where it’s realistic to not need support staff. What’s the system integrates it’s third-party apps more fluidly the system or one just like it will be at the cornerstone of every office from corporate to personal I believe.
94,Mark Grgurich,"February 6, 2018",5,Everything is where I need it Salesforce is the answer to my prayers. The new Lightning version help me stay organized and working the priorities. Thank you for making your tools better for all of us.
95,#yep,"July 24, 2018",5,It’s a keeper The Salesforce app is wonderful. So easy to use and makes entering information timely easier.  I use the desk top version for updating addresses and targeting but for day to day events nothing beats logging my sales activities as I go.
96,Emojian111111,"July 30, 2018",5,"Great Mobile Experience CRM tends to be like healthcare, or ISPs, at least in the USofA - you get what you get. Salesforce is great, much better than the competition. I really like how I can do things on the app like I could on the computer, but faster! Great mobile UI"
97,clemdan,"July 31, 2018",2,"Phone semi overheating, frozen screen Unfortunately, the app isn’t working properly. I simply wanted to view my pto and absences and when I clicked on that option the menu will not go away and none of the functions will work. The screen is frozen within the app. I can exit out of it by clicking my home button easily but I cannot do anything within the app."
98,wnydcar,"February 15, 2019",5,"SF can do anything... The flexibility of Salesforce has been the key to the growth of our company. Anything I have needed the system to do, with premier support’s help, we’ve been able to make customizations and adapt with as our company grows."
99,Jon3NT,"March 27, 2020",1,"This app is terrible!! Please Salesforce, if you’re listening, no app in 2020 should be this bad, this unpolished, this glitchy. Please, please, please just make it better lol. I know you can, I know it’s possible, and I’m sure it’s not in your priority list since most people use the desktop version and you’ve already got your money from your users. Buy just please, make it better. I really enjoy using the desktop version, but this app is so, so bad 😫"
100,B2Hillseth,"July 25, 2017",5,"Benefits of Salesforce1 I love its versatility and intuitiveness on the computer, iPad, and the phone. The support that they've been able to provide to provide better clarification, create reports, etc has also been really helpful."
101,Shoemana,"October 19, 2017",5,Excellent Salesforce is an excellent way to document my appointments and stops with my customers. The only improvement I have is more places for additional contacts at each account.
102,cotogolf,"March 31, 2018",5,Best program ever I have been an ACT user for over two decades and then I switch to Salesforce about three years ago and my profit ability has jumped up dramatically. I will never switch back.
103,kaehladae,"July 16, 2018",5,Love this convenient way of keeping up with my customer service Awesome and easy to use. Very beneficial to me and my part time status. Recommend every associate having this on there smart phone
104,mel1ora,"September 28, 2018",5,So far great! I’m finding this version of Salesforce very easy to use.  So far all I’ve done is capture lead information but it’s allowing me to “brain dump” into one simple platform. Looking forward to having it help me prosper!
105,castrocn,"February 6, 2019",5,Suggestion only The only thing I wish salesforce did was put is little red dot to remInd us of non sales apts and appointments kinda like a message on our apps on our phones just a reminder red dot on salesforce
106,AJ6797,"February 6, 2019",5,"Intuitive and easy to use Great to have full access to do all important tasks like creating accounts, opps, contacts and quotes while on the road and working from my cellphone."
107,Michelleyyyyyyyyy,"May 7, 2019",1,"So frustrating I use Salesforce on my computer basically all day, but when I have to use it on my phone it is useless. When I search an account, a lot of the information is missing. Or it will show up then disappear before I can tap it. This is especially true for the activity history. Even when it doesn’t disappear, I tap it and it’ll say I don’t have permission to view it. So frustrating!!"
108,jeff.kemp,"April 15, 2020",2,"Not great Just tried this app for first time and already don’t like it. Wanted to see opportunity pipeline but was not able to apply any meaningful filters. Filter is limited to ‘equals’ and with no option for ’OR’ within conditions, and not able to add more than one option from picklist of same field. "
109,tkocpo,"August 30, 2019",5,Team leader Tom Olinghouse Downloading takes way too long. A lot of my team is having a hard time logging in this is the first time I’ve gotten this far myself with two days of train.
110,kdkelly,"September 11, 2017",4,"Good product Much better today than when I last used Remedy many years ago. Most everything I need is right where I can easily find it and ticket entry is easier, especially when using templates."
111,Alice Atlanta,"September 26, 2017",5,My mobile office SalesForce1 makes writing a sale in a center faster and easy to add changes to a center's information
112,Goyo1973,"November 26, 2017",1,"Multiple photos, videos and better functionality I like Salesforce however it would be great if there there was a way to upload videos instead of a link.  Also it would be great to be able to upload multiple photos in one post vs having to post 1 per each photo.  "
113,Trust me I'm mormon,"March 17, 2018",3,Sometimes works Most of the time the app works now but every once in a while there’s some bugs and it has to be reset. Sales force is pretty prompt with fixing problems though as long as they get a report. Hoping for a nice polished app experience in a couple more months.
114,THEREALKONK,"April 10, 2018",5,Money maker I often joke that I’m not the amazing salesperson I’ve received kudos for so often- rather I’m skilled at timing. Salesforce makes “right place right time” a far more loaded deck and it’s SO easy to use. Do yourself a favor and use it!
115,Andonon,"August 10, 2018",5,I live by this app as an admin. I’m a certified Salesforce Admin. I live by this app. I love it. I get access to everything gnu need to work cases right from my phone. I can’t make many system changes. But collaborating is awesome. Note. I also use the SalesforceA app.
116,CJ GJ,"November 6, 2018",1,The rating is misleading I feel like it must be the gajillion salesforce employees who rated this app 5 stars because it is quite sad and awfully cumbersome. The UI is terrible- it would be much better if the layout were more like the desktop site. It’s slow to load as you scroll up and virtually no way to even customize the view. Please throw this out and start over because I WOULD rate Salesforce as a whole a 5. Not this travesty.
117,Dusty Mc,"April 8, 2019",4,Information I would like to see the customers past purchasing history along with what we charged for each product under their account.
118,MBW70,"August 9, 2019",5,App so much easier to use than desktop! The SF phone app is 100% easier to navigate and get things document quickly than the desktop version!
119,JonnyHuse,"July 11, 2019",3,"Works great when no bugs I have been experiencing many issues since the recent update on my iPhone. iPhone is updated on software, same with SF app. Been an issue for about a week now. Cannot load suspect details to log calls on the go....please fix ASAP! This tool is my mobile office & assistant"
120,Anmol Bhasin,"August 31, 2017",5,Ok with issues.. Counter intuitive design.. crashes intermittently. Deep linking from the browser is very clunky. This has been solved over and over I hope Salesforce App can pick the mechanism from a consumer app.
121,olu_chitown,"June 20, 2018",5,"Love the mobile feature Helps me manage my work load on the go, whenever, wherever. Also further aids cross-team collaboration within my organization. #TeamTech"
122,ban_cars,"June 29, 2018",1,"Completely nonfunctional after the update I can’t open any Objects - a blue bar runs indefinitely across the top of the screen whenever I search and select, or select from Chatter - and since I’m running 11.4 (the recommended iOS) on an iPhone X, I think it’s safe to say that the app is just broken. The majority of my work is in the field so it would be massively helpful if Salesforce could fix this very soon."
123,austinmarshall42,"September 11, 2018",5,"Huge Improvement Much easier to you, visibility into account details and navigation are huge improvements."
124,walkerworker,"March 25, 2019",3,My Neighborhood / what I would like. *After each entry it does not return to the previous screen.
125,Mollyperez,"April 11, 2019",1,Annoying Every time I try to open the app to validate my day of work it freezes and I have to close the app completely and reload.  I often have to do this multiple times before the page actually loads properly.  Also the fact that I don’t have all of the key features as on the website is very annoying.  Why can’t I add or edit days easily on the app?
126,Mike K,"August 8, 2019",4,I bet this is awesome if you could log in I've checked my PW and user name. Changed my password. Nothing. It's completely useless to me. I'd love if someone would reach out and tell me another way to log in since using the correct user /PW doesn't work
127,Redness13,"July 16, 2019",1,Not a fan of sales force lighting The old sales force was much easier to use and much faster and efficient you could see all of the you needed to see in a glance now there’s 12 different buttons that you have to press to see the information that you need on the fly and the pages take their time to load it’s just not a step in the right direction in my opinion.
128,budmannray,"June 25, 2019",5,Not working App constantly crashes and has to be reset...currently unable for check calendar..which is only reason I use the app.  Works on the iPad but not 7plus.
129,Shambonianator,"October 29, 2019",5,Passin tickets off to other salesforce users Great app. Wish you could assign tickets to other users in the mobile version though. Other than that I love it!
