index,author_name,review_date,reviewer_ratings,review_body
0,Quentin Danvers,"April 9, 2020",2," I would give this app five stars if there was a way to open the app. There is no way to open the app without the involved process of trying to find the PDF file, which is usually buried deep in system folders and difficult to access on some devices that may not have file management software installe...Full ReviewI would give this app five stars if there was a way to open the app. There is no way to open the app without the involved process of trying to find the PDF file, which is usually buried deep in system folders and difficult to access on some devices that may not have file management software installed."
1,reaction shot,"April 16, 2020",2," it's okay. earlier it had a dark background. that was pleasant to the eyes. the bright one now which merges with the document, is not an improvement at all. also, the page number counter on the right is too wide. sometimes the thumb touches it and the pages jump by scores. it's really annoying."
2,Steven Mancera,"April 20, 2020",4," This app is cool and all for viewer. But can we also launch the app itself standalone. And have a PDF / Documents view also. Let us quickly open local PDF files and Documents in the Drive or other locations. And let us have a quick annotations, drawing, text or signature tools, add Google Keep remin...Full ReviewThis app is cool and all for viewer. But can we also launch the app itself standalone. And have a PDF / Documents view also. Let us quickly open local PDF files and Documents in the Drive or other locations. And let us have a quick annotations, drawing, text or signature tools, add Google Keep reminders right on the app's PDF viewer. And saving it right on the PDF itself Merge the PDF viewer UI with the Drive PDF viewer too. Or just disable the Drive PDF viewer itself"
3,Dylan Charlton,"February 14, 2020",3," While rather short on features, this pdf viewer is fast and renders images nicely. It's one of the best I've used. The only reason I don't give it a higher rating is that the scrollbar on the right is too easy to accidentally get with my thumb, sending me to God knows where in the document. I wish g...Full ReviewWhile rather short on features, this pdf viewer is fast and renders images nicely. It's one of the best I've used. The only reason I don't give it a higher rating is that the scrollbar on the right is too easy to accidentally get with my thumb, sending me to God knows where in the document. I wish greatly for an option to switch it to the left of the page."
4,Chad Meyer,"March 16, 2020",3," Works as intended, but why is it I cannot have a simple icon for this app on my homepage? Why is it the only way to access this is to open a .pdf? If I can even find it w/o using a separate (office) app, and then what's the point of using this? Why does this have to be some hidden endemic android sy...Full ReviewWorks as intended, but why is it I cannot have a simple icon for this app on my homepage? Why is it the only way to access this is to open a .pdf? If I can even find it w/o using a separate (office) app, and then what's the point of using this? Why does this have to be some hidden endemic android system app that you have to go digging for? Give me a simple icon that I can put on my homepage. Geez."
5,Jadyn,"February 19, 2020",1," Hi there. I'm having a big problem with this app. I have tried to download it three times, and while it installs, I can't find it anywhere on my phone, nor can I access it from Google Play. I have already restarted my phone, and other apps download and work just fine, so the problem is only with thi...Full ReviewHi there. I'm having a big problem with this app. I have tried to download it three times, and while it installs, I can't find it anywhere on my phone, nor can I access it from Google Play. I have already restarted my phone, and other apps download and work just fine, so the problem is only with this app. Pls let me know if there is anything I can do. Thank you"
6,Hamza Adam,"April 12, 2020",4," It works even though it doesn't open as an app. All you have to do is, go to downloads, then chose the PDF you want to open, then click on it and hold the file then chose Open with, It's gonna give you choices to open it with original pdf reader or Google PDF. Thumbs up"
7,Singlet Fungi,"April 16, 2020",1, Rubbish! I downloaded this for an easy access icon to be put on my homepage and after it was downloaded I saw that there wasn't an icon. I got confused and checked the reviews on this app then learned that this is by design. There is no easy access icon provided. This app is useless.
8,William Henry,"February 28, 2020",1," The scroll feature has page numbers that stick out unreasonably far. As you open documents with more pages, the scroll feature grows in size, making if more likely you're going to accidentally touch it and scroll 30 pages down when you just want to see the rest of the page you're on. Do people besid...Full ReviewThe scroll feature has page numbers that stick out unreasonably far. As you open documents with more pages, the scroll feature grows in size, making if more likely you're going to accidentally touch it and scroll 30 pages down when you just want to see the rest of the page you're on. Do people besides Ned Flanders test these apps?"
9,Gaurav Chhaidy,"April 16, 2020",3, The page scroller should be at left hand side of the screen so that accidental scrolls can be avoided as most people use right hand thumb while reading. The double tap+slide zoom is very annoying. Sometimes when i scroll fast it zooms in/out.
10,Parimala Renga,"February 25, 2020",1," Not well developed, it is just the basic pdf viewer. If you scroll pdf file which has more than 1000 pages, it becomes laggy and it scrolles 50 pages per second!(if you jump page number to page number). Go for wps pdf viewer lite or adobe acrobat reader. This pdf viewer not suited for big pdf files."
11,Abdullah Sh,"February 4, 2020",2," Please please Fix the problem that when I add the pdf file to the home screen I can't open it unless if I go to the file manager. In previous Android 9 I can add it to the home screen, but now in Android 10 O can't. I am using Samsung Galaxy Note 10 with Android 10 and OneUi 2.0 ."
12,Gabriel Inu,"March 21, 2020",1," I tried uninstalling and reinstalling but it keeps going crazy. Whenever I open some file it scrolls down the notification bar, opens the keyboard, then closes, then notifications bar, up and down, zooms on the doc, and I can't even try to read it. Holds true for drive's pdf reader."
13,arun antony,"March 23, 2020",4, Open all pdf files without any issues... no disturbing ads... U can't find this as an app.. just select a pdf file to open the app( remove any set defaults with other apps or go to app setting and set this as a default)... 4 star only bcoz the app is very basic and lacks many functions like recent f...Full ReviewOpen all pdf files without any issues... no disturbing ads... U can't find this as an app.. just select a pdf file to open the app( remove any set defaults with other apps or go to app setting and set this as a default)... 4 star only bcoz the app is very basic and lacks many functions like recent files
14,Anisur Rahman,"April 18, 2020",3, The previous version was good but in this version the page number and the scrolling ball overrides my document makimg it difficult to see. Also when scrolling it is more likely to touch the ball and accidentally scrolling.
15,Steven Yagsemal-Doiel,"April 18, 2020",1, last time i tried to open anything with one of the google readers it wouldn't open said invalid file type. though i do seem to have access to documents on googledrive. somehow those too sometimes say invalid file type or give me some other kind of error.
16,Tim & Janet Williams,"March 22, 2020",1," I downloaded this for my Chromebook. The app can't be found to be opened--no icon on any menu, not even an option to open in Google Play)--and when I doubleclick on a pdf I'd like to view, Chrome is the pdf viewer. Waste of space; uninstalling."
17,Adarsh Agarwal,"February 15, 2020",1," What the flip!!!! This app is completely broken.... Cannot find it anywhere after downloading, I thought there was an error so I re downloaded the app but still the same problem exists. plzz fix it, never expected such a big bug from Google where u can't open an app after downloading it."
18,simonmalva,"March 26, 2020",3," App is good except for the little that I used it, but it does not have marking utilities. I have to open the document with another pdf viewer to hi-light and make notations. let me know if the issue is fixed so I could re-install."
19,swarnabh singh,"April 21, 2020",2, It's awesome but does not load all pages quickly and feels laggy. There should be some marking or highlighting tools which it lacks.
20,Laugh With Sammisam,"April 28, 2020",4, This app is great but there is no option for making annotations to any pdf file and also it is not being set as default app for any pdf file.
21,Edward Espinueva,"April 8, 2020",1, I tried it. But uninstalled it because I don't see the use for it. Chrome views PDFs exactly the same way.
22,Da Nu Tu,"April 4, 2020",1," Stupid app, it doesnt work. it opens and closes after trying to open a document. even the drive pdf viewer doesnt work anymore. i have droid 10 and a Chinese phone"
23,BeauTeyMafia Design's,"April 24, 2020",4, I thought I would be able to open up pdf without downloading a app. But unfortunately I have to use this to upload resumes or read articles saved in this format
24,Muath Mohammad,"February 6, 2020",1," I used to love this app before update, after update the page number keep showing Everytime I touch the screen to flip pages and it is really annoying when you read a small pages book , which it return like before."
25,Cristhian Lora,"April 25, 2020",4, It's very lite. But it can't wrap the text; improve the reading mode
26,Sumit Roy,"April 5, 2020",2, Need flip colours for night reading. A mode in which we can switch the text from black to white and the background from white to black for better eye sight .
27,Husain Chitalwala,"March 22, 2020",5, Absolutely no nonsense app. Does not have an icon in the app drawer. Occupies very less space on the phone. Works flawlessly. Very basic and clean app if you want it for PDFs only.
28,Neil S,"April 4, 2020",3, Good viewer and fast. Why is there not an icon for it? Always good to just open the app and have a recent opened file list. Please add icon to next update
29,Samuele Catuzzi,"February 14, 2020",1," No customisation options are available. pages do not fit the screen, it's a barely basic pdf viewer, reading from a smartphone it's nightmare of pinch to zoom in and out.."
30,Jon DuPont,"March 24, 2020",2, Renders images neatly so I guess I'll give it 2 stars. Features are very lacking and you can only open the app by opening a .PDF which is utterly brainless on the devs part.
31,Ed Sears,"April 26, 2020",1, Can't get it to work! It does not seem to open any pdf documents in email.
32,Harshendra Puwar,"April 13, 2020",3, This application is good but it does not have a pdf translator if it is easier to use
33,Rimamsirufun Paul,"April 19, 2020",3, Light app that's why I give it a 3 star🌟 . Document usually is blury on the app.. And that's a no no for me.
34,Adnan,"April 29, 2020",5, Very good service. Now I can able to read all PDF file's.
35,infiltrater Mole,"March 23, 2020",5," It's everything I been looking for the past 10 year's the best so far , great job developer's. Hope to see more of your apps like this one. God Speed to all."
36,Not Important,"April 28, 2020",3, I can't pull up any of my documents on a website page. I don't know what's up with that either...very frustration!!
37,Radu Bertesteanu,"April 11, 2020",2," At this point I don't even care about app design, I just want to correctly view and edit a pdf document, and it is not possible with this app."
38,Sachin Danushka,"April 23, 2020",5," Super fast and very smooth, but some options are not available"
39,Brajakishor Kanjilal,"February 18, 2020",5," It opens without any lagging & anyone can open any PDF file very easily with the help of this app One more point.....I want to say that, this app works on any Android device"
40,Nick Malone,"March 16, 2020",1," No stars really. It's download, apparently, but nowhere to be seen. Others having same issue I read. Advise save time by downloading something that works!"
41,Sachin Jadhav,"April 4, 2020",5, I was using the Google drive to view PDF from previous two years it consumes too much space of my mobiles now I am using Google PDF viewer
42,Naseem Ahmed,"February 28, 2020",5," I found it very easy and simple to use, it upload and run faster than others. Reviewing and update my comments in future."
43,ekta rathore,"March 19, 2020",5," Its better and i had not that is why ...i installed this app... in this app we found our syllabus or anything. And it is very usable app for humans ...i gave four star for this app because i want gave four star for this app.....i wish u also installed this app because it is very usable for our study...Full ReviewIts better and i had not that is why ...i installed this app... in this app we found our syllabus or anything. And it is very usable app for humans ...i gave four star for this app because i want gave four star for this app.....i wish u also installed this app because it is very usable for our study neccesarry ,so pdf is the good app and it can more install. Thank u so mich for give this app at play store.i hope it have complate"
44,Claire Clark,"April 12, 2020",3, Google PDF Viewer 3 stars because it's not customer friendly. There is no icon and it is difficult to see pdf's I will uninstall
45,Jonah Emerson,"April 30, 2020",5, Just a small PDF Viewer with no GUI. Exactly what I wanted!
46,Stephen,"February 2, 2020",2," Won't associate with PDF even after reinstall. Clicking on pdf files triggers ""can't open file"" error on Android pixel 1 running latest software"
47,Yogesh Bavishi,"February 26, 2020",5," Good, fast, but Please provide option for selecting from content list...so that I can navigate to a topic easily."
48,Sonu H,"February 16, 2020",5," Versatile pdf app for view. Download pdf doc and the app auto opens the doc. Clear reading options, easy scroll. Catch words with dictionary or simply move on."
49,Günter Zöchbauer,"March 7, 2020",2, Extremey limited functionality. Opens all PDFs and can't be configured to have orher apps being used for opening downloaded PDFs - so I had to uninstall it.
50,Sherwin Castro,"April 24, 2020",2, Can not open some pdf. Would have been a nice reader for low memory units
51,Radical Teletubby,"April 18, 2020",5, Please allow to change the default white color of the page in PDFs.
52,Mukesh Kumar,"March 6, 2020",3, Problem in app of this is not open any file full screen always small size open not fit screen before I opened any file fit to screen but 2nd time installed it problem in app I don't know how. Plz solve problems. Thanks
53,Gary R.,"March 13, 2020",2," Actually really a one star but don't do one star reviews no more, too much criticism, not good, and because there isn't an app called Google pdf viewer looking for it on my Note 8. Why is it one of options to open pdf's docs?"
54,Suhas Dhole,"March 21, 2020",5," Need forced dark theme, all PDFs has white background and black text. When we read any pdf in night our eye is paining, so make it invert to black bg and white text."
55,Sey Gian,"February 10, 2020",4, Works good but it works in the background and I don't have access to an icon so I can open it when I want.
56,Sifat Al Islam,"February 25, 2020",5, Best for viewing PDF.It has no icon in menu . But it works automatically when you want to view a PDF file.
57,Josh Richards,"March 13, 2020",1," App is literally non functioning. Downloaded and installed multiple times, but never actually shows up in my apps or anywhere on my phone. Don't waste your time."
58,Vinod Bhingardive,"March 19, 2020",4," Nice app, it not shows any app icon in your mobile, but when you open any pdf file, file will directly open with google pdf viewer."
59,Hitesh Sharma,"April 22, 2020",4, This is the best pdf viewer because It takes less storage and responces fast but they can add some more function like of zip files etc
60,Aniruddha Salvankar,"February 3, 2020",3, Crashes on opening PDF file offline or online please fix this problem and make it work like Adobe Acrobat which can also work offline to open pdf
61,Amanda McDaniel,"February 4, 2020",3, It used to work just fine. I havnt been able to download anything all day. Please fix
62,samantha mosedale,"April 3, 2020",5," Really amazing service and support, easy to use."
63,Shreyans Raghu,"April 9, 2020",1," No underline option, highlight option, etc etc... What is this , seriously ? Bad ."
64,Mayur Dafare,"April 19, 2020",1," No dark mode, no option for open this app.. Its externally download app but feature was zero.. U need to put inbuilt android or update all feature.."
65,Sienna Sway,"March 14, 2020",2," + Lightweight - Made by Google (lame design, lack of privacy, etc.) - Not as accurate renderning as Adobe"
66,Pablo Cieri,"March 25, 2020",1, an app that don't open all the pdf and not recognized by Android as a pdf viewer. Well done devs!
67,arkham skunk,"April 1, 2020",1, Could not start the app. No shortcut was created would just get stuck it a loop on Google Play press the open button goes back to a install option?
68,Dilip Sharma,"April 18, 2020",2," My what'sapp is dual ,nd it is not supporting the doc ,from the dual one it's notifying that u don't have proper app to open the file"
69,Vipin Kumar,"April 15, 2020",2," There's no option to highlight anything, features are less. Could be better"
70,Ayush Kumar,"March 3, 2020",1," Ihave to reboot for each new pdf""This document is not a valid PDF file"""
71,Patrick Gdovic,"March 23, 2020",1, Fails to open home screen shortcuts of pdf's. Opens to a black screen and immediately closes itself.
72,Focaz Locaz,"March 24, 2020",1, So i got this app for some work and i was very confused THERE WAS NO APP? Nothing not even an open option on google play plus it doesnt even give me a opportunity to choose to open a pdf on this app . Useless
73,d j,"February 19, 2020",1," Junk. Installed it more than once. Nowhere to easily execute it. Under the app store it says ""open"" = nada."
74,Muhammad Rizky,"March 23, 2020",5, AMMMAAZIING. This is the lightweight pdf reader ever. I can read my comic with short time loading
75,Dávid Somogyi,"February 18, 2020",1," Crashes immediately on OnePlus 7T. So, keep fixin' 'em bugs."
76,Ghazwan Fallouh,"March 22, 2020",1," It can not open many PDF files , but the other apps are able to open the same files , I delete it ."
77,Nishant maheshwari,"March 10, 2020",3," Plz include feature "" go to page "" to directly go to any page no. in big pdf files"
78,Manoj Venkat,"April 19, 2020",5, It is a good so for viewing PDF files on Android.
79,Space Kido,"January 15, 2020",5," Very very practical and light, so I recommend it to anyone looking for a simple PDF opener, especially for older devices."
80,David Hepworth,"February 18, 2020",4, Works well but I wish I could open the app by itself then view a list of PDFs available to open
81,Scott Pennington,"April 23, 2020",3, You got to Hazard app PBS app reader it's one of the best I've had no problem since I downloaded it can I can beat everything I give it three stars May 4th
82,Laurentiu Gavrea,"February 16, 2020",2," any file I try open, gives me PDF invalid format error. Curiously randomly I could open them properly..."
83,Abhijit Markande,"February 21, 2020",3," Kindly add the feature to see ""table of contents"" or ""outline"" for pdf files Eagerly waiting for the update"
84,David Tabing Jr.,"March 19, 2020",4," Simple app, still hoping to have a dark mode (inverted whites to black when viewing pages.)"
85,Bong Black,"February 13, 2020",5," Want to let everyone know that a Google PDF Viewer, easy-to-use program works well"
86,Akash Kachhaway,"February 15, 2020",4, Its simple and useful app. Gets the job done without any issues.
87,Friendly Neighbourhood Muslim,"April 20, 2020",2, No way to open the app itself. You have to find the pdf and open it to use the app
88,VenuGopal Reddy Yeredla,"March 19, 2020",5, Excellent app for opening PDFs. Dark mode appreciated.
89,It'sTeamPhantom,"March 8, 2020",2," Continues crashing on my Galaxy s20+ , can't use the app at all plus the drive version of it."
90,Md. Sumon Prodhan,"March 23, 2020",5, Excellent....sometimes it doesn't show file and took long to show
91,Asish Panda,"March 12, 2020",1, Worst update ever. Keeps automatically zooming in and out when trying to scroll down. 👎👎👎
92,David Hernandez,"February 2, 2020",5, Great app for people who don't have alot of storage.
93,Mahmood R,"January 31, 2020",5," i think it would be very useful if it be more powerful like other apps of google like google sheet, google doc & ... more editable tools to mark, comment, add pic, ..."
94,Anthony,"March 25, 2020",1, Won't open pdfs from chrome. They just come up blank.
95,Donnell Brooks,"March 18, 2020",5," The experience is a grand joy. I love the service that the app gives, and I won't change it for anything else."
96,Rkb Rkb,"April 5, 2020",5," Best in class , feature loaded, and efficient"
97,Prakhyat Kumar,"April 16, 2020",3, I m not able to find words in pdf .why?😤😤
98,Arsalan khan,"April 14, 2020",5, This is very intelligent. Beautiful and good thanks. Download the app and play it.
99,Ganesh Nagal,"January 13, 2020",5, Sort memory space is require for this that is best and pdf viewer is also good . I like it with further addition of option in sort memory space.
100,Zaid chaudhary,"March 8, 2020",5," Please add in next update, Home shortcut option for different pdfs."
101,Sujata Roy,"April 8, 2020",5, It was so good. I like it I love Google pdf viewer
102,ajay kumar singh,"April 29, 2020",4, Its seems quite very good and very easy to operate and deal with.
103,Mahin Mahin,"March 3, 2020",5, Great. Only one great PDF reader in the play store.
104,Safah Ahmed,"March 27, 2020",5, Best PDF viewer I have ever used. Keep up the good work 👌👍👌😀😀
105,aakash bishnoi,"February 18, 2020",4, Good but need a Google pdf editor app . Which we can edit pdf according to our choice.
106,Ngakan Günawan,"March 18, 2020",5," Very helpful, clean interface and easy to use"
107,Kieran Scully,"April 9, 2020",1," Rubbish, takes default and can't read files, stops you looking for the correct App."
108,Abhijeet Dhale,"March 31, 2020",5, Very useful !...easy to use and smooth graphics
109,Md Ziyaul Mustafa,"March 10, 2020",1, Google PDF viewer app not open my device.3 time download and try but not open.
110,tim scott,"April 2, 2020",3," Can't find it unless I use Google files then open the document, would be best to have an icon."
111,Dawat e Fikr,"April 6, 2020",1," not showing and working after installation, only show uninstall button"
112,Lou M,"March 4, 2020",5, AWESOME !!! unobtrusive does its job & NO ADS !!! thx google...
113,Vanktesha Tripathi,"March 28, 2020",5, Best app in work and useful for speedy opening pdf file.
114,Biv K,"March 12, 2020",1, As it zoom in and out by one finger it not convenient to use as always it get gets zoomed while scrolling
115,Asad Ur Rehman,"February 12, 2020",2, Not working in Realme XT Android 10..pdf is not opening..but opening in google Drive PDF viewer
116,Yash Patel,"March 28, 2020",5, Best for open PDF file only this will not facilitate of editing them
117,Swati Bhise,"April 4, 2020",1, After downloading this app I can't open this there is no option of open caption next to uninstall
118,wrap freekzz,"February 8, 2020",5, It's very nice no adds no bugs I using upto some 1 or 2 month it's very good
119,Archangel Azrael,"April 12, 2020",1, Nothing shows up. It's kinda useless if it doesn't even work.
120,SHREEJITA MUKHERJEE,"March 5, 2020",1, I cant find it anywhere in my phone even i cant find the option of opening the downloaded application from the play store as well. And so it is not of use at all. Very much confused about this app
121,Bernie Fortes,"March 22, 2020",1, I hate this app. When a open a pdf it can't open. I donnot recommend this app.
122,Khalil Liggins,"February 4, 2020",5, Lovely app so incredible but hen I look it up in my apps and games it doesnt shw up so how am i supposed to open my pdf
123,Muhammad Khan,"March 10, 2020",5, It is simpe versatile and above all has simple interface
124,Himanshu Gautam,"April 30, 2020",5, This is not bad it is very attractive way to click the photo clear
125,ꀯ,"January 30, 2020",5," Simple and good. No BS, ads, spyware unlike third party apps."
126,George Tzikas,"February 26, 2020",1, Crashes upon opening PDFs on Android 10. SM-G975F
127,Anis Momin,"March 21, 2020",5, Google PDF viewer is Best . Google Please Add the Translation Feature in this Apk. Thank you @
128,Muhammadh Fahadh,"March 8, 2020",5, Simple yet best reader with only little space needed for this...
129,Dweep Parekh,"April 24, 2020",5, Very good app and also doesnt take much space
130,Hasanveer Singh Nagra,"April 26, 2020",5, This app is very usefull to see PDF files.
131,Nawaz Mullani,"January 10, 2020",4, One of the best app from Google to open PDF file .The app contain simply view & Management facilities .
132,D O,"January 22, 2020",5," Wow now you can edit, highlight ,add, remove pages, photos in PDF."
133,Sayantan Sarkar,"April 6, 2020",5, Nice basic pdf viewer for daily use.
134,SANDEEP PODDAR,"April 24, 2020",3, It takes time to clear after zooming
135,Lance Ponciano,"April 14, 2020",5," Love it. So simple, no icon."
136,Virat Raman,"April 2, 2020",5, Very very very very good because it don't use net
