index,author_name,review_date,reviewer_ratings,review_body
952,Irfan Ahmed,"June 1, 2019",5, best pdf reader i have ever used. thanks
953,Vikram Kamlakar,"November 1, 2019",3," The App size is 4 MB, but after install it shows 15 MB? Also not able to clear chache as the app was not shown on installed app/app page..."
954,C.V. Rajendra,"February 13, 2019",1, Keeps crashing the moment I open any pdf.
955,Yash Pawar,"September 13, 2019",5, Nice app and size is small best for small storage phones
956,Rana Karmakar,"October 19, 2019",5, I think it's a best pdf reader application.......
957,A Google user,"December 11, 2018",2, It not opening some PDF file it lateing to open
958,CloudyTea,"April 17, 2019",5, To the people who said they couldn't find the app: it's supposed to do that go to your file and click on it and boom if you want to delete it go to the app store delete it people nowadays the smh IT'S A GREAT APP Y'ALL
959,Dhirendra Kr Sinha,"January 25, 2020",1," It is not recognising the file format, though it's opening."
960,Jeevan Mohrir,"March 24, 2020",1, Not working on samsung s9
961,Himadri Lahiri,"April 22, 2020",4, Good pictures showing
962,Sahil Malik,"April 29, 2020",5, Its really better app for PDF viewer
963,Abhineet Samant,"April 2, 2019",1," fake app... even after installing, nowhere visible for opening on screen"
964,Mark Chang,"December 27, 2018",1, fails occasionally. meaning no loading
965,Narciso Datangel,"January 12, 2019",5, amazing and fantastic pdf reader!!!
966,Sarita Niroula Dahal,"November 4, 2018",2, Google should try making this app a little better by adding editing features. Google can also put this app as a system app in upcoming OS
967,Aditya Raj,"December 4, 2018",5," Please add support to"" .epub"" format"
968,Syed Dilnawaz Hussain,"September 18, 2018",5, Not very well it is not working better & not convert big size of files.
969,Aman jagotra,"July 27, 2019",5, Best pdf viewer. Smooth and light
970,Up And Over,"March 9, 2019",5, This app is awesome for reading PDFs.
971,Sabari Sanal,"April 16, 2019",5, Simple and Efficient for low end devices.
972,Shashank Prakash,"January 17, 2019",5, Amazing app. it doesnt show in homescreen or appscreen.
973,Dev Joshi,"June 5, 2019",1, very bad orientation of Pages...Cant see the photos clearly
974,tintu joy,"August 2, 2019",4, one hundred percent better than adobe reader in fluidity
975,Aravindan,"August 13, 2019",1, looking for PDF text copy to translate in native language
976,Natarajan Rangasamy,"November 20, 2019",5, Nice to refer pdf files and documents
977,Satyam Gupta,"April 30, 2020",1, Not opening any thing
978,A Google user,"November 19, 2018",5, I need a strong PDF that can edit text at the same time
979,Ahmad Ali Fahmi,"August 1, 2019",1, cannot open pdf created using imagemagick (convert) from linux.
980,Mridul Saini,"March 24, 2020",2, Lags too much when opening Big file
981,Sanjida Hossain,"April 7, 2020",1, I hate it its not even working . i tried but no its of no use. Please make to update this please
982,A Google user,"December 26, 2018",5, a very good pdf viewer..easy to use..
983,Aishah Bi,"October 27, 2019",5, Amazing app. Easy use for viewing files on.
984,manu27rd PSN,"November 4, 2019",1, I dont know why it takes extra space which you can't see in the storage info
985,Anthony Davies,"November 28, 2019",1, Had to download to open an attachment and it don't work so uninstalled
986,Sanju,"February 29, 2020",5, Awesome app ... As we know that it was an google app so it is good
987,NAVIN KUMAR,"February 29, 2020",5, Good app excellent working
988,Luphoko Banele,"April 26, 2019",5, it's working just fine and it's not give me any problem or challenge
989,Monish Devadiga,"October 10, 2018",2," Can't jump to pages , we have to scroll down"
990,Manoj Mandal,"August 3, 2019",1, First page remain black more than 3 -4 minute always..
991,Rishang Asmadi,"September 28, 2019",2," Hello, this can't redirect me from content menu to selected hyperlink"
992,Kafeel Ahmad,"October 13, 2019",1, not working. pdf can't open.
993,Matthew Campos,"December 31, 2019",1, Can't find app to open? Installed Google docs now
994,All About BGM,"November 17, 2018",5, It's nice very fast and smooth reading
995,Bismillahir Rahmanir Rahim 786,"March 12, 2019",1, page error show... same prmblem in drive also... this is google so bad app ever in android history???????
996,A Google user,"November 3, 2018",5, Very useful and compact. Love it.
997,Ananda Roy,"May 3, 2019",1," After download, no icon or way to access the app. Weird."
998,Gabriel A,"September 10, 2019",5, Easy to use and compatible to almost anything
999,farith bismi,"January 31, 2020",1, My Mobile model is samsung A2 core i could not use it the Google PDF Reader
1000,Miguel Aranda,"March 27, 2020",5," I always wanted to get me a Motorola Moto cellphone & it works ""Divine""."
1001,Jeff Bell,"April 21, 2020",1, Cannot get my e statements from my bank to read. BS
1002,Ken M3ng,"March 18, 2019",3, please add single page landscape view option.
1003,Lynette,"April 6, 2019",1," Could not access this app anywhere on my phone after I downloaded it. Only thing I could could do was uninstall it, so i did."
1004,Saikat Kumar Kanta,"December 10, 2018",1, Can't open pdf from storage manager.
1005,aleksazr,"April 14, 2019",4," Zooming is slow, otherwise is good."
1006,Mr Booshit,"April 16, 2020",1, Does not function on android 10
1007,Nkosi Figueroa,"April 23, 2020",5, Pretty fast and work well
1008,Soumyaranjan Mishra,"February 14, 2019",5, It is just a nice and cool app and suitable for my work each and every time.
1009,Arjun Singh,"April 7, 2020",1, We cann't take a long screen shot on this app So u r requsted to give h new update for long screen shot
1010,Rathish R,"February 17, 2019",4, automatically zoomin and zoomout. totally malfunction in honor 9n
1011,Kshitij Raj,"December 11, 2018",5, Useful.less storage need .but need ui improvement
1012,Gaming TeChy,"December 24, 2018",5, best pdf reader only google can make best apps for every os
1013,A Google user,"December 4, 2018",1," Very bad can't open it after downloading it shows only uninstall icon, I hate it"
1014,Innocent Lucky,"June 2, 2019",1," despite i have downloaded the app , but it could not be found anywhere in my phone! i don't know what is wronged!"
1015,Pranabandhu Soren,"July 15, 2019",5, great pdf viewer.search option is available.
1016,adam keller,"October 16, 2019",5, Very good app and smaller then Adobe Acrobat reader
1017,Zikra Mir,"April 22, 2020",1, Just annoying hateful app😠😠😠 i dont know what's the problem when i installed the app it didn't appeared in my phone justt......hateful😠😠
1018,A Google user,"January 11, 2019",5, I think one of the best pdf file viewing app.
1019,Gucci Gang,"March 3, 2019",1," after downloading the pdf, it can't be opened.idk y"
1020,Value Trade,"April 23, 2019",1, I am unable to open pdf files received through WhatsApp.
1021,Sri Harsha Arangi,"June 9, 2019",4, Have option to search for PDFs please!
1022,jalwa Creation,"July 11, 2019",5, good app this app coverd less space and perform maximum of work
1023,Fazal Naeem,"August 5, 2019",2, app is not working in samsung Galaxy A30 Fix issue
1024,Alfred Vishnevsky,"December 21, 2019",5, Does what it should. Nice and simple!
1025,Paras Mandal,"February 4, 2020",2," Where is the dark mode????? It was there before, but it ain't now!!!!!"
1026,manish kumar,"February 2, 2020",1, Very very Bad app. Frustrating me.
1027,Rishi Kumar,"May 25, 2019",5, best app for opening pdf files at easy steps
1028,Okan Kaya,"November 3, 2018",2, I wanted to it to hide bottom navigation bar home/back button etc but it doesn't hide them on landscape mode.
1029,Ming Tai Tan,"April 4, 2019",5," Fuss free, and well integrated."
1030,KAMRAN Ahmeddd,"April 18, 2019",5, Awesome app Ad free and easy to use i love it
1031,Swarniket Gupta,"May 29, 2019",3, it does not load pages quickly or realtime
1032,Samkit Samsukha,"August 31, 2019",5, Its too good but some more elaborate features would enable good reviews
1033,H. D,"September 6, 2019",1," Its worse,it just gets vanished in a thin air as if it was never installed"
1034,Kranti Rani,"April 6, 2020",3, Good app for documents
1035,Vedant Mohan Goyal,"September 24, 2019",5, Light weight pdf..reader easy to use..simple..
1036,A.K. Verma,"November 10, 2018",5," Good , clear view of pdf files."
1037,Matthew ..,"January 8, 2019",1, Simply wouldn't open. Deleted and reinstalled and still would not open.
1038,Harsh Vardhan,"April 26, 2019",5, awesome app very helpful for opening pdf files
1039,Mevada Dhrumil,"April 20, 2019",3, Please Make this app visible on devices as we are downloading this app we expect this app to be appeared on device because inbuilt pdf viewers are already available in our devices.
1040,Mathew Zavos,"November 11, 2019",5, The best PDF reader for android
1041,Karan Bhadoriya,"November 26, 2019",5, Very nice . And easy to use
1042,Idawatirozita Khalid,"December 12, 2018",5, Thanks! Google PDF Viewer..
1043,Wahid Ahmed,"November 4, 2018",5, As expected it easily opens every pdf file
1044,Secret Architect,"July 15, 2019",1, Prompted to download this app to view an attachment but the attachment atill doesn't open. Complete waste of time.
1045,Tabassum Khanam,"July 10, 2019",1, I have Installed it... but it's not working in my mbl.... It's just useless.
1046,John Smith,"January 11, 2020",1, No contents table. Is that a joke?
1047,Sunita Singh Yadav,"February 17, 2020",1, After downloading app icon is found no where
1048,Carlene Neels,"November 3, 2018",1," Tried to download a documentary t was told I needed pdf to open. Used the suggested file plus several others, was not able to open."
1049,Paul,"April 18, 2019",1, installed to view a pdf restaurant menu and failed. epic fail google
1050,Lucie Lucianora,"January 4, 2019",1," can't open because can't find the app on my phone once installed ! that's a little problem, isn't it ?"
1051,A Google user,"January 19, 2019",1, SLOW to load pdf.very annoying when zooming
1052,Bhaskar singh,"September 10, 2019",5, Where to download Adobe reader when you have Google PDF viewer with stability
1053,Balki Ramesh 9842237854,"November 27, 2019",5, I am not able download pdf file. Kindly help
1054,Mujib Khan,"February 7, 2020",5, It's an amazing application
1055,LittlemanBryce YT,"February 2, 2019",3," Guys, this app only luanches if you open a pdf in an app. Thats why you can't open it."
1056,Go Vegan,"January 13, 2019",4, would be great if you gavw us the option to switch through the pages sideways like a book
1057,***,"July 1, 2019",1," i don't know why a company like google dosen't make a proper pdf reader, which remember where we are on the pdf"
1058,STuDy KiLaA,"February 22, 2020",1, Please Give Me Pdf Crater With Best Function
1059,PANDUKA ATHAWUDHA,"April 19, 2020",5, Best & Nice app
1060,A Google user,"January 15, 2019",5, It's a good application & easy to use.
1061,Manoj Kumar,"July 22, 2019",5, it is very good condition application for pdf
1062,Jean Bosco Ndayishimiye,"August 23, 2019",5, This app does very well. I would recommend it to everyone since it is so lightweight.
1063,Lalan kumar shaw,"November 20, 2019",5, Best and quickest service.
1064,Naba kr. Saha,"January 26, 2020",3, Good very helpful app
1065,Shiv Kumar,"March 31, 2020",5, Oppo mobile not work this app
1066,L G,"March 29, 2019",1," Wouldn't even open the document that I downloaded it for, which was a PDF file. Uninstalled"
1067,Raj Kishor Panjiyara,"October 2, 2018",5," Adds free, good pdf viewers."
1068,Mr. Mike,"June 25, 2019",1, can't simply open a pdf from my phone.
1069,MrDaBootz,"July 25, 2019",1, like the reviews say... installed then nowhere to be found. tried uninstalling and reinstalling but nope... nice one google
1070,VIJAY SHUKLA,"October 18, 2019",1, Very bad experience with PDF viewer
1071,Cindy Austin,"November 3, 2019",5, Have to have it my phone didnt need it at first caz it opened them. But then it wasnt compadible and i needed an app 2 read my documents.
1072,Joseph Kuttikkadan,"October 31, 2019",1," Very very useless app , very bad Google PDF VIEWER GO TO HELL"
1073,JASRAM MEENA,"April 2, 2020",4, Good and lite pdf viewer
1074,A Google user,"March 22, 2019",5, this is a best app for print pdf and see pdf.☺☺☺☺☺☺
1075,A Google user,"October 6, 2018",3, It's a easy way to get PDF viewer
1076,Pete Lie,"October 12, 2018",1, Useless app as it cannot open an PDF files
1077,anugrah Kp,"January 2, 2019",5, small and portable app and functional does its job well
1078,Alexsandro Simão,"October 15, 2019",5, Excellent application for read PDF.
1079,S. D.,"December 13, 2019",5, Loads faster and smoothly
1080,Dancan Kariuki theuri,"April 11, 2020",5, Ne ghethori kana machest Ati no kengori ana mavest(manfest..
1081,amgad adly,"March 13, 2019",1," it doesn't work .. when i open it , it open the app on google play and select uninstall"
1082,Mohammad Ilyas Soomro,"May 10, 2019",4, No adds. Minimum view options.
1083,aakash. Ingal,"November 2, 2019",2, When copy paste on Google translate it doesn't translate properly 😤😤
1084,Jean Baldie,"November 2, 2019",5," Easy to navigate, down load and install whatever Iwant"
1085,Roman Mondol,"February 24, 2020",5, Best PDF file reader app
1086,Jayavelu C Reddy,"November 19, 2018",2, Unable to view e mail PDF attachment file
1087,Rj Gondaliya,"January 2, 2019",5, I love it.... working awesome.... with any types of files......
1088,niloofar torab,"November 27, 2018",4," It lacks only one thing and it's ""go to page...""."
1089,Anmol Setia,"August 12, 2019",3, I think Adobe acrobat reader is better.
1090,surjit Singh,"October 3, 2019",5, Good very Good pdf work is good very helpfull app
1091,Daniel Hill,"October 5, 2019",1," Would be nice if it was an app, not an invisible service."
1092,Praveen,"November 13, 2019",1, Doesn't open any PDF
1093,jaydev vala,"January 12, 2020",5, Good app..use it without any disturbance
1094,a kumar,"September 8, 2019",1, Not working shows error unfortunately google pdf viewer is stoped
1095,A Google user,"December 6, 2018",5, I enjoyed this PDF it's really works
1096,A Google user,"February 26, 2019",5, Very awesome. Easy to use. Useful app
1097,Aaron Secor,"April 28, 2020",1, Needs to be combined with Google docs
1098,A Google user,"November 16, 2018",3, It's useful for use also about memory it's around 3 megabytes
1099,A Google user,"October 28, 2018",1," I hate,to slow it nearly too a full hour till it finished loading"
1100,#1st !!!,"August 21, 2019",5, Excellent results in less storage consuming
1101,Moufique Ahmad,"October 28, 2019",5, The Best application! My suggestion would be best for all Try #it
1102,Robert Paul Bergsman,"December 4, 2018",1, App can not be moved to external SD memory
1103,Sarika Sivan,"September 5, 2019",5, There are no ads so it is very fast
1104,ashok saha,"October 15, 2019",1, Whats wrong with this app? I downloaded it several time but i cant open it.please fix it.
1105,Mahendra Nahak,"January 23, 2020",5, The simplest pdf reader ever.
1106,It's Me Hey Dude,"May 1, 2019",1, can't open my PDF file!!!!!
1107,Nitin Choudhary,"April 8, 2019",5, This viewer is best in such a small size.
1108,mangesh more,"January 18, 2019",5, simple and work fine..no ads....
1109,Shakiddar Real,"July 23, 2019",5, this is the best pdf viewer for it's megabyte size
1110,Fist Gaming,"September 21, 2019",3, Very bad app cant open many files download any other pdf viewer please
1111,mahesh kumar,"April 5, 2019",5, easy and fast to use with google security
1112,Alokh Venu,"June 6, 2019",5, its simple and wonderful. thank you.
1113,TC Neptune,"June 12, 2019",3," Give it a try lightweight, reliable and genuine. Recommended to you all."
1114,Ciaran Reid,"July 1, 2019",1," Had to uninstall, no option to open it, just uninstall. not compatible with my Samsung Galaxy s7"
1115,KHUSHPAL AAPKA APNA,"February 28, 2020",5, Amazing pdf viewer app.
1116,Earthling Earthling,"April 11, 2019",5, Great small app for pdf. :)
1117,Lorna Rivera,"April 3, 2019",1, I need this to open a document I have installed it twice with one uninstall and it still doesn't give me the little box open so that I can use it. this app sucks big.
1118,A Google user,"November 15, 2018",5, It is easy to use & best app for pdf
1119,Mohan Y,"August 8, 2019",1, files are not opening properly taking time.
1120,সদা সিঙ্গেল সৈকত,"October 13, 2019",1, I can't access this app . After installing this app i only find the uninstall option not open option
1121,Leo Narayanan,"December 11, 2019",1, All PDFs not opening
1122,Sammy Oakley,"December 31, 2019",1, pointless as still couldnt see what I was opening in my email
1123,Yosef eE.,"April 15, 2020",2, it doesnt support text reflow
1124,Roman Gluhov,"April 26, 2020",5, As all the Google products this one is a good one.
1125,A Google user,"December 23, 2018",4," please make the app to go full screen on landscape mode, by making the lower task bar go."
1126,Jabin C,"October 16, 2018",5, Good pdf viewer with minimal size
1127,Lim Jun Hong,"February 27, 2019",5, An essential app for every phone!
1128,Jerome Uy,"June 11, 2019",1, Crashes a lot on my PixelXL.
1129,Php Developer,"January 26, 2020",3, Please add the casting feature in the app.
1130,ANKIT CHAKRAVARTY,"April 26, 2020",5, Big biggest and beautiful app
1131,A Google user,"February 26, 2019",1," app says installed on S8 but is not visible anywhere on the divice, same as a few others down below."
1132,Johnson Cabral,"April 13, 2019",1, not read all kinds of PDF format
1133,Naveen Cozmo,"January 12, 2019",5, super pdf reader. ......... loved it..
1134,Deepak Kumar,"June 20, 2019",4, its good. but sometime its not working.
1135,Dipendra Raj Singh,"April 5, 2019",5," light but does the job , we need pdf reader to read pdf , so it does the jo with very less space"
1136,daniel son,"July 21, 2019",5, Excellent app very good to use Thank you very much
1137,suman sharma,"November 6, 2019",5, Nic apps and this apps working very fast
1138,Ali Mushtaq,"November 22, 2019",5, A good app & easy to use
1139,A Google user,"February 5, 2019",4," Excellent recalling of documents allows you to learn at the same time as speaking to friends oversees if you are a serious learner of how the younger generation actually learn to speak and understand to learn the art of inflections in the local peasant words to emphasise letters in a sad,mourning or...Full ReviewExcellent recalling of documents allows you to learn at the same time as speaking to friends oversees if you are a serious learner of how the younger generation actually learn to speak and understand to learn the art of inflections in the local peasant words to emphasise letters in a sad,mourning or sulky mood. If you really care about your close friends that you have got. All Greek students in Greece have to attend a mandatory Greek class as well as English the way the English speak inclusive of"
1140,Henry Kurniawan,"September 26, 2018",3, Useful for reading my old pdf files
1141,GrowAgriTech,"March 23, 2019",1, Motorola one power not support this app pdf open black screen show
1142,Andrea Vallejo,"June 10, 2019",5, doesnt show up as app but as a download. works perfectly though.
1143,Bharat Gaur,"August 22, 2019",5, Fully loaded with the features great app
1144,Victor Koshka,"September 25, 2019",1, Fails . Does not recognise pdf downloads
1145,vb tech,"October 5, 2019",5, Very nice pdf reader excellent service
1146,Rahul Nambiar,"January 7, 2020",1, Doesn't work the application doesn't appear on desktop
1147,Tsukiyomaru Zero,"December 14, 2018",3, It's very basic and requires a file viewer to function
1148,Hayyan Ad Say,"December 2, 2018",1, This app is not work on my phone.. I don't know what is the problem..
1149,Dania Saeed,"June 16, 2019",4, i use it for reading pdf docs.
1150,Steven Blake,"March 19, 2020",5, Best pdf viewer in the world !
1151,Subhajit Das,"May 18, 2019",5, Very good app for viewing PDF files
1152,Ashish Upadhyay,"October 21, 2019",5, Excellent.. No bug... no.. problem Very lite
1153,NK,"November 15, 2019",5, Add free ! Just want I wanted. Was sick of WPS !
1154,Aleksandar Kanchev,"October 3, 2018",5, Viewing PDFs fast and smooth
1155,Kashi Bhattarai,"March 23, 2019",5, good app has a very fast and effective view
1156,chris t,"November 1, 2019",2, Can't print as PDF anymore
1157,Quaiser Perwez,"April 17, 2020",5, One of the best app of pdf viewer
1158,Kacper Wozniak,"November 23, 2018",3, Very very basic pdf viewer.
1159,Joydeep Saha,"October 28, 2018",3, At least make a difference between google and drive pdf viewer
1160,Subhendu Patra,"June 22, 2019",1, not open some pdf file. update it
1161,Satyajit Biswas,"July 3, 2019",2, need improvement like pro pdf...
1162,Nalubega Dianah,"March 25, 2020",5, Keep it up with the good work and service s
1163,विजय कुमार चतुर्वेदी,"April 17, 2020",5, Nice pdf viewer
1164,John Noshi,"April 21, 2019",1, stupid stupid app. can't even find it even it even after installing!
1165,A Google user,"March 20, 2019",5," Just works, no annoying ads!"
1166,Richie Mac,"July 20, 2019",1, This would not show up on the tablet at all. Google says it's installed but I fail to see it.
1167,Auper Bhadra,"August 31, 2019",4, Good and light size app for pdf
1168,MIR HOSSAIN,"December 6, 2019",1, This application work very slowly.
1169,Disha hemani,"December 23, 2019",2," The app doesnt work, not happy with the results"
1170,selamet riyadi,"January 31, 2020",5, Good app. Thanks
1171,Joseph Hayek,"April 21, 2019",5," Best PDF reader, I next to Adobe"
1172,A Google user,"February 4, 2019",4, Its the best in terms of office documentation
1173,Diah Maryana Handayani,"July 17, 2019",1, It's always error & crashed please fix it
1174,NILAY PATEL'S NEET TONIC,"August 27, 2019",5, Betterly load .file extension than adobe
1175,BENA'H FOOTBALL HD FOOTBALL,"December 18, 2019",3, Its not working maybe its my phone But i am using Samsung galaxy note 9
1176,Mokgerere Wilson,"April 30, 2020",4, Hopefull it will be friendly user
1177,A Google user,"December 7, 2018",1, This app stopped working after I upgraded my phone to android pie
1178,A Google user,"October 6, 2018",5, Very use full and easy to use
1179,Padmanabh K,"July 18, 2019",1, Wouldn't open on my Samsung Galaxy A2 0. Doesn't work with Samsung UI probably
1180,Andrew Perotti,"September 21, 2019",1," Doesnt work, it opens it's app info when I select it in the app drawer"
1181,Uday Naik,"January 1, 2020",5, Best pdf viewing option
1182,Dha Ra,"October 5, 2018",5, Simple and user friendly
1183,Shadman Sakib,"February 8, 2020",1, Fix the bug 👎
1184,Jayalakshmi Suganthan,"January 3, 2020",1, Not opening the pdf file downloaded from Chennai corporation website.
1185,Gregor Vir,"January 13, 2020",1, Instead as advertised size of 4MB it was more than 10MB
1186,Jahanzaib Khan,"May 19, 2019",5, please add all features of S Note and S Memo to create beautiful pdf files on any smartphone like on samsung.please.
1187,santosh jadhav,"January 5, 2019",5," Excellent, Good Good app for all users Thanks-very good"
1188,Akhlash,"August 8, 2019",5, The best pdf viewer with small package 💟👍
1189,Ashvini Hegde,"June 13, 2019",1," the app got downloaded but I couldn't open it at all, in fact the app wasn't showing in my menu at all."
1190,Dan Guersla Morales,"July 26, 2019",5, ineed to Help to all Files inportant.account is Secure in Shelds.to Protect.in need to Auotomatect to online storage.
1191,Pandey ji,"September 24, 2019",1, Very very slow in loading document
1192,Rajan Kumar,"October 24, 2019",3, It's veri good but it's no show on home page.plese development .
1193,Karthik Bhat,"October 26, 2019",1, Not opening pdf.. giving error
1194,Shivani Deswal,"November 19, 2019",5, This is nice application its help alot in my collage work 😊
1195,Janette Clayton,"May 15, 2019",4," good,but small on mysmart ph,not easy to see to read.😯"
1196,Claudy Go,"January 21, 2019",5, Barely use it. But it's handy when needed.
1197,Ankit Kumar,"December 19, 2018",5, it is one of the best pdf reader I Love it
1198,Mr Sallu,"August 1, 2019",3, some of pdf couldn't be read
1199,Ash Manideep,"October 10, 2019",3, Please enable an option to read the entire pdf
1200,Kuldip Singh,"October 22, 2019",5, It's really good aap to view the pdf files.
1201,MEROUANE DENNAMI,"April 1, 2020",5," He worked at the required level from years ago until today, and these days are few."
1202,Raven UpDraft,"April 10, 2020",5, Easy to Use.
1203,A Google user,"November 21, 2018",5, I think that the app is need some update like bug fixes....
1204,Akhilesh Panigrahi,"March 26, 2019",5, From my opinion best app for pdf viewing.
1205,A Google user,"October 1, 2018",4," It is very important, easy to understand the syllabus"
1206,anugrah darin videos,"June 7, 2019",1, very bad app not opening and also not working
1207,Aman kumar,"August 11, 2019",3," it needs to be more powerful, more tools should be added."
1208,amit rai,"April 8, 2020",4, Very good 👌👌👍👍 app.
1209,S SURESH,"April 19, 2020",1, Not opening pdf
1210,adebulu abdulgafar,"April 7, 2019",5," superb, all the way. But a user should be able to view all file and even convert, pls note that... tanx."
1211,RAHUL SAHA,"June 3, 2019",1," showing black display, not working."
1212,"Samarpan Academy, Purnea","August 5, 2019",5, good and light app for pdf viewer
1213,Rony gosh,"September 8, 2019",1, i just install this app and its not running in my phone even i Can't open this app from playstore and it doesn't appears in my apps
1214,Slimani Abdelghani,"December 1, 2019",4, It easy to use simple it great tool
1215,Mahdi Hasan,"December 11, 2019",5, I really love this app.... It’s good and handy
