index,author_name,review_date,reviewer_ratings,review_body
3241,Johan Persson,"November 1, 2018",2, Hopelessly slow I'm afraid...
3242,A Google user,"January 9, 2019",1, Can't even open it
3243,Som Prakash,"February 26, 2019",4, thanks for this information
3244,Jonathan Fragata,"April 22, 2019",2, I think it can harm
3245,Edward Frank Siljeur,"December 26, 2019",5, safe app for storage
3246,Lucas Hill,"June 4, 2019",1, it did not solve my problem
3247,Huzaifa Farooq,"June 17, 2019",1, Can't find the app
3248,Kevin Winter,"September 11, 2019",4, This could use a dark mode Google
3249,Master Chef Nai,"September 24, 2019",1, It do not open...
3250,Harish kumar K A Adhi,"October 12, 2019",3, I ly some files are opening in this
3251,Ramesh Parihar,"November 15, 2019",5, Very best option
3252,Mary Jane,"December 4, 2019",5, It's all good
3253,Jesse McDowell,"December 8, 2018",5, All good so far.!
3254,Balaji Deevi,"September 14, 2018",5, Thanks for this app creator 👏
3255,A Google user,"March 23, 2019",1, what is lmportance of water in the plant
3256,Ashok Samal,"November 9, 2018",1, It's really very bad
3257,LAYA KOLLIPARA,"April 2, 2019",1, Waste it is not working
3258,Newdawn@gmail.com Wilson,"May 8, 2019",3, I have not try it
3259,Elvin Gabilan,"June 11, 2019",1, no icon appears on my phone
3260,Mahmudul Hassan,"June 27, 2019",5, thanks for the valuable apps
3261,Curtis K. Jackson Sr.,"July 8, 2019",1," Just sucks, sorry."
3262,Misenga Christian,"August 31, 2019",1, This app is not good
3263,RAHUL KHODE,"September 2, 2019",5, Very helpful for me.
3264,singer suraj singh,"September 26, 2019",5, 15 years experience
3265,Tony De Luca,"October 25, 2019",1, Cannot even open it
3266,RAVISHARAN KUSHWAHA,"January 22, 2020",1, very nice app
3267,Toby Marquardt,"October 25, 2018",5, Keeps me in good hands
3268,Amazing World,"April 21, 2019",1, it cant easly open
3269,A Google user,"January 17, 2019",4, Good to see you app
3270,A Google user,"December 21, 2018",3, it is so important to me
3271,A Google user,"December 6, 2018",5, It's is very fantastic
3272,vinothkumar. S,"October 8, 2018",5, I love this app
3273,Aung Kyi Htay,"March 16, 2019",5, It's a useful app.
3274,Vaishunavi Vaishu,"April 29, 2019",5, suprrrr appp i really love it excellent worl
3275,Robin David,"June 13, 2019",5, best there is.
3276,Jose LaraBustos,"July 27, 2019",3, aa smh go y they aaaaaai we qfa ttqgo c to thekGh tf hihe the 5t to to be v
3277,indika Dias,"July 21, 2019",5, it's a very gooooooooood one
3278,Md Rousan,"July 15, 2019",5, it's really great
3279,Kingman Mazango,"August 25, 2019",3, It's better with it
3280,Shriram Yadav,"November 5, 2019",1, No support play store
3281,Power Control Tech Venkatesh.L,"November 28, 2019",3, Just now IAM installed
3282,dharmesh nilgade,"December 4, 2019",1, Not workins on aspx filr
3283,avinash jamgaonkar,"December 13, 2019",5, Very....Very...usefull
3284,sreenandan s,"January 10, 2020",5, I dint try it tough
3285,Ashiq Ali,"April 6, 2019",2, it does not show any icon
3286,A Google user,"March 21, 2019",5, helped me a lot
3287,Shan Ahmad,"April 17, 2019",1, it is not opening
3288,A Google user,"March 12, 2019",5, it is a wonderful app
3289,amit fhm,"June 21, 2019",1, this is not work
3290,kusum gusain,"June 30, 2019",1, I don't like this app
3291,Dipti Lagdiwala,"July 12, 2019",1, cannot be found in my appa
3292,Shangi George,"August 24, 2019",5, SHANGI GEIRGE A'M A SAVE USER PREACHER OF AGRI-CHEMICAL.
3293,Jayaraman Poovaraghavan,"September 5, 2019",1, This is the first time I am using
3294,Mukesh Kumar,"October 30, 2019",5, It's very nice app
3295,Frank Ocansey,"April 6, 2019",4, the best for now
3296,A Google user,"March 24, 2019",3, let me use please.
3297,rl williams,"November 17, 2018",4, Just seeing what it is about
3298,Next Waveai,"April 6, 2019",1, did not work or open files
3299,MOHAMMAD RAZU SARKAR?,"November 2, 2019",5, Rajuahmed.shopnill.samiul islam ardhi.??
3300,A Google user,"December 16, 2018",5, It's fantastic
3301,Stefan Blatter,"July 26, 2019",5, It does what it needs to do.
3302,Fact Dunia,"August 9, 2019",1, the wrosrt app i have ever downloaded
3303,Narsing Gond,"September 10, 2019",1, You are a great apps
3304,Yasin azmi Baig,"October 19, 2019",1, Thanks for wasting my time
3305,Anup Singh,"October 10, 2018",5, I like this app
3306,KAKOLI SAHA,"May 3, 2019",5, not good enough
3307,A Google user,"November 1, 2018",4, Good but not the best
3308,angajala harika,"December 16, 2018",1, Can't be seen
3309,A Google user,"September 30, 2018",5, I like this app
3310,A Google user,"January 31, 2019",5, I like this app
3311,I Love Anime,"April 13, 2019",1, Doesn't show up
3312,Alan Miller,"April 10, 2019",5, worked from the start
3313,A Google user,"November 13, 2018",4, It is helpful for me
3314,Jasika Saini,"June 19, 2019",5, it's really good app
3315,Jeridah Maifala,"June 29, 2019",1, why can't i open it
3316,Clinton Alice,"August 3, 2019",4, good to use.
3317,Raj Sarkar,"August 7, 2019",1, That's kind of one very Bad app
3318,ISAAC BANDA,"September 19, 2019",5, Google please continue ...
3319,StarlightRose300,"October 7, 2019",2, Doesn't actually work noobs ugh!
3320,Md Zubair,"October 10, 2019",5, What's a good app
3321,helal Ahmed,"November 11, 2019",5, Nice app i love
3322,Gurvail Singh,"November 29, 2019",5, Too appropriate app
3323,Shailesh Rawat,"December 2, 2019",3, I don't know
3324,A Google user,"December 12, 2018",5, it is a good app
3325,Kaushal K Patel,"November 15, 2018",4, Give me some time
3326,Golu Patrey,"April 28, 2019",1, why not open in my device
3327,mister retsim,"March 8, 2019",4, cant open it independently
3328,A Google user,"March 18, 2019",4, just started lets see...
3329,A Google user,"November 3, 2018",1, It is time taking
3330,A Google user,"November 17, 2018",1, Super but some answers not coming
3331,A Google user,"November 17, 2018",5, It's brilliant
3332,Prajakta Joshi,"January 30, 2019",1, not opening in my mobile phone
3333,A Google user,"September 21, 2018",1, Does not work
3334,vondric adkison,"November 21, 2018",1, Does not work
3335,A Google user,"January 7, 2019",5, Love its features
3336,Karma Gunz,"November 2, 2018",5, Great thanks Google.
3337,A Google user,"September 25, 2018",5, It makes life easier
3338,Kanan Kumar Dinghy to,"May 16, 2019",5, it is useful to me
3339,A Google user,"March 3, 2019",5, it is a great app
3340,RAHUL RAJ,"November 8, 2018",3, It is perfect for me
3341,Geeta Mardi,"April 29, 2019",3, I use this app.
3342,Ousmane Barry,"September 29, 2018",5, This is excellent
3343,Mohi ahmed,"May 29, 2019",1, worst app ever developed by google🙃🙃🙃🙃🙃
3344,Jamb Chung,"July 2, 2019",5, I am so enjoy with this app
3345,Prateek Pal,"July 28, 2019",4, could be better.
3346,swati halgekar,"July 10, 2019",1, once installed unable to find
3347,Dattatraya Naik,"July 31, 2019",4, ok very good thanks .
3348,Saahhit AR,"September 20, 2019",4, It is the good people
3349,Karthikuma Karthikuma,"November 3, 2019",5, Super solla matan
3350,Labhesh Vartak,"November 11, 2019",1, This app sucks
3351,Bongani Nene,"December 15, 2019",5, 7l LL 5 pl nun k UN pjulu UL Lu Lu lyj
3352,Nehal Chy Rifat,"July 4, 2019",5, It's important thing
3353,merlin nelson,"October 20, 2018",3, It's ok not bad
3354,Piyush Tulsyan,"October 5, 2018",5," Thanks, from Piyush Tulsyan, Daltonganj, Jharkhand State,"
3355,A Google user,"November 20, 2018",5, This is best
3356,A Google user,"October 11, 2018",1, Cannot download it
3357,aligit martin,"January 15, 2019",4, It's a nice app
3358,Praphull Chandra,"May 17, 2019",1, can't open this app
3359,justice onyeugboh,"October 10, 2019",4, Very good so far
3360,Janet Farrell,"October 28, 2019",4, Cannot open file
3361,Utlwanang Elvis,"November 5, 2019",5, Best with viewing
3362,Sebastian Luke,"April 23, 2020",3, X hx LS J Fu S g
3363,Dhruv namdev,"September 16, 2018",5, It is amazing
3364,A Google user,"March 7, 2019",1, it doesnt open
3365,/\zcii,"January 26, 2019",5, i can now install any files
3366,swarajya pancholi,"January 13, 2019",3, easy to use
3367,A Google user,"December 1, 2018",5, A new movement of Google
3368,A Google user,"November 14, 2018",5, i think very smart app for me
3369,A Google user,"December 12, 2018",4, It can't share
3370,IPKillers26,"April 25, 2019",5, I like this app
3371,MAHESHKUMAR PATRA,"March 25, 2019",1, Can't open it
3372,yap boon,"September 23, 2018",5, Fix all the problem pls.......
3373,San Cohen,"December 17, 2018",5, easy to use
3374,HARSH PANDEY,"December 9, 2018",1, Waste of time
3375,A Google user,"November 13, 2018",5, smart and smooth
3376,A Google user,"October 30, 2018",5, Simply the best
3377,A Google user,"November 20, 2018",5, It's helpful
3378,the most wanted,"June 16, 2019",1, I can't open the app
3379,Dharma Niranjan Mishra,"June 23, 2019",3, I'm yet to use
3380,sarode varaprasad,"August 1, 2019",5, very very useful
3381,science study,"September 17, 2019",5, Any google aap is best and work doing proper
3382,Kamogelo Bendlela,"September 20, 2019",1, Why can't I download it
3383,V n Hanuman Prasad Muvvala,"September 30, 2019",5, Excellent for office work
3384,Anup Singh,"November 27, 2019",5, Best our life
3385,A Google user,"February 25, 2019",4, I like it..
3386,A Google user,"October 8, 2018",1, App is cheating. Connot open
3387,Daniel McMorrow,"February 26, 2019",1, did not work Did not work
3388,Neha Sanas,"April 8, 2019",5, it's very nice app😊
3389,A Google user,"October 30, 2018",1, Can't share to this
3390,UMER ARSHAD,"May 10, 2019",1, its a wrost app i have ever seen
3391,rabiat bashorun,"September 17, 2018",1, It's not opening
3392,Tjiptono Pantjer,"October 27, 2018",5, Thank you very much....
3393,james Gaming,"December 2, 2018",5, I will be Updated
3394,A Google user,"December 10, 2018",5, It's the fantastic app
3395,A Google user,"March 20, 2019",4, It really helping me
3396,Thynest Channel,"March 18, 2019",5, Good For My Handphone to view my document
3397,A Google user,"December 6, 2018",1, Rubbish does not work
3398,A Google user,"October 14, 2018",5, It's just great....
3399,Tina Oconner,"November 21, 2018",4, very happy thank you
3400,Mbongiseni Manana,"June 20, 2019",1, I can't even open it
3401,SATISH CHANDRA VERMA,"July 24, 2019",5, top pdf viewer
3402,adarsh Krishnan,"August 6, 2019",5, no words to say
3403,Amar Baghwar,"August 10, 2019",3, it's really .
3404,Sarkar Sethu,"September 21, 2019",1, Its not so fast
3405,beena bharathi,"October 20, 2019",2, this is not supporting
3406,cheam Kim,"October 21, 2019",4, Can't open file
3407,Anjaneyulu routhu,"October 31, 2019",5, This more useful to us
3408,Exotic Voyages,"November 29, 2019",5, Nice & good
3409,A Google user,"March 18, 2019",5, describe your experience 😉
3410,nahid talukder,"November 27, 2018",5," Simple,, like it"
3411,Anmol Singh,"February 14, 2019",5, knttttttt attttttttt kokaaaaaaaaa greatttttttt app thnx for dis app
3412,Steve McFaul,"February 1, 2019",1, didn't work
3413,A Google user,"December 24, 2018",5, you can fix your files
3414,Pavan Raju,"October 7, 2018",3, It's a good app
3415,GUREZI Songs,"November 10, 2018",3, I dont know
3416,Fawzia Munshi,"January 12, 2019",5, Does what it says on the box 😊
3417,Ela Navales,"May 30, 2019",5, It's good!:)
3418,Raj Islam,"June 5, 2019",5, best performance.i like it
3419,Luttapy gaming,"July 11, 2019",5, wow what an app I am relay exited
3420,Little Boy,"July 22, 2019",5, It's a amazing
3421,Tshegofatso Rakwena,"August 16, 2019",1, doesn't want to open
3422,BHARAT D Vadher,"September 1, 2019",5, It was like friendly
3423,"Jitu D-Arch, CIVIL ENGG.","September 19, 2019",1, It not seeing on touch screen
3424,Allison Duhaney,"October 17, 2019",4, I cant find it
3425,Kiran Gupta,"November 13, 2019",1, Very bad app
3426,rak mik,"November 14, 2018",3, Need app icon in home
3427,A Google user,"March 1, 2019",5, i can not download
3428,N A life.!,"December 2, 2018",5, Use it feel it....!
3429,Aniket Saundane,"October 29, 2018",1, It is fake app not install it
3430,RAMDEVSINH GOHIL,"November 27, 2018",5, Please provide delete option
3431,Ognjen Miladinovic,"December 24, 2018",1, how tf do you even open this
3432,Naveen Singh,"May 18, 2019",3, Better all the way
3433,A Google user,"November 4, 2018",3, Its ok i dont use too much
3434,pandharinath nevage,"April 30, 2019",5, cool app this is given by Google
3435,A Google user,"February 19, 2019",5, it's a good app
3436,A Google user,"November 19, 2018",1, Don't install this aap
3437,Daniel Hermes,"June 22, 2019",5, Does the job
3438,Chad Kreps,"July 1, 2019",5, im busy at the moment
3439,A Google user,"July 4, 2019",1, does not work
3440,ALL CULTURAL DANCE,"July 6, 2019",5, good and useful
3441,Mark Capiz,"July 15, 2019",1, Does not work
3442,Christopher,"August 4, 2019",1, This does not work. At all.
3443,Maphomolo Zinhle,"August 23, 2019",1, just take my data only not download
3444,Oriyomi Micheal Onaayomi,"September 1, 2019",5, I like this app
3445,alury vinod,"December 2, 2019",5, Thank u google
3446,Theresa Chandra,"December 22, 2019",5, waste of TIME
3447,Jayantilal Patel,"January 15, 2020",5, Best WITHOUT test
3448,Bansidhar Bhatt,"April 4, 2020",5, Google pdr vi
3449,A Google user,"December 6, 2018",4, I liked it
3450,Andrew Macnabb,"May 10, 2019",1, doesn't work
3451,Kelly Anderson,"February 12, 2019",1, won't work
3452,A Google user,"March 3, 2019",5, it's amazing
3453,A Google user,"February 14, 2019",5, it's very important
3454,Somenath Dey,"December 13, 2018",3, Let me see
3455,A Google user,"September 25, 2018",5, This is sooo gooooooooooooood
3456,Raman Dubey,"November 29, 2018",5, It is very nice
3457,Mohd Arif Ali,"March 12, 2019",1, worst app ever seen before
3458,Brandon Boyd,"February 7, 2019",1, installed but couldnt use.
3459,Kumar Chettiar,"November 12, 2018",3, Good for me
3460,Puneeth Shetty,"May 6, 2019",5, awesome . i luv it yaar
3461,Maria Kotik,"June 3, 2019",1, doesn't work
3462,Gokul Muralidharan,"June 27, 2019",4," Good like it, no hang"
3463,Ari Raven,"September 5, 2019",1, Does not work
3464,Kleptoz2,"October 6, 2019",1, No app installed.
3465,Justin K Issac,"November 9, 2019",1, bad very bad
3466,Sono Kofcoo,"November 25, 2019",4, Heelp ful app
3467,Sakshi Singh,"January 6, 2020",1, Poor than poor app
3468,rois munandar,"February 7, 2019",5, good good very good
3469,The Roar Channel,"November 10, 2018",5, It is very good
3470,Karnal Arif,"April 18, 2019",5, traanswer to h.d.f.c bank many.
3471,Dilipbhai Raja,"September 24, 2018",4, Yet to use it
3472,William Gleeson,"March 29, 2019",5, does the trick
3473,Muhammad Wajahat Shahid,"November 1, 2018",5, It's good...
3474,Darrell Sheets,"March 8, 2019",5, it's great
3475,A Google user,"October 27, 2018",5, That's nice
3476,Alfred Akelo Nyamita,"March 25, 2019",1, a good one
3477,Tùng Nguyễn,"May 7, 2019",5, It's useful
3478,A Google user,"February 9, 2019",5, It is nice
3479,waqarshah dvm,"May 27, 2019",5, 100%useful for anyone
3480,Chiradip Das,"August 16, 2019",5, a no nonsense app...
3481,Ann Khoabane,"August 19, 2019",1, Water & Sanitation
3482,Mo Nkadimeng,"September 17, 2018",5, I can view pdf files
3483,Luis Fernando Arroyo Cervera,"November 16, 2018",5, I simply like it.
3484,Leila Eddie,"April 11, 2019",3, ok on first time to use
3485,A Google user,"February 26, 2019",5, good i like it
3486,A Google user,"October 28, 2018",3, I thank to this app
3487,Manchalla Gayathri,"June 6, 2019",4," good, nice and super"
3488,Junior Mthembu,"June 4, 2019",1, app didn't appear...
3489,Mathew Mutangira,"July 28, 2019",3, 😒great... ..... ..... .... try it
3490,Sharof S.,"July 25, 2019",2, doesn't have an spp shortcut
3491,Darshit gamit,"November 15, 2019",5, Verrrrrrrrrrrrryyyyy help ful appp
3492,Mohanlal Rabidas,"September 16, 2019",5, Google's apps are best
3493,Chirag Patel,"October 19, 2019",5, Log in sf t keep I sf key. Off
3494,Satyam Nath Tiwari,"November 24, 2019",2, Work for e
3495,SREE SREE REDDY,"December 24, 2019",5, Its vey good
3496,Naveen Nanu,"January 21, 2020",4, Nice to app
3497,Atul Patel,"February 11, 2019",5, nice and interesting
3498,Lavi Nag,"May 10, 2019",1, what an idiotic app.... useless
3499,A Google user,"December 1, 2018",5," Awesome,nice,superb"
3500,A Google user,"February 17, 2019",1, this app is not open
3501,nagabhushana rao Chigilipalli,"June 22, 2019",4, its good for all
3502,Chinmoy Bose,"July 10, 2019",1, not so good
3503,shubham gupta,"July 28, 2019",1, it is not opening😠😠
3504,Ahmed Mohamed,"July 28, 2019",1, i can't install
3505,Albert Rodriguez,"August 7, 2019",5, making a great day
3506,Percy Skosana,"August 6, 2019",5, its just perfect
3507,Anilkumar Naredla,"September 13, 2019",1, Good to see
3508,Ayie Yellok,"September 20, 2019",1, It is very useless
3509,Ramesh Rana,"September 29, 2019",2, Good but not best😈🙀
3510,jajati mohanty,"October 8, 2019",1, Doesn't work
3511,Shryan Kashyba,"October 22, 2019",5, It's just awesome
3512,Vishwas Sharma,"November 3, 2019",5, meet up to expectations
3513,SAMARTH SAKHARE,"April 21, 2020",5, Nice 👌 helpful app🤩🤩🤩🥳🥳🏋️🏋️🏋️🏋️👑👑
3514,Justin Danzanbary Justin Danzanbary,"June 24, 2019",5, Great app ever
3515,Ripu nice broo Jain,"April 8, 2019",5, best app ever . . .
3516,A Google user,"September 26, 2018",5, This is good app
3517,samson mwangi,"September 29, 2018",5, It's amazing
3518,A Google user,"December 1, 2018",5, I am very happy
3519,A Google user,"November 21, 2018",4, It is quite worthy
3520,A Google user,"March 9, 2019",5, great app very useful i recomment thia app for all
3521,paul s,"May 16, 2019",1, don't work
3522,Rajat Howlader,"May 30, 2019",5, that's great
3523,Love Dale,"August 1, 2019",5, very good n thanks its importance
3524,Simran Khatoon,"September 19, 2019",5, Overall I think good 😊😁
3525,Rajesh Kallidai,"November 5, 2019",4, pls give night mode reader pls pls
3526,A Google user,"February 16, 2019",4, It's sufficient
3527,A Google user,"November 15, 2018",5, It's very useful
3528,Ruth Lever,"September 27, 2018",2, Waste of time
3529,A Google user,"January 29, 2019",5, it is very good ☺☺☺
3530,Nelson Nthali,"May 26, 2019",5, it helps for reading
3531,Sandeep Maharshi,"May 28, 2019",5, nice light weight app
3532,Koduriking Saibharath,"August 25, 2019",4, Good for students
3533,Muhammad Rafique,"October 18, 2019",5, Do not work
3534,rakesh kumar,"November 28, 2019",3, I vile check
3535,JITENDRA KUMAR RAJPUT,"December 20, 2019",3, Pdf Please insert
3536,JAI PARKASH RANGA,"November 13, 2018",4, It was helpful.
3537,harmeet Kaur,"January 28, 2019",5, easy to use
3538,Manish Gupta,"April 3, 2019",1, does not work my phone
3539,Kamil Abdi,"May 22, 2019",5, becouse i read some my lessons
3540,mahendrakumar lahare,"April 26, 2019",2, its a good worker
3541,Anurag Rana,"May 8, 2019",1, it won't open
3542,RANDHEER KUMAR,"September 14, 2018",5, It is best app
3543,A Google user,"January 28, 2019",5, easy to use
3544,Prashanta Karmakar,"May 25, 2019",5, PLEASE MAKE 2 APPS i.e. GOOGLE SLIDE AND DOCUMENT VIEWER
3545,Vittal Ajmera,"October 1, 2018",5, Visible to seen pdf
3546,John j acquah,"June 9, 2019",5, thanks for the app
3547,Roger Owens,"June 28, 2019",1, Have not had one yet.
3548,Daniel Muchiri,"July 7, 2019",5, good for me
3549,January Emerald Mishra Eldob,"September 12, 2019",5, it was so amazing apps
3550,Ken Nichols,"October 30, 2019",4, Have not tried it yet.
3551,A Google user,"October 6, 2018",2, It is a bit of a sick boy
3552,A Google user,"December 5, 2018",4, It is good
3553,Ravinder Balsotra,"November 10, 2018",5, Keep it up
3554,Stan Sharp,"June 8, 2019",1, does not work
3555,Yasmeen Malik,"June 4, 2019",5, cannot open file
3556,MD.SAIDUL ISLAM,"June 30, 2019",5, nice application thank you
3557,arkrishnan arkrishnan,"July 1, 2019",5, good app! ok!
3558,Misty,"July 7, 2019",1, it doesn't work
3559,Nikhil Kondetty,"July 16, 2019",3, He is working nice
3560,k shivaiah,"July 20, 2019",4, google is the worst
3561,Abhinav Jain,"August 13, 2019",5, THIS IS THE BEST
3562,Ujjwal Sharma,"August 17, 2019",5, one of the best
3563,Abraham Albert,"September 11, 2019",5, so far so good
3564,Chloe Porter,"October 1, 2019",4, It ok not bad at all x
3565,rahul kumar,"October 10, 2019",2, Won't turn on
3566,Just Ganesh143,"October 15, 2019",5, it more useful to us
3567,Dr Shadangi,"October 28, 2019",5, Supabbbbb google is always correct
3568,Khadim Hussain,"October 26, 2019",5, Nice APP OF GOOGLE'S PLAY STORE
3569,Ramesh Vangala,"January 15, 2020",5, Use full app
3570,jafar umar,"November 13, 2018",5, Good to go
3571,Aditya Dubey,"October 27, 2018",5, It is cool
3572,sanam,"October 31, 2018",5, Nic to open documents as pdf
3573,A Google user,"January 8, 2019",1, this app is so bad
3574,gaiming daniel henry pubg,"April 14, 2019",1, you dont earn a star
3575,Gorav soni,"November 30, 2018",5, this is editor choice
3576,Sara Chaudhary,"November 2, 2018",5, An older version
3577,banamali puthal,"September 18, 2018",5, Easy to use
3578,A Google user,"March 8, 2019",5, it help me too much
3579,fajir A.u,"September 29, 2018",4, Easy to use
3580,A Google user,"October 4, 2018",5, It is nice app
3581,La Bib,"May 29, 2019",1, It's a trash
3582,Purvi Mak,"July 27, 2019",5, I like this app
3583,sk supertrade,"September 7, 2019",5, Thanks google for this app
3584,Cynthia Ramdall,"September 20, 2019",5, Very nice app
3585,Imrana Naz,"October 20, 2019",1, you have to do
3586,Andrian Aquino,"October 22, 2019",5, I like the idea of having
3587,E Johnson,"October 24, 2019",1, Wouldn't work
3588,Gunjan Kumar,"April 1, 2019",5, very nice application
3589,Shabane Sinethemba,"March 8, 2019",5, Send it to me
3590,A Google user,"December 3, 2018",4, It's very good
3591,Saurabh Singh,"December 10, 2018",1, Totally disappointed me
3592,A Google user,"December 17, 2018",3, not so bad
3593,A Google user,"December 17, 2018",5, Thanks for me
3594,A Google user,"March 21, 2019",5, no1 app for students to study
3595,Mehedi Hasan Nahid,"June 27, 2019",5, very very good
3596,Rajkumar Mondal,"June 27, 2019",5, I am very happy
3597,Himanshu Kumar,"August 3, 2019",2, not as expected
3598,Akshat Singh,"August 10, 2019",5, nice to have
3599,Sarita Gupta,"September 24, 2019",3, It's not working
3600,Arush Bhatnagar,"May 7, 2019",2, disappears as it get install
3601,Nandkishore Singh,"December 14, 2018",3, I thonk positive of this aap
3602,Prasanta Kumar Nandy,"January 8, 2019",5, why not open
3603,Angela Smith-Wynder,"February 6, 2019",5, I am not sure yet
3604,RISHVANT K.M,"April 3, 2019",1, nothing comes in that blody app
3605,Bri Moon,"October 5, 2018",5, Works as intended
3606,A Google user,"November 29, 2018",1, It is not working
3607,Caption Master,"December 4, 2018",1, its not working
3608,Abdul Motaleb,"December 17, 2018",5, It is great app
3609,Krishna Krrish,"April 27, 2019",1, its not appear after download
3610,A Google user,"November 9, 2018",5, Let me down load my pdf
3611,Taju Shankar,"June 9, 2019",3, ok let us see..
3612,Mike Malley,"June 18, 2019",5, i love this app
3613,JOGINDER SINGH,"July 6, 2019",5, like the one
3614,alan romano,"July 5, 2019",1, did not work
3615,Varshil Shetty,"July 18, 2019",1, no use for me
3616,Ranga Durai,"September 18, 2019",4, It's amazing
3617,shanker yadav,"October 9, 2019",2, Wast use less App not working not seeing ieys
3618,Philip Kaku,"October 28, 2019",4, It will be good
3619,Ronald Tovot,"November 21, 2019",5, It was great ❤️❤️❤️❤️
3620,Hamza Umair,"January 10, 2020",5, 2 good app
3621,Scp-096,"March 8, 2020",1, Scp mod big boy bad
3622,Nisar Mahaldar,"April 7, 2020",5, Ok Nice aap
3623,A Google user,"February 26, 2019",5, its the best
3624,manzs sinclair,"February 12, 2019",2, update thiss app !!!
3625,Misheck Chigumbu,"April 3, 2019",5, it's very indomitable awesome
3626,A Google user,"February 9, 2019",5, Very nice app
3627,Tesfaye Sorsa,"May 4, 2019",5, Keep it up
3628,Muhammad Hasan,"November 22, 2018",5, MUST USE THIS AMAZING APP
3629,B Anand Prasad,"October 3, 2018",5, Very very thank you
3630,A Google user,"February 22, 2019",5, all is well
3631,A Google user,"December 27, 2018",3, this app is nice
3632,Devesh kumar,"April 11, 2019",5, Very nice app
3633,chandra mohan kumar,"February 9, 2019",5, best for me
3634,Amrit Upadhyaya,"December 13, 2018",5, no word for mantion amazing
3635,Vamsi Krishna,"November 24, 2018",3, Should be fast
3636,Rakesh kumar,"December 9, 2018",4, Used for small files
3637,Roma Ratiani,"October 29, 2018",1, It doesn't work!
3638,oyowe Susan jessica,"January 9, 2019",5, I just love it
3639,A Google user,"January 20, 2019",5, Very nice app
3640,Ruben Hall,"June 27, 2019",5, I have not used it yet
3641,rohit bhorali,"July 14, 2019",1, very poor app......no use👅👅
3642,Nasew dj,"August 14, 2019",5, it is amazing app
3643,Jyoti prakash Joshi,"November 4, 2019",5, Osm app i love it
3644,A Google user,"October 6, 2018",1, Just hate it
3645,A Google user,"November 15, 2018",3, Want to use 1st
3646,BRANDON,"December 31, 2018",1, Doesn't open
3647,marex lagua,"May 1, 2019",3, its ok for now
3648,Rahul soni Pataudi,"June 21, 2019",5, i love all Google app
3649,Sumangala K m,"August 13, 2019",1, chee yak its a third party app
3650,Brenda Chambers,"August 14, 2019",1, could not access
3651,Safin Ahmed,"September 5, 2019",1, acrobat is much better
3652,Md Sajjad Amin Masud,"October 6, 2019",5, App is Good.
3653,Michelle Dyer,"October 19, 2019",5, Thank you Google
3654,Ashok Yadav,"October 19, 2019",5, Very nice app
3655,Michael Kralik,"October 27, 2019",4, Not sure yet
3656,A Google user,"March 28, 2019",3, thanks for this app
3657,Sanjeev Hemple,"October 2, 2018",4, I THINK VERY NICE
3658,Amit Jha,"March 8, 2019",5, thanks a lot
3659,Safwan Chowdhury,"October 31, 2018",5, The worst app....
3660,Rachael Ramus,"February 17, 2019",3, Yet to proof..
