index,author_name,review_date,reviewer_ratings,review_body
98,layercake69,"April 15, 2019",2,"Poor iOS app App with its poor design choices is extremely annoying to use. There is no swipe to back, among other things. Really?"
99,hermiee,"November 9, 2019",2,"Can't login with Google The concept is nice and the app seems fine, but there's no login with Google or manual sign-in... My account is linked with Google so I can't access it, so it's essentially useless."
100,itsTheChairman,"April 21, 2018",1,New version not usable This new version is not usable. I cannot browse more than one product before it crashes.  
101,Beer_zaygy,"April 25, 2018",1,Light gray tiny text is hard to read I can’t read tiny light gray text! Who came up with such a disaster of a font.
102,CiociCio,"May 5, 2018",3,It is a good app This is a great product that where you can find a lot of new product.
103,Sender111,"May 7, 2018",1,Glitchy and Slow New update is very unresponsive and slow. When I click to view a product the app often does not respond.
104,HonnestTruthJP11,"May 8, 2018",2,Latest version is buggy Love the app in general but this latest version has bugs and hardly works for me.
105,Rasterised,"September 14, 2018",2,Logs me out every other session Every other time I open this app it makes me log back in through Twitter when I try and upvote. iPhone X. Please fix this.
106,Taapl,"January 13, 2019",2,"Shoddy native app I like the site but the native app is barely usable. Lots of empty screens, superfluous stacking, broken screens that redraw incessantly. How much care is going into this product? Even the app history copy feels shoddy: “Adress [sic] frequent signout.” (4.3.3)"
107,❤️,"January 27, 2019",1,"Position jumps and you lose where you are. The app is a feed, the app cannot maintain your position in that feed, every minute the feed jumps up 4 days worth of projects. Seriously dislike their new react native direction."
108,Kittysalas,"February 1, 2019",3,Crashes Cool and all but it crashes every time i go to my profile. Fix for max stars :D
109,Kranthi7325,"February 23, 2020",1,"Too many bugs Can’t scroll down, it won’t allow me after some point. "
110,Edwin-wee,"April 25, 2018",5,"Paw-some update Love PH, and this app is even better with iPhone X support! 😻"
111,PooranPrasad,"April 25, 2018",5,"Coolest app One of the coolest app to hunt latest apps, startups, devices.. loving it.. keep up the good work"
112,idkmyman,"April 28, 2018",5,Great way to find new tech Love the app
113,Branimir Ivanov,"May 2, 2018",5,Awesome Great products every day
114,Winstun,"May 2, 2018",4,"Clean, cool UI Nice UI, very easy to use. Prefer the web version, though!"
115,Evelyn Ng.,"May 3, 2018",5,Must-have app for PM Clean & easy to follow up content. This is a must have app for all PM.
116,justjoshin11,"June 14, 2018",1,"Sev 1 defects in app I love PH, but the app has glaring defects for me. On iPhone 5 SE the login buttons for Twitter and Facebook do not work. Clicking contact customer support leads to a ""not_available"" message. Please fix your sev 1 defects and I'll update my review to a 5 star :)"
117,Trixmasta,"October 6, 2018",1,"App keeps scrolling up, glitching I can’t keep binging on the app because it randomly shoots me up to a different part of the feed. Extremely annoying."
118,SaveEarthWithVeggie,"December 14, 2018",1,"Miserable experience You scroll down, the app scrolls you back up.  Impossible to look beyond one day! How can a P1 bug be around for months and not fixed!?  It’s not Product Hunt but People Trap"
119,cmer4,"April 6, 2019",1,Disappointment for sure Year 2019 and a simple app like this one is still buggy and lacks core functionality.
120,Bethz+r,"April 22, 2018",1,"What happened? I love Product Hunt, but the app is barely useable now. When I touch an entry to see it, nothing happens. I’m using an iPhone X. Maybe it’s incompatible? Yuck."
121,Bah bahahaha,"April 23, 2018",1,Unusable Pretty much unusable. Crashes and
122,JNEGRETE31,"April 25, 2018",5,😻😻😻 Keep up the great work!
123,ro.sully,"April 25, 2018",5,Great Big fan of the new app. Keep up the good work PH...
124,strellyman,"April 28, 2018",5,Just another review Is it sad I’m only writing this for the free P.H. Stickers 😂
125,goldfarb_alex,"April 30, 2018",5,Great App Sleek app with a modern UI and great functionality
126,Klim3k,"January 4, 2019",1,Unstable Crashes every time. Notifications in the app are broken too.
127,musicianeer,"February 24, 2019",3,Eh Just not featured enough. What kind of product hunt app doesn't let you hunt?
128,Ksllalalla2092891,"April 8, 2020",1,"Can’t log in Downloaded app and tried logging in via Facebook, but the wheel spins forever and I can’t log in"
129,afern247,"November 28, 2019",1,No google sign in You need to implement simple email and password!
130,MichaeIScarn,"August 22, 2014",3,"Finally Got Logged In, But... So the Twitter Log-in finally works (!) but the app itself is still a little too bare bones. Obviously fixing the Twitter bug wouldn't resolve that, but I would like to see the experience become a little more visual (ie--thumbnails of products/sites instead of just headlines). I also wish the default view was for the site/product link, and not the people up-voting. Which is more important for this experience? And Pocket support would be quite lovely. I guess I'm just being critical because this concept of a service is very cool and something I've wanted for a long time."
131,ChristieJ1217,"August 24, 2014",2,"Potentially Cool I could potentially come to love this app but right now it's too big of a pain in the neck to even bother with.  The ""Details"" tab should provide a few more details than a one line blurb about the product. A photo and price would be ideal :) Then I can more easily determine if it's even worth going to the website for further details. Especially since every time I click on the ""website"" tab I get the spinning wheel of death forever and end up having to open it in Safari to actually view the product. Add a photo of the product and speed it up and I'll quickly change my rating to 5 stars! ;)"
132,LoveTheCool,"September 5, 2014",5,Product Hunt is SO valuable!!! I didn't know how badly I needed Product Hunt until I found Product Hunt! The digg-like list of new apps is so valuable because it's curated by people who think critically about tech - I know I'm only seeing stuff worth knowing about. 
133,Re-evolved,"April 9, 2015",5,"Great product and community get a worthy app I'm a big Product Hunt aficionado, and though most of my activities of the site involve lurking rather than posting and commenting, I love what Ryan and team are building."
134,Irvghady,"April 10, 2015",5,"I'm a startup nut and I love PH and the awesome community As a maker, I like to build products and create things that empower other entrepreneurs. PH has honestly allowed me to share my passion with other like minded people from all over the world. From Digital nomads living in Bangkok to Silicon Valley techies and all the way down to the Silicon Beach bros of LA. This revamped version of the app is executed flawlessly and has many great features. One of my favorites is the much awaited feature to add products to your ""collections"". You can also now reply to comments and the overall flow of the app is smoother and the animations are oh so slick. Mad props to the IOS Engineers who put this together and a big shoutout to the PH team which is near and dear to my nerdy heart."
135,thejessicawolfe,"December 26, 2015",3,"Cool Concept but how do I personalize? I really like the the concept of this however it is still in the social media category. Given this, do not forget to identify with all of your personas most importantly, the social aspect to each. I want to be able to update my profile picture and the background image so that I can further identify myself socially on this app. Given that I utilize the Twitter sign on when I log onto your app, then my images automatically transfer from Twitter to Product Hunt. I do not like that they cannot be different then what is on Twitter. I hope I'm just missing how to update this. Thanks for any assistance and future updates to allow this!"
136,LulusMyBuddy,"February 7, 2016",3,Wish I hadn't updated - new layout is not user friendly Nooooooo :(
137,Dturnq,"April 13, 2018",1,App not responsive :/ Bummer
138,nizfromtokyo,"April 24, 2018",1,How ironic! The app is very buggy!
139,fake is the new real,"May 22, 2018",1,"Pain to use Zero UX, slow, sad!"
140,andreplaut,"August 21, 2014",5,"Proud Product Hunter Product Hunt has been one of my favorite websites for the last few months, and now it's one of my favorite apps. This is a startup made up of great people building great things. If you're into tech, design, and product in general, you need to download this app."
141,soupcowb,"August 22, 2014",2,"Bugs Cool but it crashes every time I try to connect to Twitter which is required before you can use most of the app's features.  Also, if you're viewing a previous day's products, click on a product, then navigate back to the product list page, the page refreshes and only loads the current day's products.  You then have to manually load each day's product list to get back to where you left off."
142,VoteYo,"August 22, 2014",5,Excellent app to keep up on tech Product hunt is hands down the best way to keep up to date with the latest apps and products being released. The app is beautifully designed and has a great community of developers and founders that post.
143,LekanB,"August 24, 2014",5,"Get this today. Must have if you use the site all day! Do you browse the web and end up with 50 open tabs by the end of the day? Find that you are the person everyone comes to for app recommendations? This is for you. It's like Ryan took what I do all day and packages it into one simple, yet addictive package. Download it already."
144,Zak Suhar,"September 8, 2014",5,"The New App You'll Always Have Open Product Hunt is the sole app you need if tech interests you even the slightest bit. I used their web interface for some time and immediately downloaded the app once it came out. Once you get it, prepare yourself to never have it closed."
145,PassingNotes,"December 10, 2015",4,"bring back simple list view w no pics! recent update is outstanding, but please bring back OR give me the option to have a simple text only list view! the image sizes in the ""today"" view are ridiculously huge and it means scrolling takes forever, which means low ranked stuff will be ignored or overlooked"
146,Instahits,"December 10, 2015",3,"Lots of great functionality, but very laggy Great effort to bring the functionality of the app up to speed with the website. The team did a great job at providing us with a very comprehensive update. However, I'm running an iPhone 6 and the app is very laggy for me. This is pretty much true across the app, but particularly noticeable when swiping between categories. Get rid of the lag and this will be a 5-star app for sure."
147,theneverafter,"April 1, 2016",5,"Product Hunt is a game changer Kind of like Reddit for cool products & startups. This community is something really special, and the app does some really smart things like letting you listen to a podcast episode while browsing posts. This is now the first thing I open every day."
148,Azcraze,"February 27, 2018",3,It’s beautiful but lacking in a couple things One of the most useful and exciting parts of the previous Product Hunt app was the ability to see similar products. If this application does have that feature I am not able to find it and so therefore it’s a little bit of the usability and user experience problem. 
149,beingadrian,"March 1, 2018",2,"A downgrade in experience In my opinion, the new design has significantly worse viewing experience than the previous version."
150,The keywork,"August 21, 2014",5,"A Must Have If you want the best place to find a curated list of new products, Product Hunt is where it’s at. The website was great, and the mobile app makes it that much sweeter. This will be my go-to on the product front for a long time."
151,Rizzu26,"August 22, 2014",4,Clutter less design and speed Same feel as web. No ad. Clutter less design. Handy app for the product hunt regular users. Now it is easy to check the latest product and more over it is easy to post a product also.
152,jaybroho,"May 2, 2015",3,"Great app with an annoying ""feature"" I love the app but I hate having to scroll way down, click on a product, then click back only to find myself back at the top of the list. It's pretty annoying having to scroll back down again every time to find out where I was at before. Please fix."
153,thezi,"December 12, 2015",1,Bad idea to change the design I loved product hunt for its simplicity and lack of clutter. 
154,Epsan,"December 14, 2015",2,"Neutered and Slimmed Down I think I get what they're trying to do with this update, but it's actually removed helpful functionality. For example, it used to be easy to filter down search by type, which is no longer available. The images and copy take up far too much space, making for a much more tedious browsing experience. Hopefully they can iterate on this new design well."
155,Jeff Manislaw,"December 16, 2015",2,Poor UX I immediately went to the settings to see if that was an option to disable images in the list view.
156,Rad krish,"January 17, 2016",2,"We don't need images on main page Product hunt was better when there are list of apps, games with just app name and metadata. The new app focus more on image where the image layout doesn't add any value to product. "
157,Just a guy named bill,"March 28, 2016",5,"THE PLACE to learn about and launch startups ProductHunt has quickly become one of the most important platforms in the startup world. If you want to learn about or discuss new products or are planning on launching your own soon, you need to be here."
158,beautifulentropy,"April 2, 2016",3,"Not built for reading, focus on the content Too many useless pictures and too little text. I want to be able to read more than one sentence without having to click on the description of the product. Apple News version of this is ironically better than this dedicated app."
159,One4skiing,"April 26, 2016",5,Saving items There could be a better way to save items so that u can go back at a later time to review what you saved. I love the app I jus have difficulty saving the things I'd like to review later like when I'm pressed for time.
160,Hellometro,"August 21, 2014",5,"Keep an eye on the stream of products It’s great to be able to get a quick ‘product’ fix, and keep on top of the stream of products. "
161,cundimundi,"August 22, 2014",5,A Must Have For Product Discovery This app surfaces the best and most popular products in a wide range of markets. One of the best parts about the community is that makers contribute to the conversation in an AMA style approach so you can talk to the people behind the product.
162,nicberry,"September 11, 2014",5,"Everything we hoped for! If you're a Product Hunt fan, you know how long we've been waiting for an official app. This app will NOT let you down! It is everything we've been hoping for... And THEN some! Awesome! 5 stars!"
163,Kridakid,"September 17, 2014",5,Awesome and new! I had read about product hunt before through Alexis Ohanian and techcrunch but never knew exactly how great/easy/fun the platform is until I first tried it! Now I love using it when I have time to myself!
164,AreYouIn,"September 24, 2014",5,"The Hunt Download the app now. Just do it. I really don't even know why you are reading reviews, you know you love the hunt and you know you'll love this app. So stop wasting time and install this beast right this second."
165,Pixelpushaaaa,"October 9, 2014",5,I love this app Such a useful app. I find myself browsing it more and more everyday and it's usually one of the first apps I check when I look at my phone in the morning. 
166,Love circa,"July 23, 2015",4,"Not sure what to think Although the things on the app seem to be pretty handy, it's seems pretty barren. I don't know how many people actively use the app, but I don't think it's a lot. Besides that, the UI is pretty bland and you can only sign up with Twitter. Needs some work."
167,Pilotboy172,"August 27, 2015",5,Thank you for bringing Safari back!! This update brings back the ability for users to open articles in Safari. Thank you for that!
168,MacMotives,"March 16, 2017",3,"Someone Hunt a UX designer Recent changes to this app have ratcheted up the annoyance factor.  The large ""app of the day"" wastes screen real estate and I'm a 6+ the animated images will invoke whatever ptsd that online advertising has created in your psyche. I find that now I want to quickly browse new stuff and leave the app asap because it's an eyesore."
169,Happier & Luckier,"March 3, 2018",1,No way to add to or access my saved hunts or  lists I've been using PH for what feels like years and I've been categorizing my hunts with lists. With the new update I have no way to either return to my previous lists or add items to lists/save them for accessing later. There used to be a small icon at the top which allowed me to do that and it's gone. Why is that single feature gone? That's a huge miss.
170,NoIceInmydrinkplease,"August 22, 2014",5,Get your hunt on! Bunch of great products to find. I love the discussion between the makers. High quality community and the dudes who make it are awesome! Only gripe is that its missing edge drag to go back! Peace out!
171,Bhenriot,"September 9, 2014",5,Best way to kill 1 minute Love opening the app while waiting for the bus or the elevator. 1 minute here and there and I know everything about the latest startups/products.
172,Tjphilli,"January 1, 2015",5,Had issues with Twitter auth but fixed I had an issue with re-requesting Twitter login but worked with the PH team to address it. Love the app and use it every day.
173,charlesjo_us,"December 13, 2015",5,"It's the community behind the app Remember that the key value of Product Hunt is the awesome community. These app updates for PH are works in progress. If you are doing anything with products, design, coding, or startups, you need to participate."
174,Corndogl337,"January 9, 2016",5,Amazballs So I flip'n love product hunt. It's an amazing place to discover new products and services. I only wish I could post comments and upvote Things without using Twitter. That's my  only complaints. gO PH!
175,$RUM,"November 21, 2016",3,"Great App but, it has Sync Issues The app works well, is well designed, but is seems to lag behind the website in keeping my collections and submissions in sync. In other words, the website is always more current and up to date."
176,evelynnmimi,"March 9, 2017",1,"Buggy! I love the platform, but this app gave me trouble on my last and now on my current phone, both iPhones. The activity will show, but when I click on it, I don't see anything. Also when I get responses to comments, I get taken back to the product, but not my comment, so I can't respond to comments. This app is useless for me."
177,californiadreamer+,"April 19, 2017",5,"❤️ Product Hunt is an amazing concept, by entrepreneurs for entrepreneurs. I've discovered some amazing tools that helped us a lot to develop our app. Can't stress enough how important this company for entrepreneurs and founders!"
178,msdorsett,"November 1, 2017",3,Craving more I love PH. I wish the app allowed me to post products that I've hunted on the go. Also it doesn't seem to be syncing properly with my online profile. It only displays one of the products I've hunted? Maybe have set something up wrong I'm not sure.
179,Toro Fin Sushi,"March 5, 2018",1,Description too small. Waste of screen space. This revision is terrible. The description font size are way too small on devices with smaller screens. Too screen real estate is wasted for upvote. The layout is done poorly making user experience the worst ever. Perhaps you should focused on enhancing curation rather than just finding things to do by moving things around.
180,Chakkaradeep,"August 24, 2014",5,Great addition to mobile website Finally a great way to stay in touch with all the great new apps!
181,jack3952,"April 10, 2015",4,"Great Update Cool new features added! Although I do hate that I can't swipe to go back in the details page, something essential with these big new phones!"
182,Paps Van Winkle,"December 11, 2015",3,Fixing something that wasn't broken It was a great app the way it was. I'm not a fan of screen real  estate being taken up by large useless images. I preferred the list view as it is easier to consume content.
183,jlnsb,"December 15, 2015",3,"Terrible update Guys the update looks terrible... slow to scroll around, fuzzy pictures, overall I just want to use it less.  The previous version was fantastic... like with Reddit, please add option for ""condensed"" (classic) view."
184,walker454577,"January 13, 2016",5,Good for startup Product hunt is the best place to introduce your product to the world but the only problem is it's require a twitter account otherwise very good for the startups
185,kleerkoat,"March 8, 2016",5,the old new look rocks i missed the simple layout of old and I'm glad they brought it back!
186,defined2,"March 26, 2016",5,Great app! A very good app to keep track of all the happenings on Product Hunt.  Easy to use and adds another dimension to the PH community. Highly recommend!!
187,giox360x,"June 23, 2016",5,Awesome app. Essential for the las tech thing This product gives you the latest in tech news and awesome products
188,Joejoe1243,"March 15, 2017",5,"Gonna be the next thing!! Forget all the other apps, this one shows promise to go somewhere new.."
189,db839,"March 18, 2018",1,"Latest UI removed features In a recent UI update, categorization of the products is gone. There is no way to tell what is designed for game, technology, programming, etc. This makes it very difficult to use the application and figure out which products you are interested in reviewing or obtaining."
190,Line Crosser,"August 21, 2014",5,Strangely Addictive The only way to find software built by smart people from all over the world!
191,Lakers1170,"August 21, 2014",5,Love PH A new entertaining list of products each and every day. What else could you ask for
192,Craig Zingerline,"August 22, 2014",5,Great v1.0 Solid initial release putting the best elements of the popular product finding website into a slick and easy app.
193,blakeir,"November 24, 2014",5,"Finally made my home-screen! Can't say enough good things about Ryan, Erik, and their team. I check Product Hunt routinely."
194,Soeeee,"April 15, 2015",1,"Curious about the product, not the comments In the previous version, it is pretty easy to access to the product website in the details page. However, in this new design, there is no obvious entry point for to the product site. Please change it."
195,Keno 94,"April 15, 2015",4,"Nice, But.. I really wish you  could link a different account other than Twitter.  Maybe Google+. I don't care what else but please add more ways to make an account"
196,mike demarais,"October 19, 2015",5,Can't remember life without Product Hunt Second thing I check after waking up
197,clayzug,"March 8, 2016",5,"Nailed It Nothing wrong with a ""traditional"" tabbar. The faster the navigation the better. Glad to see PH moving in the right direction, it's still sooo early 😊"
198,Who knows who...,"April 13, 2016",5,"If it crashes, restart phone. If it crashes, restart phone."
199,Hirschinator,"February 27, 2018",2,Slow and buggy Swiping between product cards lags and sometimes tapping a product will either take you to the wrong product card or show a blank screen.
200,awdog99,"August 21, 2014",5,"Great app for a great product! I'm a huge PH fan, glad to be able to check out the daily leaderboard on the go now!"
201,Rklusas,"August 22, 2014",5,Product Hunter There is simply no better way to find the best new products.
202,bsmartt,"August 22, 2014",4,Beautiful But the only signup option is twitter which consistently crashes my brand new fully updated iPhone.
203,BGbeast,"August 26, 2014",5,Superb Well designed app; even better content. Some of the up and coming apps/ sites are amazing.
204,tsylorswift,"August 30, 2014",5,love it I look forward to checking this app everyday. need a favorites list!
205,Robertspangey,"September 24, 2014",3,Great design Fantastic app. Great design and had everything I love and come to expect from the website. Would love to be able to swipe across the screen to go back. Hate having to hit the arrow
206,AParekh,"January 6, 2015",5,Twitter bug love the concept.. would be great if I didn't have to log onto Twitter every time I wanted up vote something.
207,lazerlex,"December 16, 2015",1,"Design is baaad. Also login doesn't work. Login throws error. Also, new design is pretty bad guys. The last couple iterations are totally overdoing it. Gaudy animations and unnecessary complications. This new version is like I'm at 200% zoom. This is what happens to a simple startup with more money than they need. Keep it simple...don't ruin a good thing."
208,Abazark,"March 21, 2016",4,"Great app If you love new tech and startups this is the app is the best. I like the new layout, it's very simple and clean. I just wish they would split the tech section into hardware and software."
209,Hi!HowAreYou?,"July 6, 2016",5,Great team behind this app Really useful. Friendly team. This is why the Internet rocks
210,bartolah,"August 22, 2014",5,I’m a big fan I love product hunts regular updates - even better as an app.
211,SexualRomance,"December 8, 2014",5,Handy tool Helps me find the most popular apps and products across an increasingly wide spectrum
