index,author_name,review_date,reviewer_ratings,review_body
0,polygrafix,"April 29, 2018",5,"Like consumer reports and reddit had a baby Ok, first off, I don’t do a lot of reviews unless something catches my attention that is of exceptional value. Product hunt is that app.  It keeps me on top of the tech scene by letting me know what is the hottest things (or about to become) in tech, books, software and more. It has a voluntary community that curates things that get voted up or down, so there is a democratic process administered by the internet, it’s like consumer reports and reddit had a baby. "
1,AndrewMcMahonJr.,"April 26, 2018",5,The most productive infinite scroll out there I’m a product designer and thusly just love Product Hunt in general. I’m glad that they introduced a solid mobile experience so I can stay connected and inspired even when I’m indisposed. 😜
2,SandraWNY,"May 1, 2018",3,"I appreciate so much about the PH website, but ... ... this app, well...  New products, apps, websites, services: Product Hunt delivers. And that the makers participate in the discussions is pure gold to me. My first impressions of this new app are 1) please don’t make my eyes hurt, grey on lighter grey would be tough even for a kitty; 2) it's crashed a couple of times in the past 15 minutes; 3) where are the categories/tabs? All I see are new products, listed from mewest (actual typo, but I just have to leave it) first. Probably a bit of fine tuning “under the hood” would make it better than ever. (P.S. I’m setting up my new laptop and it doesn’t have a single kitty sticker on it. Sad, so sad.)"
3,dannypizarro,"April 4, 2018",1,"Horrible update I am a very long product hunt user, which makes writing this review that much harder. Huge fan of PH and the community and platform they have built. Their last app was not amazing, but it was pretty good and got the job done. This app is absolutely useless. Not sure if the problems are only on iPhone X or all devices, but it’s literally unusable. I open the app and click on a product and nothing happens for a few seconds. Then the page opens, the app bugs out, and everything I try to click is unresponsive. This update is so bad that I have found myself using PH on my mobile browser or just not checking it at all. "
4,heyluis,"May 15, 2018",3,"Missing potential I like product hunt and what it does for browsing cool products. However, the app is actually really bad. It’s super unresponsive, tons of bugs which cause crashing, sluggish and constantly reads my touches/swipes incorrectly. "
5,TheAirBender,"April 25, 2018",5,"Great design, effectivity, and usefulness. I found Product Hunt a few months ago, on Google. I started using it on my desktop/laptop and subscribed to their mailing list. I then realized they had a mobile app and realized I can take this on the go. It was really great to see the development of the mobile app and then taking feedback from users and actually implementimg them. The company owners and adminstrators are also friendly and I love how they shed light on these startups and cool programs/tools."
6,dwilsonsf,"May 4, 2018",5,"Best place to find new products and trends I often find myself searching ProductHunt first when looking for products to use, or I research. "
7,BRuLeZ,"March 5, 2019",1,"Good content, but terrible iOS app The developers must have thought it a good idea to implement their own scroll view.. then failed miserably at it. "
8,Spencerncrane,"January 18, 2019",2,"Can’t login with Google? I love Product Hunt and have always used the web version, and have just discovered the app. However, on the web version I’m able to login with my Google account (which is what my entire account relies on); on the app version, I only see the options to login with Twitter and Facebook which means I can’t access my account."
9,AteamSF,"May 2, 2018",5,"Tech Guru of Startups 5min/day to capture a ton info on latest startups, new features and the talk of the town. You’ll find everyone from C level execs and the brightest SWE here talking about what’s good and what not. A quick look at the daily tab gives me a good info on what’s new, what’s trending, and what’s worth buying/paying for. I would highly recommend NOT wasting time on buying expensive tech magazines. PH is the key to your tech house!"
10,tjs0,"April 25, 2018",5,"A place to connect Product Hunt is not only a place to find new products, but a place to find entrepreneurs to talk with, build with, and share with. "
11,markjohn1,"April 25, 2018",5,"What I needed I enjoy reading about new products, but don’t always have the time to follow everything. With PH I get to not only read about new products but also interact with others about said products. It makes my life easier and it’ll do the same for you if you’re like me. Great job PH TEAM!"
12,@prodsunday,"April 25, 2018",5,"Amazing! - Just needs a bit more. I recently downloaded the ProductHunt mobile app update a while back, it is amazing! I’m loving the dark mode and just being able to upvote new launches 🛠🚀. But one thing I think it is missing is being able to check your Ship Subscription 🚣‍♀️. I think that being able to manage this and your launches would be awesome! 😀"
13,Rami D.,"April 26, 2018",5,"Overall great package I’m a huge fan of PH it’s the number one thing I do as soon as I get to my office in the morning, the app is fast and pretty easy to get used to but there could be some improvements in the navigation system sometimes swipes as misinterpreted :( "
14,jdavini,"April 26, 2018",5,My goto App for all Startups! Product Hunt is an addiction and with an enhanced mobile app it further grows that addiction because I can find all the new best products and startups where ever I go!  The app is simple and that's all that is needed when I'm sitting on the toilet or even walking on the treadmill. This app helps me discover the best apps and products instantly!
15,RubenzeoG,"May 2, 2018",5,"The holy grail for makers The best part about the product hunt app is the fact that it’s well...an app! If you’re on the go and want to keep updated on the latest web apps, App Store apps, devices, platforms etc. Then it’s the best place to stay updated on the best digital and physical tech based products. If you’re a techie, entrepreneur, or just tech fiend then download the app and join the tight product hunt community."
16,André Web,"May 4, 2018",4,"The app experience Is a bit laggy and not the same as the website which I use daily. I wish you can filter out all of the apps to just showcase iOS apps on the iPhone this way you don’t have to deal with a bunch of slow loading formats instead it takes you right to the App Store. Overall I love this company, but the app needs a little work :) "
17,Joe Bruck,"May 19, 2018",2,"Memory issues The new design looks great but this app has some sort of memory issues. It runs fine on the first couple launches but then the animations will slow down like crazy. I’ll click on a product and about 30 seconds later, a jittery opening animation will slowly start. Once I force close the app it works correctly for a little bit. I’ll be glad to send screen recordings if it’ll help investigating the issue. I’m on an iPhone X so I didn’t really expect to see performance issues with a simple app like this. Hope it gets fixed."
18,Ian1Dlover,"October 17, 2018",3,"Good but needs fixing... Product Hunt is a great community for finding the next big thing whether it be apps, websites, products, etc... however the latest update isn’t too great; the looks and functionality is fine but I’m constantly logged out every single day and I constantly have to delete the app and reinstall because It crashes and won’t open. I’ve gone to using using the mobile site because the app has been so buggy. PLEASE FIX!!!"
19,omarooh,"January 20, 2019",1,"Disappointed Long time PH user here, sad to say that I am extremely disappointed in PH mobile. Since they redesigned the app, it seems like all the functionality went down the drain. There’s barely anything left to do on the app, as a matter of fact, why do we need the app anymore? Why can’t I browse categories? Why can’t I view my notifications without it flickering and never showing me the notifications? Why do some products never load even though I’m certain I have a stable connection. So much wasted potential here. Will uninstall until they release a new version."
20,Eddie A Rodriguez,"April 25, 2018",5,Slick! Love that everything was streamlined. There's so much to see and browse through when it comes to the products and the app is built to get out of your way and let you explore. I do wish though that force touch would work though.
21,mattmetrovich,"April 25, 2018",5,"Awesome app. Product Hunt keeps on surprising me: they carefully listen to the feedback from the community and the user experience of this new mobile app is the digital proof of that. With a clean design, great UX, the right amount of features to discover products quickly on my daily commute."
22,SirJconny,"April 27, 2018",4,"Love Product Hunt, but mobile is now limited. I love Product Hunt, but lately the mobile version seems to be limited. It’s seems you can no longer search by categories, and now the search is only for a specific thing. Still, I love product hunt and I love browsing for new things!"
23,Evan Palmer,"May 30, 2018",1,"Garbage, barely usable The new design is nice and all but the tradeoff here is a significant one - performance. The app freezes regularly and the card view often takes double digit seconds to load, if it loads at all. View refresh requires a force kill more than occasionally. The list goes on but, at the end of the day, the application is broken."
24,ZeroDrek,"September 13, 2018",2,App is full of bugs. This app used to be decent but ever since the last redesign it has been absolutely horrible. I constantly get logged out and have to sign back in via Twitter. I can’t even view my profile; Tapping my profile icon crashes the app. The notifications page is unreliable and is currently flashing like it’s having a seizure and is completely unusable. Better off just visiting the website at this point.
25,Big Appletite,"February 15, 2019",4,"Great site, not so great app I love PH. Truly. But the app is not so great; "
26,Banditiiii,"March 9, 2019",3,"Glitchy Hey Product Hunt,"
27,newillusions,"March 26, 2019",2,"Screen bumping up on scroll When scrolling down through days (today>yesterday etc), the screen will bump up when you scroll down, causing you to lose your place and need to scroll back down. The further down you scroll into past days, the more it happens. Just a quick bug report as otherwise Product Hunt is great."
28,Kguy18,"July 20, 2019",3,"Love the concept The app is great in theory, unfortunately it doesn’t persist your location in the scroll view so when you hit a product and then go back to it you have to scroll back down to where you were previously. Would love to not have to do that. Also, a fair amount of network errors pop up - on wifi and LTE. Other than that it does what it’s supposed to do."
29,Khglynn,"November 9, 2019",2,Still crashes daily Update: years later and this is still the most frustratingly unstable apps I use.
30,hawluchaa,"April 25, 2018",3,"Incredibly useful This is a great app. I’d have missed out on so many new services (and so many pre order discounts) if I wasn’t on Product Hunt. The services I’ve found on this platform have helped me immensely with my work (launchaco was a lifesaver). To the team at PH, I’d say keep up the good work, and never stop using the Google Glass cat as your mascot🐱."
31,Tobins,"April 25, 2018",5,Easiest way to keep up with what’s new! The technology industry moves at a fast pace and keeping up with where things are going takes a lot of effort. Product Hunt makes it easy to see what tomorrow’s makers are building.
32,yisrael_87,"April 27, 2018",5,"Love Product Hunt! I've been a Product Hunt user for years! I don't even know how many of my most loved apps were first discovered on PH. If you're an early adopter or someone who loves great tools, you definitely should check it out!"
33,itzel yrv,"April 28, 2018",5,"The best app to discover new tech products PH is an excelente place to keep up with the latest products on the tech scene. Also, you can publish your own product and receive feedback from the community, LOVE IT!"
34,icysquish,"April 29, 2018",5,Keeps you ahead of the curve. I’ve been following product hunt for some time now and the app is awesome. I love the ratings of the app of the day and just the variety of apps you can look at in one place.
35,@shacheng,"April 30, 2018",5,"Daily rotation The PH is in my daily rotation. There’s no better place to see community support and surface the best and new digital apps, podcast, books and more. Definitely worth downloading if you love trying new things."
36,scottpenton,"May 2, 2018",5,"Must download Product hunt is the perfect app if you’re looking for new apps to try or if you are a maker of things and want to get your product out there, whether it’s an app, book, gadget or whatever."
37,KankleKobra,"May 8, 2018",1,"Cannot use on iPhone X Even with latest update. If you click into a product, app locks up and phone begins to overheat. I have to force quit the app. The app has been like this for over a month or so now and no update has addressed this issue. Multiple people have mentioned it. I have saved a safari bookmark to my home screen which works just fine and I can actually view ProductHunt without my phone overheating!"
38,nicksterdude,"May 8, 2018",5,"My go-to app every morning Do I drink coffee? No. I use Product Hunt. Discovering the best products from around the world is my favorite way to wake up every morning, and their new iOS app is the bomb dot com."
39,Ycellardoor,"June 18, 2018",3,"Love PH BUT, recent version is a problem Since the latest update, I get constantly logged out and have to keep reconnecting my twitter account. Most times the app stalls out while trying to connect to the twitter login screen."
40,TruBluNoDoubt,"April 25, 2018",1,"Basically non-functional I 😍 PH. It’s a daily activity to see what everyone is making and connect with the makers directly. The community is full of great insights. HOWEVER, the new app is down right unusable. It’s horrid in the way it loads data, locking up the UI, and making it so a 2 second interaction takes more like 2 minutes. For a team who is focused on helping people launch product people love, this is disheartening."
41,hemigirl7,"April 25, 2018",4,"Love PH App! I use PH every morning on my phone for “wake up” inspiration for the day. Love the app for quick browsing, sharing, and saving. Have it 4 stars as I occasionally experience screen load lags on iOS. But, overall, one of my fave apps!"
42,FVP!1,"April 25, 2018",5,New UI The new app UI is great and fast for navigating through new products that are launched every day. I especially like the easy way I can swipe through the products via cards. ❤️❤️
43,BeeeHoff,"April 25, 2018",5,"Part of my morning “routine” Love me some PH. The iOS app is part of my morning app checks. Overall very happy, just wish it had a bit more features inline with the website. "
44,Talbot911,"April 26, 2018",5,"For startup enthusiasts I literally look at this app or site every day. If startups excite you, this is the app for you. It’s incredible the amount of cool products I’ve found only from using this app."
45,yanirnulman,"April 27, 2018",5,Product Hunt rocks!- Product Hunt is my favorite place to learn about and connect with other makers. The tools I've found on PH are tremendous. The app makes the experience only better.
46,Lmick002,"April 28, 2018",5,"Great community for up and coming startups to gain traction If you love discovering new products and being in a community of people that enjoy creating new products, this is the app you’ve been looking for."
47,auron12233,"April 28, 2018",5,"I bet someone made it... Most of the time I’m browsing PH looking for ideas, sometimes seeing if something already exists. 9/10 times I’m late to the game but love it! The community is awesome and welcoming, a great thing to have!"
48,Mtgpix,"April 28, 2018",4,"Keep Your Finger On The Pulse of Tech If you’re trying to learn more about tech or startups, look no further. This app combined with their daily news letter will help you stay up to date on all the goings-on of the tech industry and see new trends before they go mainstream."
49,RyanRallen,"May 3, 2018",5,An awesome resource for all things “Product” Simple UX. Consistent content. This easily-digestible feed brings you all the latest Product updates you need.
50,Thehacker1245,"April 8, 2018",3,Great but missing something The app is great. Reading descriptions about the product. Upvoting if you like the product. That’s all great. But I want to see what my upvotes are and need categories like the website. The idea is brilliant but missing a few things.
51,JC7133,"April 25, 2018",5,Long timer PH user I’ve been using PH for years and love it. The new mobile app has removed the bloat and I love how fast it now is. Keep up the good work!
52,JellyyRoll,"May 1, 2018",3,"Love the app, still needs a lot of work The layout of the app is great. But it still feels kinda clunky and slow. Pages take a while to appear and lags when transitioning. Can't wait to see the improvements"
53,altafd,"May 1, 2018",5,Must-have! The only app I use to stay updated with the latest product news.
54,Dafiretoora,"May 2, 2018",5,Great way to stay on top of tech I use product hunt every day to keep up with new products and ideas people are shipping out to the world. Great daily digest
55,Sammers09,"May 20, 2018",5,Great app to stay informed! I love the Product Hunt app to stay informed and involved with daily product launches while on the go. A must for anyone who uses Product Hunt!
56,Jaykayshay,"May 24, 2018",1,"Buggy on iPhone X Buggy as all hell on the iPhone X. It’s a shame because the app is on my second home screen and I open it at least once a day, but often times tapping into a product causes it to freeze and I have to then force close+reload. Easier at that point just to go to the web page."
57,Jingle Himer,"May 30, 2018",2,"Incredibly buggy and lost all my hunts The most recent update managed to remove all my hunts I had saved and made Facebook the only way to log in. UX is a little buggy as well. Clicking on some “get it” links crash the app. The app before the update was amazing, Not sure what happened here."
58,Arthur Abadjan,"June 28, 2018",2,"Please re-design iPad Pro layout Hey guys, as for now it’s ugly with huge empty blocks and over structured in a 20% of the display. It makes it not just unattractive but very UX-unfriendly, especially upper block with photos and video."
59,ronbombardier,"September 11, 2019",2,"Frustrating Auto scrolling I use this app often, but it seems to constantly auto scroll me back to the top after I have scrolled down through a few days of product hunt results."
60,Mark Bruckert,"April 25, 2018",5,What would I do without Product Hunt? As a Designer/ Developer it is important to keep up with the latest tools and products PH is a life saver!!!
61,NAS77Y,"May 2, 2018",5,New Products in my pocket! Love it. Always a new product to discover each day and get inspired over.
62,@vitaliivashchuk,"May 2, 2018",5,Vitalii Vashchuk PM I use product hunt to observe the latest product ideas. It’s a really good place to check things on the fly
63,PGM APPS,"May 3, 2018",5,Always discovering new things Product hunt allows me to be more productive and jump on the latest trends in tech. Love this app!
64,kate.spade,"May 4, 2018",3,"Bring back old layout Not a fan of new layout. Experiencing all sorts of bugs with delays and the app automatically shutting down. I love what the app is all about, but it’s less usable since the new update."
65,Muniperez,"July 12, 2018",2,Many bugs Hey guys 
66,Ethan0320,"September 6, 2018",2,"Bad app Crashes. Makes phone get super hot. Most importantly.. as a long time fan of Product Hunt.. it is very upsetting that because I do not have Twitter or Facebook, I am not able to sign into my account on the app with my gmail account like I normally would in their website. PLEASE FIX."
67,Throwaway59003892,"October 10, 2018",3,Somewhat functional Main nav and product exploration is there but you can’t create collections and notifications are totally broken and keep glitching in and out with the placeholder graphic. +1 for dark mode!
68,hunterrams,"November 21, 2018",3,App needs improvement for a really great site There’s no Google sign in and finding the actual discussion page is confusing. Overall I love the site but this app needs improvement.
69,Icons8,"February 5, 2019",4,"Love it as a maker and as a consumer But please fix the commenting. When I type on my iPhone, each letter appears for a split second, than erases itself."
70,BrownManUPS,"April 27, 2018",4,Everyday usage! I really enjoy PH as a regular destination on my phone. It's cool to be inspired by what is put out there and really fun to give feedback to founders just starting up. Great stuff!
71,Cloud light,"May 1, 2018",5,Comfortable app to check PH from mobile. I like simplicity of user interface and how good it works. All what I need.
72,ahmadao,"May 2, 2018",5,Great App Product Hunt is the place to learn about new cool things. It helps keep you up to date on all tech stuff!
73,Smurfbra,"May 2, 2018",5,"Useful I use Product Hunt adds to google chrome, and this app is very similar. Well done!"
74,Misschellyyyy,"May 2, 2018",5,Best thing since stumble upon Product hunt is a great place to find new companies or get traction if you’re a new company. :)
75,ClemCaza,"May 25, 2018",2,"I love PH... but the app is too buggy... I can’t seem to be able to load the hunts, it stays on a black screen. iPhone X, and I’ve even deleted/reinstalled the app.."
76,"Clark W. Griswold, Jr","June 2, 2018",2,"Still unusable. Huge PH fan. But this app is, at times, completely unusable. Don't bother tapping for details or upvoting from the main screen– they can take as long as 2 minutes to actually show up."
77,Celi95,"February 27, 2019",3,Keeps Crashing Love this app but disappointed because whenever I click on my profile it immediately crashes:/ ?
78,Inevitable79,"June 1, 2019",1,"Must have Twitter or Facebook If you don’t have a Twitter or Facebook account then you cannot use this app. And I have neither so I am going to delete it. It looked like it would be nice app, but I don’t want a Facebook or Twitter account...So it’s useless for me. Life is hard enough without the drama that those 2 apps bring."
79,Jfitzsonjeezy,"September 5, 2019",3,App is Glitchy When I go to my notifications the app starts glitching and does not let me see what notifications I have. I tried removing and reinstalling the app but get the same issue.
80,dpalmer492,"April 25, 2018",5,Easy peasy I enjoy the new update. It's simple yet effective. I'm not looking for super custom feeds. I just want to see cool stuff. 🤘🏼
81,anmolm1996,"April 25, 2018",5,App update The updated app works so much better
82,vicjaq23,"April 25, 2018",5,Best place to learn about new products Love the feeling of contributing and learning from new product launches!
83,stevekillington,"April 26, 2018",5,So handy I love the new updates. It’s so much faster. I really appreciate that it syncs too! Well done.
84,JessePinkman1,"April 28, 2018",5,"One of a kind As a app developer/product designer, this is the place I love to visit every day."
85,Hameid fay,"April 28, 2018",5,Best App for all startups You will find the perfect community for your business
86,Go_Broncos_16,"May 2, 2018",5,"Great way to track latest products Good design, awesome company, great extension of the website."
87,jarradw4,"May 2, 2018",4,Where I go for the latest! Love the new app to stay on top of the latest and greatest. New design is much easier to navigate!
88,Mark__m,"November 1, 2018",5,Product feed Make up your mind
89,kevbot123,"April 10, 2020",1,Scrolling is completely broken The app will not scroll back further than 2 days without re-loading the same day’s content you’ve already seen. Completely useless.
90,ChadwickSwenson,"April 11, 2018",3,IPhone X keep locking up ui I like the new design and swiping between products but it keeps becoming unresponsive to my touches when I browse.
91,Healthledger,"April 25, 2018",3,"It’s alright Sometimes slow, going through cards it buggy. Would appreciate LastPass integration too."
92,Anup D,"May 2, 2018",5,Love it As an entrepreneur I love seeing what other makers are up to and the energy is just amazing
93,Alexy00119,"May 2, 2018",5,"Ocean The latest, coolest products that can inspire you. Also the best place for constructive feedback at scale."
94,mattdaymon,"May 24, 2018",1,Buggy and Slow This app has some issues that cause it to become unresponsive nearly every time I use it. It’s a far worse experience than using the web version. Please fix it.
95,samueldrozdov,"August 21, 2018",1,Misses all the little things I love Product Hunt but the app continuously fails at the little things providing a frustrating experience. Some examples:
96,shkl96,"September 4, 2018",1,Barely works now Love the app and the community. However with the latest update the app never stays logged in and this makes it nearly impossible to use. Sad to see an app that was once great become barely useable.
97,FAppleUsernameRestrictions,"February 18, 2019",1,"Buggy Just signed up for an account. Pretty bad experience full of bugs. Don’t care for having to log in via desktop, and the mobile view is restrictive on what you can do anyways."
