index,author_name,review_date,reviewer_ratings,review_body
212,JTzou,"April 9, 2015",5,"Essential App for the Early Adopter Imagine if you could combine the newsworthy parts of TechCrunch, the quality commenters of Quibb, and the tight-knit community of Reddit into one beautiful package."
213,Donnycakess,"September 24, 2015",5,"Photo aggregegator premium Like an rss for new hints on tech via pictures, looks great on my iPhone 4 even"
214,One4skiing,"December 9, 2015",5,What a gem I use this app all of the time I'm all about discovering new things so this fits me well! Nice job on the design !!
215,Becknest,"March 22, 2016",5,Helps me find good products This is a good app and I find new and interesting apps from using it.
216,Pallavmac,"May 14, 2016",5,Amazing App And Great idea This is a really great app to discover new apps and technologies as well as submit your own! Very interesting and insightful!
217,TwiApp,"August 24, 2016",5,Great app Product Hunt is great for surfacing only the best new products. The app works as well as the website.
218,Matt zamat,"February 28, 2017",5,"Great app Use this very frequently, would recommend to anyone"
219,Jugutier1,"December 12, 2017",2,Can’t change profile picture When I tap on my profile pic I only see a cat thing but it doesn’t let me upload a picture... really? From the browser it only allows sync with twitter
220,Scottallen541,"August 21, 2014",5,"Finally! I've been waiting for a PH app for awhile, and this was worth the wait. Wonderfully built."
221,applefan555555,"August 21, 2014",5,I use producthunt every day at work Now I can use it on the go
222,zaphod007,"September 3, 2014",3,"Can't see comments Pretty glaring bug for such a buzzy app. Thankfully the mobile website doesn't exhibit the problem, so I am switching to the website."
223,Polaske,"September 9, 2014",5,"Great Show! Informal chats with founders, product people, and investors about the products that are catching their interest now!"
224,tony1234512345,"September 25, 2014",4,Almost perfect Great app. Simple design. My only request is a bookmark so I can save products for viewing later.
225,RigolettoFrancis,"November 11, 2014",5,"Adding Evernote widget It will be a lot nicer to integrate Evernote widget into PH so lots of fresh apps found on PH can be easily curated, listed and stored on Evernote."
226,Mattgd29,"December 13, 2015",2,Takes too long to view all of today's hunts Hunts need to be organized in a better fashion so you can read through all of them and poke through the ones of interest.
227,Mat.db,"September 24, 2016",3,"Love PH, but app is missing content The app does not have all the content you can find on their website. Hope it will change soon."
228,mDn41292,"December 12, 2017",2,Unable to log in with angel list Not sure why the app does not let you log in with angel list. Is there an update in the pipe that would allow this? You can do this on the website
229,°*•.•*°*•.Review.•*°*•.•*°,"March 16, 2018",3,"Could we add categories to mobile? The mobile app is so stripped down. If I want to browse a specific category- I can’t. Other than that, it’s a great app."
230,Babybadass11,"August 21, 2014",5,Awesome app! A big buggy but it's awesome! Huge fan of product hunt and so glad it's native now. Great job PH team and Ryan!
231,DaviddelC,"August 21, 2014",5,Must Have App! Very easy to use. Has great potential. Everyone get this app!
232,cac_80,"August 22, 2014",5,Well done Same ProductHunt flavor brought to you on the iPhone
233,Manas Vaze,"November 9, 2014",5,Real good update! Web browser improvements are great! Thanks!
234,McGarryGadGets,"April 9, 2015",5,Great company + Great app = Happy Ryan and his team are awesome and they've created something truly special for all techies! Beautiful app!
235,vahanavagyan,"May 10, 2015",1,Even 9gag keeps you on the same page Why can 9gag app keep you on the same spot regardless where you come from but product hunt app keeps pushing you to the top of the page each time you come back to home? Pls fix this.
236,Wikipetera,"July 27, 2015",5,"Great service Product Hunt is a daily visit for me, and the app is as simple and no-fuss as the web client."
237,Carter_D,"December 14, 2015",1,"New design isn't great Too many crazy images taking up tons of space. It's hard to read the text AND it's hard to see the image. I am not normally one to complain, but the old design was much easier to use."
238,Jakobthorsmari,"February 27, 2016",5,One of the app There is always a 2-6 apps that you just adore. This is one of that app.
239,Mac842,"February 21, 2018",3,iPhone X Support The reason it get down voted is because of the lack of support for iPhone X Screen. It really makes the experience poor.
240,Geoffrey L Weg,"August 24, 2014",5,"Awesome! The Product Hunt app is awesome! It's a great way to track the latest apps, hardware, and more."
241,Matt Ellsworth,"August 26, 2014",5,Seriously Addicting Can't stop.
242,Bestviral,"November 5, 2014",3,Great app but fix the Twitter login! I have to log back in with Twitter every day. Never seen login work so poorly in an app. Otherwise the concept is great.
243,Maxattack3333,"April 9, 2015",5,Amazing Love the new update! Or maybe i just love PH in general. Probably both.
244,fotobee,"April 13, 2015",3,"A query more than review... How is this different than Quirky, Ahhha, or others of that nature? Is it a more of a virtual wish list than a crowd-sourced promotion of a new product? Thanks! :-)"
245,Macunlimz,"December 10, 2015",1,"Unable to login Good update but not able to login with Twitter. It says ""encountered an error. Try again"". I was not able to login in previous version also. Time to get this right folks."
246,acbimmer,"February 19, 2016",4,Great design App could use some optimization improvements and the use of the slide back gesture.
247,Mikeccccccccccc,"September 17, 2016",5,Best new apps Easiest way to keep up to date
248,tokyoblues,"March 6, 2018",2,why’d y’all have to make it so tiny?😠 I hate it. I find myself using the app a whole lot less than I used to after the mini me print update.
249,GameHEADtime,"March 29, 2018",5,Great app I like what product hunt brings to help the market!
250,Joel Burke,"August 21, 2014",5,Pumped I'm pumped you guys have an app now! Looks great so far
251,WillCrushU,"August 21, 2014",5,Super useful Love checking this daily
252,--Wax--,"August 22, 2014",5,"Simple clean useful No frills straight to the point, find cool products. Worth the DL"
253,DotheDew2,"August 25, 2014",5,Move Over TechCrunch There's a new startup king in town.
254,BillZhuanh,"October 8, 2014",3,"Crash when click any item in trending view Pls fix that, tks"
255,chineset8kout,"October 9, 2014",3,Bug Crashes every time I try to click on a post.
256,@dannyoz7787,"April 23, 2015",5,Love I check this all day long.
257,DamienMerali,"January 29, 2016",3,"iPad Could you please make it have landscape support so it wouldn't look terrible and be awkward in the iPad, thanks!"
258,Cloud8,"September 16, 2017",3,Ok to browse but not great for editors GIFs don't play and no way to edit a post (even simple text fields) if you're a Maker.
259,Brucecris,"February 6, 2018",4,Love it but where is the support for iPhone X screens Need support for iPhone X screens. But that is the only real issue.
260,lalaalalalLay,"September 5, 2014",5,Great app well designed
261,Get. This. Now.,"October 8, 2014",5,Babies This app can have my first born.
262,nonnull,"January 22, 2015",5,Nice This app has a really simple clean design
263,mportillo80,"June 26, 2015",2,"Can't Sign In Sign in requires Twitter account. Even if you have a Twitter account and Product Hunt is allowed to use it, it still doesn't take."
264,brentcas,"December 10, 2015",3,"Lack of iPad support is disappointing The app works ok on the iPad in the tiny iPhone size, but I'd love to see it support the full iPad pro and split view."
265,Coschaos,"December 23, 2015",2,You couldn't find a better UI ????? Fire your UI designer. Such an inconvenience to go through new picture view list .
266,Carlamoralyy,"February 19, 2016",5,Amazing app! Tell everyone to get this!
267,VelvetAcid,"October 23, 2016",5,Incredible App Love the design. Love the interactivity. All in all 5/5.
268,shmarda,"February 4, 2017",1,"app of the day banner is too large it's very annoying, and takes up 40% of the screen. Is this a paid promotion or something?!? I have to deactivate it LITERALLY every day."
269,Wholedamnm,"July 28, 2017",2,I feel like a crash test dummy Great app but it takes me 5 crashes to use.  10.3 and 7 plus
270,bmullCA,"August 21, 2014",5,"Incredible Simple, great app"
271,alexiskopikis,"August 21, 2014",5,A must App for innovators A welcome addition to my home screen.
272,nbashaw,"August 21, 2014",5,Love this app Awesome source of new product discoveries
273,Terribly unlucky,"September 29, 2014",4,Excellent A great app. Just won't let me upvote. Lots of great suggestions.
274,bluerootr,"April 9, 2015",5,PH 🚀 Great for search & discovery of new products!
275,dasoccerplaya,"April 24, 2015",1,"Doesn't work Was unable to download, now crashes every time I open"
276,ceo12345,"December 10, 2015",2,Pics take up too much room Way too much scrolling now
277,JuanGMartinez,"March 26, 2016",5,Amazing! Cant Stop Product Hunting!! Awesome team!
278,mi4aps,"October 18, 2016",5,"keep calm and producthunt it's been years. everything's fading, still we're gonna hunt according to the plan."
279,junyor,"March 5, 2018",1,"Upgrade? Someone should have decided if it’s not broke, don’t fix it. This new version is slow, cumbersome, and buggy."
280,@user.review,"August 21, 2014",4,Good to have an app! It's great to have a product hunt app!
281,Cr@zyG4y,"August 21, 2014",1,App is crashing It is crashing while trying to sign up.
282,MKKK1986,"August 24, 2014",5,👍👍 Perfect ! just what i was looking for ... Goodluck
283,airjer,"October 9, 2014",1,Crashes Can't open any product description on newest update. Crashes every time. iPhone 5 7.1.2.
284,kangaroo5383,"October 10, 2014",1,Crashes... Every single time. Completely not usable... Can't click into any descriptions...
285,Benjyork1,"April 12, 2015",1,Trash and more A very bad app I give 1 star because I can't give 0 but this app is very annoying and confusing trash.
286,jgwidmer,"December 10, 2015",5,"Great app, great website! I love it"
287,MidnightFuzzy,"January 5, 2016",1,Bring back the old UI This new UI is so bad. The old list format is so much better. Product hunt is not Pinterest.
288,Brimon,"June 23, 2016",5,Great app Perfect way to find cool kickstarters and fun apps.
289,i.33,"September 29, 2017",1,Worst app DELETED! From notifications sent me directly to their fb page without asking. This app is a trajan horse. Fake links.
290,The bird5199,"September 1, 2014",1,Can't log in The app seems awesome but I can't log in!! If they fix that it would be great
291,zacbdct,"October 25, 2014",2,Can't stay logged in I continually have to re-login to Twitter
292,Loboelduro,"November 16, 2014",1,I don't use social media Can i just login without Twitter using a regular email i don't use social media
293,PhillyFanBoy,"April 9, 2015",1,App won't even let me try to log in Bizarre.  App won't even let me try to log in. What's up with that?
294,person12,"June 17, 2015",1,"Only one way to make an account... And it's Twitter. Not everyone has or wants Twitter (me), so one cannot make a profile."
295,filiptheo,"December 16, 2015",1,Can't login Can't login to vote so the app becomes useless. You need to fix that asap!
296,anthonyb342,"February 8, 2016",5,Works well! Lovin it
297,karthik93,"March 31, 2016",1,Crashing 😢 The app just opens up and crashes on iPhone 6S Plus running iOS 9.3. All I see is the logo! :(
298,Nikkidkat,"August 16, 2017",1,I love Product Hunt but App won't open I hope U fix this. I was curious how this would work on my IPad. So far it doesnt.
299,scfscfscf,"March 3, 2018",2,Update is buggy Sadly this is a regressive update for a once very useful app.
300,gentlemanbasil,"August 27, 2014",5,PH FTW Beautiful App. Great experience!
301,HoustonDebate,"August 27, 2014",5,Fantastic Love it.
302,Tim Sanchez,"August 28, 2014",4,Good start Please please please add integration with Instapaper and/or pocket.
303,Russ Smith,"April 9, 2015",5,🍹🍹🍹🍹 With so much drama in the LBC It's kinda hard bein Snoop D-O-double-G.
304,HeartacheAfterHeartache,"April 14, 2015",4,Animations are making me dizzy Overkill.
305,Clicheid,"April 18, 2015",1,Super buggy Lots and lots of bugs
306,Lzhang39,"July 8, 2015",5,"Amazing Awesome app, love it!"
307,Amahi,"December 20, 2015",1,Closed community Could not get to comment. Looks like a circle jerk of self promotion
308,Rostyys,"December 22, 2017",3,No iPhone X support Please update.
309,Ayoola John,"March 28, 2018",1,Can’t login via Facebook Can’t shake to submit review either.
310,whoopwhoop1994,"August 21, 2014",5,Wow Perfect!
311,nikunjk,"August 21, 2014",5,Love PH Great app
312,Ben Broca,"August 21, 2014",5,👌👌👌 🙌🙌🙌😏
313,cd0419,"February 20, 2016",1,Landscape mode Landscape mode needed for iPad
314,Bagabooyou,"February 25, 2016",4,Good design! Love it
315,GabrielLewis,"March 26, 2016",5,Love this app :)
316,Scott22,"January 22, 2017",5,Great app Great app
317,Mista Genius,"April 13, 2017",5,Great App Best APP ever!
318,Trash Giver,"March 7, 2018",1,Trash Update is trash
319,fauxfamous,"March 27, 2018",1,app app crashes on search bar
320,DashHudson,"October 8, 2014",5,Love Product Hunt Discovered Product Hunt when @byosko added @dashhudson. We saw amazing engagement and connected with some fantastic early adopters. Love the mobile app. Clean and simple.
321,guntherpea,"April 11, 2015",3,"Yeah, love the app, but it won't let me login So all the stars go for what the app is. Love finding new product. Easy rating: 5 stars. "
322,The Magical Mr. Bray,"January 9, 2019",2,Major bugs! Your contact support in app doesn't work and when you log in with Twitter it connects you incorrectly. I can't change the username to match my Twitter handle and whenever you select my product hunt user name it links to a completely different account than mine. I've also been a member for over 3yrs so this isn't a new user issue.
323,GGarnhart,"January 18, 2019",2,The best website has the worst app I love ProductHunt.com. I’ve been using it for 3-4 years and have found hundreds of intriguing ideas and projects to follow. 
