index,author_name,review_date,reviewer_ratings,review_body
56,DaddySnail,"March 21, 2020",5,"First app store review I’ve done And they are worth it. Stop shopping, Mint will take care of you. They even refunded me when my kid accidentally bought an extra year plan. No fuss. Great customer service. And offering unlimited data for no extra charge for COVID-19 is just the icing on the cake. Keep up the great work guys."
57,VMP74,"March 2, 2020",2,Bugs For the past month or so I have not been able to do anything on the app. At first it wasn’t allowing me to change payment or plan options. Now it’s not allowing me to sign in. It says that I have an incorrect password or account. After hitting IForgotPassword it tells me that it doesn’t recognize my phone number. I went to the mobile site through safari and was able to login just fine.
58,Cocoa 1966,"August 18, 2019",5,"New to mint This service is awesome, I haven’t had any problems , you just need to have your account number and pin ready and know the business hours of the carrier you are leaving and try to port at least a week prior to the end of your cycle, all these things keeps it simple. I AM ONE VERY SATISFIED CUSTOMER, THANKS MINT FOR THE FRESHNESS."
59,Boh3180,"August 3, 2019",5,"Great quality service at ridiculous price! After being with one of the major carriers for many years, I made the switch to Mint Mobile and am very pleased. Only regret - should have switched years ago!!  Keep up the great service Please!!"
60,Posh Penguin,"January 22, 2018",5,"Easy Setup Easy setup — took maybe 10 minutes. I switched from T-Mobile so the transition was seamless and no change in network, which has been great. And to think just over a year ago I was paying $100/month for AT&T. Thanks Mint."
61,Mikejc Bay Area,"November 3, 2018",5,Painless Cell Service Mint is the best cell service I have had since my first phone way back when. Performs better than my old big blue and easy to check on usage. Can’t beat the value. Love the attitude of Mint as well. They put a little fun back in life!
62,terry.mcshan,"December 29, 2018",4,"Needs just a little help, but great!!! Great service and alright app. Just wish it would keep me logged in and that it would automatically show me my data minutes. Right now you have to go out and come back to check data. Also a widget showing the data would be great. Thanks."
63,Aju1117,"May 5, 2019",5,Working Greaaaaaaat! Going very smooth for the past two weeks since I switched and ported my number. The change was without any glitch and a confirmation came within 24 hours even though it said perhaps a 24-48 hrs time frame.
64,Timmy754,"February 19, 2020",5,YES LAWD I switch from T-Mobile and I am extremely impressed at the ease of access and the service quality.
65,lazrtek,"March 5, 2020",5,"FANTABULOUS!!! I am so happy with Mint!!! I almost cannot believe it! I am saving sooooo much money I keep waiting for something bad to happen and it hasn’t. I have good coverage, no problem with calls and I am now paying less than a third of what I paid before."
66,TonyAMx,"January 13, 2020",5,"It’s awesome!!! Es increíble!!! From the first day I had the coverage and quality excellent, plus a very affordable price. I spend money on other companies with so expensive plans only because I wasn’t in a family plan."
67,T34BPilot,"July 28, 2019",5,Incredible deal! Coverage has been great. Perhaps slightly better than my old Cricket/AT&T service. Also includes WiFi hotspotting at no extra cost. Phone number transfer happened almost immediately. No regrets!
68,dlashworthjr,"March 26, 2020",5,"Great service Been with them for almost 4 years now, could never go back to any of the big four. "
69,Jjwiggy,"December 16, 2019",5,Cheap and Surprisingly Good Very affordable and the service is better for me than what I had with Verizon and at less than half the price. I’m very satisfied already and impressed with the service. At this price I’m never going back
70,Nods clan,"September 16, 2018",5,Works great!! I’ve been looking around to a cheap alternative option for cellphone service. This is far cheaper with well service anywhere I go. I recommend this to anyone who has good Tmobile service in their area.
71,Valdene.,"September 27, 2018",1,Doesn’t wok when you try renew your plan Works fine until the plan expired and I tried renew. They debit my credit card and I’m with my plan suspended for one week until now. I’ve tried call the support team and they said to me that it is a system problem and they don’t have any dead line to solve it. For me this is unbelievable. 
72,bruny gb,"January 21, 2019",4,"Basically T-Mobile T-Mobile service without the T-Mobile price tag. Not 5 stars because the price I paid initially wasn't the actual price, just the promotional offer. Havent had any dropped calls yet or spotty service. Overall good experience."
73,DME_Ski,"April 10, 2019",1,"Trying To Reach Mint Customer Service I have tried contacting Mint because I’m am receiving tons of calls and messages for the previous owner of my new Mint number.  I have not heard back from Mint. I signed up for 6 months. Bad move on my part. I do not recommend Mint.  Other family members who have Verizon don’t get this happening to them.  Also, they get better data speeds.  Don’t get Mint.  They recycle the former customers numbers sooner than LEGALLY ALLOWED."
74,jemanko27,"November 23, 2019",5,Stop wasting money on major carriers Saved money and very user friendly app that was easy to install without talking to twenty humans on the phone (talked to no one!!) and kept my phone number in a matter of minutes.
75,Lilinpha,"April 25, 2020",5,"I love the UI/UX My friend recommended me this wireless company when I move to New York City, I really think is worth it. I can’t believe I paid $65 a month for At&T last four years."
76,Bholly8,"February 16, 2020",5,Better than att It’s cheaper than att. Service is the same and you can pay for an entire year if you want to. No worries about paying month to month. Easy switch over. Do it!
77,Emulaay,"September 12, 2019",4,"Customer service could be better Tried to call for a simple question about my shipping and gave up after being on hold for 20 minutes. Other than that, it’s a cheap plan, I just started so we’ll see how it goes 👍🏻"
78,N2peq,"December 16, 2019",5,I had this set up in about five minutes It took know time to make everything work. Porting was easy. My family is saving money.  I wish we did it sooner.
79,King Me San,"January 6, 2020",5,Greatest Experience Switched from AT&T and couldn't be happier!!! It literally was 2 days after ordering and we had our sim and activated it in minutes.  No complaints!!!
80,hoagies_ma,"November 16, 2017",5,"Try Mint before buying a plan! Was interested in Mint SIM after seeing a review online. This app let's you try out their service before going all in. My trial plan worked really well, now I'm a Mint customer!"
81,nourt14,"August 25, 2018",1,"Awesome BUT!!! I am getting ready to give the 5 stars, on customer service, coverage and price until i found that iphone wifi calls are not supported. I dont understand what the challenge about making this step to earn my 5 stars. "
82,pawangill,"October 13, 2018",5,"Satisfied So far mint mobile has been great. Porting my old number took about a day and call quality is equivalent to my old carrier. Great price for unlimited text, call and 10 gigs of data!"
83,mtvses,"November 18, 2018",5,"Cheap, and good service Love mint mobile! It’s an amazing price (I use the 10gb/month every 3 months), and the service is great. Definitely recommended, not to mention I live in practically the middle of nowhere and it works great no matter what."
84,techyron,"December 2, 2018",5,Glad I switched! I was able port my number in minutes and my old service was cancelled automatically. Black Friday was a bonus. I highly recommend Mint.
85,💰✨,"December 16, 2018",4,Where’s my data I like this app because it’s cheap & nice quality but I just bought the 3 month deal yesterday and my data won’t work also when I go on the app it keeps saying account services temporarily unavailable
86,Bri_201,"December 29, 2018",5,"Great Start! Yesterday I ported from TMobile Prepaid & the transition went smoothly! My data is fast, calls are clear & all the features work beautifully. As of now Mint is the entire package & extremely happy with this."
87,y0b0y,"February 1, 2019",5,Buy it dont look anywhere else Actually one of the cheapest mobile connection you can get. No problem with reception or with international calls too.
88,Aaric55,"December 4, 2019",4,"I m still using it! Looks fine I just shift it from family mobile which is owned by Walmart, its been one month so far and looks fine and going to try more and will update my review but at this point I will go with 4 stars."
89,Personn_,"January 9, 2020",5,I highly recommend this service!! I have been using it for some time now and I can say that it is quite excellent and reliable.
90,PopoJoe1413,"January 1, 2019",1,"Too good to be true I received my sim for the &20 for the month holiday promotion and when I tried to use it, it wouldn’t work. I called Mint and they said they would have a tech contact me within 24 hours to fix the problem or they would send another SIM card. That was 4 days ago and I still haven’t heard anything. Looks like I will eat that $20 and go with some other carrier."
91,RandyRandersonman,"March 9, 2019",5,Great - Suggestion The app is fantastic! I’d love to be able to track data usage through the Notification Center. That would be helpful.
92,markbyrn,"May 13, 2019",4,"Intro Pricing Great The $45 for three months inc 3GB per month is great and it’s very handy to use on my backup phone.  The regular $75 price is too much though for that purpose, and so I’ll have to get a new another $45 SIM package if available."
93,Bigbear440,"May 27, 2019",5,Excellent service Don't know why I waited so long. Excellent service everywhere I go. I was paying one month at Verizon what I get three months on Mint. Definitely renew for the year service!!
94,Geri@,"August 7, 2019",5,Fantastic Fantastic service and price. Best bang for your buck. I transferred my number and here’s a tip. ... get your account # and any pin/ passwords used with your old carrier. My and my wife’s transfer happened instantly.
95,Joonnnahhh,"January 19, 2020",5,Perfect for me Since day one this service has been perfect for me and it’s been almost a year already with mint. I recommend it to everyone i know!
96,Go Vegan Now!,"December 22, 2019",5,All smiles Was with AT&T for more than 10 years. I’m now saving more than $400 a year for the same quality product. Thank you Mint Mobile!
97,可不可以不用昵称呢呢呢？,"September 5, 2019",5,"Recommended The coverage is fantastic. I finally got coverage where the ATT doesn’t cover, which I use before. "
98,pyneyshit,"June 20, 2019",3,Good app People on here clearly don't understand they should be rating the app and not the business operations. 
99,JSB1975,"September 29, 2019",2,App does not show phone model for trial sim. I have an iPhone XS Max and it doesn’t show this option when trying to order a trial sim. I recently upgraded to iPhone 11 Pro max and have the same issue.  App just shows iPhone X models.  
100,bleurrrrrggg,"December 23, 2018",4,Logs out! Why does the app automatically log out after every use? So inconvenient having to log in every time I want to check my data usage.
101,LawlessGear,"December 25, 2018",5,Question I really wanna use this service buy can someone tell me if this service supports esim? Do I have to order the physical SIM card first ?
102,jccbwhite,"January 12, 2019",3,"Constant Login I love my service so far but the constant need to login just to check your Data balance is a bit ridiculous, it’s a prepaid mobile service not a bank account. At least add Touch or FaceID."
103,3851Sally,"April 4, 2020",1,Horrible experience so far My phone number is now gone and I have been assigned a phone number I DO NOT WANT. 
104,Jigaboo77,"July 23, 2019",5,Real friends tell friends about Mint! This is the best deal ever!  I now pay less for three lines than I did for one.  My family loves it too!
105,VRod007,"September 19, 2019",1,"Prepaid Mobile I bought 1 whole year in advance & I am regretting it! Their mobile data speeds predate year 2000! Horrible download speed & consistency! As proof, their app doesn't have a speed tracker to tell you how crappy their speed is! I live & work near downtown Houston, TX. Other family members in same house have other company services & have no problems!"
106,sarahjhm,"August 2, 2019",1,No one is helping out I tried to reach out to the costumer service for a while now because I locked my SIM card and need the PUK. No one is responding and the chat function doesn’t work. The SIM card is useless for me now and I paid 60$ for nothing.
107,J-man7769,"January 11, 2020",5,Save money I’ve been using Mint Mobile for a week and I am happy with the quality of service.
108,omedr,"July 19, 2019",4,"Good deal until need extra data This is the best mobile service, if you surely use less than 12GB. Because for every 3GB they are gonna charge you 20 dollars."
109,Chris2topher,"September 27, 2019",1,"Very poor Customer Support Unfortunately I can’t recommend mint mobile. I accidentally activated a new number and emailed support to refund my money. 10 day later I got an email that it had been longer than 15 days and they could not refund my money. If money means nothing then go for it. Otherwise , stay away. Bad actors!!!"
110,mint mobile problem,"September 17, 2018",3,No service There is no signal for the area where I live. Especially in Laramie city. And I don’t know why our university promoted these cards to students. When I left the city among the highway then I have signal suddenly...but it’s useless.
111,Yu F.,"December 14, 2018",5,"Great app! It works the way it should, basically showing all the info I need. I’m just wondering if there’s any plans to support FaceID and TouchID for authentication."
112,Sharky09,"March 22, 2019",5,"Shoulda switched a long  time ago Works great, WiFi is as good as my previous provider,  it I save hundreds a year"
113,Apps revi0w,"April 14, 2019",5,Really good app The big telecom companies should really learn from mint how a properly functioning app should look like.
114,dsigma6,"April 24, 2019",3,"Data Counter Needs Auto-Refresh Please have the data counter refresh every time the app is opened, rather than having to tap on “Account Summary” and “Check” every dang time."
115,finewinch,"May 24, 2019",5,"Cool! Ported my number no problem, took same day. Then I like how they have you pay 3 months ahead. So far, so good!"
116,Kberna,"August 11, 2019",2,"A lot to be desired I’m a new client. I’ve been using it for almost 2 weeks and never got full bars of reception. The app is poorly made. There’s not details of my consumption or whatever. The app is just a money grabber, if you want to recharge your data. That’s all. I don’t like it."
117,Prospect of SAMCRO,"January 3, 2020",5,"Excellent price & service Plus added bonus no CONTRACTS!!! gonna be with this company 4 a long time. Highly Recommend, no bs."
118,joeygeenotes,"March 6, 2020",5,"Great service and redesign I got the Super Bowl freebie and it's been great so far. The app redesign is working nice! Will definitely extend my sevice, and highly recommend!"
119,andy martinez,"November 7, 2019",5,Great service in Los Angeles California Great plan and cheap and perfect !! Take your number with u and I like it has international plans for travels !! The one year plan 300 is good perfect!! Try it peeps
120,Bafflef,"June 21, 2018",5,"Good app, good plan Mint listens to suggestions! They fixed the app so it's way easier to check on vital account details. Thanks!"
121,Raterrific,"June 29, 2018",3,"App needs work Wish the app wouldn’t log you out after 24 hours.  Also, would like to see a widget to monitor data usage."
122,Ique0,"June 29, 2018",3,Missing an important feature i would give them a 5 stars if they support faceid login on iPhone X. i dont want to type my long password everytime i log in
123,wildBLADErunner,"October 25, 2018",5,"Great Service I came from MetroPCS and because Mint uses the same towers I saw no difference in service, but a price drop that was significant."
124,ray ciss,"December 7, 2018",1,Can no longer view. Not sure what was done but now the app has become so large that the important numbers go off the screen and you only see a part. At this point the app is useless and I would not recommend. Mint Mobile cust. service is also useless and did not help.
125,lyndatx,"March 17, 2019",1,App fails to report correct data balance The current version of the app shows data balance as 0GB. 
126,elyred121,"February 23, 2020",5,Works good Just needed a phone  without spending a whole lot of money
127,Mass log,"December 21, 2019",1,"Super slow connection After finish the limited data you can’t even browse map, pay bills, etc this is actually not affordable price. huge spending money on buying additional data two three times a month."
128,GoldChihuahua24,"March 7, 2020",1,"What happened? What happened with the latest app update. Can’t reach entire keyboard to log in, as the resolution appears to have changed and doesn’t fit the screen. Maybe because I’m running iOS 12, but still should have been tested prior to release."
129,cactushackedus,"March 15, 2020",5,Well done With version 2.0 you guys took a good app and made it perfect. You should be proud! Thanks for caring!
130,qheuoplsmndjxjskwmsskkq,"June 23, 2018",1,Cannot be activated I uploaded the application following the website instructions. My card is valid but this app says its an invalid card or billing information. I cannot purchase anything for his reason. Even sometimes before I enter the information the invalid warning occurs rapidly.
131,62hrs,"September 17, 2018",3,"Good app, Needs a few fixes App needs support for Face ID & Touch ID. Also, The reset password screen is broken, always says the passwords never match so I’m forced to reset it using the website."
132,Zpyder5,"February 26, 2019",5,"Mint Mobile! Great trial run, liked service and got 3 months with no issues"
133,Jessbar555,"April 8, 2019",5,Great service So glad I switched to mint mobile. I’m saving over $1000 a year. The app works great.
134,Flim flamin the jammin,"August 15, 2019",5,"Love the alternatives Love how there are quality alternatives to mobile carriers. This company is great. Quality service, app and easy setup."
135,Keymusic,"March 7, 2020",2,"They Ruined A Good App!! This 2.0 version that was just released is terrible. Non-intuitive layout, lots of glitches, and the new app icon looks like the “cute fox” mascot is in extreme pain, which he would be if he’s using this update."
136,BiggSexee,"April 1, 2020",5,No Compromise Lifelong Verizon customer here to assure you that there are no compromises when choosing Mint. Great product and coverage with unbeatable prices.
137,Michrick3999,"January 24, 2020",5,good value Cheapest cell phone plan with most features.
138,uddinemad,"April 10, 2020",5,Awesome I have been with Mint Mobile for a long time. So far so good. No complaints at all.
139,WhoKnowsWhatToCallThis,"November 16, 2019",3,First Time User....My error? Hi. 
140,MaxwellBC,"April 27, 2018",4,So far very pleased! Since I’m a new user gave 4 stars. May bump it up to 5 stars if all goes well. Really appreciate trial period!
141,B. Oswald,"July 20, 2018",3,"WiFi calling Cheap, but not having WiFi calling is a huge blow and super inconvenient. Do you guys know when it will be available for iPhones?"
142,benie264,"March 8, 2019",5,Great service I’m glad I heard about this on Ben Shapiro’s show. This service works great and will save me a lot of money.. thanks Fox
143,Baolang11062016,"May 13, 2019",5,Cheapest mobile plan in USA My whole family like Mint Mobile
144,Stateswimmer1,"February 11, 2020",4,"Best Carrier Besides the few hiccups with data and SMS, by far the best service for the best price. The app itself is very intuitive and easy to use."
145,Presyin,"December 9, 2019",5,"Best plans, best app Both service and app experience is very user friendly. 👏👏👏"
146,LushRimbaugh,"October 23, 2019",5,Fantastic! Works beautifully and flawlessly. A great alternative to other providers. It’s cellular... simplified.
147,TAWoody84,"December 19, 2019",4,Please add iPad support with landscape mode! The icon on the home screen ios is also blank.
148,priya- udr,"December 21, 2019",1,Review for customer service It’s impossible to port out of Mint. First they make you call customer care to get account number and it takes forever for them to pick call. I don’t know why companies use such shadow practices.
149,Trueist45543,"February 29, 2020",5,Great app Wow what a great phone app so easy to use my geraniums could use it.
150,kay_m7,"July 27, 2018",1,"Doesn’t Transfer Number It’s doesn’t transfer numbers(from another carrier) for Campus SIM cards. It just keeps trying to assign me a new number. When I called the customer service, they had no idea how to help me."
151,bandwidthoracle,"August 7, 2018",5,"Good service, good price It does what it says, and there have been no unpleasant surprises."
152,b2thew,"September 2, 2018",2,Good service no WiFi calling I like the service and the affordable price but lack of WiFi calling on iPhones will not work for me. I am switching back to metro pcs at the end of the month.
153,NateRoss,"July 16, 2019",4,"So far so good; app could be better As far as the app goes (that’s what you’re eating and reviewing here, really), is pretty good but could be better. As far as viewing plans and pricing, purchasing, activating and setting up service the app is great and very user friendly. After you have service it’s features and use are severely limited. You can check your account status and next recharge date, change your plan or buy additional data, and check your total data usage and roaming (if you use that). You are not able to see detailed data usage, text usage, call history, etc. Adding those details would make it better. I’d also like to see an in-app chat for customer service vs being limited to phone or email for support. "
154,"Effective, highly recommended","March 6, 2020",5,Never going back Best plan I’ve ever had. Great service for a great price.
155,MaxBurnout1200,"August 11, 2019",4,Lol wow On iPhone X 12.4 and I cannot get past the end user license accept screen... well guess I’m not gunna try out mint :/
156,Misakz,"March 3, 2020",5,Works as it should. No bells no whistles plain organized app.
157,moji7,"January 3, 2020",3,$ Needs more focus towards how much data minutes and texts used.
158,Mon Cheri Mon ami,"December 17, 2019",5,"Mint is Wonderfully WONDERFUL ! The representatives I spoke to help me activate my SIM , all 4 were so incredibly fun loving and very great . I thought Isabelle was very sweet , and funny , "
159,Fe-ranger,"February 24, 2020",5,Good provider no issues Use in far northern Mn with good results
160,Ra-Ca$h,"February 18, 2018",3,Add support for iPhone X plz! I have yet to try out the service but I am sure it’s gonna be really good but I’d give it 5 stars if you guys optimize the app for the iPhone X
161,Some homie,"October 22, 2018",1,DONT WASTE YOUR MONEY These guys will charge your account without your knowing and without issuing your sim card or providing any service. They do not offer any explanation for critical failures and customer service is non existent. DO NOT GIVE THEM YOUR INFORMATION
162,Fire0000,"January 16, 2019",1,Won’t let you purchase a phone plan. The app won’t let you buy a plan if you’re doing the trial period. On top of that customer service is hard to get in touch with.
163,Kevin Naruto,"February 11, 2019",1,"The app is broken. I can’t use the app to purchase the plan. It pops up saying sorry there is an error with your card. This critical part of the app and your fail to deliver, how can I trust you!"
164,Mikefrom304,"April 3, 2019",5,"Good service Good coverage Great price! Good signal in town. Great price, good service! Thank you Mint!"
165,trevordaddio,"September 22, 2019",1,Horrible number transfer process 4 days and still waiting on my number transfer.  Robot customer service replies keep saying they're on it but no follow ups.
166,rhardship,"April 13, 2020",2,"UNLIMITED Mint mobile needs to have unlimited data,"
167,CrazyCheburek,"March 6, 2020",1,Old was better New update is meh
168,GAA211,"June 18, 2019",5,No problems at all. Amazed to see such azlow price.
169,Zoeyizou1999,"February 21, 2020",1,"Too many fraud calls I got calls and texts All Day long, I have to set my phone to airplane mode. This is frustrating! I don’t know who dose this number belong to before."
170,krevbot,"April 27, 2018",2,Please Keep Me Signed In My one request right now is that the app would keep me signed in. Or at least authenticate with Touch ID.
171,KCmint777,"January 21, 2019",1,"Worst Service. Intl. roaming not working. Worst Service. Intl roaming does not work. It’s been more than 3 days, but no support.I was stuck at an international airport which this service does not work."
172,letpr,"April 18, 2019",5,Great! Works perfectly!
173,DeeSprout,"May 19, 2019",5,Amazing service in NY So happy We switched!
174,Sinium,"May 29, 2019",1,Update The new update is just plainly unneeded and taking away the option to log in to your account using an email is just plainly dumb.
175,Daviary12,"December 25, 2019",1,Services is amazing but the app is very limited with information I wish the mint app had more stats on how you’re using your data
