index,author_name,review_date,reviewer_ratings,review_body
176,Skye Clayton,"November 5, 2019",5,"Best. Carrier. EVER. Very good service, WiFi calling and many more!"
177,Shukang Y,"March 11, 2020",5,Nice User Experience Really nice UIUX and customer service.
178,chibzly,"March 7, 2020",1,"Icon? App is much improved, but make the icon cute again you monsters. I’ll make this five stars."
179,Geeluh,"March 22, 2020",5,The Best NETWORK!!! Love mint and have been spreading the word!!
180,_gilberti,"February 15, 2018",5,I love this app!!! Please update for iPhone X! Beautiful app!!
181,o0capgirl0o,"May 11, 2018",5,works for me! i started mint 2 months ago and live in nyc. since it’s a big city it works out great for me. im satisfied :)
182,krnndjh,"May 27, 2019",5,Cheap and works ...
183,My app review omit_hassan,"March 1, 2020",5,Fire One word and that word is fire🔥
184,kittykatt8088,"November 16, 2019",5,"Mint is magic Love the freedom, love the price, love the service."
185,godsmyauthority,"November 4, 2019",5,Love mint$$ Excellent service! Thanks for the savings!$$
186,fjfmtoweotl,"July 31, 2019",5,Yeah do it Fire service. So cheap.
187,digbynda,"June 27, 2019",5,Great Best service for the price
188,ReggieBoohoo,"January 13, 2020",5,Awesome cost Awesome service great price
189,Jc kick just,"June 30, 2019",3,No 1 month plan is an absolute joke See title
190,Metalrate,"May 3, 2018",5,"Review Works great m, Touch ID will be awesome"
191,Al Laz,"September 21, 2018",1,Wi-Fi calling It is still not working with iOS 12. Upon registration E911 couldn’t verify billing address.
192,ericoff,"November 8, 2018",3,FaceId Needs face id. C'mon now
193,BReaLovely,"November 23, 2018",4,"Great Cost/Cell Service Outweighs Challenging Customer Service REVISING MY REVIEW: Mint finally stepped up to the table and everything was rectified. The run around with customer service and the unfortunate reality that 1 in 5 customer service reps really know what they are doing, that is the reason I am not giving 5 stars. But for as little as you pay for their, service it works great as long as everything functions smoothly and you don’t have to call Mint, you will remain a happy happy customer. "
194,Dshammm,"December 31, 2019",5,Great Love the service
195,Bovard Chen,"September 10, 2019",5,Cheap and Good Service as title
196,guoexploit,"July 10, 2019",1,Get stuck and do not work. Get stuck and do not work.
197,why do i need a dam nickname ?,"November 15, 2019",1,No Decent provider. The app doesn’t work at all.
198,SouthCaliBoy714,"January 28, 2020",5,A+ Switched and no regrets.
199,nztohi,"March 6, 2020",1,Worst icon ever. App functionality is ok.
200,Akki_patel,"April 21, 2018",1,Support iPhone X resolution Title says it all
201,snorthort,"August 28, 2018",5,Mint is great! Mint is great!
202,BrianRacer,"March 4, 2020",5,SWEET DREAMS NOT TO WORRY ABOUT BILL ANYMOREEEEE!!!!!😂
203,selat24,"October 5, 2019",5,Excellent plans Excellent plan rates and service
204,S Hayman,"March 28, 2020",1,"Hidden fees The app has a lot of glitches, it took multiple tries and even deleting and reinstalling this app multiple times before finally successfully getting my phone up and running. When ordering the “try the service” SIM cards, I ordered two, was charged for five, and actually only received three. I emailed the company and explained what happened. I was told that as long as I have the numbers off of the SIM cards I could get a refund. Well I can’t produce SIM card numbers for something I never received. As stated earlier I ordered two, was billed for five, received three. When I signed up for three months of service (after finding that the service coverage for my area is truly great) they slipped in a $6.25 “”recovery fee”. That was irritating, I mean it’s a pretty sweet deal to get three months service for $45.00 so be honest and tell me from the beginning it’s really $51.25. It’s still a sweet deal to get three months of service for $51.25 and I’d have more respect for an honest up front way of conducting business. After all the little hurdles I’ve had to get over, I’m still happy with Mint and it is going to save me a small fortune. Over the past two years I’ve gone from paying AT&T $700 a month to paying Straight Talk $45 a month to now paying Mint Mobile $51.25 for three months!! Not bad eh? And the service with Mint has AT&T beat by a landslide!"
205,pschotic panda,"February 20, 2020",3,"Works great, but could be better I enjoy the service enough to say I’d recommend it to someone, how ever service can be a little spotty, I noticed that it refuses to load certain apps. I can watch YouTube using cellular and have no lag with 720p quality. But on apps like letgo I sometimes need to message people on the go, my mint service couldn’t be bothered to even try to load the app. I also noticed that at times people have trouble hearing me on their side. Before I transferred to mint Mobil I had no problem with people being able to understand me. It would appear the issue is only outgoing as I can hear the other person clearly. Overall it’s very good for the price, I’d recommend it to someone who wants to save money. However if you need your phone for a living such as business or contract work I’d keep to the big guys for sake of making sure people can understand you let alone hear you. Of course this could be an issue with my area.(Tulsa, Ok)"
206,FilmWonder,"January 30, 2020",1,"Scam They send you a text saying you used 80% of your data.even if you turn off your data, turn off your phone, or remove your SIM card the moment you turn it on you will get a message that you somehow used all your data.if you reach a supervisor they tell you well you only paid x amount so get over it. Or if you try the trial version you need to download the app which makes no sense because in theory you don’t have a phone plan that’s why you purchased their SIM card so how would you have data to download an app???? Complete scam -D on the Better Business Bureau if you need further verification"
207,joonaskristian,"January 18, 2020",5,EXCELLENT CUSTOMER SERVICE DANGIT!! SIM NOT COMPATIBLE. 
208,Fishahoy,"January 7, 2020",5,"Pretty Awesome I was skeptical at first, after researching it I found that it was the cheapest option out there. I even talked to the Best Buy mobile person trying to find a cheap plan; he even was astonished at how inexpensive it was. After using google fi for a bit I decided that Mint mobile was worth the inquiry. I love it, the signal and data have a great connection. If your looking for an inexpensive plan, then I suggest trying this."
209,Bmyqteepiedj2,"December 25, 2019",5,"Woo Hoo AWESOME I really LOVE Mint Mobile! I have not had one single or multiple issues with this phone service. I was paying over $80.00+ at AT&T for 12GB Unlimited Talk and Text now I only pay $25.00 a month for the same thing!  Only $300 per year opposed to around $960 to $1,000 a year that’s a BIG difference. No drop calls, no static, or sounding like your in a hole! Clear service. I’m so glad I found the fox! THANKS A BUNCH MINT MOBILE KEEP UP THE GREAT SERVICE. 10’s across the board. ;o)"
210,Dyne540,"October 1, 2018",1,Abysmal data speed .01mb/sec no ticket response In SF land of 4g lte. Service can’t load a website like Wikipedia. 
211,Twofiveking,"December 22, 2018",5,"I can’t wait to tell ATT to F off. Jesus 25$ a month seems unbelievable 10gigs a month is plenty I’m using 9 to 11 gigs now for 65$ a month on an unlimited plan with no hot spot. I even called ATT and said unless you renegotiate my price I’m leaving he couldn’t do a thing. I’m looking forward to getting my SIM card. It’s about time there’s a company that’s reasonable. I remember the days when sprint would charge me 25$ for a late fee. They still send me bills. Updated review 12/22/18 after 3 weeks with mint absolutely amazing service mint has saved me 40$ a month and the service works great. Att, sprint and all the other major carriers should all be ashamed of themselves for ripping people off all these years. They will all fold eventually and I won’t feel bad one bit."
212,frustrated_customer1343,"February 13, 2019",1,Does not work in western Illinois I was very excited to try this out however my zip code in Illinois is not served which makes Mint useless here.
213,赫赫赫赫,"March 17, 2019",3,Buggy. 4G LTE balance on iOS app now shows 0 Android app and web site both show the correct amount.
214,Jccmd11,"April 20, 2019",5,"Great service I had ATT, and it was $1350.00 for 2 lines, for 15 months. Mint cost $450.00. $900.00 savings, you have to pay in advance. 3 months and the renew at 12 months. I haven’t found any difference in service. You Keep your old numbers, that’s 3 gb on each line , talk and text all free. Awesome!!"
215,Geno Orl,"May 4, 2019",5,Service I switched to them porting my number over took less then 10 mins service is good spotty some places just like any other service prepaid but overall had them for a month and no disappointment here at all.so give them a try they have a trial so you have nothing to lose.
216,anon113399,"May 5, 2019",3,Great sevice. But Annoyed by few things You guys have great service at really cheap rates. Probably would have given 5 stars if it wasn’t for these annoying things. 
217,saintranger,"June 6, 2019",1,"New to Mint Mobile I switched cell phone carriers to Mint Mobile a little more than a week ago, it’s online only process is streamlined and functional. Initially service worked fine for my needs but lately l’ve notice a delayed response and buffering while trying to review home security videos. There app doesn’t include a means to communicate customer concerns or problems with Customer Services."
218,taqitasliya,"September 12, 2019",5,MB This is way better than Verison and ATT.   Until now I have never had four bars At my house and I live in Silicon Valley. Before Mint Verizon was the only one that worked out at the ranch where my horses live in case of emergency.
219,srulinax,"August 15, 2019",1,"Dumb app and tricky service provider There’s absolutely no necessary info into that app. Nothing that I couldn’t do through the website. Even Touch ID is not yet invented! And Mint service all together is very questionable. I had a kinda few different providers before and I know what 12Gb of data is. I barely used 7Gb a month on my previous plan. Here Gigs are melting with unbelievable speed. Cmon I don’t even stream any music, just some WhatsApp email and 5-10 min YouTube a day and my 12Gb ends up in a two weeks? Really?!? And same shot with roaming. Was in Canada few days. First my phone had a hard time to pick up roaming. It’s frustrating. When connection finally was established my roaming balance began to disappear even faster than my monthly data. I don’t even used it! All the time was on hotels WiFi. Small little foxy might be cute but it likes to steal your money. And you can’t really do something about it!"
220,Ipod2Guser7,"February 18, 2018",2,"No Wifi calling for iOs. I have really bad coverage when I’m in my basement or a really thick walled part of my house. Wifi calling not being included for whatever reason was definitely a deal breaker for me. But why just block wifi calling on iPhones??? You let android phones have wifi calling, I don’t understand."
221,TSo1990,"July 1, 2018",5,Great Works perfectly! But the $5 test kit on Amazon and make sure t-mobiles network works in your area. I’m completely happy with the service and have recommended it to all my family and friends.
