index,author_name,review_date,reviewer_ratings,review_body
0,Bryan Wang,"April 22, 2020",1," I've been using QQ for more than 10 years and kept in touch with my old friends. Recently it was forced to be updated to the new version. I cannot login without link it to my phone number which I don't remember. It has been more than 10 years. Too bad. Why cannot I login by username and password as ...Full ReviewI've been using QQ for more than 10 years and kept in touch with my old friends. Recently it was forced to be updated to the new version. I cannot login without link it to my phone number which I don't remember. It has been more than 10 years. Too bad. Why cannot I login by username and password as usual? Actually I can login, but cannot send or receive any messages. I hope the next rev would fix the bug."
1,Daisy Wiratama,"April 14, 2020",1," it is helpful for my online learning but this app gets error for several times and I don't know why. Whenever my qq is error, I restarted my phone, but nothing happened. It's written that my connection is poor, but at the same time I can use other chinese apps like wechat, chaoxing platform, and moo...Full Reviewit is helpful for my online learning but this app gets error for several times and I don't know why. Whenever my qq is error, I restarted my phone, but nothing happened. It's written that my connection is poor, but at the same time I can use other chinese apps like wechat, chaoxing platform, and mooc perfectly without any connection problem. This app sucks"
2,Yu Zhou,"April 22, 2020",1," The app kept displaying ""network error"" while my other apps are working perfectly. Everyday I have to uninstall the app and reinstall it so that I can receive new messages from friends. Terrible experience."
3,Xin Qiao,"April 23, 2020",1," Always connection error. I cannot receive or send message. But at the same time, my other applications work well."
4,Rachel Poh,"April 16, 2020",1, Can't sign up or register at all. I had use 4 or 5 different phone numbers to register and its shows that the phone number isn't safe. Please solve the problem
5,Vincent Teo,"April 24, 2020",1," last update has been very laggy for international users, where messages unable to load no matter how many times you refresh."
6,guo caroline,"April 19, 2020",1, Garbage! I have to uninstall and reinstall EVERYDAY cause it can't receive any messages! It always shows that I dont have internet. Thats BS!
7,Taylor Guo,"April 24, 2020",1, I have to log in from mobile QQ first in order to log in from my Mac? What a shity design.
8,alistair higgins,"April 13, 2020",1, It's all written in Chinese and I can't understand a single. There's no option to change the language and there's no way of signing up on their website.
9,hillary Chen,"April 12, 2020",1, Not sure why this app need to be so big and it has so many functionality that it fails to do the basic msg and online calls.
10,Ng Yih Horng,"April 18, 2020",1," Cannot register the account, it says phone number not safe on foreign country. Bad app"
11,DIAC Z,"April 18, 2020",1, Always can't receive messages even reboot the app. Plz fix it soon
12,Tadokorovsky,"April 18, 2020",1, Can't connect to the network after latest update
13,Xicheng Li,"April 11, 2020",1, Really bad interaction experience with the latest version.
14,Thet Lwin,"April 24, 2020",1," After update the new version, unable to send message. Please help"
15,Wai kay,"April 16, 2020",1, After this latest update can't receive any message
16,rangga mait,"April 12, 2020",2," I want to register but can't because I have to have friends who are already registered, but I don't have one, please help"
17,B • 20 years ago,"April 24, 2020",2, I don't know why my phone number is 'risky' and I don't know why it keeps on refusing for me to make an account. Does it have something to do with the fact that I live in the states? Or can u make an account for me I really want to try out the Chinese pubg
18,わたしわ웨이,"April 20, 2020",1, It's very useful for online learning but now I can't see all message Pls develop for exchange student and I will go back to give 4 or 5 star
19,eric too,"April 14, 2020",2, Why cannot use in English because I don't understand Chinese thank you so much
20,Zhengyang Wang,"April 22, 2020",1," keep losing signals recently, can't send messages"
21,syed zeeshan,"April 22, 2020",1, Why you removed english version😡
22,Chepor So,"April 23, 2020",1, Can't even register.
23,Gordon Lei,"April 17, 2020",1, pretty bad experience after i upgraded the new version
24,Fan Yang,"April 19, 2020",1, not working any more it seems
25,Robert Chai,"April 18, 2020",3," Hi, its now working properly on my samsung note fe"
26,Stanley L,"April 16, 2020",1, The new version broke the app
27,Sung Sian Jong,"April 23, 2020",2," Something is really wrong and I don't know why. I have encountered the same problems like people below. How come suddenly I don't receive any notifications? My data and internet connection are very strong. I have deleted and re-download it for 3 times. This is absolutely a BUG. Please solve this pro...Full ReviewSomething is really wrong and I don't know why. I have encountered the same problems like people below. How come suddenly I don't receive any notifications? My data and internet connection are very strong. I have deleted and re-download it for 3 times. This is absolutely a BUG. Please solve this problem, I don't really like to keep download, delete, and re-download again."
28,oja bella,"April 25, 2020",3," if only it allow new user from outside China by email instead of phone number it would be much helpful. since every time i input my phone no. to register it keeps saying ""your mobile phone number may have security risks tested by our system. please change a new mobile phone number to register QQ acc...Full Reviewif only it allow new user from outside China by email instead of phone number it would be much helpful. since every time i input my phone no. to register it keeps saying ""your mobile phone number may have security risks tested by our system. please change a new mobile phone number to register QQ account"". Like, what the hell? this is my only mobile number for the whole of my life, and i won't using any other number just for the sake of registering to QQ."
29,Maurice Chen,"April 7, 2020",1," Every time I touches my phone on a credit card or my university card, this little piece of software will jump in and attempts to read it as a transit card. And since I've disabled location access for it, it will continually make annoying sound between location access prompt and card read failure pro...Full ReviewEvery time I touches my phone on a credit card or my university card, this little piece of software will jump in and attempts to read it as a transit card. And since I've disabled location access for it, it will continually make annoying sound between location access prompt and card read failure prompt. Very annoying. Can't be disabled. Who wants to read a transit card with a messenger?"
30,陈哲源,"April 17, 2020",1, Full of useless feature
31,Jun Kitami,"March 27, 2020",1," Why it must be fail almost all the time I register... I tried register to playing qq speed, and it always said my number has been suspicious like... What the hell?! I never been using my phone number anything suspicious while I using my phone number for other game registration never been like that b...Full ReviewWhy it must be fail almost all the time I register... I tried register to playing qq speed, and it always said my number has been suspicious like... What the hell?! I never been using my phone number anything suspicious while I using my phone number for other game registration never been like that but yet your system said so. i never been this frustrated for registering a single account to playing a game. Bad app, no community service either for reporting this situation"
32,Ngọc Tân Võ,"March 28, 2020",2," Almost apps from China are trash, this is not even a trash app. But this app is so annoying, idk why the hell a chat app needs my passport/ID information for verification ???? And they create an app with a bunch of unnecessary features that I never use. And the last time I check the app storage stat...Full ReviewAlmost apps from China are trash, this is not even a trash app. But this app is so annoying, idk why the hell a chat app needs my passport/ID information for verification ???? And they create an app with a bunch of unnecessary features that I never use. And the last time I check the app storage status, it was 2.6gb of ""data"" and 789mb of ""cache"", for a chat app ? Seriously ? I really hate this app, but I have to work with my Chinese collague so have to use this app like Skype of China."
33,Sue Minn,"April 21, 2020",1, Too slow to update
34,Jerchow Chan,"April 22, 2020",1," I have changed 4 phone number but it keeps saying that my phone number isn't safe. How can I register like that. I've tried to download from play store, app store and also from Google but still can't register. Please solve this problem ASAP. Thank you."
35,Mike O,"February 15, 2020",1," Don't use this. This used to be useful, however the international version has been removed and this mainland only version is practically impossible to get unlocked if it gets locked and demands more personal information than any country I've ever visited, starting with your passport information. Hos...Full ReviewDon't use this. This used to be useful, however the international version has been removed and this mainland only version is practically impossible to get unlocked if it gets locked and demands more personal information than any country I've ever visited, starting with your passport information. Hostile government spyware."
36,Xin Jie,"April 13, 2020",3," The app is ok, the problem is it takes up a lot of space in my phone. And I wanna move it to another device, but I can't move my chats to other device which upsets me a lot. Please add that function too."
37,Michelle Fan,"March 2, 2020",2, I've been terribly bothered by the fact that I can't use a password to login. I've reset my password again and again and I remember it exactly. But the app won't recognize it and I also hate the exploring page. I downloaded the lite to avoid it but lite won't lemme login.....
38,Dean Lewis,"March 29, 2020",3," Looks great but no English or International version, which QQ previously had for the desktop version ""back in the day"". This review isn't intended to reflect on app functionality for Chinese users. Additionally, on giving my Australian phone number the app wouldn't let me sign up."
39,David Turingan,"March 3, 2020",1," ""Stock in mobile verify"" I was consistently signing up to register a QQ account for me to be able to play league of legends wild rift here in the Philippines but when I type my phone number it always says ""waiting for verification"" like it takes for a whole day and that really pisses me off, I'm so ...Full Review""Stock in mobile verify"" I was consistently signing up to register a QQ account for me to be able to play league of legends wild rift here in the Philippines but when I type my phone number it always says ""waiting for verification"" like it takes for a whole day and that really pisses me off, I'm so done with this app, such a waste of time!"
40,Notagood person,"April 5, 2020",3," I don't have any friends so I don't use this app often but I have this app because very often other Chinese apps will ask us to login so I have QQ to log in to other apps. Overall, pretty good,can still improve."
41,Muhammad Nur Fajar,"February 2, 2020",1," Before this apps really useful but i forgot to change permision number phone when uninstall (update os) i know the password but no way to change or get in there espesially i'm the user of the account, thats really awful i think | i'm the user but the system still detect i'm not the user of my accoun...Full ReviewBefore this apps really useful but i forgot to change permision number phone when uninstall (update os) i know the password but no way to change or get in there espesially i'm the user of the account, thats really awful i think | i'm the user but the system still detect i'm not the user of my account | i can login with my password but can'nt change my number phone easly so i cant use that qq anymore"
42,Josh Si,"October 31, 2019",1," There is an annoying feature/bug that will constantly require permission to use current location. However if it is turned off, the dialog box just consistently jumps out and you won't even have a chance to fix it unless you go to settings and force it to stop. Jesus, if I don't want to give you such...Full ReviewThere is an annoying feature/bug that will constantly require permission to use current location. However if it is turned off, the dialog box just consistently jumps out and you won't even have a chance to fix it unless you go to settings and force it to stop. Jesus, if I don't want to give you such permission, could you just shut the f*** up? You can simply tell me that I won't be about to use that feature and let it go without constantly asking me to change the setting, I don't want to!"
43,Valen††a Ꮍʊʀɨ,"February 17, 2020",1," lol you don't use this app except if you work in China which essentially needs it, it sucks compare to telegram, violate & spying your activities and notifies LOTs Ads, Tons of unnecessary stuffs. It's basically a malicious spyware background by CN gov. However it's a cleaner also cutted version com...Full Reviewlol you don't use this app except if you work in China which essentially needs it, it sucks compare to telegram, violate & spying your activities and notifies LOTs Ads, Tons of unnecessary stuffs. It's basically a malicious spyware background by CN gov. However it's a cleaner also cutted version compare to mainland, international qq is less intrusive but also cannot modify even some basic settings."
44,Amelia Tan,"March 15, 2020",1," When I tried to register an account, it told me that it requires the newest version to work. So why should I download the app when I can't even use it? I've tried another way, which is to download the app on QQ's website. I went through all the steps to register, and reached the step which I was ask...Full ReviewWhen I tried to register an account, it told me that it requires the newest version to work. So why should I download the app when I can't even use it? I've tried another way, which is to download the app on QQ's website. I went through all the steps to register, and reached the step which I was asked to send a message to a certain number. Until today the message is still not sent and I can't find a way to fix it."
45,Teoh Kang Soo,"April 20, 2020",1, I can't receive the messages even though I refreshed it for many times! I don't know why it always say the connection is poor.
46,Karac Walker,"March 9, 2020",1, I used to use QQ international to talk to my friends from China. Now that it's gone I can't speak to them anymore. I dont read enough Chinese to use this app. QQ international used to translate for me and everything.
47,Rieno Sports,"April 20, 2020",1, Just in China languech which I can't understand and it's didn't let to login I thing it's just design for Chinese there is no registration or login option for other countries persons except China so it's sucks for foreigners
48,Fazle Rabby,"March 19, 2020",1," I'm from Bangladesh 🇧🇩. When I try to create new account it shows Registration failed Because your mobile phone number (registration behavior) was detected to be insecure, you cannot register successfully at this time. Please try to change your mobile phone number or try again tomorrow. 😢😢"
49,Sam Wang,"April 11, 2020",1," Worst update version ever!!!!! All the texts size became way larger and cannot change the size, there r very limited information can be seen on my phone since the texts r too big, stupid update!!! i uninstalled it :("
50,chengjie li,"March 13, 2020",1," When tap the NFC card, QQ will open automatically. I can't find any option to disable this function, so I can delete QQ only to solve this problem."
51,Ng Ai Wee,"April 23, 2020",1, I need EVERYDAY uninstalled and reinstalled this apps. It always show that internet is poor. But Wechat no problem. Can function as usual. Only QQ can't!
52,Robert Herkes,"February 6, 2020",4, Must install Aptiode for the English version. For some reason Google play doesn't support English versions of Foreign apps. QQ is an example. I rate QQinternational 4 stars as there is the occasional problem with videos.
53,Bailing Ma,"November 11, 2019",1," It sucks. I installed it and tried to log on, and it told me to upgrade. I just installed a second ago, how can it not be the newest version? Also you have to let it manage your phone calls otherwise wouldn't be able to use the app at all. Claims to be safety reasons. Complete nonsense!"
54,Asfand Yar Abid,"April 5, 2020",1," Description says that its an English version QQ Messenger for International users but whenever you install it, you can't even find an option to change / set English as your language."
55,Yichen Tian,"March 23, 2020",1," Doesn't work anymore, you will have to download an installer from their website and install manually, or install the update directly in the app (of course the content is not checked & protected by Google play anymore)"
56,Jiawen Yuan,"April 22, 2020",2," need to reinstall all the time otherwise it will say i dont connect to internet, but both my data and wifi works well for other apps."
57,William Wang,"March 29, 2020",1," what a fxxk app it is. you can not shut off default NFC function inside , i don,t wanna to use your fxxking wallet at all. my G pay and other NFC are affected by the terrible app every time. fxxxxxk"
58,Peter Bullert,"December 1, 2019",5," Super deception by Tencent & Google Play, hence my 5⭐ for fooling people. As I write this, the app offered here is 7.7.6 and it won't work. The current version is 8.1.8 Temporarily no international version and no updates here on Chinese version. It's called a Trade War. So catch the newest version f...Full ReviewSuper deception by Tencent & Google Play, hence my 5⭐ for fooling people. As I write this, the app offered here is 7.7.6 and it won't work. The current version is 8.1.8 Temporarily no international version and no updates here on Chinese version. It's called a Trade War. So catch the newest version from Chinese site. Please don't complain about the lingo. Try to learn it or switch to something else. Alternatively one can wait till the war is over and QQ international will be back on G-Play shelf"
59,Gabriel Okoth,"January 11, 2020",1," It gives no room for new nonchines members. Where did the English version go 😠😠😠. It's displaying text in Chinese alone, so selfish this app is. I need it but I cannot use it. Why such terms. Why limit it to the Chinese alone. Are we not people. I have friends who started using the app long ago a...Full ReviewIt gives no room for new nonchines members. Where did the English version go 😠😠😠. It's displaying text in Chinese alone, so selfish this app is. I need it but I cannot use it. Why such terms. Why limit it to the Chinese alone. Are we not people. I have friends who started using the app long ago and are still using it, but being a first time user I am limited, I don't know Chinese, leave alone speaking it. Am so disappointed with the way these people have made the updates. I hope they act soon"
60,Nour HxH,"April 7, 2020",1, I need to use it in china and yet there is no English!!!! It's horrible... Wechat has an Engliah version... Be smart and add an English version.
61,jovan ng,"October 29, 2019",1," This app is just trash, keep saying my app is not updated, but when I go to the website and register it says I need a code, what? Then I went to another one and wrote down my number to get the code, after few minutes still didn't get the code, then I tried the qq International apk but still didn't w...Full ReviewThis app is just trash, keep saying my app is not updated, but when I go to the website and register it says I need a code, what? Then I went to another one and wrote down my number to get the code, after few minutes still didn't get the code, then I tried the qq International apk but still didn't work and bringing me to its own website. Basically China app doesn't allow foreigners to use their app, instead trying to hack our account and numbers while we providing our information."
62,JunJie,"November 11, 2019",1, This app is sh** you can't even register an account because it just keep saying for your safety please download the latest version of the app and since I just downloaded it it means it should be the latest version and even I check it still doesn't have the update button IF THERE'S 0 STARS I WOULD GI...Full ReviewThis app is sh** you can't even register an account because it just keep saying for your safety please download the latest version of the app and since I just downloaded it it means it should be the latest version and even I check it still doesn't have the update button IF THERE'S 0 STARS I WOULD GIVE
63,alfred hawk,"March 30, 2020",1," First of all there is no English version available, and in this version issue in for new users in log in."
64,Kishan Mervin,"March 28, 2020",1, I just downloaded this app and it said I can only register with the newest version. Hello??? Excuse me? That's the newest version. This app is full of bugs.
65,V Z,"April 20, 2020",2, After recent update almost no connection. QR code for login on PC also doesn't work
66,Otto Tietz,"April 6, 2020",1," For one,this app sux no translation into other languages so that one can read and know what the f is going on in it. So i say bad very bad app. No star from me. Even if i have to put up a f star just to post this,it if f up to ask it."
67,evis cobani,"February 22, 2020",2," Why something this cool should be only in Chinese? If is possible do it in English! Thanks. For now everyone from China told me that this app is awesome so I want to try, but I could not understand nothing."
68,Sacrifice Prime,"April 17, 2020",3," Why is there always the older version??? There is a update notification in my app, but I still can't update it on Google play store 😠😠."
69,Syfy streama,"November 1, 2019",4, It will be better if I can sign up within this qq app itself that I don't have to download qq international from the browser just to sign up and there's another option to sign up for qq in the browser but it didn't work it says server is busy and this qq app will be better if there is language trans...Full ReviewIt will be better if I can sign up within this qq app itself that I don't have to download qq international from the browser just to sign up and there's another option to sign up for qq in the browser but it didn't work it says server is busy and this qq app will be better if there is language translation and the qq international app you have to keep clicking than only it will sign up.
70,Huai Chun Shih,"November 21, 2019",1, The app QQ can use NFC to read my credit card without permission. It's scary. Contact me if you want screen shot. Also it forces you to download the updated version from their website otherwise can't use. It's security concern.
71,Christopher Stephens,"February 12, 2020",1, Couldn't even get it to install. Error message in Chinese that flashed up too quickly for me to even get a screenshot to translate.
72,Evanceline Tang,"April 6, 2020",1," I typed my phone number in to create an account, but when I clicked next, it said I have to download the newest version?! And yet the version I downloaded is the only one in this play store..."
73,Chuan He,"November 7, 2019",1," This app will be woken up whenever you put a NFC card near your phone, which means, it blocks the NFC function of all other apps. And it doesn't have a switch to turn it off"
74,Emily See,"March 21, 2020",1, I can't even start an account. It keep asking me to use the latest updated version while I just downloaded it minutes ago.
75,Yi Jen Teoh,"April 20, 2020",1, I can't login !I tried for many times but it still doesn't work!
76,Lu Han,"April 20, 2020",1, I can't login !I tried for many times but it still doesn't work!
77,kakashi ha,"April 23, 2020",1, Why always cannot received message ?? Line problem or app issue??
78,Aimee Henrietta Hong,"February 7, 2020",1," It asked me to install the most updated version for account registration, but there is no other version in google play, what happened!!!"
79,Lim Li Hui,"November 2, 2019",2, This is bad. I downloaded this version and it still tells me to download the latest version and I can't create an account at all despite trying to re-create a new account using my phone number. This is unusable.
80,Carlee Harder,"April 1, 2020",1, I can't even create an account because it keeps saying I have to download the latest version of QQ. I already have the latest version downloaded.
81,Adis Hamzic,"July 14, 2019",1," Waste of time. Literally I have tried to create an account since the game pubg came out. I have reached out to support multiple times, never a word from them. I tried web site and the app to register. ""server busy, try again later"" is all you get. Trying over and over for a good while and it's alway...Full ReviewWaste of time. Literally I have tried to create an account since the game pubg came out. I have reached out to support multiple times, never a word from them. I tried web site and the app to register. ""server busy, try again later"" is all you get. Trying over and over for a good while and it's always the same. I used VPN China proxys, everything possible to create an account and it's just not happening. Worst is the support as they won't even respond. Don't waste your time and data"
