index,author_name,review_date,reviewer_ratings,review_body
1221,shaz,"March 15, 2019",2, How to change the display language?
1222,Abhilash Singh,"July 31, 2019",4, how do i change ui language to english from Chinese
1223,Mr Shehbaz,"February 8, 2020",2, I want QQ international. Where i can get it
1224,OGGY,"January 2, 2020",2, I am facing problem with creating account please help me.....
1225,Aloyce Kilawe,"December 8, 2019",1, i want to change language but i can't so i need help please
1226,Shah Zaib,"August 3, 2019",4," Can you tell me please in this App language is Chinese, what i do, i want English language please"
1227,Lalduat Hmunhlei,"January 20, 2020",1," What's the use of this app, if it doesn't allow you to create an account?"
1228,A R Khan Yusufzai,"August 9, 2019",1, English please. Who understands the sign language you have added. WASTE OF TIME AND EFFORT
1229,harsh vardhan,"September 11, 2019",3, Can you make the app available in English 😅
1230,Nakuru Kou,"May 24, 2019",1, why ask for a person's country/region when you still refuse to let them register anyway?
1231,5aroufy GT,"June 19, 2019",3, why QQ it's not in English language to be very simple to communicate with the peoples in china thank you for your help
1232,Ria Jade,"July 18, 2019",1, How do I get English language?? Please help its urgent!
1233,Favour Ikechi,"September 19, 2019",1, It's very difficult to use for Nigerians because you cannot translate it to English language.
1234,noob number1,"February 12, 2020",1, Unable to register from India. You suck
1235,kae Suzy,"August 21, 2019",2, I don't know how to open it But is it English version??
1236,Susi Sukaisih,"February 23, 2020",1," just have hanzi, cannot use for other country"
1237,Linda clark,"March 9, 2020",2, Want app in english please
1238,BISWAJIT,"December 1, 2018",3, How to change language... I m Indian user........ Please tell me how to change Chinese language to English language
1239,ravenmorson,"June 25, 2019",2, Please bring back QQ International!
1240,X XMAN,"November 23, 2019",1, Take too much space
1241,Thomas Gōh,"April 18, 2020",5, The connection from security China.
1242,Annieijnj Bilal,"April 10, 2019",5, i want english version of QQ but i am unable to do this. how could i? anyone plz help
1243,M Q,"March 14, 2019",1, why all in Chinese??? am not Chinese where is the dam English version ?????
1244,Jeffrey Green,"October 22, 2019",1," Emporer Xi demands all of your data and phone number and first born. Chinese dont even use this app anymore, preferring the 1984 telescreen which is WeChat"
1245,Amadin Osakpolor,"July 30, 2019",1, I don't no how to set this app please help me out I want it to be english
1246,DADA GAMER,"September 22, 2019",1, Typeing phone number from up I stumble
1247,០០ ០០,"January 17, 2020",1, Why can not sign up in Cambodia?
1248,Great Abraham Mundi,"April 2, 2019",1, it is only in chinese i cant understand a thing! qq are so jealous share it with the world!
1249,Bangulsoft Solutions,"June 21, 2019",5, please share QQ in English version link
1250,Mohammed Ijas,"June 30, 2019",5, Help me to change the application language Chinese to English.
1251,Rejuan Hosain,"September 24, 2019",1," Totally trash app,Don't download and waste your valuable time."
1252,Aadarsh Sharma,"March 17, 2020",1, You should add english language.
1253,Waqar Gamer,"April 16, 2020",1, I need to login pubg cn than I download this app
1254,Arju Ashraf,"May 31, 2019",1, y its not in english version
1255,Ronald Crane,"April 2, 2020",1, Dont understand anything and I cant find QQi
1256,Gaurang Vyas,"November 30, 2019",1, It's Chinese version how can we indian understand it?
1257,Roblox Pro,"December 21, 2019",1, Very weird because everything is chinese
1258,Satyam Chaubey,"January 6, 2020",5, Very good app
1259,A Google user,"February 25, 2019",1, hey dude i cant sing up how to fix it
1260,Alpha Bah,"April 30, 2019",1, translate it in English
1261,Imelyn Garcia,"March 21, 2019",2, How to change the language into English?
1262,oreo _reoreo,"May 10, 2019",2, I cannot sign up on it..
1263,ʀʏʟᴇᴇ ɢᴀᴍɪɴɢ,"July 28, 2019",1, HOW DO I MAKE IT ENGLISH? Please give the full instructions here for instant 5 stars :)
1264,Bag O'chips,"September 12, 2018",1, Does not sign up
1265,Sam Wan,"April 27, 2019",1, I just need a communication app. pls dont feed so much news and social media
1266,Zubair Bangash,"September 19, 2019",1," It is hard to understand now because it has all to all Chinese now , so bad for we foreigners"
1267,Trends on Tik tok,"April 22, 2019",1, this ap does not have English at all 😡 I hate it I don't even know what to say About this it is just stupid 😠 I hate it so much
1268,Gaurav Chauhan,"October 7, 2019",1, This app is totally in Chinese don't waste your time who don't know Chinese
1269,Vanja Kosor,"October 17, 2019",1, Can you please add Serbia to the list of countries???
1270,Nguyễn Thế Huy Trương,"January 9, 2020",1, Tell me update newest ver but dont tell me how to update 🙂
1271,DEVIL GAMER,"January 29, 2020",5, I give a star because I its need to be sinup
1272,Vincent Jojo,"March 31, 2020",5, Please add an updated version
1273,Drake Old,"April 10, 2020",1, HOW TO SIGN UP IDIOT CHINESE VIRUS???
1274,A Google user,"March 19, 2019",1, how to change language in qq i can not change language from chinese to english
1275,Kpop 7717,"March 1, 2020",4, How do I chang it to English?
1276,Nirav Patel,"July 19, 2019",1, there is no English language in application so we can't understand
1277,mukadome levi,"September 2, 2019",1, Where is the English version When signing in
1278,Two face,"January 31, 2020",1, Can u pls fix the server prob
1279,Josef Mengele,"April 5, 2019",1, i was just using this app in english where did it go?
1280,Samuel Violah,"February 12, 2020",3, I want english version
1281,Fazee Khan,"May 19, 2019",1," I am from Pakistan,Can I use these app,where I can find English Veraion of this App"
1282,KALPESH SOLANKI,"May 10, 2019",2, please update in English version so all can read it easy it's my big request to you because qq is very important for me now
1283,OM Eja,"May 7, 2019",1, this is app for china only?i cant speak chinese tf. why u dont build this app with international language? i dont understand
1284,Phương Minh,"July 27, 2019",3, could some one teach me how to sign in to this app 😂??
1285,aldawi,"February 21, 2019",4, How to change language to English ?
1286,Anastasiia Volkova,"January 8, 2019",1, trashy app that needs access to all of your personal information
1287,Abdnr Thr,"March 18, 2020",1, I can't find Morocco . add +212
1288,Runsheng He,"February 4, 2020",1, Where is the latest update?
1289,Fachmi Ananda,"September 28, 2018",1," I just want to play Kog but it won't let me sign up, racist app"
1290,MOHI DDINE,"May 5, 2019",1, doesn't deserve it..I just did it to show how trash it is
1291,A Google user,"October 21, 2018",5, Best for playing pubg exhilarating
1292,Vicky Dogra,"September 18, 2019",1, Not in English.
1293,ck_ style,"April 2, 2020",1, 💩💩💩💩💩that was my expirence us of this app sory i cnt loging this💩app becouse i cnt loging
1294,Imran Khan,"May 1, 2019",5, can we have in the English version plz plz plz plz plz
1295,Michael Tao,"April 11, 2019",1," why i could not use qq, until allow the permission of phone. I dont wanna share my information , tony"
1296,ទួន ដេវីត,"January 18, 2020",1, Why in Cambodia very difficult to verify?
1297,Asher 8,"November 3, 2019",2, It must have to be in english for the forigners
1298,Sluggish Hobbit,"November 9, 2019",1, I can't sign up.
1299,Julio Subrata Biswas,"January 7, 2020",1, Can't sing up from India?
1300,ChinLin Lee,"March 26, 2019",1, how to change my profile picture? why do you make it so difficult?
1301,Mohammed Helal,"September 26, 2018",3, This software is Chinese language but i don't know Chinese language please update total English language
1302,Edugie Kelvin,"July 22, 2019",1, Please how can I change my language to English?
1303,Omer Rexhepi,"April 17, 2020",1, Why not making in english?
1304,Gigi Tan,"October 27, 2019",1, I've been email to them since few weeks ago. But NO ONE'S is REPLY ME!!!
1305,HIREN Panchal,"March 29, 2020",1, Wrost apk..!! Trash.!
1306,Stanley Idahosa,"April 5, 2020",5, Taking so long to danload
1307,ritz ashwan,"June 13, 2019",1, Worst app!! I DON'T RECOMMEND ANYONE!
1308,Penelope,"July 11, 2019",2, How do you change your profile picture? Sorry but Im not given the option too haha
1309,BHAÌ THE GAMER,"January 27, 2020",2, This app is not opening plzz do something
1310,shaila Madhav,"February 4, 2020",5, Because of this app i can play game for peace
1311,Combat Affairs,"April 27, 2019",5," please I dnt know who can help me out, I need to turn my app into english"
1312,Imran Nawaz,"August 10, 2019",5, do you have English version of QQ? please reply. thanks
1313,Nisar Ahmed,"August 9, 2019",5, admin plz provide it's English version. I want it plz. regards
1314,Harry Jay,"November 9, 2019",5," Tag me, Drop your qq number let's get a group chat"
1315,Sujeet Singh,"November 20, 2019",3, Where is English version
1316,Michael Johnson,"December 9, 2019",1, Not very friendly to non Chinese
1317,roaringrook creations,"October 17, 2019",1, Software made to track you made by Chinese Communists. Enough said
1318,Adugna Feyissa,"December 28, 2019",5, Is the latest version available?
1319,karan pandya,"January 9, 2020",1, trash !!!!! total trash !!!!!👎
1320,Stark Marketing,"March 17, 2020",1, never know the use of the app
1321,A Google user,"September 21, 2018",1, I am a Pakistani and you did not give Pakistani code
1322,NoobGod,"June 13, 2019",5, It really help me to contact me to my perents and lots of my friends us this app.(≧∇≦)b
1323,Nguyễn Tuấn Nghĩa,"August 8, 2019",1, can't sign in
1324,Stanley White,"January 18, 2020",5, It been good all the way
1325,Lucy Lu,"March 8, 2020",1, Can't open
1326,Asif Shahriar,"April 5, 2020",5, This is my love
1327,DyNoX 07 gamer,"April 13, 2020",1, I can't register
1328,RAJA HINDUSTANI OFFICIAL,"April 23, 2020",4, I want English app plz give me link
1329,黄瑞见,"November 8, 2018",1, I don't want log in!!!!!!!!!!!ok!!!!!!!!!!!!
1330,A Google user,"November 23, 2018",1, It is a very badddddd app don't waste your time downloading it
1331,rida drimzi,"March 29, 2019",1, Why no Morocco contry?? Pls add +212!!!?? I can't register
1332,Suzette Ramalepe,"September 19, 2019",1," I donloaded but it uses chinese, how do i convert to english?"
1333,Rai Tallal Ahmed,"January 28, 2020",5, Wonderful Chinese app
1334,Vinayak halekoti,"October 19, 2019",1, How to change language?????????????
1335,Bobi pradhan,"February 4, 2020",1, How to create an account
1336,Maisha Hassan,"March 23, 2020",1, I can't understand anything
1337,Akashdeep Singh,"September 27, 2018",3, Can you plz launch this app in english...
1338,VENUS*ASMR TASTE BUDS YUM,"November 3, 2018",3, I'm sad wish with have this one it's more cool then the other one
1339,Anime Lover,"July 28, 2019",3, qq i dont know why i can't create an account please help😣
1340,ruddy alvarez,"September 15, 2019",2," Code area for countries like dominican republic are wrongs,dont let fix it or change"
1341,Aditya Patel,"March 28, 2020",1, Stupid application do not use
1342,JanelleVillamorLuna,"February 6, 2020",1, I can't sign up
1343,Shrinivas Deshmukh,"March 10, 2019",1, How to change the language of this application??
1344,MJ24 GAMING,"June 11, 2019",1, bad app all country name in chinese hate it.
1345,Kp Skills,"January 27, 2020",1, I will not try again later
1346,Ken Kaneki,"February 6, 2020",1, Never let me even sign up
1347,Saeed Gondal,"April 5, 2019",1, i cant look around people why is like this???
1348,A Google user,"October 28, 2018",5, I want the newest updates all the time
1349,Nolan Hutwelker,"October 30, 2019",1, Can you make one in English?
1350,Kali Muthu,"January 24, 2020",1, Doesn't open qq account please help me
1351,GAMING GUIDER,"January 24, 2020",1, Vefy hateful app in the world remove this on play store
1352,Đức Hoàng Trần,"June 8, 2019",1," It not Việt Nam, why, I am vietnamese, I not don't add"
1353,Nadia Chrissanty,"March 14, 2020",1, I CAN'T SIGN UP
1354,JAK Krause,"April 11, 2020",1, Doesn't work
1355,Regino pratama,"May 25, 2019",1, I play king of glory. however bloked it's stupid app
1356,MUSIC IS LIFE BY PRINCE,"May 11, 2019",3, because you want to put in English version please do it that wise i give you 3 marks only sorry for it
1357,Vic Lim,"October 20, 2019",1, Want to do thing can not do want to ask thing can not ask i thinking why want to use is app man...
1358,genrex Peral,"December 29, 2019",5, Can you make it in english
1359,Harshith Mardithaya,"September 23, 2018",4, I downloaded this app only for the sake of pubgm Chinese
1360,ARISH KHAN,"April 22, 2019",1, how to set English language because i don't understand chaines language please help me
1361,John Guchu,"August 16, 2019",1, I cant install this app. A waste of time
1362,Johnathan Somogmugol,"October 9, 2019",5, Those this app translate or it's just a Chinese word??
1363,Gargus Blocksfard,"June 16, 2019",1, I can tell you truly hate global users.
1364,Eleven,"May 9, 2019",1, Doesn't let me create an account 😔😳
1365,wong Love rate,"February 28, 2019",5," this app is useful, well, not so much"
1366,Prabhat Kumar,"March 3, 2019",4, I am from India I not able to make account help me
1367,Eric Money,"September 2, 2019",5, But I can't change the Chinese language to English
1368,Sigit Sugianto,"November 6, 2019",1, Please bring back QQi for international users
1369,Ruknuddin Idreesi,"December 2, 2019",5, Need a true English experience.
1370,damar ibrahim,"April 1, 2020",1, why is the language in china
1371,Shindge Wong XJ,"December 9, 2018",1, Don't make it so fat as it in China!
1372,Paul Jordan Eso,"April 9, 2019",1, i don't know how to change the language into english.
1373,GEIBI GIBI,"July 1, 2019",1, why can't i register a new account 😢😤😣 i want to read my favourite chinese manhua
1374,San XCV,"September 10, 2019",1, Why? Why I can't change my profile picture?
1375,o h,"June 8, 2019",5, I can't update the QQ.
1376,Saad Shaikh,"May 15, 2019",2, i dont know how to translate the app into english help me out
1377,DANNUY,"June 8, 2019",2, QQ international but not in English. What???
1378,Former Testing,"July 20, 2019",1, hated ur app because at least u must add different language setting for any other guy
1379,manoj karmakar,"July 20, 2019",2, It it work in saudi Arabia or other Asian country's plz someone inform me
1380,Tranquility Story,"September 6, 2019",3, I give you 5 if you have English language for mobile app
1381,Abdul Qayyum,"November 22, 2019",1, How I can use English language
1382,Buket Araci,"February 26, 2020",1, I can't register
1383,Jonathan Lim,"April 5, 2020",1, Trash app. China suck
1384,S A,"April 14, 2019",1, How to change the language to english?
1385,Guru Subramania Sarma,"November 9, 2019",1, One of the worst messaging apps ever
1386,Brian Lam,"April 14, 2020",1, I hate Chinese bad stuff
1387,Bianca Co,"July 12, 2019",3, How can I change the language into English??
1388,Imane Nana,"March 20, 2020",5, Great app i like it
1389,Hathila mitesh Raman,"April 7, 2020",3, Very nice app
1390,love black,"April 10, 2019",1, I need this app in English i don't understand Chinese 😭😭😭😭😭
1391,michael wang,"June 17, 2019",5, good.... good.... Only non chinese review thats why rating so low.
1392,De3mi Entertainment,"July 29, 2019",3, how to change it's Language Please tell me?
1393,Jannat Rosalia,"April 6, 2020",5, It is so nice 😊
1394,Denis Ananda,"March 7, 2019",4, how to change the language from chinese into english?
1395,joey guardians,"May 26, 2019",5, how can we register...we cant understand Chinese?
1396,Ankit Kumar,"January 12, 2020",1, Worst app ... Useless...
1397,just 4 fun,"November 10, 2018",5, I just download it to play pubg mobile Chinese version;)
1398,Heng PS,"June 19, 2019",1, keep asking me install latest version yet i installed latest version
1399,Aakash Dass,"July 15, 2019",5, i got a lot of Chinese friends after using the QQapp
1400,HOUS SEM,"January 24, 2020",1, English is not avaible!!
1401,Omkar Singh,"February 5, 2020",2, How to chang language?
1402,AZ-Zakwanul Faiz bin Zakaria,"February 7, 2020",1, Not non Chinese user friendly
1403,Steven Zhang,"May 25, 2019",1," rubbish, not friendly to user"
1404,Fox Arts,"January 7, 2020",1, Can you please publish qqi to playstore
1405,Lwutung Dennis,"February 10, 2020",5, Write in English
1406,Al Quran'r Alo,"April 14, 2020",1, singin process are very bad
1407,SpectreAX,"April 14, 2020",3, Better than WeChat.
1408,A Google user,"January 29, 2019",1, app is tooo irritating
1409,Akeeb Malligawad,"March 23, 2019",1, how to select English language..?
1410,TitansX GhosT,"May 1, 2019",5, best application my request make other in english
1411,David Alexander,"July 1, 2019",1, no good at all ....all in Chinese
1412,Tupac Bayar,"July 25, 2019",1, I wanted sign up an account but ther is not Mongolia
1413,A Google user,"October 20, 2019",1, Is there an English version to this app?
1414,Boniface Mutuku,"April 1, 2020",1, Some how disturbing
1415,kaysrel palallos,"March 8, 2019",4, how can i change the language to English?
1416,Omair Shafiq,"March 8, 2019",5, what happened to the international one?
1417,sakurisa,"July 30, 2019",3, please how i can change the language in qq app?
1418,Enan,"October 20, 2019",1, Why is this only for china? So selfish.
1419,Jone Fredirec,"January 22, 2020",1, You have to add Morocco
1420,imran masih,"March 17, 2020",5, Please English first page
1421,Rucxim,"March 24, 2019",1, Is there a way to change the language settings?
1422,Saraf enam,"January 24, 2020",1, Just give you middle finger rating🖕
1423,rosa pn,"February 7, 2020",1, so hard to use
1424,fabian brian,"March 19, 2020",5, This is great
1425,Gerardo Iglesias,"March 31, 2020",1, Not in english
1426,A Google user,"August 5, 2019",1, Please update it，keep it simple
1427,A Google user,"September 20, 2018",5, Very good app
1428,ProThePUBG V2,"June 11, 2019",1, you have not the group member error coming please help
1429,Diwakar Giri,"November 18, 2019",5, It's so suitable for me
1430,only_ one*s,"January 5, 2020",1, How to new login please send me artical
1431,A Google user,"January 28, 2019",3, I can't change my profile picture....
1432,A Google user,"March 30, 2019",1, i can't resister with my phone number until tomorrow
1433,Mohsin Ali,"June 20, 2019",2, Is there an English language or not?
1434,Csic Tim,"September 13, 2019",1, FORCE YOU TO ALLOW ALL THOSE PERMISSION THEREFORE THEY COULD SPY ON YOU
1435,Bala Isah,"September 21, 2019",5, Very good app
1436,Yuraj Singh,"December 1, 2019",1, How to convert in English
1437,Seyboy Chongloy,"February 1, 2020",1, Can't sign in this mf app
1438,JH Tee,"November 18, 2018",1, Lousy apps for asking permission!
1439,Vinu Venugopal,"June 4, 2019",1, i cannot create a account :( please help me
1440,cleve mbogo,"January 23, 2020",1, Total waste of time!
1441,Sunny P,"April 28, 2019",1, Not registering Indian number
1442,Dudz Sanity,"January 12, 2020",1, give access to non chinese people
1443,Barkat Rezae,"March 25, 2019",1, how do i change the languageon this thing?
1444,Edge_Of_TheKnife,"January 15, 2020",5, If u can read this u r stupid
1445,엘이나누미,"August 12, 2019",2, why i can not change my avatar?
1446,BobTheFish1238,"October 8, 2019",1, I just want a account :( China really does suck
1447,Raja Babu,"March 29, 2020",1, Account not creating qq aap
1448,Feng Zhen,"March 15, 2019",1, I can't even change my god damn profile pic!
1449,Asam Anwar,"April 26, 2019",4, how do you change to English?
1450,meisya,"August 15, 2019",1, WHY THIS APP KEEPS TELLING ME THAT I SHOULD GET A NEWEST VERSION
1451,A Google user,"November 19, 2018",3, How to change the language..?
1452,PARSA STYLES,"September 23, 2019",1, How to change my language to english?
1453,Ahmed Barea,"February 4, 2020",1, No English anymore 😕
1454,Waqas Raza,"February 25, 2019",1, I want old QQi version. Where to get?
1455,ahmad javed,"February 9, 2020",1, Always in Chinese
1456,Abdullah Ahmad,"February 25, 2020",1, Not in English 😡
1457,mike johnson,"April 6, 2020",5, IS SO NICE MY DEAR
1458,Mick L,"January 25, 2019",5," What is this app, is it a china version of fb ?"
1459,THAT GAMING YT,"June 6, 2019",5, this is the best app i see in my life
1460,Jose Lee,"March 24, 2020",1, Do t download!
1461,Ahmed Ben Ali,"December 8, 2018",2, it haven't a english or arabic or a france launge why?
1462,Biju Markam,"June 30, 2019",2, Where is English version
1463,VE X,"September 6, 2019",1, Fak this application. When your die? I hope tommorow
1464,P4Pubg,"February 1, 2020",1, Its good application
1465,33 3,"February 8, 2020",1, i cant make account
1466,unboxing king,"February 14, 2020",1, How I sign up into QQ app
1467,Ahad Hossain,"February 17, 2020",1, Bad app ever.
1468,Fit Boy,"April 8, 2020",1, Very disgusting app
1469,Shizuka's Nobi Skateboarding,"April 19, 2019",5, How to change language please anyone.?
1470,Aminath Anjal,"June 28, 2019",1, i don't know this langauge could you change it to maldivian abcs its english
1471,Moeed Ali,"June 29, 2019",5, can we change language in English?
1472,DR.NDOUMBE MBAPPE,"October 9, 2019",5, this Apps is very important in the world
1473,Katari Quispe,"February 3, 2020",1, 在秘魯用的沒辦法 I can't use it in Peru
1474,K 9 G A M I N G,"February 23, 2020",1, Only in chinese
1475,Oussama Omary,"November 15, 2018",1, remove yourself from this world please QQ.
1476,Dmitrii Starovoitov,"July 29, 2019",4, Can we use stickers on the Android?
1477,Safura Owas,"November 14, 2019",1, Well qq is very hard to get
1478,HYDRA SHOT,"January 9, 2020",1, Its is worst app I ever seen before😠😠😠😠😠😠😠😠
1479,MAFIA gaming 2992,"February 26, 2020",4, I am only on pubg
1480,Michael Wang,"September 15, 2019",1, Ask for too many privileges.
1481,Dennis Waweru,"October 21, 2019",1, Doesn't support foreigners at all.
1482,路理你,"December 9, 2019",2, Ugly and big，stupid
1483,Rosaf smiler,"January 4, 2020",5, Plz give English language .
1484,Gamer Bro Live,"January 14, 2020",1, stupid and foolish app.. dont install
1485,Manoj Thirani,"September 1, 2019",1," Sir, I need english language..."
1486,Kasun D Abeydeera,"December 6, 2019",1, Cant understand everything in china
1487,bella chiams,"February 17, 2020",5, Worst app ever
1488,Su Yan,"May 20, 2019",1, Do not let me use app without phonr permission
1489,Lazarus Mweendalubi,"June 16, 2019",1, takes an eternity to recieve a veryfication code
1490,JOHUD'Z GAMING,"October 10, 2019",5, Any one help me to make this english thanks
1491,Angela Tsui,"October 28, 2019",5, my friends from shanghai adore me
1492,Sahil Khan,"March 25, 2020",3, Love this app
1493,emoyoma alex,"April 21, 2019",1, i can register becaus its all written in chineese.
1494,Jerry Wahjudi,"November 5, 2019",1, No English language
1495,Zarbdor Games,"February 11, 2020",1, Worth app in play store
1496,zahid hameed,"May 21, 2019",5, can i use QQ in English language??guide plzz
1497,Moshe Mack,"February 23, 2019",1, Can't understand the language
1498,Kobee Jarin,"March 1, 2020",5, can register now
1499,vamsi vamsi,"May 18, 2019",2, I'm downloading this for only game for peace
1500,Muhamed S. Ahmed,"March 11, 2019",1, English or any language?!!!
1501,Moonlight,"November 21, 2018",1, I don't like this communication
1502,小婷,"May 28, 2019",1, Why i can't register
1503,CG ki Clips,"January 10, 2020",1, I can't create an account 😠
1504,Bilal Rehman,"January 23, 2020",1, I cant signin with my Italian Number
1505,Mei Xia Lie,"April 15, 2019",1, make it in english version
1506,ThenMust De'ens,"January 9, 2020",1, suck no option for english.
1507,62 West GaminG,"March 10, 2019",5, this app using I playing Crossfire legends last 12 hours
1508,Jonathan Morales,"September 10, 2019",2, How to change language to english?
1509,Azon Sagcal,"December 4, 2019",2, i can't register here
1510,瞎瞎怪一只,"December 9, 2018",3, Why cannot I change my profile
1511,Owners Tech,"April 16, 2019",1, i can't change it to english
1512,Mohammed Shoaib,"November 3, 2019",1, I can't create id
1513,Diana Skorinina,"December 1, 2019",1, This app very bad...
1514,Widdy Fouldt,"March 30, 2020",5, Amazing app 🤗 i love qq
1515,杨小 兴,"April 26, 2019",5, you can contact with poeple wich is very good.
1516,boyka gaming,"March 31, 2019",1, Why it's not working in Saudi Arabia
1517,Tirtha Ashram,"July 31, 2019",1, very poor cause there is no english laguage.
1518,santhosh games,"August 22, 2019",2, It is language in China I want in English
1519,Kenny Girard,"October 29, 2019",1, Cannot read Chinese
1520,Altaf hussain Ansaire,"April 11, 2020",5, QQ Rate this app
1521,Monster Manoj,"March 27, 2019",1, please I requested to Google don't add chaines app please
1522,S.S Prime One,"May 10, 2019",3, please make this app also for English
1523,Ajay Nunda,"June 17, 2019",4, how do you change it to English plz help
1524,Mohammad Imran,"August 26, 2019",1, Please english version
1525,Jugol Roy,"October 3, 2019",1, this apps can't install.. why??
1526,muhammad aslam,"March 24, 2019",1, How can I use this app in English
1527,Jundullah Tsaraut,"July 17, 2019",1, why the server is always busy?
1528,Breanna Wong,"August 18, 2019",3, Why I can't sign in??
1529,King Muhammad,"December 10, 2019",2, Not make account on my number
1530,evacuate clash,"May 29, 2019",1, its basiclly useless if youre not from origin country
1531,Dare Devil,"December 23, 2019",5, I like it's
1532,Samuel Forextrade,"April 29, 2019",5, How do i change language because am not china
1533,A Google user,"March 12, 2019",1, I can't translate to english
