index,author_name,review_date,reviewer_ratings,review_body
4867,A Google user,"November 1, 2012",5,"English version please!!! Great app, fast and smooth. But If the English version would not be possible, at least let us have the option to copy and paste the buttons, and translate from Chinese to English. That way we know what we are doing. Thanks!"
4868,A Google user,"September 9, 2012",3,stops working backstage always blank out after 10 mins or so when operating in the background. disappointed. otherwise all goods.
4869,A Google user,"August 13, 2012",1,"Samsung s3 Can't open at all . Such a lousy application . No update for so long , please fix it"
4870,A Google user,"November 1, 2012",1,操作过时 超级烂的软件，常常进不去，要重新安装才能用，不过不到几个小时又自动退出，进不去了，这是我遇见最烂的软件，工作人员，做点事吧！
4871,A Google user,"August 13, 2012",2,"Pls Fix it up The app was crashed when i opened the app, i hope u cant fix it up on moto razr maxx"
4872,A Google user,"October 21, 2012",5,QQ not run on my S3 i have try to install QQ many times. after i install i cannot even open this app any help for this solution?
4873,A Google user,"October 4, 2012",4,Pretty cool... Nice! But it will be much better if there was an option to change the language to English to understand the options available...
4874,A Google user,"July 28, 2012",1,看起来漂亮一点都不人性化 qq号都看不到，更别说复制给别人
4875,A Google user,"August 22, 2012",2,Eric Worked for couple of weeks and keep crashing since last week. Had to uninstall it.
4876,A Google user,"August 16, 2012",1,Shawn Dude Shawn make this app unto English everyone is complaining so make it English version too
4877,Reid 4-Real,"February 3, 2013",1,Da bian Crash all the time. Make English version ben dan
4878,A Google user,"November 21, 2012",5,Crashes it doesn't even open up on my S3
4879,A Google user,"November 9, 2012",1,一大堆流氓权限 本来就用的很勉强，新版本竟然还要读/发短信。。。删掉！不废话。
4880,A Google user,"September 23, 2012",3,"Pls fix bug From galaxy s3, sys version 4.0.4 Bug: auto quit when lanching the login screen."
4881,A Google user,"November 17, 2012",1,狗改不了吃Shi啊 还TMD要开机自动启动，要这么多的系统权限，流氓！！！
4882,A Google user,"July 27, 2012",5,完美 這次更新已經脫離失敗 ， 界面簡單 ，chat能換桌布 ，而且重要是運行得很順 不會很卡 值得大讚，最喜歡是個人名片 大大增加 個人美化風格 不錯。總結 這次更新 （完美）
4883,A Google user,"August 27, 2012",1,还行 不如以前塞班版本好，差距很大。中国最牛逼的qq怎么在谷歌商店才排119，看来只有中国人用这玩意儿
4884,A Google user,"October 16, 2012",1,Does not work Installed but could not open it on S3.
4885,David Xu,"January 9, 2013",1,为什么迟迟不发布app for android pad google tablet也已经出来好久了，qq和微信怎么还没发布，我们可都是忠实用户啊，等了快半年了。我们都准备转用gtalk和其他chat工具了。
4886,A Google user,"July 30, 2012",3,Galaxy S3 unable to sent picture pls fix
4887,A Google user,"November 23, 2012",4,流量啊 功能较2011强大了许多，不过这流量可是哗哗的没啦，能不能向微信一样有省流量版本呢！
4888,A Google user,"August 22, 2012",1,请增加删除名片访客和赞 非常不喜欢不能删除陌生人的访问记录和赞！请尽快加入这功能和举报功能.头像应该要审核！
4889,A Google user,"September 19, 2012",1,Galaxy s2 Please release this in english. Then it would be a 5 star really
4890,A Google user,"September 3, 2012",1,Crashes on CM10 The phone reboots when trying login.
4891,A Google user,"June 22, 2013",1,恶心的界面！ 安卓用ios界面，真恶心，我看你是不是准备用一辈子！
4892,A Google user,"August 14, 2012",1,not work  on gs3 have no idea  what  happened
4893,A Google user,"August 16, 2012",1,有瑕疵 太霸道 無法更換id 強制使用記住密碼號碼 無更改選項 不夠人性化
4894,A Google user,"December 8, 2012",1,要权限这么多干啥 越更新要的权限越多，腾讯你的垃圾码农怎么还不去跟权限速查机一起去吃翔？
4895,A Google user,"November 23, 2012",3,conversation backup？ no sd card backup and restore conversation likewhatsapp and other apps？？？
4896,A Google user,"November 9, 2012",5,"WOW! It really works. .. It is thwart most versatile and productive app for viewing multimedia, I was very impressed"
4897,A Google user,"October 7, 2012",2,Force closes Force closes every time on Samsung Galaxy S3 Jelly bean. Shame it's a great app.
4898,A Google user,"October 26, 2012",4,还不如之前的 每次查看邮箱都要输入两遍密码和验证码，总是提示密码错误，真的很烦人
4899,A Google user,"October 17, 2012",1,Ctd Crashes whenever system message is opened.
4900,A Google user,"October 3, 2012",1,Jelly bean下crash Jelly bean 下无法后台运行
4901,A Google user,"May 22, 2013",1,又多出来奇怪的权限了 你只是做qq，为什么要读取我的通话记录？送你一星好评
4902,A Google user,"September 21, 2012",4,不错but。。 挺好看的但就是如果不是wifi就完全不能发照片。之前的版本的可以的。而且也不能转微博。不过还是挺爱qq的。加油
4903,A Google user,"September 13, 2012",1,Doesn't work on Samsung s3 Keep crashing
4904,A Google user,"November 13, 2012",1,"No way I will updatw Bad permisions , to many unwanted"
4905,A Google user,"November 9, 2012",1,权限要求的也太多了吧 好多看起来不相关的系统权限。抵制！
4906,A Google user,"October 3, 2012",1,kristel cannot open the app. it auto hop back our to the main page after i click in!!please solve!! i need qq to contact all my friends!!
4907,A Google user,"September 16, 2012",1,突然就挂了 突然间连登陆都没办法了，点击图标之后就闪两下白屏然后退出了
4908,A Google user,"July 26, 2012",1,crashing update qq today 3.0. it crashing crashing
4909,A Google user,"October 25, 2012",3,Change ringung tone I just change from from iphone to Samsung and realize that  Ringing tones cannot change like iphone QQ. Hope can be fixed
4910,A Google user,"August 19, 2012",1,s3 not working properly. please fix it.
4911,A Google user,"August 25, 2012",1,Samsung Galaxy S II - VK Custom Rom Can't even log in and FC every time launching the app! Need to improve!!!
4912,A Google user,"September 11, 2012",1,系统通知我一点就强制关闭 系统通知我一点就系统崩溃和强制关闭，点多少次都一样，更新怎么更不好用了？
4913,A Google user,"September 6, 2012",1,"what's going on ? can't open it on Galaxy S3, crash all the time."
4914,weiwei li,"May 21, 2013",1,very bad it cannot be worse.
4915,A Google user,"September 7, 2012",3,Missing english version Needs English option added. I miss the version on the iPhone when I had it.
4916,A Google user,"July 26, 2012",4,郁闷 HTC G14升级后就提示密码不对，根本不能用
4917,A Google user,"August 16, 2012",4,2012新版 不方便就说说进行评论，比较麻烦。 每次登陆成功会有强制关闭提示。
4918,A Google user,"September 27, 2012",1,What happened? It can't open  . Keep log out every time I try  to log In
4919,A Google user,"August 1, 2012",4,Good!but... But I like qq 2011 more.   it's more beautiful .
4920,A Google user,"October 19, 2012",2,越做越差 微信处理过的离线消息，上qq之后还要处理一次
4921,A Google user,"October 13, 2012",2,离好用还有距离 依旧很卡，接受信息比桌面版要慢
4922,A Google user,"September 11, 2012",3,Request This version of qq is good.. But pls add option to text chat while doing videocall.
4923,A Google user,"August 22, 2012",4,后台程序关不掉 新增加的功能没什么意义。
4924,A Google user,"July 28, 2012",1,Is it difficult! Please add english!!!
4925,A Google user,"August 26, 2012",2,晕鸟 打开聊天窗口各种自动关闭。我去
4926,A Google user,"November 8, 2012",1,"Pls keep away from personal data As a chat tool, you really request too much authority"
4927,Qi Cai,"February 18, 2013",5,方便 可以和家里人联系，是我最开心的，谢谢，腾讯
4928,A Google user,"August 18, 2012",4,"Needs English interface Great app, but really needs English interface"
4929,A Google user,"September 17, 2012",2,三星S3不能用 不知道为何忽然间S3不能用请快修好.
4930,A Google user,"September 18, 2012",3,经常收不了信息 坑！经常收不到别人的信息
4931,A Google user,"November 12, 2012",1,越来越流氓 qq，你要发短信和查其它app信息干嘛？
4932,A Google user,"September 29, 2012",3,"Cant open Cant open it, please fix it!"
4933,A Google user,"September 8, 2012",3, 耗电！没法用。安卓的qq和微博都这个德行
4934,A Google user,"November 3, 2012",1,垃圾表情显示 比苹果差远了 你们自己用过么！！
4935,A Google user,"November 9, 2012",5,Need to be in English also. This app need to be in english also. It will become even more popular after that.
4936,A Google user,"November 9, 2012",2,Sad 为什么需要读取其他正在运行的程序????
4937,A Google user,"August 8, 2012",3,啊啊啊啊啊啊啊 更新后吃电太大啦 拜托更新一下啦
4938,A Google user,"August 1, 2012",1,QQ 2012 Why keep restarting on Samsung s3. Please help to fix.
4939,A Google user,"September 27, 2012",1,English Y is there no english version or international version?
4940,A Google user,"July 27, 2012",1, Keep restart itself and can't login.
4941,A Google user,"July 27, 2012",1,总是崩溃退出啊！！ 每次打开，没用多久就会崩溃退出！
4942,A Google user,"August 21, 2012",1, 在cm10 jelly bean 上完全无法打开，suck
4943,A Google user,"October 8, 2012",2,Closed by itself Everytime  when.i check friends request alway closed by itself
4944,A Google user,"September 27, 2012",2,buggy cant chat at all. window auto closes to mainmenu
4945,A Google user,"September 18, 2012",2,"galaxy note can't log in using wifi, please fix it"
4946,A Google user,"August 25, 2012",1,新更新导致手机过热 频繁重启！ Galaxy Nexus.
4947,A Google user,"November 6, 2012",1,keeps crashing keeps crashing on jelly bean
4948,Wai Leung,"March 11, 2013",3,點解要權限send sms? 如題
4949,A Google user,"September 12, 2012",1,cant open with s3 can someone please fix the bugs?
4950,A Google user,"March 31, 2013",1,"Evo 4g Was gd till update, qq hd mini much better!"
4951,A Google user,"November 9, 2012",1, 不更新了 要那么多权限
4952,A Google user,"October 7, 2012",1,Can't open I think it doesn't support android 4.0. It will force close. automatically.
4953,A Google user,"November 10, 2012",3,English please I wish it was in english like on a pc.
4954,A Google user,"November 9, 2012",3,Oh nooooo Need English option so I can understand selection options.
4955,A Google user,"February 4, 2013",1,问题 差劲的很
4956,A Google user,"November 8, 2012",1,it not support Nexus7 Why not support  ...Tango can do it  why u can not  .
4957,A Google user,"July 26, 2012",1,失败!!! 登录完后 什么都失败!!! HELP!!! LG OPTIMUS BLACK
4958,A Google user,"August 14, 2012",3,照片问题 不可以收照片和传照片
4959,A Google user,"October 22, 2012",3, Why there is no English version?
4960,A Google user,"September 16, 2012",1," 垃圾軟件，Sony LT26,galaxy3,galaxy note 根本打不開"
4961,A Google user,"August 21, 2012",3,改下 相册无法修改
4962,A Google user,"November 9, 2012",2,又更新啊，没完没了 此版返回键按了没有反应了...
4963,A Google user,"August 20, 2012",1,"Can't connect Please fix this, I can't log in."
4964,A Google user,"November 6, 2012",1,Samsing Malaysian people can't use
4965,A Google user,"September 3, 2012",1,"Nghinghi Cant use it, it log out whenever i try to log in @,@"
4966,A Google user,"February 4, 2013",1,English Include English language option please
4967,A Google user,"July 30, 2012",3,HTC One X 好！
4968,A Google user,"November 14, 2012",5,好东东 qq啊！
4969,A Google user,"November 18, 2012",2,新版太卡 发不出去消息是要怎样?！
4970,A Google user,"January 27, 2013",1,太多权限 做好im，其他不必
4971,A Google user,"October 16, 2012",4,English Version. English version pleeeease.
4972,A Google user,"August 29, 2012",4, 耗电问题已经解决
4973,A Google user,"November 9, 2012",5,非常好 有进步
4974,A Google user,"July 31, 2012",4,3.0很好 3.0进步很大，整体改进很大，用起来就知道了
4975,A Google user,"October 21, 2012",1, Crashed all the time
4976,A Google user,"August 3, 2012",1,Fix!!! (: Wo de shou ji bu neng yong !!!!! Please fix thank you!
4977,A Google user,"November 10, 2012",4,English I wish they would make it easier to obtain the English version.
4978,A Google user,"November 5, 2012",4,卡 很多次都卡
4979,A Google user,"March 22, 2013",1,"常常fc, 太多permission 常常fc, 太多permission"
4980,A Google user,"October 29, 2012",1,"Cannot view.... updated can't view,keep flashing.pls fix it!!"
4981,A Google user,"August 28, 2012",1,无法登录 太好了，登录超时
4982,A Google user,"August 19, 2012",1,Samsung G3 Can't open.
4983,A Google user,"October 14, 2012",1,关不了推送！！！！ 关不了推送！！！！
4984,A Google user,"November 9, 2012",3,差 分辨率低，操作感差
4985,A Google user,"August 5, 2012",2,crashing why is this happening?
4986,A Google user,"November 14, 2012",4, Amazing app to find chinese cute girls. Loving qq
4987,A Google user,"October 16, 2012",5,awsome i would say this is the best version ever！big improvement！
4988,A Google user,"October 16, 2012",1,why？ keep force close
4989,A Google user,"November 10, 2012",1, Permission too much
4990,A Google user,"September 1, 2012",1,language is this available in english??
4991,A Google user,"November 9, 2012",5,Need English version Need English version
4992,A Google user,"October 11, 2012",2,老是崩溃，拖慢整个系统！！！ 老是崩溃，拖慢整个系统！！！
4993,A Google user,"August 1, 2012",1,失败 登录不了 失败
4994,A Google user,"November 9, 2012",5,Singh Awsome app.... we be better if its' in english
4995,A Google user,"September 4, 2012",5,All good after update 更新后一切都好
4996,Jinas kc,"September 25, 2013",4,Nice Me it was used allows country Without China
4997,A Google user,"November 16, 2012",3,English I wish this App will have English language..
4998,A Google user,"July 26, 2012",4,Not bad Better than the former version.
4999,A Google user,"July 30, 2012",3,此版本不支持视频？ 手机和电脑聊天，不能视频？？
5000,A Google user,"July 29, 2012",4,还不错，呵呵。 如题
5001,A Google user,"August 12, 2012",1, Always crash!!!!
5002,A Google user,"September 15, 2012",5, 还行
5003,A Google user,"August 9, 2012",1, FC on 4.0
5004,A Google user,"September 22, 2012",5,Yes Better than before
5005,A Google user,"August 30, 2012",4,Mb525 Good n stable
5006,A Google user,"November 9, 2012",4, Better than older version
5007,A Google user,"September 15, 2012",1,... suck
5008,A Google user,"August 27, 2012",5, super good app
5009,A Google user,"August 6, 2012",5,OhLalaa Wonderful App
5010,A Google user,"September 18, 2012",1, cant turn it off
5011,A Google user,"July 28, 2012",1, 卡
5012,Aung Myo,"March 6, 2016",3,ok ok
5013,A Google user,"July 31, 2012",5, I love it..
5014,Martin Ye Tun Lin,"November 29, 2013",5,good great
5015,A Google user,"November 15, 2012",5,good excellent
5016,A Google user,"November 11, 2012",5,COOL COOL喜欢
5017,A Google user,"November 10, 2012",1,Poor Poor
5018,A Google user,"November 15, 2012",5, Superb
5019,A Google user,"August 14, 2012",4, Good
5020,Muyideen Ismaila,"January 12, 2020",1, Nicest
5021,A Google user,"July 9, 2012",4,simple enough i don't know a word of Chinese but for the most part i can navigate this app pretty well. i made a friend in china who was using me for English practice but due to the time differences i might be out when he gets a moment so i installed this app. i will admit it would have been nice if it had detect...Full Reviewi don't know a word of Chinese but for the most part i can navigate this app pretty well. i made a friend in china who was using me for English practice but due to the time differences i might be out when he gets a moment so i installed this app. i will admit it would have been nice if it had detected my handset language and switched but for the most part everything is where you expect it to be. even if i cant read it the contextual hints and great design make it usable nice job
5022,A Google user,"June 28, 2012",3,"English please I more or less have to use this, because my wife and family uses it. So it would be nice to actually have an English version, so I won't have to guess all the time.  @Andy  You are full of s***. It opens two processes, and two connections to China Telecom. Besides, you don't *have* to use it. Do you...Full ReviewI more or less have to use this, because my wife and family uses it. So it would be nice to actually have an English version, so I won't have to guess all the time.  @Andy  You are full of s***. It opens two processes, and two connections to China Telecom. Besides, you don't *have* to use it. Do you?"
5023,A Google user,"June 2, 2012",1,"Good App Its a huge battery hog on my Galaxy Nexus on ICS, I usually get 3 or 4 days on battery after I installed this it drained my battery in less then a day, i wasn't even using my phone, just sitting  on my desk. Plus the fact it is only in Chinese is a draw back"
5024,A Google user,"May 27, 2012",1,Fix! On HTC one will force close and flicker on start up.  Have to open many times to work.  Hand writing tool also does not work.  When opened it goes to a blank screen and does not allow hand writing.  Please fix!
5025,A Google user,"April 11, 2012",3,"Needed an English version I have QQ installed on my Nexus S, although it works fine yet I would appreciate if it was in English. As I do not understand Chinese much and somehow manage to communicate with my friends. Please help"
5026,A Google user,"April 6, 2012",4,Slight problem This app has worked realy well. And is really great but lately it hasn't been letting me log in and when I do finally log in it freezes and logs me back off. I am not sure if it is just an error with my phone or the app. Please try to fix it if you can. ^^
5027,A Google user,"May 25, 2012",2,"it would be better if user change language setting I have been using QQ for the past 4 years and i really like it, but the only problem is that everything is in Chinese, which means that the people who cannot read Chinese cant understand or use all the features, so in my opinion as being a systems designer usability is a big issue, as this software ...Full ReviewI have been using QQ for the past 4 years and i really like it, but the only problem is that everything is in Chinese, which means that the people who cannot read Chinese cant understand or use all the features, so in my opinion as being a systems designer usability is a big issue, as this software is only attracting Chinese users, although my experience says that this product has much more potential and if added additional language settings it would be much much better, after all we are all living in a multi cultural society.    Therefore, and excellent product but locked down because of the language barrier."
5028,A Google user,"April 17, 2012",3,Push Does anyone know how to stop the Push-notification? If i want to quit QQ; i want to quit and do not want to receive messages all the time.
5029,A Google user,"July 17, 2012",1,"English I got QQ so that I could message my Chinese friends and now not only can I not read any of the program, I can't translate what my friends are saying! Ridiculous! Add an English version!"
5030,A Google user,"July 22, 2012",3,"ENGLISH I'm Chinese raised in america and for crying out loud, there should be a language selection. Unless they update the QQ app for Americans to conveniently understand, I will rate it 3 stars."
5031,A Google user,"March 24, 2012",2,"Still bad Even though it says in the changelog that they fixed the issue, it still drains the battery. Even if i close it completely, it just restarts on it's own and keeps the phone awake..."
5032,A Google user,"July 11, 2012",3,"Unstable, feature rich Unstable on Samsung Galaxy S3 (Android 4.04).  Inbound messages get ""stuck"" and do not appear, often for hours.  Great features.  Hope they fix it soon."
5033,A Google user,"March 23, 2012",4,Excellent I have just loaded this and found it to be the best QQ ever running on my Android 4.0.3. Instead QQ 2011 quits every time when I start it.  And I love the widget too.  Very convenient.
5034,A Google user,"July 14, 2012",1,"crash often since i upgraded my galaxy nexus to jelly bean,this qq crashed every time i used it. it is annoying"
5035,A Google user,"April 28, 2012",1,battery hog it is in memory after the phone starts up even i am not using it. then it is the app that uses the battery secondly most . bad
5036,A Google user,"April 13, 2012",1,"Bad for Non-Chinese No English version. On for laptop/desktop.  Don't expect EVERY lanuage, but at least an English version would be nice..."
5037,A Google user,"November 20, 2013",2,"不好用 哪里是推送？分明是轮询pull,没有网络的时候还拼命的发http请求，一看adb logcat,一堆报错，不耗电才怪！"
5038,A Google user,"July 4, 2012",1,Installed on HTC One V QQ 2012 Sucks!!!!!!!!!!  always forced to close each and every min of use.......... fix it plsssssss. its really annoying. QQ 2011 is unable to open after installed ICS. Help pls
5039,A Google user,"April 21, 2012",4,能不能别这么仇恨电池 我没有开，都自动运行，猫咪的，我充满的电池，一个小时就没电了阿阿阿阿阿阿！能不能改善一下bug
5040,A Google user,"April 19, 2012",1, 完全没有开QQ它居然还能在后台运行，耗电排第一！难怪我的电池一下就没电了。删！
5041,A Google user,"July 20, 2012",1,"Lousy After installed cannot open, pls help. Using SE neo v on ICS."
5042,A Google user,"May 26, 2012",5,Very Good 2012版很不错，推送功能哥很喜欢，把界面略作修改适配一下平板电脑就更好了。哥的平板卸了QQ HD改成手机2012了。不仅仅是因为有推送功能，而且QQ HD老是卡死。
5043,A Google user,"June 9, 2012",1,电池杀手 费电，重启开机，杀进程后就没有运行过qq程序，下午吃饭时还60%的电，晚上突然电量告警了，一看，qq耗电30%，什么垃圾软件，后台服务自动开启
5044,A Google user,"July 9, 2012",1,"battery hog Killed my 100% battery in 6 hours of idle, even with juice defender, really?"
5045,A Google user,"April 16, 2012",4,在平板上工作有点问题 照理平板和手机都一样的，可是平板上，有个账号经常接收不到消息，同步聊天记录也经常出现乱码的情况，我重装平板的QQ试试
5046,A Google user,"May 27, 2012",4,有明显好转 使用Galaxy Nexus，原生Android 4.0.4系统。待机掉线问题经初步试用有明显改善。耗电等有待进一步观察
5047,A Google user,"April 29, 2012",3,不是真正意义上的语音通话 语音对讲只能是发送语音短信，并不能语音通话。如果是手机qq联系电脑qq的话就用不成了。另外从电脑qq上发过来的语音或视频通话请求，在隐身时在手机qq上也没有任何记录。还有待提高...
5048,A Google user,"April 16, 2012",1,"非常需要改进，一用它其他软件都force close. bad, going bk to 2011. all my chat history was deleted too. very bad"
5049,A Google user,"July 14, 2012",1, Everytime i attempt 2 open it.. it saids it stop workin unexpectly and i must forceclose  ..
5050,A Google user,"March 18, 2012",3,电池续航仍是问题 电池续航有改进，但仍然是问题。系统进程耗电量统计QQ依然排名第一，超过所有系统进程。
5051,A Google user,"May 20, 2013",1,周令曼说。。。 我是周玲曼。我刚发现爸爸是一个俄罗斯间谍。中国人请找这个叛徒然后杀死他。我以后不管他
5052,A Google user,"May 5, 2012",3,"Samsung galaxy s II LTE For some reason, the voice call doesn't work on my device,pls fix it, thanks!"
5053,A Google user,"June 10, 2012",3,死机 之前手机是2.3版本时非常好用，自从升级到4.0.3后，运行就不是很流畅，有时候点击程序会死机，但是最近几天用语音发信息，结果程序彻底死机，现在根本无法使用了… 请快出最新版本，更好地支持4.0
5054,A Google user,"May 21, 2012",2,Not work well in HTC Friend off line still show online. Delay update message. The base functions not work.
5055,A Google user,"August 21, 2012",1,Cannot open in Samsung S3 It has been a month that this application cannot be used in S3 and not yet fixed ! Very disappointed!!!! One star is too much for ur service!!
5056,A Google user,"June 5, 2012",1,视频/电池 1.一开视频，电话从启。。  2.太可怕了，没登入照样吃电，耗电量大的离谱。先声明，我已经关闭推送服务了！
5057,A Google user,"June 27, 2012",1,"English option please I can't read it but it look nice, have different languages please like English"
5058,A Google user,"June 17, 2012",1,English Please Lacks a way to switch the setup language. Needs better design. Whoever was behind Wechat obviously had more forethought than the QQ team. 2012 means nothing if it is still hard to use.
