index,author_name,review_date,reviewer_ratings,review_body
2104,Rafael Filho,"December 17, 2019",5, I mean I do this at school so it is quite boring but besides my opinion it is really good
2105,Desmond Kilpatrick,"September 10, 2019",5, It is great and legendary and divine
2106,Amara Toki,"September 19, 2019",5, Its amazing you can do your home work online
2107,PheonixMorphix,"February 22, 2020",1, Some douchebag at Google made some random update without even checking to see if it actually was function correctly and now thousands of students who innocently updated their Goggle Classroom app will now have homework that is overdue (which in under certain scenarios lower that students grade)
2108,Nate 09,"April 7, 2020",1, Dont dowload I regret it
2109,A Google user,"October 8, 2018",4, Great but need the to do list
2110,A Google user,"October 4, 2018",5, Its great for me because I use it for school work.
2111,neha qureshi,"March 27, 2019",2, i can't submit my work.. after i turn in it shows work not submitted.. respond asap
2112,Beryl Sarkis,"March 29, 2019",3, it's easy to open
2113,Sketch 61762,"February 8, 2019",1, I cannot send in video attachments to my teachers on my samsung galaxy J7
2114,Kaylie Bartleson,"October 13, 2019",5, Its a really great app to get things if u arent in school
2115,KatieBee Honey,"February 10, 2020",5, My teacher and my and my class loves this app it's awesome
2116,Main Tonic Prod.,"February 21, 2019",1, cant check classwork categories
2117,ᴥ,"September 17, 2018",5, I love this app I use it for school this is amazing
2118,Dakshraj Mehta,"September 20, 2019",3, Best app. For students
2119,bertete charlemagne,"October 8, 2019",5, This is a good application for school
2120,Devil Gaming,"November 26, 2019",5, It is educates for us and good for teachers and for student
2121,Flame K1ng,"November 25, 2019",5, The app is perfect
2122,Aaron Aaron,"April 7, 2020",1, Dont like it terrible
2123,A Google user,"November 9, 2018",4, Good to keep up with class work
2124,A Google user,"November 2, 2018",4, I think this is a very usfull app for school and work
2125,Meredith Perez,"October 5, 2019",5," This is a great app, I Love It!"
2126,I E D's,"April 7, 2020",1, Take it down lmao
2127,DaGammaDragon,"September 25, 2018",4, No updates when it says available
2128,KEVIN DE BRUYNE,"July 27, 2019",5, This app is lit it has every thing
2129,Reinhart the boi !!,"December 9, 2019",2, Why cant i save my work!? Not cool google . NOT cool
2130,Jeremiah Mavungu,"February 6, 2020",1, IT DOESN'T WORK MY GOD FIX THIS!!!!!
2131,A Google user,"January 10, 2019",4, amizing to use in class
2132,A Google user,"February 5, 2019",5, great for managing work
2133,Thang Khup Khai,"January 15, 2019",5, Excellent app Thanks Google!
2134,Supriya Chauhan,"June 5, 2019",5, quite good app fit for students
2135,Danila Maldonado,"January 16, 2020",1, I cant sign in to my school account and i end up getting 0s because of it i dont recomend
2136,Asamoah Collins,"November 17, 2019",5, It is easy to use
2137,Sohil Oriakhil,"October 14, 2018",5, Hi I love using this app but it's saying to upergrade it
2138,Chandu AN,"June 20, 2019",5, its too useful to read the students
2139,Aleshia Vick,"September 11, 2019",5, It is amazing and I love using this app
2140,tabitha indrisano,"October 25, 2019",5, This app has been very helpful with my school work.
2141,Black_whiterose 32,"December 26, 2019",5, Its the best for me and my students :))
2142,Sheena Fougere,"January 4, 2020",1, 1 star because its school. But 5 stars to the app its rly good
2143,Nari-yah Smith,"January 7, 2020",5, This app helps comuticate from teacher to students
2144,Susana Kubicek,"February 11, 2020",4, Good to connect to the homework from the school
2145,Rifat Mahmud,"September 24, 2018",4, sometimes doesn't show files
2146,A Google user,"November 8, 2018",1, Terrible won't even let me sign in as well it won't even do as I ask it
2147,V GM,"August 12, 2019",1, This app is trash...won't let me log in it doesn't deserve even one star
2148,YASMEEN_ SHAIK,"September 3, 2019",5, Excellent app for learning
2149,Udit Roy,"December 12, 2019",4, Download should me made directly to SD card ..
2150,Wilma Sequeira,"February 29, 2020",5, Very good n helpful
2151,A Google user,"January 7, 2019",5, easy to use awesome for school
2152,A Google user,"October 11, 2018",5, I lpve it its veary helpful and if i cant login
2153,bridvie bleed,"January 8, 2020",1, I hate this app because teachers use it and its useless to me 🤣💨🔥💥
2154,fatima fatima,"March 4, 2020",5, nice and beneficial
2155,Mohit Pandey,"November 12, 2018",5, Very useful app.
2156,Taha chowdhury,"August 6, 2019",4, it's very useful for the students
2157,Miya Tuley,"February 19, 2020",5, Great app you should get this app amazing 👌
2158,A Google user,"October 22, 2018",3, Its a cool tool for school. It just won't let me use my account?
2159,Nathan Renner,"February 13, 2019",3," Will not let me access certain docs that my teachers post. It says ""You need permission"" but I have the perms and I go through Google and it works. it is the app."
2160,ALPHA REAP3R,"October 28, 2019",5, It's very useful for a student
2161,Jesus Briones,"January 28, 2020",1, Makes me do a lot of work
2162,Elizabeth Ahmed,"February 24, 2020",1, I keep getting removed from my enrolled classes
2163,cadence briggs,"October 3, 2018",5, It helps me with my classes and is amazing
2164,Sodha Arvansingh,"June 14, 2019",5, it is very very useful application
2165,Lakeicia Lewis,"June 18, 2019",5, It is fun and exciting 😉😉
2166,Yanci Portillo,"December 3, 2019",5, Well i use this to get my work that i missed in google classroom
2167,Waleed Butt,"December 6, 2019",4, I'm not getting notifications of classes i am enrolled in.
2168,pet smart,"February 9, 2020",5, Great for homework on the go!
2169,What,"April 6, 2020",1, Hate this shit
2170,sid aware,"July 19, 2019",5, best app for cma foundation and other course
2171,Bharath Traju,"November 1, 2019",4, Aweee app for students and teachers
2172,Merhama Kamlani,"August 1, 2019",5, fun and also interesting😀
2173,Arsynn san,"October 31, 2019",1, Installed update only to see all my classes get wiped.
2174,Lobster,"January 24, 2019",5, Ive been using this for a while and I love it.
2175,Francisco Vanegas,"November 14, 2019",1, I can't log on 😡😡
2176,A Google user,"December 17, 2018",1, I think that the whole thing is stupid and a waist of students time if we cant even use it on our devices
2177,TCT _NotBlizzard,"November 3, 2019",5," amazing,ig wirks perfectly"
2178,countomar,"December 2, 2019",3, Sometimes doesn't let me access
2179,Mira Ayoub,"December 17, 2019",5, I use it for homework all the time it is a great app
2180,Dildar Ali Mari,"January 30, 2020",4, This is too much Good
2181,Achintha Perera,"May 28, 2019",5, very helpful issues yet.
2182,suria m,"June 15, 2019",5, I love it. Easy to use
2183,Amy Leary,"February 24, 2020",4, Good but it says i am not in my classes
2184,vinny bag of donuts yeets,"February 26, 2020",1, I speak German groch pei eane lae
2185,A Google user,"September 13, 2018",5, Most useful app in my school experience.
2186,Thanukrishnan Jagadesaperumal,"November 13, 2019",5, Wonderful app for schools
2187,Vamsi kalyan,"December 4, 2019",5, Very good app
2188,Malek Expert YT,"January 13, 2020",3," Not bad, it's good for school anyways."
2189,Tierdabear :3,"November 8, 2018",5," Its easy to do HW you can do it on a phone, tablet, or computer."
2190,Kross_ Apollo,"November 19, 2018",5, It is an amazing app for students
2191,ThatoneBuescherfan37,"September 13, 2019",1, Cant even work properly
2192,Yuliasti Ika,"October 5, 2019",5, Great apps for education
2193,Amarie Domingo,"January 12, 2020",5, Help kids get homework and other work done really cool
2194,A Google user,"May 13, 2019",5, This app not only keep me on track but gives me good grades it's so organize.I really recommend this app
2195,keara opalenik,"February 21, 2019",4, Great I use it for school everyday.
2196,Ellappan Selvakumar,"July 28, 2019",5, super app .it is so useful
2197,Giorgio Bond,"April 10, 2020",1, Horable it sucked
2198,A Google user,"March 24, 2019",5, I love it cause you can do your home work
2199,Pranav Moturu,"September 24, 2018",4, Nice and easy
2200,-Robin _,"December 17, 2019",5, The best of luck to all of your help and support to our website and the rest are you doing recently my responsibilities included handling of this message and it's disclosure to anyone else please erase all are you going to the next week to discuss a business opportunity you should have it on the pho...Full ReviewThe best of luck to all of your help and support to our website and the rest are you doing recently my responsibilities included handling of this message and it's disclosure to anyone else please erase all are you going to the next week to discuss a business opportunity you should have it on the phone and blackberry and you are not in a while ago but haven't heard from the following link unsubscribe you have received the payment
2201,Fossil Fuels,"December 24, 2019",5, google classroom is cool and all but i am so tired of high school
2202,Steven Sherrod,"April 7, 2020",1, F Google Classroom
2203,Arsalan Ali,"March 26, 2020",1, Totally flop app remove it
2204,Jitendra kumar Tiwari,"January 24, 2019",5, very helpful for all student
2205,Esme Purnell,"September 5, 2019",5, i love this app its amazing for school work!
2206,Samurai Gaming,"November 19, 2019",3," Hmmm... sorry but, I was gonna rate 5 stars but, uh, I was expecting for it to be like the Google Classroom from the school's Chromebooks and I use a Samsung Galaxy Tab A. Sorry."
2207,노래NicoleInterlude,"September 23, 2018",5, Amazing! So useful!
2208,Dr. D. G. Ajay,"October 4, 2019",5, Excellent Apps for education
2209,Skelly_boi,"April 23, 2020",1, Can't get into my classes. And the work don't pop up for me till the week it's due.
2210,No nickname,"January 19, 2019",5, its amazing i ♡ its effecient and useful
2211,Elimalai Ks,"October 28, 2019",4, Useful to students
2212,Abdikadir Muganga,"February 7, 2020",1," This is a weird app on Androids ,"
2213,Rockrezzz 123,"February 23, 2020",1, Can't sign in
2214,Ayesha Nadim,"February 25, 2019",1, It never gives me notifications about my school work and is very messed up.
2215,AK dance tutorial,"September 19, 2019",5, This app important for information of class
2216,TSM KID,"November 17, 2019",5, Fun but to much work from my teacher
2217,Monique Hernandez monique,"December 14, 2019",1, Dosen't t let me press join I been trying for 3 hours
2218,Eden Pynes,"September 16, 2018",5, I like this app because i use this app for my classes and my work to turn in
2219,Virendra Tijare,"October 25, 2019",5, It's very useful for the students
2220,Calvin Leonard,"November 6, 2019",1, Never get notification about my enroll class.. u must open this app first to get a notification about ur enroll class... That sucks!
2221,Allison Darosa,"January 18, 2020",5, i love this app i can talk to friends and my teacher i can finish homework ang more
2222,Hillary Obasi,"November 1, 2018",4, It is a well packaged app like not like other education app
2223,A Google user,"October 17, 2018",5, In like this app its really good realy useful
2224,Tamal Biswas,"May 10, 2019",4, good but need improve
2225,Margo Villmoare,"August 19, 2019",1, i cannot get onto an email
2226,stephanie barker,"December 3, 2019",2, Not letting me do things Fix please an thank you
2227,CHANDAN ROY,"January 25, 2019",5, Useful for all persons
2228,Abhay Patel,"July 28, 2019",5, supper cool app for learning.
2229,SpyroStorm15 The Final Quest with Ramset,"February 25, 2020",5, I did this with my school!
2230,Ana Lese,"March 14, 2019",5, AWESOME! We use this at my school so.... love it!💙
2231,A Google user,"March 6, 2019",5, this is the good app for childrens
2232,Priya Kumari,"June 15, 2019",1, use less you can't join class I don't know how to join in a class please! not download this app
2233,TTVninja10messi,"February 3, 2020",5, Easy can track of my math and English
2234,SHANTA KALAI,"August 20, 2019",5, Can't connect
2235,Ashik Gowda,"October 27, 2019",5, Nice and useful app
2236,Sumit Solanki,"July 6, 2019",5, thank you sir this app is very useful to me
2237,Dr. Ramlal Porika,"September 2, 2019",5, The best app for teachers
2238,Elijah Shelley,"November 27, 2018",1, I couldnt even log in
2239,Renson Dimalanta,"October 5, 2018",5, Good easy to use
2240,gorgie thehusky,"October 25, 2019",1, It has no confetti:(
2241,Nizom Nadzir,"December 26, 2019",5, Excellent! The future of learning is here!
2242,Monique Brown,"October 18, 2018",5, Love it so so so so help my grandbaby to her work she missed
2243,Lalji Udecha,"September 16, 2018",5, Nice app this app is seving time
2244,Jansen Polintan,"August 2, 2019",5, very useful with school
2245,Saud Ahmad,"February 16, 2020",5, It is a good app after all
2246,Aman Singh,"September 18, 2018",5, Good and best app
2247,A Google user,"February 14, 2019",1, doesnt work anymore due to update
2248,Gaming on YT,"September 15, 2019",5, The app was very very nice
2249,A Google user,"September 26, 2018",3, Its ok but I dont always find my assignments but when I was using i my computer it worked
2250,Jenil Manghani,"August 17, 2019",3, good app I learn so much from this app
2251,Oliver Paredes,"December 25, 2019",5, I love talking to classmates and my teacher Mrs.Earl
2252,xpizzaplace100,"January 30, 2020",3, School is very hard.
2253,Abdallah Bozo,"February 18, 2019",1, Unfortunately Doesn't work
2254,Breana Langford,"October 23, 2018",5, The app is very helpful
2255,Saloni Bothara,"September 16, 2019",5, Best app n easy to use
2256,marya yoona,"December 5, 2019",5, Thanks making me easy to accomplish my assignment
2257,Tyler Luker,"January 23, 2020",5, It's the ONLY thing my teachers will use
2258,Nessa Blanco,"February 25, 2020",5, I got work and it is fine
2259,Chidiogo Ezeh,"March 3, 2019",1, couldn't download easily
2260,Rokas,"October 21, 2018",5, Can anyone tell me how to log in using a non gmail account?
2261,Sathya Manoharan,"March 22, 2019",5, good experience i bet everyone love it i do to.... because easy to share all the info through this app with all ppl....
2262,Diana Mirable,"April 3, 2019",3, Been good. But still can't save the files sent to my classes
2263,Joe E,"February 22, 2020",1, Samsung Galaxy S9+ app now has a fish icon and deleted all of my classes. How am I supposed to post my students work now? If you this is supposed to be a LMS it needs to be 100% reliable and right now it is the opposite of that.
2264,Sachidanand Pandey,"November 1, 2018",5, Nice app for exam preparation
2265,A Google user,"March 9, 2019",5, How do you upgrade google classroom?
2266,Shahin islam,"September 5, 2019",5, Very helpful app👍👍
2267,John Ramadhan,"May 22, 2019",5, Pretty sad app. It always reminds me of my responsibilities.
2268,Maria Wilson,"September 26, 2018",5, My son is in 7th grade and this app is helpful.
2269,Sakib Ahmed Turjo,"October 27, 2019",1, faltu app. download koiren na keu vayera.
2270,Kirby bubblegum,"November 27, 2019",5, I used Google Classroom for school now I can used it anytime
2271,Imad Alwakeel,"April 18, 2020",1, I hate how I get way to much and like who do you think you are giving me this much work to do like i'm trying to do some homework and all of a sudden there is another lesson and it due some day like maybe for like tomorrow and I just got it I would like it is I would have a week like who do they thi...Full ReviewI hate how I get way to much and like who do you think you are giving me this much work to do like i'm trying to do some homework and all of a sudden there is another lesson and it due some day like maybe for like tomorrow and I just got it I would like it is I would have a week like who do they think they are giving me so much homework but I mean it would be good if we did not get so much homework but I mean this is what I think and we all have different opinion.
2272,A Google user,"December 9, 2018",5, Most useful App....!
2273,putin nice,"September 16, 2019",3, Cant open documents...
2274,RABIN G,"January 28, 2020",1, Its is a worst app developed by google llc
2275,A Google user,"September 26, 2018",1, Too boring and professional
2276,Khaotic,"September 24, 2018",1, This app makes my life a living hell every single day
2277,Adanech Workineh,"June 11, 2019",5, I don't have to use my Chromebook (computer) every time!!!!
2278,Tracy,"September 7, 2019",5, A very good way for my daughter to keep up to date with her school work and asignments
2279,ChekLily12,"December 6, 2019",1, Why i can't submit my assignment?
2280,Maragei Serah,"April 22, 2019",1, too Slow to download
2281,"Ethan Feng CE,","January 6, 2020",1," I was go an` turn in my work, then it just crased, and my work got throw away, and I got a talk with the teacher cuz I did not have time to redo it. When I first used it, I though it good, but this BUG HAPPEN LIKE 23 TIMES!!! So I uninstull it. I do not think you should this hateful, bugful, useless...Full ReviewI was go an` turn in my work, then it just crased, and my work got throw away, and I got a talk with the teacher cuz I did not have time to redo it. When I first used it, I though it good, but this BUG HAPPEN LIKE 23 TIMES!!! So I uninstull it. I do not think you should this hateful, bugful, useless google app I dislike this app."
2282,RAMAVATH SONI,"February 4, 2020",5, ♥️I'm in love with this app😍
2283,A Google user,"October 30, 2018",5, Useful app...thanks
2284,Raza Ali Magsi,"September 29, 2018",5, Being an student this is always helpful
2285,lightnimaton,"January 9, 2019",5, Can not upgrade
2286,Kashinath Chavan,"August 29, 2019",4, Nice app easy to hadle
2287,Garreth S,"February 24, 2020",1, Unenrolls from classes when u open them
2288,Clifford Tama,"February 11, 2019",5, I really like it. It helped me alot.
2289,Manpreet Bhullar,"October 4, 2019",5, I like it a lot because of this I am never behind in any work
2290,Saima Sharif,"December 18, 2019",5, It is great way of education
2291,mason bailey,"January 27, 2020",1, it is so stupid
2292,Nick the beast,"February 9, 2020",1, It made my classes dissaper
2293,saryajeet waghmare1,"February 11, 2020",1, why i shouldn't save contacts
2294,Youssef Sayed Ahmed,"February 12, 2020",1, Uhhhhh.... Well the app is kinda great....
2295,Pavan Devulapalli,"July 29, 2019",4, Convenient To Use
2296,Kamal Raj,"August 25, 2019",2, I don't get the notification from any announcement
2297,Trinity Elizabeth,"September 1, 2019",1, This app will not load
2298,A Google user,"October 12, 2018",5, Really useful for school
2299,YANDRA SIVABALASUBRAHMANYAM,"June 21, 2019",5, its very useful for students
2300,Leonard Chang,"October 11, 2019",5, Very extraordinary app😃
2301,A Google user,"September 24, 2018",5, This is great for all schools. People who think it's boring are school haters. It is helpful for the teachers who wouldn't waste their time on notebooks. They'd prefer Classroom.
2302,Ronnie James,"September 24, 2018",1, I enter my code for my classroom and it doesn't work
2303,Victoria Anderson,"September 21, 2019",5," Un Un b h. U u u I k j h. y y y y y. y y y y y y y y u u u UNUNUNUNUIMOKKKKKKKKKKK MN Jjjj I It Is If I I'd 8th JJJFJTJG. Jjjj Jjjj jjrjrhrhkijjdjuyrimdenedjrrjjrrjrjrjfjfjfjfjfjf in r a lot more than just a bit. I am a big fan, but it was a great deal with. This was my favorite. I will not only a f...Full ReviewUn Un b h. U u u I k j h. y y y y y. y y y y y y y y u u u UNUNUNUNUIMOKKKKKKKKKKK MN Jjjj I It Is If I I'd 8th JJJFJTJG. Jjjj Jjjj jjrjrhrhkijjdjuyrimdenedjrrjjrrjrjrjfjfjfjfjfjf in r a lot more than just a bit. I am a big fan, but it was a great deal with. This was my favorite. I will not only a few of my favorite, and a few days, the, but I have to be a problem with the same thing, but it was a great deal. I am not sure if I had to do .6. The other day and age, and a. The only thing that I ca"
2304,Hiruma Himawari,"February 6, 2020",4, Add call or reply in comment pleaseee
2305,Ixchel Ramirez Atilano,"September 22, 2018",5, Its very easy to use for homework and my friends love it to
2306,Pucks world,"February 13, 2020",1, Gays should not be allowed to be married
2307,Geetha Senthil,"February 28, 2020",5, Its giod for teachers and students
2308,Kinsley Hendrickson,"April 15, 2019",5, keeps track of work needed to be done
2309,Sanjay B,"December 11, 2019",5, I got this app I am faster in study
2310,Adesina Omotayo,"February 4, 2020",5, Good i can reah my friends anywhere
2311,JETheKristoff,"February 13, 2020",1, I hate it!!!! This app is just a bummer. I DON'T EVEN GET TO DELETE MY CLASSES!
2312,Priyadarshi Kumari,"April 14, 2020",3, This app takes a high space so I couldn't able to download it
2313,A Google user,"September 12, 2018",5, It's great! I get to know when my assignments are due and I can see what I got wrong
2314,A Google user,"December 19, 2018",5, very good for students and teachers
2315,Nicole Rollins,"August 27, 2019",4, I love google classroom thanks to this app my kids can turn in their assignments early and get a good grade
2316,Momina Shahid,"December 22, 2019",1, Because it gives us school homework
2317,Sujata Vhanmane,"July 7, 2019",5, it's perfect app for students
2318,Helen Limas,"August 17, 2019",5, easy to used
2319,PopularoverlordYT,"December 15, 2019",1, School sucks. This sucks
2320,Betrand Ngong,"January 1, 2020",5, Still to know I just installed it
2321,Daripalli Nikhil,"January 10, 2020",5, Good used app
2322,Jonathan Iroth,"February 24, 2020",1, Can't hand in assignment
2323,Nikhil Devmurari,"July 16, 2019",5, It's very usefully app.
2324,henry gamer tv,"February 21, 2020",5, It help me do the homework
2325,thomas maus,"September 16, 2018",5, Love everything about it.
2326,Manish Joshi,"January 9, 2020",5, Wah wah... easy to work...
2327,Jese Somerville,"February 4, 2020",1, I hate school
2328,Ameen Garman,"December 27, 2019",5, Great Site from recommended by our great Prof. Mohialdeen Al Otumi ممتاز وممتع ومتعب
2329,himanshu bhadoliya,"October 31, 2018",5, This is easy to study
2330,Johnna Obryan,"October 25, 2019",5, This app is really good for work at school
2331,sajjad hridoy,"February 25, 2020",5, very helpful app
2332,Lovely Pineapple,"October 30, 2019",1, The app really isn't the best on mobile
2333,SAWIN H S,"February 15, 2020",5, Important for me
2334,Firas Al Juboori,"March 1, 2019",5, good an useful app
2335,Jay Tolar,"September 24, 2018",5, Very good role play app. I can make a classroom for all of my 'students' and set them real homework like: kill the cat by Monday or drink the bleach by Friday!
2336,A Google user,"November 9, 2018",1, Its too slow
2337,Aditi Gaddam,"June 25, 2019",5, Its a great expierience!!
2338,akash sharma,"November 23, 2019",5, It is good for study
2339,JOSS WILSON,"February 1, 2020",5, Good for homework needs
2340,Ivanna Flores,"December 9, 2018",1, The last version was so much better
2341,prathamesh khochade,"February 8, 2020",4, It is good
2342,Ms. Nicole,"February 28, 2019",5, this is a good way of teaching👏👍🏾
2343,Mihir Keshur,"December 27, 2019",5, Student best application Best in students information in clg and school Notice
2344,A Google user,"October 4, 2018",5, It is a cool and educational. App
2345,Shubhamkar Joshi,"September 27, 2018",1, Can't refresh
2346,Dr. Nandkumar Kamat,"December 7, 2018",5," This is an app as important as library of Alexandria once was for educating mankind. Google deserves the NOBEL PEACE PRIZE for democratizing education. Its iberating force for teachers in poor underdeveloped Anglophone and esp member countries of British commonwealth. But if offered in other languag...Full ReviewThis is an app as important as library of Alexandria once was for educating mankind. Google deserves the NOBEL PEACE PRIZE for democratizing education. Its iberating force for teachers in poor underdeveloped Anglophone and esp member countries of British commonwealth. But if offered in other languages like Chinese, Arabic, Swahili, Persian, Hindi, Urdu, Tamil, Marathi, Telugu, Bangla, Gujarathi, Punjabi then it can be used very effectively and bring billions under its use. Its free , simple to use and Outstanding teaching app but restricted by limit of 20 files which can be attached with any post. Doesnt make any sense. Please increase to min 50 files."
2347,Aaron Musiimenta,"October 27, 2019",5," I hope this application is the best , so I am expecting the good from it but I am not sure of everything I put and Blaaaaaaaaaaaaaaaaaaaaaaaaaaaaaaaaaaaaaaaaaaaaaaaaaaaaaaaaaaaaaaaaaa aaaaaaaaaaaaaaaaaaaaaaaaaaaaaaaaaaaaaaaaaaaaaaaaaaaaaaaaaaaaaaaaaaaaaaaaaaaaaaaaaaaaaaaaaaaaaaaaaaaaaaaaaaaaaaaaaaaa...Full ReviewI hope this application is the best , so I am expecting the good from it but I am not sure of everything I put and Blaaaaaaaaaaaaaaaaaaaaaaaaaaaaaaaaaaaaaaaaaaaaaaaaaaaaaaaaaaaaaaaaaa aaaaaaaaaaaaaaaaaaaaaaaaaaaaaaaaaaaaaaaaaaaaaaaaaaaaaaaaaaaaaaaaaaaaaaaaaaaaaaaaaaaaaaaaaaaaaaaaaaaaaaaaaaaaaaaaaaaaaaaaaaaaaaaaaaaaaaaaaaaaaaaaaaaaaaaaaaaaaaaaaaaaaaaaaaaaaaaaaaaaaaaaaaaaaaaaaaaaaaaaaaaaaaaaaaaaaaaaaaaaaaaaaaaaaaaaaaaaaaaaaaaaaaaaaaaaaaaaaaaaaaaaaaaaaaaaaaaaaaaaaaaaaaaaaaaaaaàaaaaaaaaaaaaaaaaaaaah"
2348,PrincessPink 313,"February 10, 2020",4, It's pretty good. 👌🏼
2349,Potato Dash,"October 17, 2018",4, Great for students/teachers 👌
2350,The ISV Studios,"September 26, 2019",5, A wonderful experience for me throughout the years
2351,Red Diamond,"January 27, 2020",1, It is dumb
2352,Martin Tinklepoo,"December 18, 2019",5, This is an awesome app.
2353,SAIYOGESH S,"January 12, 2020",5, Easy way to learn online
