index,author_name,review_date,reviewer_ratings,review_body
729,Joshua Tohom,"February 22, 2020",1, It did not work after a couple of days. And the things I have to do are not there and today all the classroom that I had where erased and there was something important I had to do.
730,Ramesh Ramisetti,"February 24, 2020",2," My classroom account was left involuntarily and unable to join again using the invite code. It said sorry, something went wrong"
731,Leroy Phan,"May 2, 2019",1," So you're telling me that I have to allow Google to access my contacts, to be able to reset my phone's password, to possibly wipe my phone's data via factory reset, etc. in order to use Google classroom? Why do I have to allow it to access so much of my phone and data just to use this app? Uninstall...Full ReviewSo you're telling me that I have to allow Google to access my contacts, to be able to reset my phone's password, to possibly wipe my phone's data via factory reset, etc. in order to use Google classroom? Why do I have to allow it to access so much of my phone and data just to use this app? Uninstalled and just used Google Classroom on browser instead."
732,darcey dezutter,"September 25, 2018",4," The app is great for school, but it says I need to update it, but it's up to date. Hopefully glitch can be fixed soon!!"
733,XGN Rivers,"October 2, 2018",5," Amazing, my teachers at school use it and it makes everything easier on us and them, overall great performance and relieves the stress of you knowing that the students might not get the classwork!"
734,j p,"January 11, 2019",5, My only suggestion is instead of showing the list of topics under each section.. Can you make it inside that list (in class work) Otherwise after adding so many meterial it look very crouded 😂
735,Hazoor Ahmad,"October 4, 2018",5, Good! But I always find difficulty in tracing my students roll # or registration codes while adding quiz results. Specially when the students are with same name.
736,Emily Crisafulli,"June 14, 2019",5," Very helpful when teachers have to get information to their students, and it is very organized. I would recomend this app for educational purposes."
737,Ajay Kumar,"July 5, 2019",4, Nice app but a little problem in opening sites. It's a good app for studying and making groups.
738,Mahendra Chittupolu,"August 22, 2019",4, This app is very good and useful but when we open a pdf or a ppt from the folder in it and again manage that app in recent apps and then when we open this app again the whole ppt is starting from the first page Could you please fix this
739,Obese Phobes,"November 5, 2019",5, Great app much a times to share docs . This is really a good app . Hip hip Google
740,Deli Rocha,"March 29, 2019",1, It was working but I can't upload any material anymore and the mp3 files won't work. Disappointing.
741,Carley Fox,"December 25, 2019",1, I'm a student and I can't use this app on any of my personal devices. It isn't always possible for me to get access to my laptop in order to do school work on the website.
742,Todd McKnight,"February 1, 2019",4," the comment feature is pretty finicky. sometimes you can from the stream, sometimes you have to click the Assingment and sometimes it doesnt work"
743,A Google user,"December 7, 2018",3, All my assignments always say something went wrong and it also says that my assignments are unavailable and out of class. Its okay but not as good as i thought it would be
744,Kenneth lin,"November 10, 2018",2," Fix your comment section, every time I type in the comment section it blends with the post making it hard to edit!"
745,Honesti Jae Masuka,"May 13, 2019",3, i think there is more to be done to make it more simpler and understandable. Also i wish it could be joined usong phone numbers not email Only.
746,Jonas Wong,"October 10, 2018",1," Some items posted does not show up. Almost missed an assignment because classroom does not show the post, regardless of constantly refreshing."
747,A Google user,"November 16, 2018",5," I think its pretty good keeps track of work and it helps i see many ""its boring"" in the reviews. Google Classroom is not a game its a tool you use for school etc"
748,Kamakshi Baid,"October 13, 2018",2," Attachment of any file or image takes too long time, and sometimes it does not even get attached."
749,anonyo sanyal,"October 28, 2018",5, It is really a helpful application. Both for teachers and students things become easier. Good stuff. Please Google do not shut this down.
750,Ahil Kannan,"August 7, 2019",5, Useful in a very optimised way. It connects us more than a classroom does. And it really inspires people to learn.
751,Damian Schirripa,"October 23, 2019",2," I try to add an account (that being my child's) but the first thing it asks for is a password, not a email, but a password. My password doesn't work and neither does my child's."
752,Paolo Sophisticado,"October 25, 2019",5," I just attented a seminar regarding google classroom and using this program to help teachers and students with the integration of technology, it is very helpful and easy to use."
753,SHAY PERKINS,"November 3, 2019",5," Helps me get my work done fast n it's very organized to the point were I'm able to catch up on missing assignments n get good grades, it also help know where I'm at in a class n what I need to work or what I am done with..👍🏾👍🏾👍🏾👍🏾"
754,CARTOON WORLD,"January 21, 2020",1, Downlod speed is very low it takes much time to downlod small pdfs.
755,ASHISH KUMAR,"February 2, 2020",5, That is very useful app in student life so I suggest every student that they are must use this application 😍 🥇 🎯 Ashish Kumar
756,Mubashir Rehman,"October 5, 2018",3," It should add tagging options, notifications and pop telling teachers that a newer and better version is available (if so)."
757,Ayan Kumar Saha,"March 14, 2019",5," Very good app for teachers and students. Every school, college, universities must use this app for post-class assignments, notes etc like that."
758,Elisha Elias Lomay,"April 16, 2019",5, An excellent learning management system for any class of whatever level... secure and safe... I recommend you to use it
759,Dillon Halim,"April 10, 2019",4," I'm a student and my class use this app to do assignments that my teacher give. I write this review because for some reason: usually after you submit the answer, you can see other classmates answers. But one day(till now) it dosent show any answer but only showing ""no answers yet"", even from the pre...Full ReviewI'm a student and my class use this app to do assignments that my teacher give. I write this review because for some reason: usually after you submit the answer, you can see other classmates answers. But one day(till now) it dosent show any answer but only showing ""no answers yet"", even from the previous post. I'm not sure if other people are having a difficulty like me but please fix it, I really enjoy using this app. I'm using a Samsung Galaxy Note 5 you can contact me if more info needed."
760,Vicky Vignesh,"February 1, 2019",4, All options are good... but i need select multiple images option... to select more at one time..
761,Laggy logo,"October 1, 2019",5," Very easy to use for class. You can have fun with it too buy making a classroom for all your friends and give them ""assignments""."
762,Grant Cooper,"November 19, 2019",5, A highly effective system for schools and teachers to organize assignments for students!
763,Deepa Vaidya,"January 3, 2020",3, Sometime Uploaded files & links aren't accessible to students.
764,Krishna Chinnara,"September 25, 2018",3, Standard but need more concentration. Hence it needs more development and upgradation.
765,Nurul Farzanah Rosli,"February 19, 2019",4, I have this one tiny problem where i keep on having a loads of notification of the same activity on my feed. Please help me to solve this idle. I already sent the feedback.
766,Rashmi Joshi,"October 21, 2018",4," App is good but please make it's website more user friendly. Content shown there is very random, please allow the website to organise the contents according to classes."
767,Thelma Buigbo,"November 23, 2019",5," It is very good for learnig and good to keep track of the works you have done your grade,classroom,test and home work.Thanks to the producer director and every one who woks pn producing this wonderful app thankyou very much✌❤."
768,Mathew Smith,"February 25, 2020",1," I never even signed up for the ""Beta"" now it deletes all my classes and makes me uninstall and reinstall the app. Garbage"
769,FIGHTMEHELEN,"March 17, 2019",1, this is really 0 stars but every time I try to log in no matter what account on what device the info is ALWAYS outdated on. mobile
770,justin jose,"May 26, 2019",4, A very handy app for educators and students. However i feel that over the course of time few more features need to included.
771,Kimberly,"December 21, 2018",4, it wont let me see pdfs... it just gives me the spin of death. other than that it is good.
772,Delmz _,"June 2, 2019",1, The new update is the worst. It doesnt let me access my classes and there is always this circular arrow in the middle. Also it says class does not exist and the notifications do not work
773,Ainee Noorainie,"August 5, 2019",4, it is easy to use..however the interface is quite boring...pls upgrade the interface...to make the class more fun.. i think it need to be user friendly especially for any age of users..
774,ToDDtheKiDSY,"August 21, 2019",4," Great but for some reason, I am unable to receive any notifications from this app which makes things rather inconvenient when it comes to updates from my classes."
775,P.J. R,"August 30, 2019",4, Wish this had a feature so parents could see assignments and communicate with teachers. That would be better then waiting for the teacher to email or waiting for weekly updates.
776,Venkat Raman,"January 10, 2020",2, This is really a bad app which I have never seen. It is used for my school purpose but I am not abled to complete within the time given.
777,Monika Verma,"February 17, 2020",5," Amazing teacher , best for the preparation of mains....!!!!!"
778,Alyssa _,"September 26, 2018",4, I absolutely love this. My school mostly uses Google Classroom and I love it. This is actually really helpful for school.
779,Malar Manohar,"June 3, 2019",5, This app is very much useful for school students.it doesn't contain any inappropriate ads or any unwanted messages.Thus it provides fullest satisfaction for the user.
780,Sugiyanto G,"February 24, 2020",1, Other Univ Email can not connect Please Fix this Bugs Thanks
781,Nathan Craggs,"May 15, 2019",2, I used a account that is supposed to work and it said I did not have access. it works on my computer but I have no idea why it is doing this
782,A Google user,"February 9, 2019",5," I love this APP , but sometimes it shows me ethernet issues suach as not network conection. but it is ok."
783,Nitin Sharma,"May 26, 2019",4, App is very useful and i like the feature of online test but i am a physics teacher so i am not able to assign that test. Please add a feature so that i can type mathematical equations also.
784,Mic Coleman,"February 4, 2019",2, Doesn't even load the comments for my classmates or my answers sometimes. Why'd you change the interface it was fine. Everything doesn't have to be completely white.
785,ranger the border collie,"September 15, 2018",1," I had to delete bc there was a glitch, so when I redownloded it I had to use my school email and it said I couldn't! Now I can only use my laptop, and that better still work bc I'm using my school email, and I'm sure they can't give me a new one, therefore u get 1 star😒"
786,Hamzah Al-washali,"September 22, 2019",1," I don't know why notifications is just the least priority in the developer's head, you don't know how much a notify icon could change someone's scores on the subject, anyway, worst app made by Google"
787,M.A Alam,"January 14, 2020",5, Excellent app for Bangladeshi teachers. Thanks a2i
788,A Google user,"October 15, 2018",2," Keeps saying to upgrade,then clicked to upgrade and nothing. Stays in upgrade loop will not let me access."
789,zackary Stellingwerf,"January 13, 2019",5, I LOVE this app it helps me catch up on important subjects like social studies and health. And since im only in 4th grade it REALLY helps.
790,Hardik Khanesa,"August 11, 2019",3," it's need improvement in terms of idea because professor first sign in paper then they say to upload,Is there any way to digital signature, because everyone can submit single pdf to assignments."
791,Jenni William,"August 29, 2019",4," It's really good and really helpful, but sometimes it wont let me log in from my phone which sucks. Whoever made this app yall gotta fix this problem."
792,Hope Star78,"October 27, 2019",5, Good app only problem I have is it's also connected to my school email so I get two Notifications every time but that's my problem not an app problem.
793,Anant Maurya,"November 18, 2019",4, Nice app for taking practice test and classes.But some times the app stops working properly .
794,Jahanvi Sharma,"May 18, 2019",5," It's really helpful for school teachers and professors , its an easier way to connect with students ."
795,Atin Bag,"July 28, 2019",3, It's really Useful.It's too easy to use. I think it's be better if we can attach any file with class comments.
796,Munira Daud,"December 31, 2019",5, Good and very helpful in education
797,daniel ansah,"January 8, 2020",5, It really helps me when I'm at home and I want to get work done
798,sabrina savedra,"October 16, 2018",5, This app became my university life easier. Where the professors post the material and tasks. Very easy to use it by the mobile and also by the computer. Very useful!!!
799,karolina kure,"November 13, 2018",1, I cant even log in to my school account. My teacher and some students got through. I tired to log in and it dosent work.
800,Faisal Mohammed,"January 10, 2019",5," Great way to deliver training/educational content to masses. kudos to Google, it's an awesome service from Google with intergrated so many other service like gmail, gcal etc. keep up."
801,Kyle Stotch,"June 9, 2019",1," I created new classrooms via Desktop successfully but when I viewed them via mobile, they aren't displaying correctly / imvisible."
802,CLB,"June 13, 2019",1, I don't receive notifications when a student posts or comments. which defeats the purpose of having the app on my phone. I checked all my notification settings. everything is on with sound.
803,Magis,"September 9, 2019",4, I use this for school. It's convenient because I get a notification everytime an assignment is uploaded or returned.
804,Soo P,"September 24, 2019",4," Google classrom is a very handy tool for student and teachers. Although, I do wish rhe get rid of class comments. There are somtimes students typing and posting stuff that is not appropriate. All in all, a very good app. Four🌟🌟🌟🌟s."
805,The Funnie Memez,"October 23, 2019",5," I love it and I use it for many activities in school. I love this app and wish that it was just a little faster, but other than that it's perfect."
806,GreenIsStraight,"March 8, 2019",2, I had to uninstall Google Classroom because it wasn't allowing me to view recent assignment uploads. I tried to redownload and now it isn't allowing me back in with my school account. I'm not sure what to do.
807,A Google user,"October 1, 2018",4, This app is great the only problem is that it only has it in English and I need it in French.
808,Vova Volosevych,"January 15, 2019",1," Afetr a week of use a window ""Something went wrong"" comes. I have to delete my account from my phone, and sign in again. Every week repeated."
809,Haley Vigil,"October 28, 2018",4, It's great! Pretty easy use but doesn't upload pictures and update class well
810,Taylor Nash,"October 7, 2018",5," Very helpful on the go! My students all use this app. The mobile app is limited compared to the online version, but it's still worth the download if you are a student or a teacher."
811,Prof. Mushahid Syed Mason,"August 29, 2019",4," A feature for student attendance must be introduced, so that students can see their attendance percentage and teachers might go with digital attendance feature."
812,Tanya Ruiz,"September 12, 2019",1," Can't log in, keeps telling me to type in a random word. 0 stars"
813,Melvin Awuku,"September 26, 2019",3, Please when I try opening sent documents it keeps telling me that Google classroom has stopped working. So please try and find solutions to this problem. Thanks
814,Yumi,"October 9, 2019",4, It is really awesome! I mostly use it on my PC but things are good on the phone!
815,Ashish Khuje,"February 22, 2020",5, It is very useful app for every student I like it
816,A Google user,"February 7, 2019",5, Awesome App it helps me stay orginized and buy less paper to store my notes and assigments. I highly recommend this for students and teachers also
817,P.E.M.C Games,"October 24, 2018",1, Everytime I tried to edit a document and save it the app would crash.
818,Shubham Bichke,"September 23, 2018",4," It's a good platform for sharing knowledge But it has some issue that even I have updated it, it shows update the app Pls fix it ASAP"
819,helmetmcbarin,"September 30, 2018",3, Doesn't work for me it says something to do with out of date and always says something went wrong and is constantly having problems
820,Rachel Coladonato,"August 30, 2019",1, Its way too complicated with its set up and when you dont have internet to turn something in it says its late when really its done. This app sucks and its slow
821,Amrya Natasya,"November 8, 2019",5, This application helps me to improving myself than before.Thank you for this app.Student should install this app because there are a lot of advantages.
822,A Google user,"March 17, 2019",5, It's a very useful app because it helps a lot of students to communicate with their teachers and not only just to communication but also to download apps such as maths formulas
823,A Google user,"February 2, 2019",4," Really helpful and efficient, but I think it ahould give notifications whenever something happens in your class. Not just big announcements."
824,sharif hossain,"September 30, 2018",5," Love it, very useful for my daughter, to complete her school assignments and her homework at home, very useful! :)"
825,Looi Jaslin,"July 6, 2019",1," Hi, I've sent an email and a few feedback via the apps to request for assistance. Can you kindly assist and expedite on the issue that I'm facing as I need to communicate with the teachers via this apps? After using my child's school email address to login, I've accidentally selected ""as teacher"", s...Full ReviewHi, I've sent an email and a few feedback via the apps to request for assistance. Can you kindly assist and expedite on the issue that I'm facing as I need to communicate with the teachers via this apps? After using my child's school email address to login, I've accidentally selected ""as teacher"", should be ""as parent"" instead. I couldn't find any options to change it. Need you to change to ""as parent"" instead. FYI, the teacher can't edit/ amend on her end that is why I'm contacting you guys."
826,OneUp117 Gaming,"October 26, 2019",5," I honestly do not use this much, for teachers it could be useful on a digital school, for students, it helps remind them."
827,Isela Ibarra,"February 6, 2020",3, It's always giving notifications and it's annoying me.
828,Phaidra Ruck,"February 25, 2020",1, Does not show calendar on mobile
829,Teaii ᐛ,"April 22, 2020",1, this app has crumbled away any sanity i had left. my mental health is deteriorating day by day due to google classroom. my mind will forever be broken.
830,Henry E. Laskow,"January 21, 2019",1," The latest version keeps crashing when I zoom in on an image, so now it's practically useless."
831,Caroline Reddick,"January 12, 2019",5, This application has made learning easy and interactive. I would highly recommend it to instructors and students alike.
832,Sophia White,"December 10, 2018",4, It was pretty good there are a few glitches but that is rare
833,A Google user,"March 24, 2019",1," it worked fine and then it started not getting my notifications now i uninstalled it and reinstalled it then it said ""you cant use this account"" or something, please fix this bug! my teachers will get mad!"
834,Rajaldesar Activist,"May 30, 2019",4," good app for coordinator, teacher, student to interact with and exchange view and learn & teaching."
835,Julia,"September 29, 2019",5," Very good app, really helps me to know about school exams, tests and upcoming events😊, definetly recommend."
836,Cote Brothers,"October 18, 2019",1," Ever since the new update i cant log into google classroom, my email is controlled by my school. This used to never be a problem"
837,Marcelo Schneider,"January 12, 2020",5, The best school app ever! Never got 1 error message.
838,lazy minecraft,"January 17, 2020",5, Great app except my child keeps getting a lot of notification everyday so much.
839,VICTORIA PENA,"April 15, 2020",5," There's people that have a love and hate relationship with this app I actually find it extremely useful,because it sets up what assignments i need to do on whatever days what i have already done so I dont have to stress about an assignment that did I or didn't finish it.Not just that but also you ca...Full ReviewThere's people that have a love and hate relationship with this app I actually find it extremely useful,because it sets up what assignments i need to do on whatever days what i have already done so I dont have to stress about an assignment that did I or didn't finish it.Not just that but also you can also see other students comments to see if a question you needed answered was answered.I saw something that a student wants to ban or cancel this app and I am so UPSET because this really HELPS me!"
840,A Google user,"September 19, 2018",5, This app is amazing.... It's very much funner than regular paper . The pen comes in different colors and sizes it's GRATE for school I love this app
841,Rowan W,"May 3, 2019",1," Useless app. It never works and even when it updates, it never fixes the actual problems, despite many complaints."
842,Maile Janel,"October 29, 2019",1, Won't even let me sign in. I click on my school email connected to classroom (that works on the google classroom website) and it says I don't have access. I'm just trying to do my work and I can't.
843,Melike Kaya,"September 24, 2018",3," Since the new update, it is really hard for me to access my homework. This is because the 'to do' tab isn't available anymore. Please fix it, thanks."
844,Emerald Rngr,"November 27, 2018",5," It's really useful during school. Basically all of my classes are online, the only problem is that if you're on the road, it doesn't work well. But good every of there time"
845,Shayl Voss,"August 18, 2019",5, great app for learning and sharing. the course I did with Ross was fantastic. obviously each class is also only as good as its teacher
846,A Google user,"October 25, 2018",1, Don't link apps for google play & subscribers can't update it all the types. It occur more space
847,CptCyborg,"November 1, 2018",5," Google. Great app for me and my class no lagging at all, Great layout. Well done!"
848,Andrey Barbosa,"January 4, 2019",5," Awesome to teachers and students, the google classroom offers a complete tool to manage teams for a improved learning."
849,Monique Van der Harst,"April 25, 2019",5," Great for contacting students,organizing assignments and assessing work in one place."
850,Pablo Fernandez-Beri,"April 1, 2019",1," I was going to start a new school year of teaching with Google classroom like I'm used to doing since 2015 or so, but this year there was an extra requirement, that the school had a premium or corporate account or whatever. So I moved to Edmodo."
851,Oyerinde Oyetunji Donald,"July 14, 2019",5, i love this app it has made it possible for me to reach out to some of my students that find it difficult to express themselves in the real classroom.
852,MichElle Fourie,"August 22, 2019",1," Stopped working on my phone the first day; I uninstalled and reinstalled... still says... ""stopped working""! I have now sent three messages to admin asking for help..."
853,Thanh Huong Le Thi,"September 2, 2019",2," I dont know why my app always says that ""Sorry, there is something wrong, please try again"" and I can not see any new materials updated in classroom"
854,Ibrahim Anser,"September 11, 2019",5," Great app! It's so easy to keep on top of my homework and classes! Very nicely done, Google!"
855,Muhammad Hamza Sajjad Abbasi,"November 15, 2019",5, Amazing app for quickly viewing content and provides reminders timely.
856,A Google user,"March 3, 2019",1," This ""Can't be updated"" thing keeps popping out even though I have WiFi. It worked before but now the app is useless. Please fix it."
857,Chloe Perez,"February 23, 2020",1, The latest version has a fish emoticon and keeps on kicking me out of classes! I can't use it for school rn and I don't know what to do.
858,Jessica Selzer,"November 23, 2018",1, It stopped working after the last update. I can no longer log in
859,Sharon Carr,"May 3, 2019",5," Excellent communication point for teachers-students. As a parent, I love being able to monitor assignments."
860,Nickolas Laine,"October 3, 2018",1, Most recently updated version but keeps saying to update it. Infuriating. Fix it.
861,A Google user,"January 17, 2019",5, i like the new update where u can see the teachers and students and assignments more easily because its way bigger and it stands out
862,That One Gaming Channel,"October 3, 2018",1, Perfect. It gives you an easy way to manage schoolwork. Would recomend to educators and students
