index,author_name,review_date,reviewer_ratings,review_body
0,Jai Chapman,"February 23, 2020",1," Shortly after downloading the latest update, whenever I open up one of my classes it says I can't access it, then the class gets removed from my list. Tried reinstalling and now my account doesn't log in. Thank you Google very cool."
1,Sharifah Serena,"February 23, 2020",2," Why I can't log in using my previous account? After I reinstall, this app wouldn't let me use my account and it says error. I often use this app for my studies but now I don't know how am I going to do if I couldn't log in using my account because all of my group classes are still there."
2,Charlie Phillips,"February 22, 2020",1," Was updated to include ""confidential features"" but it seems the only confidential feature is that I can't sign in anymore. No option to downgrade, so Google just broke a perfectly working app for no reason"
3,Shraddha Dwivedi,"February 24, 2020",1, Since the last update all my enrolled classes are missing there is just some weird fish icon on classroom icon and it is asking to add different account when uninstalled nd reinstalled after which is not. Proceeding further. Please help classroom app is needed on urgent basis please resolve the issu...Full ReviewSince the last update all my enrolled classes are missing there is just some weird fish icon on classroom icon and it is asking to add different account when uninstalled nd reinstalled after which is not. Proceeding further. Please help classroom app is needed on urgent basis please resolve the issue.
4,Sparrows tale,"February 24, 2020",2," I've used classroom for years and have never had issues, was a good app until the most recent update. After opening the app now, however, it has unenrolled me from one of my courses (one that I should be still in). I'm now unable to get my coursework. Hoping this bug gets fixed soon!"
5,Candida Medina,"February 23, 2020",1," Annoyed. With the new update, I have been removed from all my classes. Lost all my information and cannot log in with any of my emails. Please fix!"
6,Sofija Savić,"February 24, 2020",1," I am so disappointed. Since I updated the app, I got removed from all my classes and even though I tried to join again, the app didn't let me. Until now I kinda liked the app, but after the update I honestly couldn't be more mad. Fix it!"
7,nighwingrox711,"February 25, 2020",4," Due to the latest update when you enter the app and click on the class it will give you an error and it will then remove the class from appearing on screen, if you use the website your still in the class, it simply won't show you through the app, if you delete and re download the app you will not be...Full ReviewDue to the latest update when you enter the app and click on the class it will give you an error and it will then remove the class from appearing on screen, if you use the website your still in the class, it simply won't show you through the app, if you delete and re download the app you will not be able to log in"
8,Irelyn De Jesus,"February 24, 2020",1," Im having this strange glitch lately, where it tells me its in confidential mode, I try to log in to my class and then it suddenly erases me out of the classroom, saying that I need a code for it--But I was already signed in! Was it the latest update?"
9,IceBerg -大哥,"April 22, 2020",1," -sometimes couldnt upload mp4, even from gdrive -sometimes couldnt upload ppt -cannot upload multiple photo at once -sometimes not showing notification when got new assignment"
10,Molly Brazell,"February 23, 2020",1," Got kicked out of newly added class and couldn't get anything to work. Upgrade messed everything up and now I can't log in at all. Was great, now its useless!"
11,Shubham Shirpurkar,"February 22, 2020",1," Since the update on 22nd Feb, I cannot view my class, join my class and when I reinstalled it, now it is not letting me add my account. I have an exam tomorrow and all the notes were shared through the classroom. This is a big let down from Google."
12,Steve Ho,"March 4, 2020",1," Class notifications are not functioning: when you turned off notifications for some classes, the app turns them on again while turning off some classes that you want to have notifications non-stop."
13,Burntfish,"February 23, 2020",1, After recent update it has become broken. Very annoying as I use it very regularly and have contacted people about being removed from classes when it is the app that has become broken. Please fix
14,Akatu Morishoo,"February 23, 2020",1," Everytime i click a classroom it kicks me out and deletes the classroom, i thought uninstalling and reinstalling would work but now it won't let me log in! Please fix this issue immediately.."
15,Jessica St.Gelais,"February 24, 2020",1, I can't see my classes anymore I am unenrolled now and I can not sign back in!! Please fix this app/disaster I rely on this app as I work in a high school as a para educator and I need to see the work and information teachers post!! Fix this ASAP!
16,Owl Post,"February 24, 2020",1," This app updated and then kicked me out of all my classes. I uninstalled it then reinstalled it and now it won't let me sign in to my email. This is no bueno. This is only happening in the app, i can access all my classes on my computer but y'know. I'd like to get proper notifications so i can do cl...Full ReviewThis app updated and then kicked me out of all my classes. I uninstalled it then reinstalled it and now it won't let me sign in to my email. This is no bueno. This is only happening in the app, i can access all my classes on my computer but y'know. I'd like to get proper notifications so i can do classwork."
17,Tin Of Beans,"February 22, 2020",1, Uninstalled it and reinstalled it and it still won't allow me to use it on any of my existing accounts. In the past it has worked perfectly giving me notifications for homework but ever since the last update it's just stopped working
18,Dan Overlander,"February 26, 2020",1," Bug in the latest version : I was no longer recognized as a teacher in one of my classes, and the class disappeared from my class list, entirely."
19,Sovas,"February 24, 2020",2," Weird bug has kicked me out of all of my classes, and when I reinstalled and tried to log in again it didn't allow me to log in. However, it works fine on my other phone. Google, either provide proper support or fix this mess you've created"
20,Debashruto Bhattacharyya,"February 23, 2020",1," Ever since the new updated I'm getting removed from classes that I'm already part of. It gives my some 'error occurred' message and as soon as I go back, the class is just disappears."
21,SuitofSpades,"February 25, 2020",4," After this newest update I have been removed from majority of my classes, and cannot view important assignments that are due. Please fix this. Edit: The fish below the app has disappeared and now the app is working fine again. App is solid when it works, just refrain from making whackjob changes and...Full ReviewAfter this newest update I have been removed from majority of my classes, and cannot view important assignments that are due. Please fix this. Edit: The fish below the app has disappeared and now the app is working fine again. App is solid when it works, just refrain from making whackjob changes and please don't use my classroom as a guinea pig for changes because I care more about my classes than optimizing the app that my homework assignments are on."
22,best boy Leon Kuwata,"February 24, 2020",1, It was a great app until the update. It unenrolled me from all my classes and everytime I enter the code it says something went wrong please try again what's up with that ?
23,Raja Rani,"February 25, 2020",1," After the appearance of the fish icon , the app's not working and I got un-enrolled from classes on the app , when I reinstalled it , it says unable to create account and it doesn't work . Look into this horrendous blunder"
24,Muhammad Taufik,"February 23, 2020",1," After last update i am getting removed from all the classroom i'm in, i'm trying to re log in but nothing happened and i can't open my account, please fix it, solve that problem."
25,Rajtilak Pal,"February 26, 2020",5, The previous version was very good...but after the latest update neither could I see my classes that I had already joined not can I switch between accounts. Then I uninstalled the app and reinstalled it. Now I cannot enter the app with any of my Accounts
26,Adam Price,"February 25, 2020",1," Can't log in with any accounts on my phone. I've tried reinstalling the app, waiting a couple days and restarting my phone, it says try again later or choose a different account."
27,Mohammad Nehal,"February 16, 2020",3, This is usefull Apps but auto class code are not changeble so its class code are very difficult to reminder.and class Look are not attaractive and content are not downloadable and its not offline opnen. And content are no downloadable. So make context/content are downloadable and password/class code...Full ReviewThis is usefull Apps but auto class code are not changeble so its class code are very difficult to reminder.and class Look are not attaractive and content are not downloadable and its not offline opnen. And content are no downloadable. So make context/content are downloadable and password/class code are changeable. For perfect.
28,Roop Sannigrahi,"February 24, 2020",1," After updating to the latest version of classroom, im getting unenrolled from all the sessions, not fixed even after reinstalling multiple times."
29,Ketsueki Shisha,"February 24, 2020",1," Something is seriously wrong with classroom. There's a fish icon and I was confused. I clicked on a class and it immediately unenrolled me, so I uninstalled it and redownloaded it and it said I couldn't sign in. If this is a glitch, I need it fixed in order to do my work."
30,Liz Cornett,"February 26, 2020",3, 2/26/20 UPDATE I did a force stop and then updated the app and it is working properly. 2/24/20 Same as Jenny Peters below!!! All of classes are gone! I keep getting notifications but whenever I click there's nothing there and all classes have disappeared!
31,Mat Marshall,"February 21, 2020",2," Ever since the February 20th 2020 update Google classroom the app on my phone is completely broken, would not let me open a classroom and then would delete it immediately after attempting to. So I uninstalled it and reinstalled it and won't even let me sign in now."
32,Cello4ever,"February 24, 2020",1," Since the last update occured, ive been kicked out of all my enrolled classes, and when i try to log in with my Gmail, it tells me that im ""not able to use this Gmail."""
33,Luigi Coradduzza,"February 21, 2020",1, After the 22/2's update it kicked me out of the class I teach and can't access it again. It works fine on browser so it isn't an account related issue!
34,Nyoto Sulistiyo,"February 24, 2020",3," Before the update, it works perfectly But now, its impossible for me to login to my account I'm so disappointed by that. Please fix it UPDATE : It's possible for me to login right now. Gonna wait sometimes to consider for 5star rating"
35,MARCH_O MARCH_O,"February 23, 2020",1," I created a class and had been using it for two weeks when, suddenly, with the new update, the class is gone and now can't even sign up with my google account"
36,Olga Yolgina,"February 22, 2020",1, After the last update the app stopped working. I couldn't open any of my classes and after reinstalling the app it can't even log me into my account. Please fix it.
37,Fernando Leonardo,"February 24, 2020",2," After this last update, i can't acess my account after uninstall the classroom. But, before uninstallation appeared a message saying "" you can't join this class"", but i was already joined in that class, so fix it because i can't acess my account using the app."
38,Ellie Tan,"February 23, 2020",1," After update on Feb 24 2020, app has become usable! Classes are disappearing from the app but are still there when viewed in computer browser. A fish logo also appeared, indicating beta mode?"
39,Its just Aubree!!,"February 28, 2020",5, I love google classroom Ive been using it for a good while and it works perfectly and my teachers also use it all day every day.If you dont have google classroom you really do need it. it also helps you keep up with your work!!
40,Sum Nub,"February 27, 2020",5," My school uses it in a ton of classes, and I can see why, it's a good app. But a couple days ago, I used this app to send in pictures of my finished homework, and instead I got kicked out of the classroom. I checked my other classes and couldn't access those either. But in addition to not being able...Full ReviewMy school uses it in a ton of classes, and I can see why, it's a good app. But a couple days ago, I used this app to send in pictures of my finished homework, and instead I got kicked out of the classroom. I checked my other classes and couldn't access those either. But in addition to not being able to get into the classroom, the glitch kicks you out of the class as well. Please fix this, school is hard enough as it is. I'll make sure to rate 5 stars if/when this is fixed. THEY FIXED IT 👌"
41,Bonnie Parris,"February 23, 2020",1, What is going on??? I just tried to go into one of my classes but it didnt let me and upon reinstalling I cant add my school account anymore. I've even seen other people talking about this. THIS NEEDS TO BE FIXED ASAP
42,Martin Hotchkiss,"February 24, 2020",1," The app is no longer working. It seems that the ""dogfood"" version (i.e. the developer's test version) has been incorrectly deployed to the public. Please fix ASAP."
43,Avation,"February 24, 2020",1, Was a fantastic app until the latest update. Now I've been unenrolled from most of my classes. After reinstalling the app I can't even sign in to the app!!
44,Isabella Kroon,"February 24, 2020",1," After the most recent update, I was kicked out of one of my classes and am unable to rejoin. I tried uninstalling and reinstalling the app, and now I am unable to sign in at all."
45,Lee Lark,"February 23, 2020",1," As of the last update, I can't enter my classroom and I was kicked from all of my classes meaning I can't turn any of my work in the weekend. I will get zeros on them because of this. Please fix this issue quickly."
46,Sock Oon Lee,"February 23, 2020",1," Please fix the problem. After I update my apps yesterday, it show I been remove from the classes. After I reintsall, I am unable to log in to classroom. Please fix it!!!"
47,Bakurally Yusrah,"February 23, 2020",1, Everything was good until the last update I was removed from the classes. I uninstalled the app. Then I downloaded it again and now it says that I can't even log in.
48,Shreeram Patkar,"February 26, 2020",1," New update bug As many other people have mentioned, the new update with the beta(fish) icon is still not working. Please fix it asap"
49,Saaniya Khan,"February 23, 2020",1, I am unable to access my class after the new update.. I was automatically removed.. And now I am unable to login again because of some wierd technical problems..
50,Rajat Kumar Bawa,"February 24, 2020",1," After updating to the latest version, I am been removed from my enrolled classes and afterwards when i try to reinstall it, it says not able to sign in...try again...quickly fix this up..."
51,Ariana Marchan,"March 3, 2020",5, Now that the app has been fixed it's working good. My teacher uses it for assignments and I didnt like going through the steps to get into classroom using the chrome but now that the app is working better I like it again thank you for fixing it!!!!!
52,Lisa Byars,"February 23, 2020",1," Latest update yesterday erased many classes I had access to and gave message it was a ""private"" version or something. Fix it please!!!"
53,Akshatha,"February 24, 2020",3," I am having problems after the latest update, I was removed from all my classes. Uninstall and reinstall also didn't help. Hope this issue is resolved at the earliest."
54,maddie_ ida,"February 24, 2020",1, The latest update broke the app! It said is un-unrolled me from my classes (just on the app) and now it won't let me log in. NEEDS to be fixed ASAP!
55,Aidan Fagan,"April 20, 2020",1, Destroyed my pixel 4. Anytime I booted up the app it would crash my phone and reset
56,Talha Nawaz,"February 24, 2020",1," please fix that bug. After the latest update, there is a fish icon appearing on the app and whenever I open the ap and login, it says that you cannot sign in. 😑"
57,Sam Friedman,"February 22, 2020",1," I don't know what is wrong with quality control at Google, but this is some next level BS. Pushed out a confidential APK, and now the app is completely useless. Has weird fish icon in the app icon and I cannot access any of my classes."
58,Raju Vemula,"February 22, 2020",1," After the latest update, I am unable to access my classroom. Worst app ever. Instead of fixing the bugs, they have introduced more. Hats off Google."
59,Fani Hatinda,"March 1, 2020",5," Hello Google, after updating this app to it's latest version, the app suddenly removed me from the class in which I enrolled. I couldn't even add my university account, the app wouldn't let me log in. Edit: Thank you for fixing the bug, I can use this app for my class now. :)"
60,KandieHC,"February 24, 2020",2," Something isn't right with the latest update, I am being removed from classes I am enrolled in, and once reinstalling it I can't login in with any account. This has to be fixed or I'm screwed for this school semester."
61,Meowzer,"February 23, 2020",1, I have to use this in school. It is a crucial platform for teachers to communicate to students. FIX THE ISSUE WHERE I CAN'T ACCESS THE CLASS AND THEN GET UNENROLLED FROM IT
62,Vivek Vishwakarma,"February 24, 2020",1," Major bug on the new update,the app doesnt show any of my classes,after reinstalling it isnt even logging in with my gmail id"
63,John M. Pasternak,"February 22, 2020",1," The new version doesn't work on Pixel 3. Deleted classrooms. On reinstall, won't login."
64,Nikayla Als,"February 23, 2020",1, All of my classes have disappeared in the past 24 hours. I deleted the app and reinstalled but it won't let me login to my account. This is very frustrating as I have assignments to complete
65,Abid Nasir,"February 21, 2020",1, Help needed I downloaded the application a few days ago everything was okay until I was unable to access one of my classes I uninstalled and reinstalled the app again and now I'm unable to sign in from my existing gmail account Please help me
66,Nick S,"February 23, 2020",1, After updating the app I am no longer able to login. Please fix this immediately. As a teacher I need this to communicate with my students.
67,afroz lubbai,"February 24, 2020",2, Today when i opened the app the classes have been exited from the app and cannot be joined again. But the classes is present in the website. I wanted to know the solution to this problem Thank you
68,Christine Gatchalian,"February 24, 2020",1, When I tried to open a class today it wouldn't open it just disappeared and I can't get it back. I rely on this app please fix this issue ASAP.
69,Brad V,"February 26, 2020",5," Since the update, it doesnt recognize my school account, and I cannot access any of my classes. Classroom works fine on my PC, but not on mobile. Edit: Changed from 1 to 5 as everything is working again. Thank you."
70,Shreyash Agrawal,"February 22, 2020",1, After updating to the latest version I am unenrolled from all the classroom. And after reinstalling it I am not able to login to my account
71,Saad Mughal,"February 23, 2020",1, The app was working fine but after last update 20Feb 2020 it's not working my account is not signing in please fix it ASAP.
72,Ranther YT,"April 22, 2020",1, I just hate that google classroom doesn't send emails in time sometimes. I can get an assignment and get it in Gmail 5 hours later It sucks
73,Adinda Yunariza,"February 24, 2020",2," I'm downloading classroom in my new phone (android), unable to log in, it's says classroom couldn'd add the account. 2 star until it fixed. I really need classrom because most of my class are using classroom"
74,Bernie Porter,"February 24, 2020",1," After this last update, deleted the app to get rid of the fish in the app icon, re downloaded it and it will not allow me to login into any account. Please fix this, as i need this app for my school work."
75,Muhammad Imran,"February 22, 2020",1, Why it doesn't open in Redmi Android phone? It shows again and again login problem. Doesn't this app Android supportive?
76,Lord Farquaad,"February 24, 2020",1," After the update, I couldnt get into my classes and after reinstalling I cant even do anything about it. Fix it ASAP."
77,Shadman Shahriar,"February 17, 2020",3," No attendance taking option, No pinned post option, No way to highlight a post. There's a option to pick on students but none for taking attendance. How is that possible?"
78,avaraine,"February 22, 2020",1," Please please please fix this bug in the new update! after updating i did not have access to the classes im enrolled in however was still getting the notifications for them, when i deleted it and reinstalled i could no longer sign in"
79,Fern Gross,"February 25, 2020",4," Since i found out about the recent update, i have had really annoying problems. It has unenrolled me in 2 lessons now. Please fix this, i need it for school. UPDATE: Thank you so much for fixing this."
80,Grace Andrews,"February 23, 2020",1, Unable to configure Google classroom account on Nokia 6.1 with latest Android version 10. Please can you help. Thank you for your respose.
81,Evan Mason,"February 26, 2020",5, The app no longer works and it won't even let me log in. This is my only teaching platform and this kind of bug is unacceptable.
82,Leonardo Guzman,"March 5, 2020",3," If It just keeps crashing and says in red:something went wrong then go to Google itself and go to Google classroom,make sure it doesn't take you to the appstore"
83,Rushikesh Patil,"February 25, 2020",5, Previous update was having account adding problem. But Google was fast enough to push next update which fixed this issue.
84,James G,"February 24, 2020",1," The app just doesn't work, I didn't have one of my classes available so I uninstalled it and reinstalled it. Now I can't even sign in."
85,cw cw,"February 28, 2020",3, there's a new bug that causes some assignments are not being shown in todo; no issue in browser
86,Yrxtuditticitcuf Xturxuxufx,"February 23, 2020",1," After the updates the app had kick me out of all my clases when i tap on it and, than i deleted and re installed the app and i try to log in but it would not let me ."
87,Ashley Richardson,"March 2, 2020",3, My google classroom has been great until recently. It says I don't have access to my school account and won't let me log in.
88,Gabriel Benavides,"March 5, 2020",5, I use it a lot in school and it does not act stupid when your teachers put you on lanschool😒. With the new update nothing has gone wrong with me so those that say theres isnt working must be doing sonething wrong😏
89,Jaylon Moore,"February 25, 2020",5," The latest update I had for Google classroom doesn't allow me to login anymore for some reason and it shows a fish icon,please fix this i need it for school."
90,Shreya Mandhana,"February 24, 2020",1, After the new update I am automatically unenrolled to classes I have enrolled for. After uninstalling the app and then re installation it I am not able to sign in please look into this matter as soon as possible
91,Justin Stelzer,"February 24, 2020",2, It won't let me log in and always glitched and I never can see my classes. It's the newest update with the fish. It sucks
92,Eleanor Elephant,"February 23, 2020",1, This app is very bad. I cant log in. Fix your problems please. I wish I could give it a negative 1 star. Seriously fix your bugs. I need to use it but you dont let me use it. Stop ruining others lives
93,Alyssa Ausa,"February 22, 2020",1, I WAS LOGGED OUT OF MY CLASSES AND I CAN'T LOG IN ANYMORE 😭😭 I NEED THISSSS. PLEASE FIX AS SOON AS POSSIBLE !!!!! ASAP PLEASE!!!
94,Warp Nova,"February 24, 2020",3," The last update broke the mobile version, but it still works on PC."
95,Sujil Maharjan,"February 23, 2020",3," After updating to the latest version, I got removed from the enrolled classes and after uninstalling and installing the app again, it is not adding account."
96,Charles,"March 6, 2020",4," New update unenrolled me from a class that frequently uses Google classroom, but was fixed within a week. Fast response to a large problem."
97,Loona-kun,"March 4, 2020",5," Amazing app. Made a class to chat with my best friends, gets notifs every time they comment/ 'chat'. I love it."
98,Pink Diamond,"February 25, 2020",5," I got kicked out of all my classes, and when I reinstalled it I couldn't even log in. Edit: Thanks for fixing it!"
99,lakshmi sruthi,"February 26, 2020",1, After new update classroom unenroll automatically. After reinstall it couldn't connect my account.
100,An Trần,"February 23, 2020",3," After the update, I cannot sign in and it said that this is confidential?:)) before the update it is a nice app though, keep developing"
101,Hue Hue Hue Hue Hueston,"February 13, 2020",2," Kind of mid, for turning in school work it takes way too long to upload kb pictures. I have to upload 10+ and it takes forever."
102,kevalya sharma,"February 18, 2020",5, Very helpful as a teacher and student suggest for voice conference and other features like this
103,Bethany,"February 25, 2020",5, The newest update fixed the problems of the last one. It works fine now
104,Alex Wang,"February 26, 2020",5," Thank you for fixing the bug, this app is really good. I 100% recommend it, it is really easy to use and it's really helpful for school"
