index,author_name,review_date,reviewer_ratings,review_body
2844,Surya K,"March 1, 2019",5," Good one, features and the app is more helpful for the candidates who are seeking for job on the go.!"
2845,Abhishek Singh,"June 14, 2019",2," I have been using this application from past 2 years, it's not that good, also not that bad yes ofcourse I got few calls from recruiters, but not much. This is the reason I am rating it 2 stars on the scale of 5."
2846,Saravan Kumar,"June 23, 2019",5," One of the most helpful app for the job seekers and the recruiters.Advanced features like our profile searching strategies and recruiters actions,which is usefull for develop or update our profile."
2847,Wanderinglust,"July 8, 2019",3," i installed this app on my iphone-7 so that i could stay connected. But whenever i open the job search section and the recommended jobs section, the app crashes and closes."
2848,Geevarghese k johnson,"August 31, 2019",5, The best app for job finders. I really love the way it has made. User friendly getting all the updates from Different firm. It has made our job easier to find and to connect with people
2849,Deepak Aaryan,"December 4, 2019",4, It's good for the experience holder. But this app gives the chance to trap the fresher.
2850,Saurabh Malkar,"November 1, 2019",5," I have been using this app for over a month now and I am surprised to see the response I get on here. Naukri is tailored for the Indian job market and has a lot of active recruiters on it. I have received a lot more relevant responses here than on LinkedIn. Creating profile is easy and one-touch job...Full ReviewI have been using this app for over a month now and I am surprised to see the response I get on here. Naukri is tailored for the Indian job market and has a lot of active recruiters on it. I have received a lot more relevant responses here than on LinkedIn. Creating profile is easy and one-touch job application makes it convenient. Also, I like the clean UX of the app. I am yet to land a job. If and when I do, I will update this review."
2851,arjun d,"November 17, 2019",4, Very Good job searching site for freshers
2852,praveen sk,"December 13, 2019",4, Other than any job apps this is really doing well
2853,Vikram Singh,"December 17, 2019",5, Really its good and helpful aap for job
2854,bhavya s bhuvana,"January 7, 2020",5, Very helpful app ..nice journey
2855,monika mishra,"December 18, 2019",5, Very helpful application.
2856,Parthasarathi Behera,"January 26, 2020",5, Very nice app for job seekers.
2857,Dharmesh Mahant,"January 23, 2020",1," Always mail jobs, which are not relevant to my preferred location"
2858,mehul kanjariya,"February 23, 2020",5, Very good job portal i like this website and mobile app both.
2859,doremon 17,"February 9, 2020",5, Very good and useful app
2860,sanjeev rai,"February 18, 2020",4, Simple and nice app
2861,Naresh Kachhwal,"February 25, 2020",5, Helpful as it connects to various agencies and recruiters.
2862,Avijit Nath,"January 23, 2019",2, not getting openings.. search options are very poor.. only pay service is what they are looking for.. recruiters are something like brokers here... openings as per individuals profile is not available.. the search options are very hazardous with such selecting options.. direct search not available a...Full Reviewnot getting openings.. search options are very poor.. only pay service is what they are looking for.. recruiters are something like brokers here... openings as per individuals profile is not available.. the search options are very hazardous with such selecting options.. direct search not available and search as per preference is also not available
2863,Himanshu Kale,"April 10, 2019",5, Good app with a smooth and useful UI. Easy to get your profile set up and receive calls from recruiters in no time. Would definitely recommend for professionals in IT Sector.
2864,vikas gupta,"October 16, 2018",4, This is very helpful app for job seekers by which they don't need to go for anywhere to find the job. We can get the opportunity of by this app easily. I like it a lot
2865,Deepanjana Gupta,"October 29, 2018",4, Please also add a reset button while searching a location. If you want to deselect a location you have to again type and search it then uncheck it if instead a reset button is added it will be more convenient
2866,Himanshu Srivastava,"April 27, 2019",3," overall an ok service. but the paid service. the day my paid service period ended. i got an autogenerated mail from Naukri showing the comparison of the performance. guess what, i got only one call during the paid service period (3months), whereas had 5 calls in the period just before the paid servi...Full Reviewoverall an ok service. but the paid service. the day my paid service period ended. i got an autogenerated mail from Naukri showing the comparison of the performance. guess what, i got only one call during the paid service period (3months), whereas had 5 calls in the period just before the paid service."
2867,Govind Khandelwal,"June 14, 2019",5," The experience i having very good about this app in last 5 year...wonderful features like multiple profile creation, apply through selected profile, update about the jobs regularly..good app keep it up..."
2868,Anirban Laha,"June 21, 2019",4," very useful application, much better than monster, it clearly gives you a visibility of your profile and whosoever checked your profile moreover the recommended jobs matches your profile."
2869,Sai Srikar,"June 20, 2019",2, Needs lots of improvements. After browsing some time it lags and stops working. For some jobs if opened it just shows white screen and had to force close and redo searching. disgusting.
2870,Mandar Madali,"June 27, 2019",5," Very good service to the job seekers! App is very fluent. UI is good, easy to navigate. Love it!"
2871,varshita muddana,"August 28, 2019",1," Worst app! Showcase every other job except the field in which you need....and showcase imaginary profile viewers, who actually don't take any action...waste of time, energy and hope"
2872,Ravindra singh,"March 23, 2020",5," Very good Aap , important role play for job search."
2873,Rishab Dutta,"September 24, 2019",2, Recruiter communication deletion is not working properly. Select multiple communication and delete them. Look what was deleted instead what should have been deleted. Looks like you guys need some good developers.
2874,Madan Panwar,"October 30, 2019",5," This is very useful apps for every professional persons, for getting a awesome job."
2875,Kannan Sekar,"November 2, 2019",5, It's really good.For job seekers it gives relevant jobs notifications as well as we can apply job thru the app.
2876,jay patel,"November 18, 2019",5, It's a very useful application for the job
2877,Sudip Prasad,"November 27, 2019",5, Perfect app for job seekers.
2878,Sagar Patil,"December 5, 2019",4, It's very good app for searching jobs
2879,Sagar Raut,"December 26, 2019",4," Promising for Job openings, Job application and Recruitment..."
2880,SHUBHAM YEWALE,"December 26, 2019",4, Great app to find and seek job
2881,siddharth shrimali,"December 22, 2019",5, Very useful find new jobs
2882,anupriya m,"December 22, 2019",5, Very good responses from assistants
2883,Tabassum Sheikh,"January 26, 2020",1, I gave one Star May be its enough for this app I hate it......bakwas app Use less job portal.....😫😫😫
2884,Divya Anand,"January 6, 2020",5, Good app for those who looking for job.
2885,Pramod Dan,"January 27, 2020",5, It is the best app for searching the jobs
2886,Mohammed Saif Patel,"February 4, 2020",5, Very Useful Very Helpful
2887,Tushar Kumar,"February 11, 2020",5, This is a great job portal app.
2888,Sreekanth M,"February 12, 2020",3, has to be user-friendly
2889,Bheemashankar s.j,"February 13, 2020",4, Excellent App for job seekers
2890,AMRUTHA PRAHLADH,"February 12, 2020",5, Efficient way to communicate
2891,Divya T,"April 19, 2020",4, Best app to get the relevant skill jobs @ naukri
2892,Jigyasaa Sharma,"December 28, 2018",1, The application never gets updated. I receive the notification but there no data for that inside the app. I have tried reinstalling the app but there no better result.
2893,Subodh Kumar,"January 27, 2020",5, Great application for job search
2894,Way to right thinking,"May 21, 2019",2," Hi, I have already updated my educational details, then why it is asking again & again on applying for any job. It is really frustrating. Please fix for my account. Thanks!"
2895,padma valli valiveti,"December 14, 2018",5, It would be good if you recommend the jobs based on the technical skills. In my case I would like to see only mainframe jobs and the equivalent experiance jobs and the location preference on top of my priority Instead of displaying all jobs over the world.
2896,Vicky Ranjan,"November 5, 2018",5," Very good app.had always got job from this site,and it has always been a good experience.please ensure that the update is received on real time basis."
2897,Mythbuster Mom,"April 12, 2019",3," Your app is very user friendly and has maximum jobs, but there should be an option for 'Work From Home/Remote work' and also update courses in education list. (Journalism etc)"
2898,Chandra Mohan,"March 15, 2019",4," This is good mobile app because you can search similar jobs with your job profile. As retail, SalesMarketing & more other fields. i hope this app could be more better whenever showing results in Automobile Industry."
2899,Dhari Akkenapelly,"June 17, 2019",5, Availability is for all the users. easy to use and communicate. User friendly Interface.
2900,Priya Kumari,"July 29, 2019",5, Very nice app with a good amount of functionalities with good user interface. It made job search easier. Keep improving.
2901,Lakhan Lekurwale,"November 19, 2019",2, it does not helped...i was try last 2 month but there is no any feedback even i update daily my profile... worst app i ever seen
2902,Amit Naik,"October 9, 2019",1, I do not receive calls at all. I have applied several times. All the app settings are also fine. But finding it useless.
2903,parker preet singh,"November 9, 2019",5, Its so benificial app for us for finding any types of job and i am happy with them 😊
2904,vinay t,"November 22, 2019",5, Good and most useful app
2905,Debanjan Deb,"December 27, 2019",4, I think it helps to find jobs more easily...
2906,ÃShu rOy rj,"January 13, 2020",1, (Bad bad bad app 1000+ bar )Frud app also if apply for job and call for interview then demand larg amount but cant give job. So Very bad bad bad appp 👎👎👎👎👎👎👎👎👎👎👎👎👎👎👎👎👎👎👎👎👎👎👎👎👎👎
2907,praveena H M,"January 23, 2020",4, Nice and very use full
2908,Yogendra Singh Jadon,"March 18, 2020",4," Installed recently, till now experience is awesome."
2909,Pralhad Kulkarni,"March 5, 2020",5, Nice and very useful app.
2910,vipul sharma,"March 28, 2020",1, Worst app. Gives false hopes. Unless you pay sth they will not do anything. Once again worst app.
2911,Ravi Hammad Sirvi,"April 15, 2020",5, I strongly recommend this app if you are looking for a job... Download it and get hired. 👍
2912,KVM,"November 19, 2018",2, The app is slow & updates are rarely reflected in real time. You have to delete & reinstall the app to view the changes made to the profile usimg the app.
2913,Sushanth Khadtale,"January 6, 2019",5, Undoubtedly the best link between job seekers & jobs in the market. The app interface is good and you hardly need to visit the desktop website.
2914,Dr.Sonal Sanghi,"January 5, 2019",5," A very good app for jobseekeers. Every aspect is precisely available, so that the potential candidates will get appropriate updates. User friendly."
2915,Deepak Kumar,"September 17, 2018",5," I got my job through this platform, so, I love it. Easy to use. You get continuous calls from many recruiters. You will get what You want. A Must have app."
2916,Girija Mrt,"April 23, 2019",3," Rarely i am getting calls from recruiters and that to for immediate joining or less than 60days, which is not possible becoz of 3months NP followed by our company, and app wise they are improving, comparetively its better now."
2917,Supam CB,"November 2, 2018",3," Why does it shows blank or empty if I click on ""Applied Jobs"", even though I already applied these? It is useless to use this app if it doesn't work properly. Please fix this bug"
2918,Jigar Sanghavi,"November 30, 2018",5, Very very handy app. At my finger tips all the time. Amazing interface too. Like it.
2919,Friends R,"July 6, 2019",4," Total experience should automatically be updated as time passes. Currently, time spent in current company automatically increases but total experience does not."
2920,Anindya Chowdhury,"June 30, 2019",5, Nice aap. You can search job very easily. Filter as per your criteria and search.. You will definitely get a call from companies if criteria will match.. Not a fake app.
2921,praveen dhandapani,"August 22, 2019",1," I was offered the premium job seeker services. I had paid for the service which are yet to get activated, because of unavoidable circumstances, I requested not to activate the service. Update: i received a call & a msg stating that it is not possible to cancel (though the subscription was yet to get...Full ReviewI was offered the premium job seeker services. I had paid for the service which are yet to get activated, because of unavoidable circumstances, I requested not to activate the service. Update: i received a call & a msg stating that it is not possible to cancel (though the subscription was yet to get activated) & they can assign it to another person if anyone i know is interested & i see that it is activated despite informing me that the request will not get activated without informing me"
2922,Zen Vengurla,"July 10, 2019",4," very good app. shows results how many recruiters viewed profile, bookmarked profile and how many recruiters contacted. getting good job updates but unfortunately I haven't got yet suitable job for me."
2923,amit bagla,"October 12, 2019",1, Worst job portal I ever went through. I did everything but haven't received any update on any of my applications. Also the recommendations that the portal provides doesnt match with your profile most of the time.
2924,Sudhakar Baral,"October 21, 2019",4, Good but some what need more friendly. preferences should be collectively and precisely shown in one place with distictively based on the criteria given in different time.
2925,Sumesh Koyikkal Suresh,"November 2, 2019",1," Most useless app, not even able to correct errors when type personal messages to HR or CEO."
2926,chandramani sharma,"November 5, 2019",3, Is too slow most of the time. Difficult to navigate
2927,Sandeep Aggarwal,"October 30, 2019",5, Best interface to stay connected with job portal on the go through smartphone
2928,Venkatesh Ch,"December 30, 2019",5, This is very useful to me and good app
2929,Naveen Naik,"November 20, 2019",5," Really its helpful to my carear , gud app, i love this app"
2930,Vrushank shah,"December 6, 2019",1, Job Recommendations not as per desire job profile.
2931,Shaik Nagul Sharief,"December 2, 2019",4, Nice and a free to search to jobs
2932,Karthick .m,"February 6, 2020",5, Useful app in jobseeker.
2933,Deepak Jangir,"January 27, 2020",5, It very support application for jobs
2934,Allen Amanna,"February 24, 2020",5, Handy app for job seeker especially for desperate ones.
2935,Dev Singh,"February 26, 2020",5, Very nice app for job searching.
2936,Prasanth sekar,"February 14, 2020",5, Very very good app for getting job
2937,Vishal Thakur,"February 15, 2020",5, It's Very helpful for job Searching
2938,Parmar Nihar,"March 3, 2020",5," Looking great, and usefull features are updated so I experienced cool.."
2939,Chumthungo Kithan,"February 20, 2020",4, Easy and helpful
2940,Rohan Dsilva,"March 28, 2020",5, It works smoothly
2941,ainampudi siva,"March 30, 2020",5, Very use full
2942,Sunil Yadav,"April 16, 2020",5, Nice app User friendly Backend team is also very responsive
2943,pasyaula srinivas,"April 25, 2020",1, The Recruitment Profiles in Naukri is FAKE. I found one today. They are totally playing with emotions if the people. There are several FAKE recruiters profiles are there and NAUKRI is not taking any action on the and not responding properly.
2944,Anil Chakravorty,"April 30, 2019",5," Highly helpful for job seekers, user-friendly app. The recently added features are very helpful for job seekers."
2945,Rajesh Adhikari,"February 7, 2019",1, it is not useful. never show jobs related to your location and profile even if you create custom job alert. always alerts you with outdated data.
2946,Swathi Tadakamalla,"March 29, 2019",5, Excellent app for job searchers..it helps a lot to find your job based on your exact skills.search option in app helps us to filter from many of the options.I will suggest to use this app for people searching for job.
2947,Sandeep Kumar,"August 17, 2019",5," Very nice, desirable result oriented and helpful to job seekers App. Good and user friendly interface with quick response are it's inherited qualities."
2948,abhikant bhave,"October 18, 2018",1, synchronization problem with desktop site and mobile app. and when i updated job profile its still showing pending action : update your profile. please help
2949,Ragu ramachandran,"May 9, 2019",4, not able to apply jobs. unistalled and reinstalled. its showing failed to connect ppesse check the internet connectivity. while internet is available for install the app why not for applying jobs. i don't understand
2950,Sunil Gupta,"January 23, 2020",5, Wonderful App and Helpful for the People around the world
2951,yerukola ram,"July 23, 2019",1," it is showing irrelavant jobs even though i filter it.If it shows, after the validation period is over it is showing.I think you are charging money to get the jobs notification which is suitable for mee."
2952,Suganthi Sekar,"September 20, 2019",4, It was good.. but the inbox (job from recruiters) option is showing the jobs even after deleting.. It takes at least 3 or 4 hours to refresh...
2953,Megha Raut,"November 2, 2019",4, Nice app for job switch. I think need to get more appropriate and suitable job according to my profile. As I am searching from last 6 months but not getting right opportunity. But overall application helps to switch job
2954,Prachee Warthe,"February 17, 2020",5, It's best app I have ever seen .I got several job opportunities within short span of time.i was lot in trouble to find a good one and going through serious financial crisis this app is life saviour no spams no fake calls .it's fully trustworthy ❤️❤️❤️
2955,anish rajpoot,"November 12, 2019",4, It's so halpfull app for start career and grow our life.
2956,karnakar kanna,"November 6, 2019",4, Good experience with this app.
2957,Chaithanya Marur,"November 19, 2019",5, Very good app for job seekers .... nice interface .... many options .... keep doing the good work Naukri team
2958,Wonderful & Unimaginable,"November 24, 2019",5, It's a wonderful app for job seekers..
2959,RaJ Patel RoBin,"December 9, 2019",5, This app is really so helpful for got jobs
2960,Sudhanshu Payasi,"December 19, 2019",5, Great platform for job seekers.
2961,Sachin Sortur,"December 27, 2019",5," Very nice app, this app has helped me a lot for searching better opportunity and job"
2962,Ambadas Nand,"December 16, 2019",5, Excellent App getting relevant job opportunities using this app
2963,Varun Dixit,"January 9, 2020",2, Was good before... now it has deteriorated.
2964,rohit singh,"January 18, 2020",5, Wonderful help full plate from
2965,shiva kokkiligadda,"January 18, 2020",2, It is not showing relevent jobs while searching
2966,Danish Qureshi,"February 28, 2020",4, Easiest way to guide a proper job
2967,Malarvizhi,"March 13, 2020",5, Its really useful for job search
2968,Rohith kamal,"April 13, 2020",5, Nice app..very useful
2969,ANKIT GUPTA,"December 4, 2019",5, Easy to use & operate.....
2970,saptarsha sarkar,"May 21, 2019",1," Why you claim that you provide assistance to almost all professions, when you simply can't design your app for other professionals. For example if we try to add Project details being an Electrical or civil engineer, in ""Roles"" it shows something related to software. Even if l am currently working on...Full ReviewWhy you claim that you provide assistance to almost all professions, when you simply can't design your app for other professionals. For example if we try to add Project details being an Electrical or civil engineer, in ""Roles"" it shows something related to software. Even if l am currently working on a project why do I have to mention end date , it should be added under current project. Absurd. You must claim our format support only software, but job assistance to every one.🤐😠"
2971,A Google user,"February 17, 2019",5, best app to search for jobs. There is some problem like if a feature can be added which can update our profile without changing any details then it will be better.
2972,Ishani Shah,"January 30, 2019",1," even with full internet connection, applications are not being sent. There's some technical glitch in the app"
2973,Rajkumar MD,"April 12, 2019",5," Good APP well developed. Nice suitable jobs recommendations. Can't understand no body replies or revert. If you can modify whether accepted - shortlisted or rejected status, it may help job seekers to identify their gaps and apply accordingly."
2974,Lenggougin Khongsai,"May 24, 2019",5," This app is awesome for people searching for job or a job change, its kind of a revolutionary thing that i came through, heads off to the participating members who developed so much in this app, i am looking forward to finding my dream job this portal or website."
2975,Kalyan Das,"May 14, 2019",1, Good. But this app is need to improve. This app is not as good as we expect from a No. 1 job portal. I am an accountant with SAP knowledge. Why naukri sent me notification for SAP software related job ? And the worst thing is 80% notification sent to me which salary package is less than my current s...Full ReviewGood. But this app is need to improve. This app is not as good as we expect from a No. 1 job portal. I am an accountant with SAP knowledge. Why naukri sent me notification for SAP software related job ? And the worst thing is 80% notification sent to me which salary package is less than my current salary. What the need of such notification ???
2976,AJAY KUMAR CHOUDHARY,"January 20, 2019",5," it's an excellent and reliable app for job seeker. but for paid personal only. if you registered free and use to searching job, then you can't receive any response by recruiter."
2977,rishi sahal,"September 24, 2018",4, App is amazing and provides a number of opportunities ... But specific details of employers are not given ... Hopefully this feature will b added soon ... All in all a very good app
2978,prabhaarr,"September 16, 2018",3," Continuous updating of profile also not useful to receive call from recruiters , even not increasing the views of profile, I think there is a hidden thing or naukri controlling our account ? Is this only paid service?"
2979,Nirmal Patel,"July 1, 2019",3, i have updated my resume 10 times today still app is showing resume headline is missing. i am facing issues with the app & web sync is not proper. recommended jobs is not showing proper result in app as well.
2980,Gyana Ranjan,"July 31, 2019",5, Finally I got the job after registration of 9yrs in naukri. Anyways it has been improved a lot in last 3 years. Nowadays at least its recommending the job related to your profile before it was pathetic. Keep improving and remove the fake placement agency profile.
2981,Manoj Meghwani,"August 1, 2019",1, Unable to login in naukri app through my wifi... the sad part is there is no customer care number to solve this... only the contact no. fastforward... and they refuse to help the non fast forward customers... extremely disappointed with services.
2982,anand sharma,"August 2, 2019",5, This is really good app and much improved version of itself. I'm loving this and getting proper attention from recruiters.
2983,Muthyala Sirisha,"September 21, 2019",4," Great job!!!...naukri Because of this app we are able to find jobs and could get calls from different companies,The profile updating process is also good because ut keeps asking to update our profile and helps us know everything. Thanks to Naukri"
2984,Anurag Kumar,"October 3, 2019",3," Unable to sort filter prioritise jobs based on skill (keywords based on proficiency and most-match with JD), company (product, captive, others), role& profile (current and desired). Relevance, jobs posted and EasyApply options are less."
2985,Shivam Singh Rawat,"October 30, 2019",3," Good app for job seekers, nice interactive interface, thumbs up for the Developers👍. One annoying thing is that you can only upload a resume of 2 mb ... it's not good for everyone."
2986,Jay Chauhan,"November 5, 2019",4, This mobile application is user friendly and easy to search job.
2987,priyanka sonavane,"November 10, 2019",3, This site is slow. No respond my profile in my educational level.
2988,Vasant Waghmare,"November 28, 2019",5, Really nice this app to your perfection
2989,manu parbhaker,"November 23, 2019",1, Kindly do not go for paid version as I have already wasted my money and have not received any call since then even though I have an experience as an Hr Executive.Totally Dissatified with such services.I would like a refund and would not suggest this app to anyone.
2990,Prabhakar Prasad,"December 13, 2019",5, Very good app you can take a best job from this app
2991,Crack This,"January 8, 2020",4, Good application for any type of job
2992,Naga Patt,"December 17, 2019",5, Very helpful and thorough...
2993,ahuja dolly,"January 13, 2020",1, Job miljyegi to full star dungingi
