index,author_name,review_date,reviewer_ratings,review_body
1361,priyanka bhardwaj,"March 5, 2020",5, Very helpful in finding suitable jobs
1362,Aswin S,"April 13, 2020",4, A good app to get employed
1363,Chinmay Daoo,"December 5, 2019",5, Going good as compared to others applications..just be like that.
1364,rajeshchowdary parim,"November 24, 2019",5, Awesome platform to get a new opportunities in the growing world.
1365,Summaiya Osmani,"December 14, 2019",4, Good one app . Helps in real in your job search
1366,Shruti Jadhav,"December 12, 2019",5, Trusted reliable and of course most useful app
1367,Himanshu Dubey,"January 5, 2020",5, It was good to search for job very easily
1368,sai sree,"January 4, 2020",5, I love it. It's a wonderful app which helped me to get a job. Thank you naukri.
1369,Manas Samal,"January 23, 2020",5," Dear team, You have a Great Job for developing this app. It's amazing app comperable you think. Peoples are just have pure benefits of this app. Again Great Job team. Thanks Manas"
1370,Saravana Ayyappa,"February 14, 2020",4, Good to search for openings and contact
1371,Harshal Bharambe,"March 16, 2020",1, very poor apps I was not got single call from last 2 year. don't waste your time and data by downloading apps. Bkwaassss app Falatuu apps hai
1372,Nishant Singh,"March 4, 2020",5, Very nice platform for jobseekers and recuirters
1373,Vara R,"February 29, 2020",5, Easy to use and user friendly app
1374,Nirmalya Sengupta,"April 12, 2020",5, Really easy to use
1375,ziyaulla bs,"April 18, 2020",5," Will get the relavrnt job options n notification, that's really good"
1376,Apurva Bhagwat,"April 11, 2020",5, Best platform for freshers and experienced
1377,Mirza Muqeem baig,"April 22, 2020",5, Good helping for fresher to find a job
1378,soumya biswal,"April 9, 2020",5, This app is very user friendly...
1379,Chetan Parmar,"November 8, 2019",5, Good feedback system to the candidates.
1380,biswanath dhal,"November 10, 2019",5, Excellent job site which guides lots of job seekers
1381,kumaresan karuppusamy,"December 3, 2019",5, Really very useful for job search.
1382,Akula Shanker,"November 25, 2019",4, For job search this is the best result oriented site to all.
1383,Hariharan Karuppan,"January 4, 2020",5, Excellent opportunities available in one place
1384,Susim Mondal,"December 29, 2019",3," App is good to find jobs. But does not show relavent jobs according to your profile, you have to search for jobs."
1385,SIVA RAMA KRISHNA KURRA,"December 10, 2019",5, Best job search app. Have used all job portal apps but Naukari is the best.
1386,Madhukar Shyam Singh,"January 1, 2020",5, Good and responsive.
1387,Avantika Naik,"December 22, 2019",4, It is really good for finding new jobs and for fresher also u can fine so much options
1388,rajashekhar danda,"January 25, 2020",5, Its a Nice App very helpful for searching jobs And i have a quick response from recutires also
1389,A K NIKHIL PAVITHRAN,"February 7, 2020",5, Very useful & Must one for career aspirants
1390,Prashant Sharma,"February 25, 2020",5, It's very good platform for Job search for Experience and Freshers....✌️😊
1391,Samarnath Gande,"February 11, 2020",5," Without this my career would not be in a shape.... thankyou for super product which is helping so many companies, families, people their daily food...just imagine without this platform how people would find better opportunities.... thankyou guy's...you are building great product...."
1392,Kartik Bansal 1987,"February 27, 2020",5, Quite helpful and overall nicely designed
1393,Navneet Kumar,"March 20, 2020",5, Best app for regarding to open your job
1394,Abhishek Munshi,"April 9, 2020",1, Always displaying unrelevent jobs
1395,krishn Phukan,"April 24, 2020",5, Good application for job seekers
1396,Jyotsnarani Ojha,"November 15, 2019",5, This is very helpful for searching job or good oppertunity
1397,Ashishrv wakade,"December 12, 2019",5, Excellent...... Platform to search for job opportunity
1398,karthik inbhasekaran,"December 22, 2019",5, This is an excellent technology improvement for job search.
1399,AJAY KULAL,"December 13, 2019",1, I searched for mechanical engineer job and suggestion for software and bpos .I changed filters then same suggestions .
1400,Shivanna J,"January 15, 2020",5, Very good and useful to all professionals
1401,ashish chavan,"December 26, 2019",5, User friendly and delivers more than expected
1402,kalpit Goyal,"February 24, 2020",5," Great app, easy to handle"
1403,Mahesh G R,"March 15, 2020",5, Very informative..and useful
1404,Manish Pandey,"November 12, 2019",2," Just ok Please update your functional area with music curation, playlisting, etc."
1405,shafiullah khan,"November 13, 2019",5, Very helpful for needy and truly authenticated
1406,Subhamay Maiti,"November 13, 2019",5, Good apps for those who are finding their suitable job profile.
1407,Dhiren Pratap Singh,"April 17, 2020",4, Getting good response from recruiters after updating profile on Naukri
1408,Ninth Realm,"November 29, 2019",5, Very honest and clean intent behind the making of the portal.
1409,Debashish Kaushik,"November 28, 2019",5," Very easy to use, and efficient"
1410,blram saha,"December 8, 2019",2, Haven't got yet the right kind of job that i am looking for in my preferred location that is - Bongaigaon(Assam) and Goalpara(Assam).
1411,Kavita Sonawane,"December 8, 2019",5, Good experience. However I feel it's little user friendly
1412,Chandru mv,"January 12, 2020",5," Amazing App, I thank All team working for this App. Keep Doing. You are doing Great Job, Keep going"
1413,Mohammad Samiullah,"January 25, 2020",5," Best place to find a Job, User Interface is very Informative."
1414,Abhishek Kamble,"January 23, 2020",5, Very customised. Every thing on place.
1415,Mohit Sharma,"January 30, 2020",5," Easy to use, user friendly"
1416,S Vignesh,"February 11, 2020",4, Nice but lot of consultant available in this app
1417,parminder singh,"March 19, 2020",5, Very good and excellent experience
1418,rishabh chaubey,"March 25, 2020",5, Best app for any field related job.
1419,Rajendra Pal Choudhary,"April 15, 2020",5, Excellent to reach desired persons
1420,Shubham Ghosh,"November 6, 2019",3, It would have been better if they would have provided the distance under/between which a person is looking for a job.
1421,Rajesh Chakrabarty,"November 21, 2019",5, Easy to navigate and use
1422,Shubham rajput,"December 8, 2019",5, Excellent site for everything for searching job...
1423,Giriraj. S.V,"December 20, 2019",5," Very good, getting alerts from reputed company's"
1424,Sana Khan,"January 4, 2020",5, A very genuine and trusted app for job search
1425,Mohit Chaudhari,"January 9, 2020",5, One of the best platform to search job and start the career.
1426,ajay kabira,"January 30, 2020",5," Awesome app. Everything Is ok, no need to suggest"
1427,Karthick GK,"February 5, 2020",4, Easy to use and convient
1428,Farman Khan,"February 18, 2020",5, Very useful app for find the job easily
1429,Parmar Alok,"February 23, 2020",1, Can't login and unable to reset the password
1430,Vinod Kumar,"March 17, 2020",5, Good easy to access
1431,Pankaj Mendhapurkar,"April 2, 2020",5, User friendly app with quick search dream job.
1432,somdatt sharma,"April 1, 2020",4, It is very helpfull for finding the job.
1433,Tarun Kumar,"April 16, 2020",5, Very useful. No. 1 job site
1434,Shridhar Badiger,"February 19, 2020",5, Easy to use and convenient app.
1435,naveen chinna,"November 16, 2019",5, I like this app very much it's easy to apply jobs
1436,MD.RAFIQ SHAIKH,"December 11, 2019",5, Excellent and user-friendly software
1437,Atul Kirdat,"January 2, 2020",5, Easy to handle and useful app must try
1438,R. k.,"January 21, 2020",5, It's a very good app for getting job opportunity for fresher condidates
1439,Navya Shetty,"December 21, 2019",5, A wonderful application for one who's job seeker nd even i recruited through this app.i totally loved it😍
1440,Drishti Jain,"January 14, 2020",2, The app is hanging a lot lately.
1441,Shahid Shaikh,"February 15, 2020",5, Very helpful for the people who are in need of Job.
1442,Harish Chandra Jal,"February 23, 2020",4, A perfect app for job oriented!!👍
1443,Ashutosh Mate,"February 14, 2020",5, A very good app for all professionalss
1444,Shakti Velan,"March 2, 2020",5, Great option to find latest job trends
1445,keval dedhia,"February 28, 2020",5, Really good with profile and jib search
1446,VAIBHAV WANDRE,"March 31, 2020",5, Nice and useful app.
1447,bhavesh rajora,"November 9, 2019",5, Very helpful and very easy to use
1448,Venkatesh venky,"December 9, 2019",4, Good app but to much of unwanted job recommendation
1449,sajanesh k,"December 8, 2019",5," Its good job site and good carrying job seeker,s about fake details ."
1450,Rohit Tingare,"February 3, 2020",5, It is really important and helping in searching jobs.
1451,nitin chandan,"February 3, 2020",4, This is a good Job providing app. I got many job offers through this app. But I got few suitable jobs through this. Most of the jobs are not relevant to me.
1452,P A,"February 20, 2020",1, It's a great waste of my time. Not even a single call or mail let alone an interview has ever happened due to naukri in all my career of 13 years. Totally useless. They are just freely minting on our database/data being the new oil.
1453,Venkatesh Shanbhag,"February 20, 2020",5, Great UI flow and stable app
1454,UMESH KOTRE,"February 24, 2020",3, Not that much suitable jobs providing.. Sometimes resume upload issues.. Shows previous resume so had been involved in an issue and finally rejected.
1455,Aman Pradhan,"March 12, 2020",5," Best app for find our own capability job online , ghar baithe baithe job khojo aasani se , very easy bas thoda details bharna hai phir aapko job recruitment aane lagege ."
1456,Vinit Chandane,"April 11, 2020",5, It's Very helpful to searching Jobs
1457,GAURAV SRIVASTAV,"April 13, 2020",5, Love user interface.
1458,VIPIN KUMAR,"January 23, 2020",5, Good work in this app.i am very happy in this app.i am using ap on 2018.
1459,Samir Oza,"November 25, 2019",5, Very user friendly and useful apl
1460,B KISHORE,"November 16, 2019",5, Very good app for getting all kinds of jobs
1461,Kavyacs Cs,"November 25, 2019",4, Convenient and quality job notifications
1462,JANMENJAY SAHANI,"January 17, 2020",1, Irritating and useless jobs posted. If you go for searching a good job then you have to go through 999 search results.
1463,Prakash Gotsurve,"January 26, 2020",4, Awesome application For Experience employees an Good for new start
1464,Suman Bairagya,"March 6, 2020",4, Helpful app for searching jobs
1465,rakesh chaudhary,"December 1, 2019",5, Very useful application for career growth.
1466,Sunil Bamane,"December 30, 2019",5, Good app for getting timely update about opening in market
1467,SUBHAM ROY,"December 19, 2019",5, Good app to find job and it response quickly
1468,Devendra Raut,"December 18, 2019",5, Very useful and interactive GUI
1469,Raghuram Srigiri's,"January 22, 2020",5, This app is very very helpful for unemployed people who are looking for a job.
1470,Arjun Sharma,"January 22, 2020",5, Very great and helpful app to find a good jop It is simply to use this app give you a best jop alert as u want
1471,Azreen Naaz,"January 30, 2020",4, Nice and easy for use but ek option or add hona chahiye ki subscriber company ko bhi sarch kar pate
1472,Nitin Yadav,"February 29, 2020",5, Awesome platform for the job opportunities
1473,Rajesh Bakthavachalam,"April 21, 2020",5, Very nice app to search job.
1474,HARISH SHETTY,"November 12, 2019",5, No free service here. All paid service only
1475,Ayush Kasyap,"December 5, 2019",5," This app is so useful to us , I got lot of confidence by using this app , and also I get opportunity to get job through this app."
1476,Jagadeesh Teaser masss,"January 2, 2020",5, I use this app it is very use ful and choose category of jobs and so trust ful
1477,Healthy Living,"January 27, 2020",5, This app is very useful for job seekers.... Thanks for your services keep going....!!!
1478,Kalvacharla Sampath,"December 26, 2019",5, Excellent app for job opportunity Updating job requirements
1479,Arun Gopal,"December 20, 2019",4, Good to know the market of job profile and very helpfull in finding specific jobs
1480,Swapnil Deorukhkar,"January 7, 2020",5, Very easy and convenient
1481,Govind Sunder,"March 3, 2020",5," It is really good app for job seeking, I loved more"
1482,Siddhu James,"March 9, 2020",5, Best👍💯 in India🇮🇳 I get lot of interviews but I didn't attend because some health issues it's really great app honestly
1483,sanjay tiwari,"March 15, 2020",4, Very good app for job searching
1484,bharatbhai solani,"March 18, 2020",5, Very nice and satisfactorily
1485,Soorej Warrier,"April 7, 2020",5, Accurate and genuine portal
1486,Mahamad Shareef,"November 15, 2019",4, Only app from where we can expect some calls from real recruiters.... Nice one....
1487,Kajal Gandhi,"December 7, 2019",5, Very Convenient Very easy to use
1488,Divyabharathy Pasupathy,"December 9, 2019",5, Very useful to finding jobs easily
1489,Daxeshkumar Modi,"April 15, 2020",5, Useful app for job seeker
1490,Sanjay Chaudhary,"November 27, 2019",5, Helpful to update profile in limited time
1491,shubham Alhat,"November 19, 2019",5, Such a good platform for freshers and experenced people
1492,Harshit Shah,"December 8, 2019",5, Very Useful application for Job Seeker.
1493,ajit gupta,"December 20, 2019",5, Very Good app for fresher and experienced worker
1494,Sury Kant Tripathi,"January 13, 2020",4," Good app, providing better opportunity for our carrier."
1495,Bharath Somshekar,"January 10, 2020",5, It's any app like a oxygen for a human and an opportunity for the talents.
1496,Madhavi G,"January 22, 2020",4, It very helpful to find out jobs in various domains
1497,misti dorve,"February 2, 2020",2, Having issue in log in.
1498,Bheemu Vali,"February 23, 2020",5, Very helpful and very fast response
1499,Subahyu Chowdhury,"February 28, 2020",5, A very user friendly application.
1500,naveen singh,"March 16, 2020",5, The really helpful app.
1501,Srishti Kaithwas,"March 28, 2020",2, Very slow server
1502,Ganesh R,"April 9, 2020",1, Profile performance not working
1503,balaji rayaluru,"November 19, 2019",5, Very useful app for those who are searching Jobs..
1504,balasubramanian mahadevan,"November 27, 2019",5, Great experience and good options available
1505,Abhilash George,"December 5, 2019",3, Their is an error in the app as i cannot add my Employment details it's not saving the details which i gave.
1506,Rakesh mishra,"January 1, 2020",4, It is designed to fulfil all the required fields a employer need. User friendly.
1507,Hrithik Dynamic,"January 28, 2020",5, Thankyou For Providing This App. This Was Very Helpful to me
1508,SHIV KUMAR DOGRA,"February 25, 2020",4, Nice... to be updated timely about opening and applying instantly....
1509,Prathap M,"February 20, 2020",1, Naukri app it is a worst app nothing interviews updated on this. If we will search on this only showing as old.
1510,Pawan Kumar,"March 2, 2020",5," Very good, my expression has been very good with this one."
1511,Vinil Bangera,"March 6, 2020",2, Not able to find the valide job and attention is given to the paid members only
1512,RATHOD PRADEEP,"March 15, 2020",5, Its very easy way to find job....
1513,YASH Education,"March 17, 2020",5, very useful website for job search
1514,Aparna Singh,"March 30, 2020",2, No jobs related with search content
1515,vijay kumar m,"April 15, 2020",1, It is showing only bpo Or telecalling maximum
1516,SanjitKumar Sarma,"December 13, 2019",5, Fantastic experience but still searching for appropriate job
1517,Anand Bhusare,"December 31, 2019",5, It is really useful for searching the job.
1518,Surya Narayanan,"December 20, 2019",1, Why my profile keeps logging out every time i close the app ??
1519,Sunil Mourya,"December 24, 2019",1, Don't download and share any profile with this app they are fraudster after you give them a details an consultant company calls you and give you an job interview location when you reach them they conduct an interview and then demand and 8000 rupees after that give u a time for 2 month for joining an...Full ReviewDon't download and share any profile with this app they are fraudster after you give them a details an consultant company calls you and give you an job interview location when you reach them they conduct an interview and then demand and 8000 rupees after that give u a time for 2 month for joining and when am reach the location no company was there and more than 20 where also stands there same job fraud happen with them today we have lauch an DDR to SSP office and we all students are waiting....
1520,vikram kumar,"January 25, 2020",1, Not working properly and showing old data
1521,Vsr Naik,"January 19, 2020",5, It's very easy to understand and uploading all the details
1522,Manoj bhiwani,"February 29, 2020",5, BEST app to search good job in market but Beware those people who demand any type of money to get job.
1523,Prasad Tambe,"March 6, 2020",4, Good app for job hunters & career beginners
1524,Imran Zahid,"February 24, 2020",5, love to use this app. easy to apply for a job.
1525,Venkatesh P,"November 6, 2019",4, Good you can receive minimum calls .. overall excellent
1526,Christo Raphael,"November 14, 2019",4," excellent,easy to use and always we can get new job"
1527,Shankar Bala,"November 24, 2019",5, Really helpful for job searchers. We wont uninstall this app in anytime
1528,Yogesh Mistri,"November 28, 2019",5, Very good application we can easily operating
1529,the turbocharged guy,"December 27, 2019",1, No point in installing this app I got calls only from Call centres.
1530,charankumar bayanagari,"February 2, 2020",5, Friendly user app and very helpful
1531,GPS ENTERTAINER,"February 15, 2020",4, Nice app. Done a good job. Thank you
1532,manoj kumar,"February 22, 2020",5, Provides Great oppertunity to search jobs easily
1533,AZAD BHORIA,"March 13, 2020",5, Better then excepted I received calls from many placement office's and sechduled my interview in many companies and the best part of this is it's totally free
1534,S Khan,"March 10, 2020",4, It's good actual reverts are there and genuine jobs!
1535,adapa tirumaladas,"April 7, 2020",5, This is a good app for job search
1536,Michael D'Souza,"April 11, 2020",5, An App that provides what it proclaims!
1537,Sakshi Mehra,"December 3, 2019",5, Very frequent and valuable inputs.
1538,Abhishek Sharma,"December 9, 2019",4," Great UI , Easy to use..."
1539,Rajat Gupta,"November 25, 2019",3, Improve and good for jobs but most of times fake vacancy call
1540,siva kumar,"December 13, 2019",4, Good. Still scope is there to improve in localised information
1541,Rajdeep wankhade,"January 12, 2020",4, Its a great app to search new job But i make disappointed because i have already mentioned that i am fresher then also it suggests me opportunity who need experience which is indirectly not in my use.
1542,Ranjit Dey,"January 31, 2020",5, Very useful app for job searching.
1543,Sanjay Mishra,"February 18, 2020",5, Excellent tool for job seekers
1544,Chidambaram Duraisamy,"February 10, 2020",4, Loved using this.! Best in business
1545,Veera Prasad,"February 26, 2020",1, Not reachable for my profile regards only paid service is available in naukri
1546,Santhosh Kumar BN,"March 19, 2020",5, Very good app for job search
1547,Salman Hussaini,"March 31, 2020",4, Nice App helpful for me since 3 years
1548,Kalyani Gourabathuni,"November 15, 2019",5, It is very helpful in searching job s that I required.
1549,Tejashree mohite,"November 13, 2019",5, Very convenient and easy
1550,Pratik Kamble,"November 25, 2019",5, Perfect application to get about job positions
1551,Mahendra Singh Yadav,"December 9, 2019",5, Great Mobile App Platform to find great Opportunity and great companies in your pocket 👍
1552,kajal singh,"December 29, 2019",4, It gives a certain platform to search jobs as per your requirements
1553,Sudipta Sarkar,"January 11, 2020",5, Easy to use app. Very friendly.
1554,Warrior FMS,"January 26, 2020",5, Good!!! very helpful to find suitable jobs
1555,Rakesh Nath,"February 3, 2020",2, Many bugs in app.
1556,Pradeep Kale,"February 15, 2020",5, Nice job portal application for freshers as well of experienced professionals.
1557,madhu thalla,"February 16, 2020",4," Good application, use full to who are searching for job Thanks you"
1558,Shubham Singh,"March 21, 2020",2," Third class app ,m using this from last three years not even got a single job suiting my requirements. Very disappointing please help."
1559,Nitin Gupta,"April 18, 2020",5, Good platform for job search..
1560,anupriya chahar,"April 21, 2020",1, Very bad.. Paid good amount of money as well but of no use...
1561,ankit bhuva,"March 17, 2020",5," Best application for Job search , Job change."
1562,Heera Singh Negi,"November 14, 2019",5, Very nice & easy to use app.
1563,Ashwani Kumar,"November 19, 2019",5, Excellent easy to use any one can use
1564,Hitesh Kumar Singh,"December 2, 2019",5, Great app with a good interface.
1565,Punit Gupta,"December 25, 2019",5," wonderful application, always gives a best opportunity"
1566,atul singh,"January 17, 2020",4, It is very useful app and am very satisfied
1567,Guna messi,"February 10, 2020",5, It's an amazing app to find a job opportunities
1568,amit sindhu,"March 9, 2020",5, Very nice app nd very helpful to find jobs
1569,SYED TAUQEER,"March 21, 2020",5, Good service all in one App for job seeker
1570,mk tech,"April 5, 2020",5, Very good service
1571,Sanjaykumar S,"December 5, 2019",1," Worst application, hardly got any calls in last 9 years"
1572,Prabhu A,"January 17, 2020",5, Very useful and we receive a frequent updates
1573,Faiyazashr Khan,"November 10, 2019",5, Its a good app easy to use and very user friendly
1574,Pramod Gothankar,"November 26, 2019",5, very easy to handle & useful
1575,Ved Prakash,"November 27, 2019",5, This is far better than LinkedIn. I've been contacted by HRs several times.
1576,Chirag Gupta,"December 20, 2019",5," Great app , help in people finding genuine jobs..."
1577,Raj Kumar Dugar,"January 19, 2020",5, A very good platform for professionals
1578,harshad shakya,"January 13, 2020",5, Amazing good app for job industry... Thank you
1579,Vivek Reddy,"February 11, 2020",5, This app is so helpful for freshers.
1580,Rajesh Pote,"February 4, 2020",4, Need to improvement for easy access
1581,Parthiban Balu,"March 10, 2020",5, very good application for job seekers and freshers 🖤
1582,Alekha Malik,"March 3, 2020",5, It's a nice platform for seeking jobs & very much trust worthy to be a job portal.
1583,sudipta maiti,"March 3, 2020",3, Not too god but good. It can not give proper designation information.
1584,JAYANTA MONDAL,"April 18, 2020",5, It's a good app for finding a job
1585,Krishna Nishad,"November 6, 2019",5, This app is really useful to change job easily.
1586,Divya,"November 12, 2019",4, Not bad...Finds relevent job oppurtinities.
1587,vinoth kumar,"November 14, 2019",1, Not that much good. Below average need to be improve etc...
1588,Bhupinder Sareen,"November 8, 2019",5, Very simple and Easy to operate
1589,Mohammed Asif,"November 26, 2019",4, Wonderful app for job seekers as well as experienced
1590,Manoj Wadhwani,"December 13, 2019",5, Always selective and good companies approach
1591,Ilakkiya Manivannan,"January 9, 2020",5, Satisfied This app.very useful to career and My job Focuses. Fully genuine Job Requirement.
1592,naveen rayala,"February 8, 2020",5," It's best app, best service even, but it's needs to hide employees ratings by employer, which cost your own job seeker opportunities... most of the cases employees are just like scape gouts, companies recruit them for 4 or 5 months tasks, once done,they will be thrown.. use&throw employer, some case...Full ReviewIt's best app, best service even, but it's needs to hide employees ratings by employer, which cost your own job seeker opportunities... most of the cases employees are just like scape gouts, companies recruit them for 4 or 5 months tasks, once done,they will be thrown.. use&throw employer, some cases employer reps provides negative feedbacks even it's untrue if they have any conflicts with those guys.many companies recruit internally ,fill jobs with relatives, tn Naukri has to search for job."
1593,Ramakant patil,"February 11, 2020",3, Optimise your engine and add filter more like freshness }posted today
1594,suman solanki,"February 14, 2020",5, Very useful app and easy to use
1595,Meghana Maggie,"March 13, 2020",1, This system not to us because I applied many companies but then don't call me and it is one of waste app and now they are asking money why are u asking money it's not correct really it is worst app in the world
1596,Sidram jatti,"April 23, 2020",5, This is a very good app.
1597,priya suman,"November 25, 2019",5," This app is perfect for job , they shows relevant jobs"
1598,Swagata Sengupta,"December 4, 2019",5, Great platform. No scam no fake promises.
1599,Gayathri Muddapolu,"December 7, 2019",3, I daily update my resume but for more than 2months i am not getting any calls regarding to job from this app. Can i know what's the reason of not getting calls .
1600,SHASHIKUMAR S K,"December 14, 2019",5, Best portal app to the job seeker and employer who looks to hire.. I love this app
1601,Vaibhav Pawar,"December 8, 2019",4, Such a good app for searching job it will good to respond at time
1602,saiyad shahabaz akhtar hashmi,"December 18, 2019",5, Good app. More updates Information for job.....
1603,Bipul Kumar Singh,"January 18, 2020",5, This is one of the good platform to provide excellent job.
1604,Raghul Lallu,"March 27, 2020",5, Useful app for job seekers
