index,author_name,review_date,reviewer_ratings,review_body
4354,MADHUKAR SHIPURKAR,"August 22, 2019",5, A just in time app which provides all fields of job vacancy details with desired location.
4355,GIRIJA D,"August 21, 2019",5, Love this app very much ...... This is very useful to searching jobs easily to get the job
4356,Lickita K,"August 27, 2019",5, Easy to access and apply. Latest job postings updated on the app regularly.
4357,Piyush Sharma,"September 2, 2019",5," Easy to use, Loading of content is faster than other."
4358,abhishek kumar,"September 30, 2019",4, Every function is batter but notification latar and one any other problem maximum chargeble consultant is call.please real and ture consultant registration only your app only.
4359,Pratyusa Bhattacharya,"September 19, 2019",5, This app helped me get my first job and the second. The app gives a fair opportunity to apply to jobs and gives visibility to recruiters. Naukri makes it easy for recruiters to directly contact the candidate. I've had a positive experience so far.
4360,Sanjay Kumar Singh,"October 6, 2019",5," Easily accessible ,good handling ,updated job. Useful."
4361,RITIK KAUSHIK,"November 3, 2019",4, Good app but 2 months left but no call from any recruiter and most of the consultancy on this app
4362,SHIVA A,"November 16, 2019",5, Good app simple to apply job's
4363,BHARATH CHILUMULA,"November 13, 2019",5, It's very useful to job seekers.....
4364,Bharath,"December 11, 2019",5, Useful for getting jobs
4365,Deeksha Bhatia,"December 24, 2019",4, Good app to the check the lastest options and opportunity in market.
4366,Shweta Prajapati,"December 26, 2019",1, All Paid services nothing for free users ...even if u are a better candidate than paid users ....ur resume will not be shown ....it will be at the bottom after all paid members.
4367,Jagadeswarrao Challa,"December 23, 2019",2, Iam a fresher and seeking for jobs in this app. This app is exelent with more options and locations ..filters are musch used data ti the job seeker ..but the negitive thing is unassured companys are fills data to the job seekers .... My experiance i have complete all my eesume and photo and job desi...Full ReviewIam a fresher and seeking for jobs in this app. This app is exelent with more options and locations ..filters are musch used data ti the job seeker ..but the negitive thing is unassured companys are fills data to the job seekers .... My experiance i have complete all my eesume and photo and job desiring details after that i found many notifications in my phone ...as they offer good money and facilities but always dosnt mentuons thier websites ..and job locations axactly ..i am helpless
4368,Ch bhaskar,"January 7, 2020",5," Good process,very importent information"
4369,Kaushik studio,"December 16, 2019",5, Very powerful Job search app
4370,Pratik Haridas,"December 17, 2019",5, Very usefull for freshersssssss 👌😭😘😘😘
4371,Anil Chabra,"January 6, 2020",5, Excellent app for job search
4372,Pramod Waybase,"January 19, 2019",5, much better to users and very affordable. lesser time consuming
4373,Mayur Bhatti,"January 29, 2020",5, Awesome app for job searching
4374,Abhinav Sharma,"February 16, 2020",5, Good Platform for Job Search
4375,satya phanindra Bonam,"February 25, 2020",5, Very good experience...
4376,dipankar paul,"February 15, 2020",5, Very good and very effective
4377,world Nature beauty,"February 10, 2020",4, Best app for direct recruitment and real jobs
4378,SOUMYADEEP CHATTERJEE,"February 25, 2020",5, Very useful platform for job seekers
4379,Arya Ghosh,"April 11, 2020",4, Very helpful application for job hunter.
4380,Saksham Choudhary,"April 18, 2020",5, Really great app
4381,A Google user,"October 23, 2018",4," One of the best app who is looking for the job,No need to wait for any reference.Follow recuirters you will be placed.I have placed due to this app.All the best."
4382,Parthiban Munirathnam,"December 3, 2019",4," Good, free services has to improve"
4383,STOP ADDICTION SYSTEM,"March 17, 2019",5, Amazing App for job search. Best App for job search. Easy to use.
4384,jayateerth mk,"November 19, 2018",5, Very helpful app in searching and applying for right position.
4385,Prabhakar Patakamuri,"March 13, 2019",3, it is taking time to load job description and few of them are not clickable.
4386,Jeet Shah,"December 13, 2018",3, So far Experience with this app not good whenever phone comes from it they told me to submit some amount for interview that's why I'm not trust on it so please solve this problem
4387,Surendra Kumar,"May 15, 2019",5, Very satisfied with the features and facilities provided
4388,Abhineet Sinha,"May 5, 2019",3, pdf format CV cannot be uploaded from mobile devices..this is a basic requirement..so please do the needful urgently
4389,jitendra Singh,"January 18, 2019",5, Its superb to use this application and sharing IT experience.Getting respective interview calls also .
4390,Sakkariya K,"October 18, 2018",3, We don't have any option for all of that opportunities updated in this apps are live or actual. As per my experience in this app there are 2% or 3% chance to get the reply from the Companies.
4391,Hardik Solanki,"May 11, 2019",5, At entrance level opening are too many but experience level after 15 to 16 there are limited opening available on Naukri and majority are for consulatant rather than direct organisation
4392,Deepak Sharma,"December 6, 2018",5, Great app but not send similar jobs and monthly quota is very low.
4393,A Google user,"March 27, 2019",1, unable to apply for few types of job opportunities gives error message. don't get proper job alerts and responses very low
4394,Saurav Raj,"October 22, 2018",1, Worst exp. ever i am trying for a job since long time but not get any response even a single time.
4395,Shiv Shankar Bose,"November 29, 2018",5, Indeed gives freedom from laptops and one can manage their profiles and apply easily from handheld devices
4396,A Google user,"November 1, 2018",1, Applying to so many jobs related to my profile but not being contacted by anyone and apart from that there is no update that after applying what has happened as only shows in applied mode
4397,Om Jayade,"October 18, 2018",4, Closed vacancies should be updated more frequently and promptly.
4398,laxmaiah goddati,"November 1, 2018",4, App is working as expected but not getting any calls.
4399,Piyush Punj,"November 8, 2018",5, It's so easy to access and Amazing app helps you find the best fit job for your
4400,Sudheer Kumar,"January 24, 2019",3, please make the app more user friendly. it's asking multiple times to updare every section even after updating and not reflecting changes at one-go
4401,BrAJ Ray,"April 25, 2019",3, Experience is mixed good. because 50% job posted by fake consultancy who asked for money after interview. i have also block some fake consultancy but still job posted by them appeared while i am searching for opening. kindly fixed all these minor issue otherwise Naukri is better platform for both ex...Full ReviewExperience is mixed good. because 50% job posted by fake consultancy who asked for money after interview. i have also block some fake consultancy but still job posted by them appeared while i am searching for opening. kindly fixed all these minor issue otherwise Naukri is better platform for both expeeiece and fresher.
4402,mohammed jafar ali,"January 29, 2019",4, old version is good but this version worst please fix the bugs.
4403,Satish Chandra,"October 24, 2018",3," Good, but improvement be needed to make it more useful. Thanks"
4404,Shivani Sharma,"May 24, 2019",5, Amazing app with lots of opportunites to look for a best option.
4405,ratnakumar gutti,"June 3, 2019",3," good app. Thanks, highly thankful if provide opportunities for on line jobs, as Sr retired officer in State Agrl department, AP"
4406,Navaz abbu,"June 6, 2019",4, Really useful app .. for every one who are in search of .. job Gives job oppoetunty .. .. according to thier .. preferce and field of interest
4407,Niranjan Bairwa,"June 12, 2019",3," Due to address not post on all vecancy information , not easy to cunnect with employer."
4408,PREM KUMAR,"June 22, 2019",5, It's awesome. A great Platform to search job and get placaed.
4409,Manish Rawat,"June 18, 2019",5, I really appreciate guys for this lovely and so useful application for employment and youth foundation. I see there are lots of people who are looking for a job and those who really do have a potential to show management what they are capable of. Thanks for this wonderful application.
4410,Muthu kumar,"July 28, 2019",4, it is easy to search job. but the highlight is to our profile to pay the amount
4411,Afreen khan,"August 11, 2019",1, This app Contain Only Consultancy number which charges fees from Candidates For job placement and this app is worst.
4412,Azim,"July 9, 2019",5, all features as in desktop version is available in app. Very helpful
4413,Kotesh Babu Thedla,"August 26, 2019",5, Very flexibility to use... But be cautious about fake jobs.
4414,Pooja Patil,"August 16, 2019",1, app doesnt allowung me to login. i tried uninstalling and again installing. stiil its not working.
4415,Manisha Upadhya,"August 28, 2019",4, Good job profiles updated every week. Overall great experience .thanks
4416,Manoj Shobha,"September 2, 2019",5, Easy to use and specific search match perfect skill. So got relevant job offers.
4417,Kamala Tejaswini,"September 15, 2019",5, Nice app for those who are looking for jobs and it is very best and easy to connect with the people for jobs
4418,MUTHU KRISHNAN,"September 21, 2019",5, Great app for searching jobs. UI & UX is fantastic. Business Logic is amazing.
4419,Uttam Singh,"October 3, 2019",5, This only app is doing a great job. One can trust in this app. It is very easy. Really great.
4420,milan verma,"October 13, 2019",1, This app is just only for Experienced candidates not for freshers...its a worst app. Here i wasted my time but now i'm going to uninstall it and i'll never recommend this app to other.
4421,Vikas Pandey,"October 11, 2019",5, Very beautiful app. Having very nice exp. Always updating me about everthing that is related to job
4422,GROW TOGETHER,"October 22, 2019",5," Navigation is easy, Job Openings are relevent and easy to access"
4423,CA Ajay Mishra,"October 20, 2019",5, Using this App we have amazing experiences It is working very vastly and unexpected its user friendly too.
4424,Deepen singh,"November 2, 2019",5, It's easy to use and find jobs Happy with the experience
4425,Prem Prakash,"November 23, 2019",5, Very user friendly app
4426,Pushpendra kumar,"November 30, 2019",5, Very helpful for job seekers
4427,Rocky Singh,"December 31, 2019",5, It's great platform for job opportunity
4428,Kartik M Devali,"January 14, 2020",5, Easy to search for the job
4429,Lagamappa Masenatti,"December 28, 2019",5, Nice Tool to search new jobs..
4430,Ajay Degamwala,"January 20, 2020",4, This app is really to goo for employment.
4431,mujahid ahmad,"January 21, 2020",5, One of the best app for jobseeker.
4432,Harish Gupta,"February 7, 2020",5, Good guidance for freshers
4433,Dipak Barman,"March 8, 2020",4, Very easy for everyone.
4434,Singapuram Harshini,"March 3, 2020",5, its an good app to get notified by wonderful job oppurtunities
4435,Subhash chand Saroj,"March 1, 2020",4, Very good apps for job
4436,Sunil Rathod,"March 13, 2020",5, Best company and I always refer for Join
4437,Prashant Borkar,"March 30, 2020",5," Excellent, user friendly."
4438,abhishek pathak,"April 19, 2019",5, great app and very helpful for all desired students and freshers who looking for new job.
4439,Mohammad Rashid,"October 20, 2018",4, It is a good App but in CV creator the phone no. Storage is not accepting international country's no.s!
4440,Tejas Jani,"May 10, 2019",2," Inefficient site to gather details regarding job, Also after after for any post not getting update on status of that job."
4441,Ujjal Dey,"January 20, 2019",5," This app is really helpfull. I got a good job from Naukri, Just you have to update your profile on regular basis.."
4442,Md Arif,"September 22, 2018",1, After the paid registration didn't get any response till date.
4443,VAITHIYANATHAN VIJAYAKUMAR,"March 12, 2019",5, Excellent service since more than a decade.Congrates to all in the team.
4444,janardan kalita,"March 5, 2019",1, No idea why..never got a call even after profile is 100%completed. Its been months with ZERo view and Zero dowload of my profile. only call i got from naukri for paid services. One star.
4445,A Google user,"October 9, 2018",3, Excellent app to check jobs and apply with advanced search options.
4446,sarmistha dash,"May 5, 2019",5, It's the appropriate app for job seekers and undoubtedly the best app for recruiters as well.
4447,Nilesh Mehta,"December 3, 2018",5," Lots of opportunities in finding relevant jobs, service are excellent, quick response."
4448,rajesh nsr,"October 10, 2018",5, Love this app.... Easy to find relevent jobs on your respective locations... Thanks!
4449,Adhi Nationalist,"September 27, 2018",3," In this Job Portal Place of Job Location only showing as District with State but not showing Name of Area (E.g. if Bangalore, Karnataka : (KORAMANGALA, JC Road, Vijaynagar,,,,,etc), There showing as ""Bangalore,Karnataka"" This has to Change,, And I am fulfilled 100% Details as you need, but I am not ...Full ReviewIn this Job Portal Place of Job Location only showing as District with State but not showing Name of Area (E.g. if Bangalore, Karnataka : (KORAMANGALA, JC Road, Vijaynagar,,,,,etc), There showing as ""Bangalore,Karnataka"" This has to Change,, And I am fulfilled 100% Details as you need, but I am not getting Call,,,,,"
4450,Vishwa G,"April 12, 2019",2, Lots of improvements needed not only in app even for website as well..
4451,Pratyush Behera,"September 29, 2018",1," What's happening, I forgotten my naukri account password, so when I want to set a new password i m not receiving otp...now all attempts are over....why so.....I m irritated....."
4452,sathish Reddy,"February 25, 2019",5," Good app to search jobs, especially for software professionals. Many opportunities in one place"
4453,Prasad Narwadkar,"August 28, 2019",5, It enables me to get rid of having to go to the website. Quick to apply and get updates on applications.
4454,Ketan Pawar,"April 3, 2019",1," i think that the app is for premium member only, so why r u giving acces to normal users & wasting their time, close acces for them ,& make it for premium only"
4455,Divyanshu Ojha,"September 29, 2018",5, Good application. Makes job search easy and simple.
4456,Divyanshi Chauhan,"February 26, 2019",3, filter options in app is not as website's. app also doesnt reflects the same openings as website does
4457,Sarika Rajput,"May 28, 2019",5, Because of this app i m able to find my job easily. Very thrustful Job ATM. your skill and experience is your bank balance. This website is your ATM and bank.
4458,Ravi Gaikwad,"June 16, 2019",4," helpful app, easy for search companies and update profile."
4459,Aditya Kulkarni,"June 20, 2019",5, App with good and easy to use . Providing good opportunities for my requirements.
4460,Yashvant Pandya,"July 4, 2019",5, it really have authenticate recruiter and also have so many jobs. really love this app
4461,debanampriya rout,"July 24, 2019",5, This is the aswesome application..Instead of laptop we can easily find out jobs and can get the notification
4462,Anurag Sharma,"July 23, 2019",5, An excellent app. Does a deep analysis of your career and fetches the best for you.
4463,Sneha Sutar,"August 17, 2019",4, It's a very good app to give very important information of freshers and student.
4464,Mujeebulla Shaik,"September 5, 2019",5," Very nicely professionally updates are review, very helpfull to everyone easily."
4465,adil shams,"September 9, 2019",4, Good app. It sends relevant job openings according to desired profile.
4466,Snehal Vibhandik,"September 3, 2019",1, Do not receive jobs recommended as expected or as updated in the profile. Not helpful to get at least a call from recruiter though updating the profile on daily basis
4467,sanket dhote,"September 7, 2019",5, Very good app for knowing the info. About vacancy but but very poor in process and
4468,Manish Sen,"September 6, 2019",4, It has a good searching experience but sometimes it shows pathetic unrelated things.
4469,Sneha Oza,"September 19, 2019",1," No real postings, never get a revert. Always unwanted unmatched profiles shared. They always try to convert you into paid clients"
4470,Benazir Yasmin,"October 3, 2019",1, So annoying. I have already installed this app then why its asking to install again while m trying to apply any job. And I have clearly mentioned where my current location and where m willing to work then why its showing other cities
4471,safiq ahamed,"October 11, 2019",5, Best app for job search. I got many job oppurtunities through this app. But recently i got error when i update the preferred location settings
4472,Moses Gudipati,"October 15, 2019",1, I hardly get response from the employers! I wonder why n how it happens! Why have u guys removed the contact details of employers in new update?
4473,LA LIT,"October 27, 2019",5," Great work, great user interface and the best application for submitting application wow, 🙏🏼"
4474,SURYA CHEENU,"November 7, 2019",4, It's good for me to search jobs based on my qualification
4475,Rohit Hotkar,"November 4, 2019",4, Very good for job hunting. But need more improvement.
4476,Dibyendu Paul,"November 16, 2019",5, Very good for Freshers...... Love it ❤
4477,Shruti Sawant,"November 22, 2019",4, Not give updates about jobs properly
4478,DEBATOSH KUNDU,"November 25, 2019",1, Don't install this application because this application is fraud. 99.99% job is fraud and authorised of the application is Non-sence.
4479,S.Thanigai malai,"November 28, 2019",4, Very good job search portal.
4480,Harsh Vanpariya,"November 30, 2019",5, Nice app for searching job users & help for trying job when you need.
4481,Vinod M,"November 21, 2019",5, Very helpful and easy to navigate
4482,Roobavathy GnanaSekaran,"December 5, 2019",5, Superb app....user friendly....
4483,manish gupta,"December 28, 2019",5," Its very easy use,"
4484,Subhashish Srivastava,"December 18, 2019",5, Great and good experience
4485,Shyamakant Ojha,"January 12, 2020",5, Best search job site for everyone Need some improvements regarding relevance with candidate urgent requirements
4486,subham kumar,"January 20, 2020",5, Best solution and revolve by This app...
4487,Shaffi S,"December 26, 2019",4, Very good app for job search 👍
4488,Arjun Gupta,"January 9, 2020",5, very good application for job seekers
4489,Ram Prakash,"January 17, 2020",4," This is good app for jobs. But lots of service are paid. I applied some time, don't come call."
4490,mahima vyas,"January 18, 2020",5, Great experience with this application
4491,Trilok Fartiyal,"February 18, 2020",4, Best app for doing good job..
4492,mochi bhaumik,"February 22, 2020",5, Good for job searching and with job
4493,Deblina Pyne,"March 19, 2020",5, The best app for job search
4494,Mari Muthu,"April 17, 2020",3, Applying for more jobs but response is very less. More number of Oppertunities are coming. Very useful.
4495,Nayan Jee,"March 24, 2019",4," Good response, easy to track apply, status and response from employer"
4496,Electrical In Industries,"September 29, 2019",5, Great application. A lot of jobs are updated here on daily basis.i can trust this job application.
4497,Sonu Kumar Prasad,"May 24, 2019",5, Very good platform for job search fresher and experience candidates can go througt this.
4498,Ankur Srivastava,"November 14, 2018",5, Easy to access and helps in regular updates of relevant job
4499,A Google user,"November 29, 2018",5," Great platform and services you people offer,in every aspect no one stands as competitor having as much dimenetional solutions...."
4500,A Google user,"March 27, 2019",5, it is very good site for job purpose I am very much happy to use this and it is too friendly and good app
4501,SRINUVASA RAO NULAKALA,"April 14, 2019",5, Excellent App for Job opportunities for both freshers and experienced..
4502,Maddy Mahesh,"February 28, 2019",4," very useful app, but needed more options to search as per company"
4503,rupagopika dasam,"December 19, 2018",5, i love this app.. thank you sooo much.. I got job without any consultancy.. i started career because of this app and now im working in hcl
4504,Prakash Jadhav,"March 21, 2019",4," Do something that the employers would want to do the recruitment only through your site. Unfortunately, only the jobseekers love it & get disappointed when data is shared with fake employers (job-portals) than genuine ones."
4505,Virendra Navre,"November 16, 2018",5, Improvement needs to be done as I m unable to view my complete profile also I am unable to download my resume.
4506,Durgesh Datar,"March 6, 2019",5, Excellent way to search jobs as per ones requirement and to get noticed by recruiters
4507,vivek kapoor,"April 2, 2019",4, Filters could be better. Lot of spam callers through naukri.
4508,Erfan Khan,"May 25, 2019",5, Amazing app. Getting calls instantly from recruiters.
4509,hariom prakash,"January 30, 2019",5, Superb app...and really helpful in searching jobs. thank you
4510,Traveller,"October 14, 2018",1, Please remove the app from playstore🙏🙏 Totally waste of time...By searching the jobs in this app...They are selling our profiles to comsultancy services.What the hell is this...!!!
4511,Ramesh Marikanti,"October 11, 2018",5, Good app in handy to apply jobs easily and for job search. Recommended jobs notification is good
4512,Sandeep Das,"October 12, 2018",5, Helps me to quickly update on the fly without much hurdles and instantly
4513,c sivasubramaniam,"February 5, 2019",5," Nice to be a tiny part of vast user group, felt handy interms of let user know up date opportunity status in the market"
4514,BAL Krishan Sharma,"January 6, 2019",5, It's very fantastic. It's best job site and getting very relevant calls.
4515,Kashid Khan,"February 16, 2019",5," Very Nice Platform for Looking Jobs of any Profiles. I Got Jobs 3 time, even i haven't choose paid Service. Thank you for making such Job Platform. Keep it Up!!👍"
4516,Soumyadeep Chowdhury,"January 13, 2019",5, Great app . geting lots of interview. trusted job portal.
4517,vijay dalmia,"June 2, 2019",5, seemless app for both employees and employers. good plaltform to find right match
4518,S Prasanth,"June 17, 2019",5, This is good and better to helpful for job searching. i really like this app.
4519,sk zafar,"July 3, 2019",3," good job search app, but job search or alert cames late some time after opening day is over."
4520,Barnes Noble,"July 15, 2019",5, Very useful and I got almost all of my job offers because of these app. Thanks.
4521,Rani Rawat,"July 22, 2019",5, Awesome app but it should add reviews also of ex employees and photos of companies. Good when you are jobless 😅
4522,DIPALI DURGE,"July 22, 2019",4, Better App to give very important company information and reviews to make career perfectly and fast....
4523,purush yadav,"July 15, 2019",5, this is really wonderful app... so many app is there but nothing works as this app... tq u team and keep doing it... very worthable app... really helpfull to find a best job with in short period of time...tq u
4524,Bellam GeyaSree,"August 27, 2019",5, Able to find out required job easily. Helpful for the job searchers.
4525,Sundararaman H,"September 5, 2019",3, Something went wrong is coming always in the app..unable to view anythng.n upload resume in app as weell as website
4526,Roshan Chaudhari,"September 17, 2019",4, Really nice app. Check everyday for better & new opportunities.
4527,Polamala Srinivas Rao,"September 18, 2019",1, One of the worst app it only works if you pay money. I wasted my time waiting for recurter reply. Please do not install this app it only works if you pay. Not a use helpful app.
4528,pramod prajapati,"October 15, 2019",1," In New version, Experience option unavailable while searching for job. Kindly update properly"
4529,pranav kumar,"October 21, 2019",4," Make application easily, filter facility is good But til now not getting response from employer"
4530,Sourav Mallik,"October 30, 2019",4, Good apps. Very need full apps. It's help everyone to get a new and respectful job
4531,bijendra singh,"November 15, 2019",5, Excellent app for job seekers
4532,Bindu Madhavi,"November 21, 2019",5, It's a very useful app for searching job and i had better experience with this app....
4533,EZHIL Arasan,"December 9, 2019",5, Need abroad openings to be taken care well.
4534,DEEPAK RATHOR,"December 10, 2019",5, This app is really usefull for find job.
4535,Suman Dey,"December 14, 2019",5, Good for fresher and experienced people
4536,DNYANESH R Jadhav JADHAV,"January 11, 2020",5, Very good Service
4537,Dulichandra Mandape,"January 18, 2020",4, Very good app for job search
4538,Ramesh Muthu,"December 18, 2019",5, Great app for people to get into companies they wish to..!!
4539,pavan kalyan,"December 27, 2019",5, A highly professional app in job resourcing
4540,Suvarna Wanjale,"January 25, 2020",5, Instant updates receives for applied jib
4541,vimlesh singh,"January 8, 2020",5, Great app given more opportunities for interview...
4542,mastan pothuganti,"January 29, 2020",4, Better usefull for now job search
4543,sunny duggal,"February 10, 2020",5, Great app my all job reference by Naukri. Com
4544,Bhaskar Rami,"February 26, 2020",5, Very good app for jobseekers
4545,Sourav Goswami,"February 25, 2020",5, Nice App Quick Response
4546,study Hightech,"March 15, 2020",5, Good application but control the fake advertising
4547,Chinmayi Vennu,"March 21, 2020",4, It's a good platform for youth
